2025-10-29 18:07:07,428 [INFO   ] --- [Historical Analyzer Started for VWAGY] ---
2025-10-29 18:07:08,167 [INFO   ] Loaded 1007 data points for VWAGY.
2025-10-29 18:07:08,168 [INFO   ] Computing full CAC curve with m=15...
2025-10-29 18:07:30,819 [INFO   ] Found 23 significant valleys in the CAC curve.
2025-10-29 18:07:30,819 [INFO   ] 
--- Analyzing Valley at 2006-07-19 (index 136) ---
2025-10-29 18:07:30,821 [INFO   ]   [Filter 2] Valley at 2006-07-19: Slope Check (30d) = 0.0311
2025-10-29 18:07:30,821 [INFO   ]   [Filter 2] Valley at 2006-07-19: Slope Check (60d) = 0.0191
2025-10-29 18:07:30,822 [INFO   ]   [Filter 2] Valley at 2006-07-19: Slope Check (90d) = 0.0257
2025-10-29 18:07:30,822 [INFO   ]   [Filter 2] PASSED. Best positive slope: 0.0311
2025-10-29 18:07:31,676 [INFO   ]     [Filter 3] DNA Test vs 'SHIB-USD_m30_ramp': Distance = 3.8060
2025-10-29 18:07:31,678 [INFO   ]     [Filter 3] DNA Test vs 'CSCO_m90_ramp': Distance = 1.7607
2025-10-29 18:07:31,680 [INFO   ]     [Filter 3] DNA Test vs 'GME_m90_ramp': Distance = 4.5434
2025-10-29 18:07:31,681 [INFO   ]     [Filter 3] DNA Test vs 'IYR_m120_ramp': Distance = 3.3338
2025-10-29 18:07:31,683 [INFO   ]     [Filter 3] DNA Test vs 'VWAGY_m15_ramp': Distance = 6.7439
2025-10-29 18:07:31,683 [INFO   ]     [Filter 3] PASSED. Best Match: 'CSCO_m90_ramp' (Distance: 1.7607)
2025-10-29 18:07:31,683 [INFO   ] 
--- Analyzing Valley at 2006-09-08 (index 172) ---
2025-10-29 18:07:31,684 [INFO   ]   [Filter 2] Valley at 2006-09-08: Slope Check (30d) = 0.0233
2025-10-29 18:07:31,685 [INFO   ]   [Filter 2] Valley at 2006-09-08: Slope Check (60d) = 0.0355
2025-10-29 18:07:31,686 [INFO   ]   [Filter 2] Valley at 2006-09-08: Slope Check (90d) = 0.0268
2025-10-29 18:07:31,686 [INFO   ]   [Filter 2] PASSED. Best positive slope: 0.0355
2025-10-29 18:07:31,688 [INFO   ]     [Filter 3] DNA Test vs 'SHIB-USD_m30_ramp': Distance = 3.6680
2025-10-29 18:07:31,689 [INFO   ]     [Filter 3] DNA Test vs 'CSCO_m90_ramp': Distance = 2.6053
2025-10-29 18:07:31,691 [INFO   ]     [Filter 3] DNA Test vs 'GME_m90_ramp': Distance = 4.4031
2025-10-29 18:07:31,692 [INFO   ]     [Filter 3] DNA Test vs 'IYR_m120_ramp': Distance = 2.4449
2025-10-29 18:07:31,694 [INFO   ]     [Filter 3] DNA Test vs 'VWAGY_m15_ramp': Distance = 5.3753
2025-10-29 18:07:31,694 [INFO   ]     [Filter 3] PASSED. Best Match: 'IYR_m120_ramp' (Distance: 2.4449)
2025-10-29 18:07:31,694 [INFO   ] 
--- Analyzing Valley at 2006-10-12 (index 196) ---
2025-10-29 18:07:31,695 [INFO   ]   [Filter 2] Valley at 2006-10-12: Slope Check (30d) = 0.0448
2025-10-29 18:07:31,695 [INFO   ]   [Filter 2] Valley at 2006-10-12: Slope Check (60d) = 0.0266
2025-10-29 18:07:31,696 [INFO   ]   [Filter 2] Valley at 2006-10-12: Slope Check (90d) = 0.0168
2025-10-29 18:07:31,696 [INFO   ]   [Filter 2] PASSED. Best positive slope: 0.0448
2025-10-29 18:07:31,698 [INFO   ]     [Filter 3] DNA Test vs 'SHIB-USD_m30_ramp': Distance = 3.7943
2025-10-29 18:07:31,699 [INFO   ]     [Filter 3] DNA Test vs 'CSCO_m90_ramp': Distance = 2.0157
2025-10-29 18:07:31,700 [INFO   ]     [Filter 3] DNA Test vs 'GME_m90_ramp': Distance = 4.5120
2025-10-29 18:07:31,702 [INFO   ]     [Filter 3] DNA Test vs 'IYR_m120_ramp': Distance = 2.4401
2025-10-29 18:07:31,703 [INFO   ]     [Filter 3] DNA Test vs 'VWAGY_m15_ramp': Distance = 6.7114
2025-10-29 18:07:31,703 [INFO   ]     [Filter 3] PASSED. Best Match: 'CSCO_m90_ramp' (Distance: 2.0157)
2025-10-29 18:07:31,703 [INFO   ] 
--- Analyzing Valley at 2006-11-02 (index 211) ---
2025-10-29 18:07:31,704 [INFO   ]   [Filter 2] Valley at 2006-11-02: Slope Check (30d) = 0.0237
2025-10-29 18:07:31,705 [INFO   ]   [Filter 2] Valley at 2006-11-02: Slope Check (60d) = 0.0100
2025-10-29 18:07:31,705 [INFO   ]   [Filter 2] Valley at 2006-11-02: Slope Check (90d) = 0.0179
2025-10-29 18:07:31,706 [INFO   ]   [Filter 2] PASSED. Best positive slope: 0.0237
2025-10-29 18:07:31,707 [INFO   ]     [Filter 3] DNA Test vs 'SHIB-USD_m30_ramp': Distance = 3.7137
2025-10-29 18:07:31,708 [INFO   ]     [Filter 3] DNA Test vs 'CSCO_m90_ramp': Distance = 3.3190
2025-10-29 18:07:31,709 [INFO   ]     [Filter 3] DNA Test vs 'GME_m90_ramp': Distance = 4.8469
2025-10-29 18:07:31,711 [INFO   ]     [Filter 3] DNA Test vs 'IYR_m120_ramp': Distance = 3.1645
2025-10-29 18:07:31,712 [INFO   ]     [Filter 3] DNA Test vs 'VWAGY_m15_ramp': Distance = 6.2869
2025-10-29 18:07:31,712 [INFO   ]     [Filter 3] FAILED. No DNA match found below threshold 2.75.
2025-10-29 18:07:31,712 [INFO   ] 
--- Analyzing Valley at 2006-12-14 (index 240) ---
2025-10-29 18:07:31,713 [INFO   ]   [Filter 2] Valley at 2006-12-14: Slope Check (30d) = -0.0039
2025-10-29 18:07:31,713 [INFO   ]   [Filter 2] Valley at 2006-12-14: Slope Check (60d) = 0.0231
2025-10-29 18:07:31,714 [INFO   ]   [Filter 2] Valley at 2006-12-14: Slope Check (90d) = 0.0409
2025-10-29 18:07:31,714 [INFO   ]   [Filter 2] PASSED. Best positive slope: 0.0409
2025-10-29 18:07:31,716 [INFO   ]     [Filter 3] DNA Test vs 'SHIB-USD_m30_ramp': Distance = 9.5007
2025-10-29 18:07:31,717 [INFO   ]     [Filter 3] DNA Test vs 'CSCO_m90_ramp': Distance = 8.6542
2025-10-29 18:07:31,718 [INFO   ]     [Filter 3] DNA Test vs 'GME_m90_ramp': Distance = 9.3140
2025-10-29 18:07:31,719 [INFO   ]     [Filter 3] DNA Test vs 'IYR_m120_ramp': Distance = 8.7060
2025-10-29 18:07:31,721 [INFO   ]     [Filter 3] DNA Test vs 'VWAGY_m15_ramp': Distance = 7.5757
2025-10-29 18:07:31,721 [INFO   ]     [Filter 3] FAILED. No DNA match found below threshold 2.75.
2025-10-29 18:07:31,721 [INFO   ] 
--- Analyzing Valley at 2007-01-29 (index 268) ---
2025-10-29 18:07:31,722 [INFO   ]   [Filter 2] Valley at 2007-01-29: Slope Check (30d) = 0.0523
2025-10-29 18:07:31,722 [INFO   ]   [Filter 2] Valley at 2007-01-29: Slope Check (60d) = 0.0587
2025-10-29 18:07:31,723 [INFO   ]   [Filter 2] Valley at 2007-01-29: Slope Check (90d) = 0.0330
2025-10-29 18:07:31,723 [INFO   ]   [Filter 2] PASSED. Best positive slope: 0.0587
2025-10-29 18:07:31,725 [INFO   ]     [Filter 3] DNA Test vs 'SHIB-USD_m30_ramp': Distance = 4.0617
2025-10-29 18:07:31,726 [INFO   ]     [Filter 3] DNA Test vs 'CSCO_m90_ramp': Distance = 3.8497
2025-10-29 18:07:31,727 [INFO   ]     [Filter 3] DNA Test vs 'GME_m90_ramp': Distance = 4.5859
2025-10-29 18:07:31,728 [INFO   ]     [Filter 3] DNA Test vs 'IYR_m120_ramp': Distance = 2.3527
2025-10-29 18:07:31,730 [INFO   ]     [Filter 3] DNA Test vs 'VWAGY_m15_ramp': Distance = 5.4341
2025-10-29 18:07:31,730 [INFO   ]     [Filter 3] PASSED. Best Match: 'IYR_m120_ramp' (Distance: 2.3527)
2025-10-29 18:07:31,730 [INFO   ] 
--- Analyzing Valley at 2007-03-02 (index 291) ---
2025-10-29 18:07:31,731 [INFO   ]   [Filter 2] Valley at 2007-03-02: Slope Check (30d) = 0.0655
2025-10-29 18:07:31,731 [INFO   ]   [Filter 2] Valley at 2007-03-02: Slope Check (60d) = 0.0186
2025-10-29 18:07:31,732 [INFO   ]   [Filter 2] Valley at 2007-03-02: Slope Check (90d) = 0.0150
2025-10-29 18:07:31,732 [INFO   ]   [Filter 2] PASSED. Best positive slope: 0.0655
2025-10-29 18:07:31,733 [INFO   ]     [Filter 3] DNA Test vs 'SHIB-USD_m30_ramp': Distance = 4.3645
2025-10-29 18:07:31,735 [INFO   ]     [Filter 3] DNA Test vs 'CSCO_m90_ramp': Distance = 2.4776
2025-10-29 18:07:31,736 [INFO   ]     [Filter 3] DNA Test vs 'GME_m90_ramp': Distance = 3.2621
2025-10-29 18:07:31,737 [INFO   ]     [Filter 3] DNA Test vs 'IYR_m120_ramp': Distance = 3.5909
2025-10-29 18:07:31,738 [INFO   ]     [Filter 3] DNA Test vs 'VWAGY_m15_ramp': Distance = 6.7567
2025-10-29 18:07:31,738 [INFO   ]     [Filter 3] PASSED. Best Match: 'CSCO_m90_ramp' (Distance: 2.4776)
2025-10-29 18:07:31,739 [INFO   ] 
--- Analyzing Valley at 2007-04-13 (index 320) ---
2025-10-29 18:07:31,739 [INFO   ]   [Filter 2] Valley at 2007-04-13: Slope Check (30d) = -0.0156
2025-10-29 18:07:31,740 [INFO   ]   [Filter 2] Valley at 2007-04-13: Slope Check (60d) = 0.0089
2025-10-29 18:07:31,741 [INFO   ]   [Filter 2] Valley at 2007-04-13: Slope Check (90d) = 0.0340
2025-10-29 18:07:31,741 [INFO   ]   [Filter 2] PASSED. Best positive slope: 0.0340
2025-10-29 18:07:31,743 [INFO   ]     [Filter 3] DNA Test vs 'SHIB-USD_m30_ramp': Distance = 10.1130
2025-10-29 18:07:31,744 [INFO   ]     [Filter 3] DNA Test vs 'CSCO_m90_ramp': Distance = 9.6170
2025-10-29 18:07:31,745 [INFO   ]     [Filter 3] DNA Test vs 'GME_m90_ramp': Distance = 9.4613
2025-10-29 18:07:31,747 [INFO   ]     [Filter 3] DNA Test vs 'IYR_m120_ramp': Distance = 9.4031
2025-10-29 18:07:31,748 [INFO   ]     [Filter 3] DNA Test vs 'VWAGY_m15_ramp': Distance = 7.9631
2025-10-29 18:07:31,748 [INFO   ]     [Filter 3] FAILED. No DNA match found below threshold 2.75.
2025-10-29 18:07:31,748 [INFO   ] 
--- Analyzing Valley at 2007-06-14 (index 363) ---
2025-10-29 18:07:31,749 [INFO   ]   [Filter 2] Valley at 2007-06-14: Slope Check (30d) = 0.0483
2025-10-29 18:07:31,750 [INFO   ]   [Filter 2] Valley at 2007-06-14: Slope Check (60d) = 0.0720
2025-10-29 18:07:31,751 [INFO   ]   [Filter 2] Valley at 2007-06-14: Slope Check (90d) = 0.0746
2025-10-29 18:07:31,751 [INFO   ]   [Filter 2] PASSED. Best positive slope: 0.0746
2025-10-29 18:07:31,752 [INFO   ]     [Filter 3] DNA Test vs 'SHIB-USD_m30_ramp': Distance = 3.7791
2025-10-29 18:07:31,753 [INFO   ]     [Filter 3] DNA Test vs 'CSCO_m90_ramp': Distance = 2.5904
2025-10-29 18:07:31,754 [INFO   ]     [Filter 3] DNA Test vs 'GME_m90_ramp': Distance = 3.4621
2025-10-29 18:07:31,756 [INFO   ]     [Filter 3] DNA Test vs 'IYR_m120_ramp': Distance = 2.9935
2025-10-29 18:07:31,757 [INFO   ]     [Filter 3] DNA Test vs 'VWAGY_m15_ramp': Distance = 6.8927
2025-10-29 18:07:31,757 [INFO   ]     [Filter 3] PASSED. Best Match: 'CSCO_m90_ramp' (Distance: 2.5904)
2025-10-29 18:07:31,757 [INFO   ] 
--- Analyzing Valley at 2007-08-31 (index 418) ---
2025-10-29 18:07:31,758 [INFO   ]   [Filter 2] Valley at 2007-08-31: Slope Check (30d) = 0.1079
2025-10-29 18:07:31,759 [INFO   ]   [Filter 2] Valley at 2007-08-31: Slope Check (60d) = 0.0672
2025-10-29 18:07:31,759 [INFO   ]   [Filter 2] Valley at 2007-08-31: Slope Check (90d) = 0.0081
2025-10-29 18:07:31,759 [INFO   ]   [Filter 2] PASSED. Best positive slope: 0.1079
2025-10-29 18:07:31,761 [INFO   ]     [Filter 3] DNA Test vs 'SHIB-USD_m30_ramp': Distance = 4.2409
2025-10-29 18:07:31,762 [INFO   ]     [Filter 3] DNA Test vs 'CSCO_m90_ramp': Distance = 3.6437
2025-10-29 18:07:31,763 [INFO   ]     [Filter 3] DNA Test vs 'GME_m90_ramp': Distance = 5.3536
2025-10-29 18:07:31,765 [INFO   ]     [Filter 3] DNA Test vs 'IYR_m120_ramp': Distance = 1.7742
2025-10-29 18:07:31,766 [INFO   ]     [Filter 3] DNA Test vs 'VWAGY_m15_ramp': Distance = 5.8115
2025-10-29 18:07:31,766 [INFO   ]     [Filter 3] PASSED. Best Match: 'IYR_m120_ramp' (Distance: 1.7742)
2025-10-29 18:07:31,766 [INFO   ] 
--- Analyzing Valley at 2007-10-19 (index 452) ---
2025-10-29 18:07:31,767 [INFO   ]   [Filter 2] Valley at 2007-10-19: Slope Check (30d) = -0.0684
2025-10-29 18:07:31,768 [INFO   ]   [Filter 2] Valley at 2007-10-19: Slope Check (60d) = -0.0589
2025-10-29 18:07:31,768 [INFO   ]   [Filter 2] Valley at 2007-10-19: Slope Check (90d) = -0.0350
2025-10-29 18:07:31,769 [INFO   ]   [Filter 2] FAILED. No positive slope found.
2025-10-29 18:07:31,769 [INFO   ] 
--- Analyzing Valley at 2008-02-12 (index 530) ---
2025-10-29 18:07:31,769 [INFO   ]   [Filter 2] Valley at 2008-02-12: Slope Check (30d) = 0.1557
2025-10-29 18:07:31,770 [INFO   ]   [Filter 2] Valley at 2008-02-12: Slope Check (60d) = 0.1029
2025-10-29 18:07:31,771 [INFO   ]   [Filter 2] Valley at 2008-02-12: Slope Check (90d) = 0.0438
2025-10-29 18:07:31,771 [INFO   ]   [Filter 2] PASSED. Best positive slope: 0.1557
2025-10-29 18:07:31,772 [INFO   ]     [Filter 3] DNA Test vs 'SHIB-USD_m30_ramp': Distance = 4.4704
2025-10-29 18:07:31,773 [INFO   ]     [Filter 3] DNA Test vs 'CSCO_m90_ramp': Distance = 3.8755
2025-10-29 18:07:31,775 [INFO   ]     [Filter 3] DNA Test vs 'GME_m90_ramp': Distance = 6.4098
2025-10-29 18:07:31,776 [INFO   ]     [Filter 3] DNA Test vs 'IYR_m120_ramp': Distance = 2.2914
2025-10-29 18:07:31,777 [INFO   ]     [Filter 3] DNA Test vs 'VWAGY_m15_ramp': Distance = 6.1868
2025-10-29 18:07:31,777 [INFO   ]     [Filter 3] PASSED. Best Match: 'IYR_m120_ramp' (Distance: 2.2914)
2025-10-29 18:07:31,778 [INFO   ] 
--- Analyzing Valley at 2008-03-14 (index 552) ---
2025-10-29 18:07:31,779 [INFO   ]   [Filter 2] Valley at 2008-03-14: Slope Check (30d) = 0.0508
2025-10-29 18:07:31,779 [INFO   ]   [Filter 2] Valley at 2008-03-14: Slope Check (60d) = -0.0003
2025-10-29 18:07:31,780 [INFO   ]   [Filter 2] Valley at 2008-03-14: Slope Check (90d) = -0.0027
2025-10-29 18:07:31,780 [INFO   ]   [Filter 2] PASSED. Best positive slope: 0.0508
2025-10-29 18:07:31,782 [INFO   ]     [Filter 3] DNA Test vs 'SHIB-USD_m30_ramp': Distance = 5.9787
2025-10-29 18:07:31,783 [INFO   ]     [Filter 3] DNA Test vs 'CSCO_m90_ramp': Distance = 3.8130
2025-10-29 18:07:31,785 [INFO   ]     [Filter 3] DNA Test vs 'GME_m90_ramp': Distance = 5.8366
2025-10-29 18:07:31,786 [INFO   ]     [Filter 3] DNA Test vs 'IYR_m120_ramp': Distance = 5.2312
2025-10-29 18:07:31,787 [INFO   ]     [Filter 3] DNA Test vs 'VWAGY_m15_ramp': Distance = 7.2255
2025-10-29 18:07:31,787 [INFO   ]     [Filter 3] FAILED. No DNA match found below threshold 2.75.
2025-10-29 18:07:31,788 [INFO   ] 
--- Analyzing Valley at 2008-04-07 (index 567) ---
2025-10-29 18:07:31,788 [INFO   ]   [Filter 2] Valley at 2008-04-07: Slope Check (30d) = 0.0112
2025-10-29 18:07:31,789 [INFO   ]   [Filter 2] Valley at 2008-04-07: Slope Check (60d) = -0.0229
2025-10-29 18:07:31,790 [INFO   ]   [Filter 2] Valley at 2008-04-07: Slope Check (90d) = 0.0110
2025-10-29 18:07:31,790 [INFO   ]   [Filter 2] PASSED. Best positive slope: 0.0112
2025-10-29 18:07:31,792 [INFO   ]     [Filter 3] DNA Test vs 'SHIB-USD_m30_ramp': Distance = 6.4089
2025-10-29 18:07:31,794 [INFO   ]     [Filter 3] DNA Test vs 'CSCO_m90_ramp': Distance = 6.1898
2025-10-29 18:07:31,795 [INFO   ]     [Filter 3] DNA Test vs 'GME_m90_ramp': Distance = 5.7102
2025-10-29 18:07:31,796 [INFO   ]     [Filter 3] DNA Test vs 'IYR_m120_ramp': Distance = 5.9895
2025-10-29 18:07:31,797 [INFO   ]     [Filter 3] DNA Test vs 'VWAGY_m15_ramp': Distance = 5.0788
2025-10-29 18:07:31,798 [INFO   ]     [Filter 3] FAILED. No DNA match found below threshold 2.75.
2025-10-29 18:07:31,798 [INFO   ] 
--- Analyzing Valley at 2008-06-16 (index 616) ---
2025-10-29 18:07:31,799 [INFO   ]   [Filter 2] Valley at 2008-06-16: Slope Check (30d) = 0.0930
2025-10-29 18:07:31,799 [INFO   ]   [Filter 2] Valley at 2008-06-16: Slope Check (60d) = 0.0286
2025-10-29 18:07:31,800 [INFO   ]   [Filter 2] Valley at 2008-06-16: Slope Check (90d) = 0.1091
2025-10-29 18:07:31,800 [INFO   ]   [Filter 2] PASSED. Best positive slope: 0.1091
2025-10-29 18:07:31,802 [INFO   ]     [Filter 3] DNA Test vs 'SHIB-USD_m30_ramp': Distance = 5.7851
2025-10-29 18:07:31,803 [INFO   ]     [Filter 3] DNA Test vs 'CSCO_m90_ramp': Distance = 4.8916
2025-10-29 18:07:31,804 [INFO   ]     [Filter 3] DNA Test vs 'GME_m90_ramp': Distance = 7.4653
2025-10-29 18:07:31,805 [INFO   ]     [Filter 3] DNA Test vs 'IYR_m120_ramp': Distance = 3.7886
2025-10-29 18:07:31,806 [INFO   ]     [Filter 3] DNA Test vs 'VWAGY_m15_ramp': Distance = 6.4047
2025-10-29 18:07:31,807 [INFO   ]     [Filter 3] FAILED. No DNA match found below threshold 2.75.
2025-10-29 18:07:31,807 [INFO   ] 
--- Analyzing Valley at 2008-08-08 (index 654) ---
2025-10-29 18:07:31,808 [INFO   ]   [Filter 2] Valley at 2008-08-08: Slope Check (30d) = 0.0704
2025-10-29 18:07:31,808 [INFO   ]   [Filter 2] Valley at 2008-08-08: Slope Check (60d) = 0.3079
2025-10-29 18:07:31,809 [INFO   ]   [Filter 2] Valley at 2008-08-08: Slope Check (90d) = 0.1297
2025-10-29 18:07:31,809 [INFO   ]   [Filter 2] PASSED. Best positive slope: 0.3079
2025-10-29 18:07:31,810 [INFO   ]     [Filter 3] DNA Test vs 'SHIB-USD_m30_ramp': Distance = 7.6836
2025-10-29 18:07:31,812 [INFO   ]     [Filter 3] DNA Test vs 'CSCO_m90_ramp': Distance = 7.3051
2025-10-29 18:07:31,813 [INFO   ]     [Filter 3] DNA Test vs 'GME_m90_ramp': Distance = 7.5793
2025-10-29 18:07:31,814 [INFO   ]     [Filter 3] DNA Test vs 'IYR_m120_ramp': Distance = 6.0885
2025-10-29 18:07:31,815 [INFO   ]     [Filter 3] DNA Test vs 'VWAGY_m15_ramp': Distance = 5.7521
2025-10-29 18:07:31,816 [INFO   ]     [Filter 3] FAILED. No DNA match found below threshold 2.75.
2025-10-29 18:07:31,816 [INFO   ] 
--- Analyzing Valley at 2008-09-17 (index 681) ---
2025-10-29 18:07:31,817 [INFO   ]   [Filter 2] Valley at 2008-09-17: Slope Check (30d) = 0.3697
2025-10-29 18:07:31,818 [INFO   ]   [Filter 2] Valley at 2008-09-17: Slope Check (60d) = 0.0266
2025-10-29 18:07:31,819 [INFO   ]   [Filter 2] Valley at 2008-09-17: Slope Check (90d) = -0.0743
2025-10-29 18:07:31,819 [INFO   ]   [Filter 2] PASSED. Best positive slope: 0.3697
2025-10-29 18:07:31,820 [INFO   ]     [Filter 3] DNA Test vs 'SHIB-USD_m30_ramp': Distance = 6.5099
2025-10-29 18:07:31,822 [INFO   ]     [Filter 3] DNA Test vs 'CSCO_m90_ramp': Distance = 6.9061
2025-10-29 18:07:31,823 [INFO   ]     [Filter 3] DNA Test vs 'GME_m90_ramp': Distance = 6.4393
2025-10-29 18:07:31,824 [INFO   ]     [Filter 3] DNA Test vs 'IYR_m120_ramp': Distance = 6.1978
2025-10-29 18:07:31,825 [INFO   ]     [Filter 3] DNA Test vs 'VWAGY_m15_ramp': Distance = 0.0000
2025-10-29 18:07:31,825 [INFO   ]     [Filter 3] PASSED. Best Match: 'VWAGY_m15_ramp' (Distance: 0.0000)
2025-10-29 18:07:31,826 [INFO   ] 
--- Analyzing Valley at 2008-10-14 (index 700) ---
2025-10-29 18:07:31,826 [INFO   ]   [Filter 2] Valley at 2008-10-14: Slope Check (30d) = -0.0118
2025-10-29 18:07:31,827 [INFO   ]   [Filter 2] Valley at 2008-10-14: Slope Check (60d) = -0.1876
2025-10-29 18:07:31,828 [INFO   ]   [Filter 2] Valley at 2008-10-14: Slope Check (90d) = -0.1677
2025-10-29 18:07:31,828 [INFO   ]   [Filter 2] FAILED. No positive slope found.
2025-10-29 18:07:31,828 [INFO   ] 
--- Analyzing Valley at 2008-12-05 (index 737) ---
2025-10-29 18:07:31,829 [INFO   ]   [Filter 2] Valley at 2008-12-05: Slope Check (30d) = -0.1759
2025-10-29 18:07:31,830 [INFO   ]   [Filter 2] Valley at 2008-12-05: Slope Check (60d) = -0.1590
2025-10-29 18:07:31,831 [INFO   ]   [Filter 2] Valley at 2008-12-05: Slope Check (90d) = -0.0814
2025-10-29 18:07:31,831 [INFO   ]   [Filter 2] FAILED. No positive slope found.
2025-10-29 18:07:31,831 [INFO   ] 
--- Analyzing Valley at 2009-01-29 (index 773) ---
2025-10-29 18:07:31,832 [INFO   ]   [Filter 2] Valley at 2009-01-29: Slope Check (30d) = -0.2465
2025-10-29 18:07:31,833 [INFO   ]   [Filter 2] Valley at 2009-01-29: Slope Check (60d) = 0.0027
2025-10-29 18:07:31,833 [INFO   ]   [Filter 2] Valley at 2009-01-29: Slope Check (90d) = 0.0165
2025-10-29 18:07:31,833 [INFO   ]   [Filter 2] PASSED. Best positive slope: 0.0165
2025-10-29 18:07:31,835 [INFO   ]     [Filter 3] DNA Test vs 'SHIB-USD_m30_ramp': Distance = 10.6367
2025-10-29 18:07:31,836 [INFO   ]     [Filter 3] DNA Test vs 'CSCO_m90_ramp': Distance = 10.4741
2025-10-29 18:07:31,837 [INFO   ]     [Filter 3] DNA Test vs 'GME_m90_ramp': Distance = 10.0360
2025-10-29 18:07:31,839 [INFO   ]     [Filter 3] DNA Test vs 'IYR_m120_ramp': Distance = 10.5800
2025-10-29 18:07:31,840 [INFO   ]     [Filter 3] DNA Test vs 'VWAGY_m15_ramp': Distance = 8.6202
2025-10-29 18:07:31,840 [INFO   ]     [Filter 3] FAILED. No DNA match found below threshold 2.75.
2025-10-29 18:07:31,840 [INFO   ] 
--- Analyzing Valley at 2009-04-09 (index 822) ---
2025-10-29 18:07:31,841 [INFO   ]   [Filter 2] Valley at 2009-04-09: Slope Check (30d) = -0.0349
2025-10-29 18:07:31,841 [INFO   ]   [Filter 2] Valley at 2009-04-09: Slope Check (60d) = 0.0312
2025-10-29 18:07:31,842 [INFO   ]   [Filter 2] Valley at 2009-04-09: Slope Check (90d) = 0.0218
2025-10-29 18:07:31,842 [INFO   ]   [Filter 2] PASSED. Best positive slope: 0.0312
2025-10-29 18:07:31,844 [INFO   ]     [Filter 3] DNA Test vs 'SHIB-USD_m30_ramp': Distance = 9.4663
2025-10-29 18:07:31,845 [INFO   ]     [Filter 3] DNA Test vs 'CSCO_m90_ramp': Distance = 9.4858
2025-10-29 18:07:31,846 [INFO   ]     [Filter 3] DNA Test vs 'GME_m90_ramp': Distance = 7.9860
2025-10-29 18:07:31,847 [INFO   ]     [Filter 3] DNA Test vs 'IYR_m120_ramp': Distance = 9.5700
2025-10-29 18:07:31,849 [INFO   ]     [Filter 3] DNA Test vs 'VWAGY_m15_ramp': Distance = 7.8569
2025-10-29 18:07:31,849 [INFO   ]     [Filter 3] FAILED. No DNA match found below threshold 2.75.
2025-10-29 18:07:31,849 [INFO   ] 
--- Analyzing Valley at 2009-05-18 (index 848) ---
2025-10-29 18:07:31,850 [INFO   ]   [Filter 2] Valley at 2009-05-18: Slope Check (30d) = 0.0829
2025-10-29 18:07:31,850 [INFO   ]   [Filter 2] Valley at 2009-05-18: Slope Check (60d) = 0.0427
2025-10-29 18:07:31,851 [INFO   ]   [Filter 2] Valley at 2009-05-18: Slope Check (90d) = -0.1251
2025-10-29 18:07:31,851 [INFO   ]   [Filter 2] PASSED. Best positive slope: 0.0829
2025-10-29 18:07:31,853 [INFO   ]     [Filter 3] DNA Test vs 'SHIB-USD_m30_ramp': Distance = 6.7510
2025-10-29 18:07:31,855 [INFO   ]     [Filter 3] DNA Test vs 'CSCO_m90_ramp': Distance = 5.5259
2025-10-29 18:07:31,856 [INFO   ]     [Filter 3] DNA Test vs 'GME_m90_ramp': Distance = 3.5672
2025-10-29 18:07:31,857 [INFO   ]     [Filter 3] DNA Test vs 'IYR_m120_ramp': Distance = 5.2947
2025-10-29 18:07:31,859 [INFO   ]     [Filter 3] DNA Test vs 'VWAGY_m15_ramp': Distance = 6.4938
2025-10-29 18:07:31,859 [INFO   ]     [Filter 3] FAILED. No DNA match found below threshold 2.75.
2025-10-29 18:07:31,859 [INFO   ] 
--- Analyzing Valley at 2009-07-31 (index 900) ---
2025-10-29 18:07:31,860 [INFO   ]   [Filter 2] Valley at 2009-07-31: Slope Check (30d) = -0.5024
2025-10-29 18:07:31,861 [INFO   ]   [Filter 2] Valley at 2009-07-31: Slope Check (60d) = -0.1905
2025-10-29 18:07:31,861 [INFO   ]   [Filter 2] Valley at 2009-07-31: Slope Check (90d) = -0.1227
2025-10-29 18:07:31,861 [INFO   ]   [Filter 2] FAILED. No positive slope found.
2025-10-29 18:07:31,861 [INFO   ] 
--- [Analysis Summary] ---
2025-10-29 18:07:31,862 [INFO   ] Total Valleys Found: 23
2025-10-29 18:07:31,862 [INFO   ] Valleys Passing Filter 2 (Slope Test): 19
2025-10-29 18:07:31,862 [INFO   ] Valleys Passing Filter 3 (DNA Test): 9
2025-10-29 18:07:31,862 [INFO   ] --- [Historical Analyzer Finished] ---
