2025-11-06 20:33:52,104 [INFO   ] --- [Historical Analyzer Started for SPY] ---
2025-11-06 20:33:53,358 [INFO   ] Loaded 1510 data points for SPY.
2025-11-06 20:33:53,359 [INFO   ] Computing full CAC curve with m=10...
2025-11-06 20:34:17,548 [INFO   ] Found 32 significant valleys in the CAC curve.
2025-11-06 20:34:17,548 [INFO   ] 
--- Analyzing Valley at 2017-07-31 (index 144) ---
2025-11-06 20:34:17,550 [INFO   ]   [Filter 2] Valley at 2017-07-31: Slope Check (30d) = -0.0057
2025-11-06 20:34:17,551 [INFO   ]   [Filter 2] Valley at 2017-07-31: Slope Check (60d) = 0.1994
2025-11-06 20:34:17,551 [INFO   ]   [Filter 2] Valley at 2017-07-31: Slope Check (90d) = 0.2061
2025-11-06 20:34:17,552 [INFO   ]   [Filter 2] 30-Day Growth Check: 0.99%
2025-11-06 20:34:17,552 [INFO   ]   [Filter 2] FAILED. Growth of 0.99% < 10.0% threshold.
2025-11-06 20:34:17,552 [INFO   ] 
--- Analyzing Valley at 2017-09-14 (index 176) ---
2025-11-06 20:34:17,553 [INFO   ]   [Filter 2] Valley at 2017-09-14: Slope Check (30d) = 0.2654
2025-11-06 20:34:17,553 [INFO   ]   [Filter 2] Valley at 2017-09-14: Slope Check (60d) = 0.2143
2025-11-06 20:34:17,554 [INFO   ]   [Filter 2] Valley at 2017-09-14: Slope Check (90d) = 0.2993
2025-11-06 20:34:17,554 [INFO   ]   [Filter 2] 30-Day Growth Check: 2.59%
2025-11-06 20:34:17,554 [INFO   ]   [Filter 2] FAILED. Growth of 2.59% < 10.0% threshold.
2025-11-06 20:34:17,554 [INFO   ] 
--- Analyzing Valley at 2017-11-16 (index 221) ---
2025-11-06 20:34:17,556 [INFO   ]   [Filter 2] Valley at 2017-11-16: Slope Check (30d) = 0.3525
2025-11-06 20:34:17,557 [INFO   ]   [Filter 2] Valley at 2017-11-16: Slope Check (60d) = 0.2764
2025-11-06 20:34:17,558 [INFO   ]   [Filter 2] Valley at 2017-11-16: Slope Check (90d) = 0.1028
2025-11-06 20:34:17,558 [INFO   ]   [Filter 2] 30-Day Growth Check: 3.71%
2025-11-06 20:34:17,558 [INFO   ]   [Filter 2] FAILED. Growth of 3.71% < 10.0% threshold.
2025-11-06 20:34:17,558 [INFO   ] 
--- Analyzing Valley at 2017-12-20 (index 244) ---
2025-11-06 20:34:17,559 [INFO   ]   [Filter 2] Valley at 2017-12-20: Slope Check (30d) = 0.5822
2025-11-06 20:34:17,560 [INFO   ]   [Filter 2] Valley at 2017-12-20: Slope Check (60d) = 0.0172
2025-11-06 20:34:17,561 [INFO   ]   [Filter 2] Valley at 2017-12-20: Slope Check (90d) = -0.0939
2025-11-06 20:34:17,561 [INFO   ]   [Filter 2] 30-Day Growth Check: 3.15%
2025-11-06 20:34:17,561 [INFO   ]   [Filter 2] FAILED. Growth of 3.15% < 10.0% threshold.
2025-11-06 20:34:17,561 [INFO   ] 
--- Analyzing Valley at 2018-02-08 (index 277) ---
2025-11-06 20:34:17,562 [INFO   ]   [Filter 2] Valley at 2018-02-08: Slope Check (30d) = 0.2369
2025-11-06 20:34:17,563 [INFO   ]   [Filter 2] Valley at 2018-02-08: Slope Check (60d) = -0.0888
2025-11-06 20:34:17,564 [INFO   ]   [Filter 2] Valley at 2018-02-08: Slope Check (90d) = 0.0695
2025-11-06 20:34:17,564 [INFO   ]   [Filter 2] 30-Day Growth Check: 2.75%
2025-11-06 20:34:17,564 [INFO   ]   [Filter 2] FAILED. Growth of 2.75% < 10.0% threshold.
2025-11-06 20:34:17,564 [INFO   ] 
--- Analyzing Valley at 2018-04-10 (index 318) ---
2025-11-06 20:34:17,565 [INFO   ]   [Filter 2] Valley at 2018-04-10: Slope Check (30d) = 0.2065
2025-11-06 20:34:17,566 [INFO   ]   [Filter 2] Valley at 2018-04-10: Slope Check (60d) = 0.1830
2025-11-06 20:34:17,566 [INFO   ]   [Filter 2] Valley at 2018-04-10: Slope Check (90d) = 0.2095
2025-11-06 20:34:17,566 [INFO   ]   [Filter 2] 30-Day Growth Check: 3.10%
2025-11-06 20:34:17,567 [INFO   ]   [Filter 2] FAILED. Growth of 3.10% < 10.0% threshold.
2025-11-06 20:34:17,567 [INFO   ] 
--- Analyzing Valley at 2018-05-04 (index 336) ---
2025-11-06 20:34:17,568 [INFO   ]   [Filter 2] Valley at 2018-05-04: Slope Check (30d) = 0.3239
2025-11-06 20:34:17,568 [INFO   ]   [Filter 2] Valley at 2018-05-04: Slope Check (60d) = 0.1885
2025-11-06 20:34:17,569 [INFO   ]   [Filter 2] Valley at 2018-05-04: Slope Check (90d) = 0.2193
2025-11-06 20:34:17,569 [INFO   ]   [Filter 2] 30-Day Growth Check: 4.64%
2025-11-06 20:34:17,569 [INFO   ]   [Filter 2] FAILED. Growth of 4.64% < 10.0% threshold.
2025-11-06 20:34:17,569 [INFO   ] 
--- Analyzing Valley at 2018-05-31 (index 354) ---
2025-11-06 20:34:17,570 [INFO   ]   [Filter 2] Valley at 2018-05-31: Slope Check (30d) = 0.0149
2025-11-06 20:34:17,571 [INFO   ]   [Filter 2] Valley at 2018-05-31: Slope Check (60d) = 0.2061
2025-11-06 20:34:17,571 [INFO   ]   [Filter 2] Valley at 2018-05-31: Slope Check (90d) = 0.2222
2025-11-06 20:34:17,572 [INFO   ]   [Filter 2] 30-Day Growth Check: 3.57%
2025-11-06 20:34:17,572 [INFO   ]   [Filter 2] FAILED. Growth of 3.57% < 10.0% threshold.
2025-11-06 20:34:17,572 [INFO   ] 
--- Analyzing Valley at 2018-06-26 (index 372) ---
2025-11-06 20:34:17,573 [INFO   ]   [Filter 2] Valley at 2018-06-26: Slope Check (30d) = 0.4297
2025-11-06 20:34:17,573 [INFO   ]   [Filter 2] Valley at 2018-06-26: Slope Check (60d) = 0.2857
2025-11-06 20:34:17,574 [INFO   ]   [Filter 2] Valley at 2018-06-26: Slope Check (90d) = 0.0405
2025-11-06 20:34:17,574 [INFO   ]   [Filter 2] 30-Day Growth Check: 5.15%
2025-11-06 20:34:17,574 [INFO   ]   [Filter 2] FAILED. Growth of 5.15% < 10.0% threshold.
2025-11-06 20:34:17,575 [INFO   ] 
--- Analyzing Valley at 2018-10-02 (index 440) ---
2025-11-06 20:34:17,575 [INFO   ]   [Filter 2] Valley at 2018-10-02: Slope Check (30d) = -0.4772
2025-11-06 20:34:17,576 [INFO   ]   [Filter 2] Valley at 2018-10-02: Slope Check (60d) = -0.4736
2025-11-06 20:34:17,577 [INFO   ]   [Filter 2] Valley at 2018-10-02: Slope Check (90d) = -0.1994
2025-11-06 20:34:17,577 [INFO   ]   [Filter 2] FAILED. No positive slope found.
2025-11-06 20:34:17,578 [INFO   ] 
--- Analyzing Valley at 2018-10-22 (index 454) ---
2025-11-06 20:34:17,579 [INFO   ]   [Filter 2] Valley at 2018-10-22: Slope Check (30d) = 0.0445
2025-11-06 20:34:17,580 [INFO   ]   [Filter 2] Valley at 2018-10-22: Slope Check (60d) = -0.3472
2025-11-06 20:34:17,581 [INFO   ]   [Filter 2] Valley at 2018-10-22: Slope Check (90d) = 0.0511
2025-11-06 20:34:17,581 [INFO   ]   [Filter 2] 30-Day Growth Check: 1.56%
2025-11-06 20:34:17,581 [INFO   ]   [Filter 2] FAILED. Growth of 1.56% < 10.0% threshold.
2025-11-06 20:34:17,581 [INFO   ] 
--- Analyzing Valley at 2019-01-17 (index 513) ---
2025-11-06 20:34:17,582 [INFO   ]   [Filter 2] Valley at 2019-01-17: Slope Check (30d) = 0.5883
2025-11-06 20:34:17,583 [INFO   ]   [Filter 2] Valley at 2019-01-17: Slope Check (60d) = 0.3855
2025-11-06 20:34:17,584 [INFO   ]   [Filter 2] Valley at 2019-01-17: Slope Check (90d) = 0.2622
2025-11-06 20:34:17,584 [INFO   ]   [Filter 2] 30-Day Growth Check: 6.64%
2025-11-06 20:34:17,584 [INFO   ]   [Filter 2] FAILED. Growth of 6.64% < 10.0% threshold.
2025-11-06 20:34:17,584 [INFO   ] 
--- Analyzing Valley at 2019-08-23 (index 664) ---
2025-11-06 20:34:17,585 [INFO   ]   [Filter 2] Valley at 2019-08-23: Slope Check (30d) = 0.2144
2025-11-06 20:34:17,586 [INFO   ]   [Filter 2] Valley at 2019-08-23: Slope Check (60d) = 0.2748
2025-11-06 20:34:17,586 [INFO   ]   [Filter 2] Valley at 2019-08-23: Slope Check (90d) = 0.3438
2025-11-06 20:34:17,586 [INFO   ]   [Filter 2] 30-Day Growth Check: 3.81%
2025-11-06 20:34:17,587 [INFO   ]   [Filter 2] FAILED. Growth of 3.81% < 10.0% threshold.
2025-11-06 20:34:17,587 [INFO   ] 
--- Analyzing Valley at 2019-09-23 (index 684) ---
2025-11-06 20:34:17,587 [INFO   ]   [Filter 2] Valley at 2019-09-23: Slope Check (30d) = 0.3334
2025-11-06 20:34:17,588 [INFO   ]   [Filter 2] Valley at 2019-09-23: Slope Check (60d) = 0.4087
2025-11-06 20:34:17,589 [INFO   ]   [Filter 2] Valley at 2019-09-23: Slope Check (90d) = 0.4332
2025-11-06 20:34:17,589 [INFO   ]   [Filter 2] 30-Day Growth Check: 2.66%
2025-11-06 20:34:17,589 [INFO   ]   [Filter 2] FAILED. Growth of 2.66% < 10.0% threshold.
2025-11-06 20:34:17,589 [INFO   ] 
--- Analyzing Valley at 2020-01-24 (index 769) ---
2025-11-06 20:34:17,590 [INFO   ]   [Filter 2] Valley at 2020-01-24: Slope Check (30d) = -0.8940
2025-11-06 20:34:17,591 [INFO   ]   [Filter 2] Valley at 2020-01-24: Slope Check (60d) = -1.4207
2025-11-06 20:34:17,592 [INFO   ]   [Filter 2] Valley at 2020-01-24: Slope Check (90d) = -0.3936
2025-11-06 20:34:17,592 [INFO   ]   [Filter 2] FAILED. No positive slope found.
2025-11-06 20:34:17,592 [INFO   ] 
--- Analyzing Valley at 2020-06-15 (index 867) ---
2025-11-06 20:34:17,594 [INFO   ]   [Filter 2] Valley at 2020-06-15: Slope Check (30d) = 0.6310
2025-11-06 20:34:17,595 [INFO   ]   [Filter 2] Valley at 2020-06-15: Slope Check (60d) = 0.7237
2025-11-06 20:34:17,597 [INFO   ]   [Filter 2] Valley at 2020-06-15: Slope Check (90d) = 0.4060
2025-11-06 20:34:17,597 [INFO   ]   [Filter 2] 30-Day Growth Check: 5.73%
2025-11-06 20:34:17,597 [INFO   ]   [Filter 2] FAILED. Growth of 5.73% < 10.0% threshold.
2025-11-06 20:34:17,598 [INFO   ] 
--- Analyzing Valley at 2020-07-21 (index 892) ---
2025-11-06 20:34:17,599 [INFO   ]   [Filter 2] Valley at 2020-07-21: Slope Check (30d) = 0.8829
2025-11-06 20:34:17,600 [INFO   ]   [Filter 2] Valley at 2020-07-21: Slope Check (60d) = 0.2152
2025-11-06 20:34:17,601 [INFO   ]   [Filter 2] Valley at 2020-07-21: Slope Check (90d) = 0.2587
2025-11-06 20:34:17,601 [INFO   ]   [Filter 2] 30-Day Growth Check: 7.48%
2025-11-06 20:34:17,601 [INFO   ]   [Filter 2] FAILED. Growth of 7.48% < 10.0% threshold.
2025-11-06 20:34:17,602 [INFO   ] 
--- Analyzing Valley at 2020-08-24 (index 916) ---
2025-11-06 20:34:17,603 [INFO   ]   [Filter 2] Valley at 2020-08-24: Slope Check (30d) = -0.5717
2025-11-06 20:34:17,604 [INFO   ]   [Filter 2] Valley at 2020-08-24: Slope Check (60d) = 0.1330
2025-11-06 20:34:17,605 [INFO   ]   [Filter 2] Valley at 2020-08-24: Slope Check (90d) = 0.4072
2025-11-06 20:34:17,605 [INFO   ]   [Filter 2] 30-Day Growth Check: -0.52%
2025-11-06 20:34:17,605 [INFO   ]   [Filter 2] FAILED. Growth of -0.52% < 10.0% threshold.
2025-11-06 20:34:17,605 [INFO   ] 
--- Analyzing Valley at 2020-11-02 (index 965) ---
2025-11-06 20:34:17,606 [INFO   ]   [Filter 2] Valley at 2020-11-02: Slope Check (30d) = 0.8762
2025-11-06 20:34:17,607 [INFO   ]   [Filter 2] Valley at 2020-11-02: Slope Check (60d) = 0.5933
2025-11-06 20:34:17,608 [INFO   ]   [Filter 2] Valley at 2020-11-02: Slope Check (90d) = 0.4640
2025-11-06 20:34:17,609 [INFO   ]   [Filter 2] 30-Day Growth Check: 10.44%
2025-11-06 20:34:17,609 [INFO   ]   [Filter 2] PASSED. Growth of 10.44% >= 10.0% threshold.
2025-11-06 20:34:17,612 [INFO   ]   [Filter 2.5] Historical Context Check: Current growth is in the 97.03th percentile of this stock's history.
2025-11-06 20:34:17,612 [INFO   ]   [Filter 2.5] PASSED. Percentile rank 97.03% >= 95.0% threshold.
2025-11-06 20:34:17,613 [INFO   ]     [Filter 3] DNA Test vs 'DOGE-USD_m30_ramp': Distance = 42.4264
2025-11-06 20:34:17,613 [INFO   ]     [Filter 3] DNA Test vs 'SSYS_m90_ramp': Distance = 42.4264
2025-11-06 20:34:17,613 [INFO   ]     [Filter 3] DNA Test vs 'SHIB-USD_m30_ramp': Distance = 42.4264
2025-11-06 20:34:17,613 [INFO   ]     [Filter 3] DNA Test vs 'CSCO_m90_ramp': Distance = 42.4264
2025-11-06 20:34:17,613 [INFO   ]     [Filter 3] DNA Test vs 'GME_m90_ramp': Distance = 42.4264
2025-11-06 20:34:17,614 [INFO   ]     [Filter 3] DNA Test vs 'IYR_m120_ramp': Distance = 42.4264
2025-11-06 20:34:17,614 [INFO   ]     [Filter 3] DNA Test vs 'VWAGY_m15_ramp': Distance = 42.4264
2025-11-06 20:34:17,614 [INFO   ]     [Filter 3] DNA Test vs 'AMC_m30_ramp': Distance = 42.4264
2025-11-06 20:34:17,614 [INFO   ]     [Filter 3] FAILED. No DNA match found below loose threshold.
2025-11-06 20:34:17,615 [INFO   ] 
--- Analyzing Valley at 2020-12-31 (index 1006) ---
2025-11-06 20:34:17,616 [INFO   ]   [Filter 2] Valley at 2020-12-31: Slope Check (30d) = 0.5036
2025-11-06 20:34:17,617 [INFO   ]   [Filter 2] Valley at 2020-12-31: Slope Check (60d) = 0.2970
2025-11-06 20:34:17,618 [INFO   ]   [Filter 2] Valley at 2020-12-31: Slope Check (90d) = 0.5110
2025-11-06 20:34:17,618 [INFO   ]   [Filter 2] 30-Day Growth Check: 5.02%
2025-11-06 20:34:17,618 [INFO   ]   [Filter 2] FAILED. Growth of 5.02% < 10.0% threshold.
2025-11-06 20:34:17,618 [INFO   ] 
--- Analyzing Valley at 2021-01-25 (index 1021) ---
2025-11-06 20:34:17,620 [INFO   ]   [Filter 2] Valley at 2021-01-25: Slope Check (30d) = 0.1446
2025-11-06 20:34:17,621 [INFO   ]   [Filter 2] Valley at 2021-01-25: Slope Check (60d) = 0.5222
2025-11-06 20:34:17,622 [INFO   ]   [Filter 2] Valley at 2021-01-25: Slope Check (90d) = 0.4979
2025-11-06 20:34:17,622 [INFO   ]   [Filter 2] 30-Day Growth Check: -0.69%
2025-11-06 20:34:17,622 [INFO   ]   [Filter 2] FAILED. Growth of -0.69% < 10.0% threshold.
2025-11-06 20:34:17,622 [INFO   ] 
--- Analyzing Valley at 2021-03-11 (index 1053) ---
2025-11-06 20:34:17,623 [INFO   ]   [Filter 2] Valley at 2021-03-11: Slope Check (30d) = 0.9630
2025-11-06 20:34:17,624 [INFO   ]   [Filter 2] Valley at 2021-03-11: Slope Check (60d) = 0.4816
2025-11-06 20:34:17,625 [INFO   ]   [Filter 2] Valley at 2021-03-11: Slope Check (90d) = 0.4266
2025-11-06 20:34:17,625 [INFO   ]   [Filter 2] 30-Day Growth Check: 5.11%
2025-11-06 20:34:17,625 [INFO   ]   [Filter 2] FAILED. Growth of 5.11% < 10.0% threshold.
2025-11-06 20:34:17,626 [INFO   ] 
--- Analyzing Valley at 2021-05-21 (index 1103) ---
2025-11-06 20:34:17,627 [INFO   ]   [Filter 2] Valley at 2021-05-21: Slope Check (30d) = 0.4144
2025-11-06 20:34:17,628 [INFO   ]   [Filter 2] Valley at 2021-05-21: Slope Check (60d) = 0.4892
2025-11-06 20:34:17,629 [INFO   ]   [Filter 2] Valley at 2021-05-21: Slope Check (90d) = 0.3591
2025-11-06 20:34:17,629 [INFO   ]   [Filter 2] 30-Day Growth Check: 4.87%
2025-11-06 20:34:17,629 [INFO   ]   [Filter 2] FAILED. Growth of 4.87% < 10.0% threshold.
2025-11-06 20:34:17,629 [INFO   ] 
--- Analyzing Valley at 2021-06-28 (index 1128) ---
2025-11-06 20:34:17,630 [INFO   ]   [Filter 2] Valley at 2021-06-28: Slope Check (30d) = 0.4154
2025-11-06 20:34:17,631 [INFO   ]   [Filter 2] Valley at 2021-06-28: Slope Check (60d) = 0.3063
2025-11-06 20:34:17,632 [INFO   ]   [Filter 2] Valley at 2021-06-28: Slope Check (90d) = 0.1900
2025-11-06 20:34:17,632 [INFO   ]   [Filter 2] 30-Day Growth Check: 3.43%
2025-11-06 20:34:17,632 [INFO   ]   [Filter 2] FAILED. Growth of 3.43% < 10.0% threshold.
2025-11-06 20:34:17,632 [INFO   ] 
--- Analyzing Valley at 2021-08-31 (index 1173) ---
2025-11-06 20:34:17,634 [INFO   ]   [Filter 2] Valley at 2021-08-31: Slope Check (30d) = -0.6383
2025-11-06 20:34:17,634 [INFO   ]   [Filter 2] Valley at 2021-08-31: Slope Check (60d) = 0.4838
2025-11-06 20:34:17,635 [INFO   ]   [Filter 2] Valley at 2021-08-31: Slope Check (90d) = 0.4065
2025-11-06 20:34:17,635 [INFO   ]   [Filter 2] 30-Day Growth Check: -3.67%
2025-11-06 20:34:17,635 [INFO   ]   [Filter 2] FAILED. Growth of -3.67% < 10.0% threshold.
2025-11-06 20:34:17,636 [INFO   ] 
--- Analyzing Valley at 2021-12-02 (index 1238) ---
2025-11-06 20:34:17,636 [INFO   ]   [Filter 2] Valley at 2021-12-02: Slope Check (30d) = 0.4040
2025-11-06 20:34:17,637 [INFO   ]   [Filter 2] Valley at 2021-12-02: Slope Check (60d) = -0.5870
2025-11-06 20:34:17,638 [INFO   ]   [Filter 2] Valley at 2021-12-02: Slope Check (90d) = -0.3272
2025-11-06 20:34:17,638 [INFO   ]   [Filter 2] 30-Day Growth Check: 1.92%
2025-11-06 20:34:17,639 [INFO   ]   [Filter 2] FAILED. Growth of 1.92% < 10.0% threshold.
2025-11-06 20:34:17,639 [INFO   ] 
--- Analyzing Valley at 2022-01-10 (index 1264) ---
2025-11-06 20:34:17,640 [INFO   ]   [Filter 2] Valley at 2022-01-10: Slope Check (30d) = -0.7206
2025-11-06 20:34:17,641 [INFO   ]   [Filter 2] Valley at 2022-01-10: Slope Check (60d) = -0.1496
2025-11-06 20:34:17,642 [INFO   ]   [Filter 2] Valley at 2022-01-10: Slope Check (90d) = -0.3989
2025-11-06 20:34:17,642 [INFO   ]   [Filter 2] FAILED. No positive slope found.
2025-11-06 20:34:17,642 [INFO   ] 
--- Analyzing Valley at 2022-03-25 (index 1316) ---
2025-11-06 20:34:17,643 [INFO   ]   [Filter 2] Valley at 2022-03-25: Slope Check (30d) = -1.5807
2025-11-06 20:34:17,644 [INFO   ]   [Filter 2] Valley at 2022-03-25: Slope Check (60d) = -1.2458
2025-11-06 20:34:17,645 [INFO   ]   [Filter 2] Valley at 2022-03-25: Slope Check (90d) = -0.6856
2025-11-06 20:34:17,645 [INFO   ]   [Filter 2] FAILED. No positive slope found.
2025-11-06 20:34:17,645 [INFO   ] 
--- Analyzing Valley at 2022-05-20 (index 1355) ---
2025-11-06 20:34:17,646 [INFO   ]   [Filter 2] Valley at 2022-05-20: Slope Check (30d) = -1.0501
2025-11-06 20:34:17,647 [INFO   ]   [Filter 2] Valley at 2022-05-20: Slope Check (60d) = 0.3374
2025-11-06 20:34:17,648 [INFO   ]   [Filter 2] Valley at 2022-05-20: Slope Check (90d) = 0.0451
2025-11-06 20:34:17,648 [INFO   ]   [Filter 2] 30-Day Growth Check: -1.55%
2025-11-06 20:34:17,648 [INFO   ]   [Filter 2] FAILED. Growth of -1.55% < 10.0% threshold.
2025-11-06 20:34:17,649 [INFO   ] 
--- Analyzing Valley at 2022-07-08 (index 1387) ---
2025-11-06 20:34:17,649 [INFO   ]   [Filter 2] Valley at 2022-07-08: Slope Check (30d) = 1.7237
2025-11-06 20:34:17,650 [INFO   ]   [Filter 2] Valley at 2022-07-08: Slope Check (60d) = -0.2885
2025-11-06 20:34:17,651 [INFO   ]   [Filter 2] Valley at 2022-07-08: Slope Check (90d) = -0.3702
2025-11-06 20:34:17,651 [INFO   ]   [Filter 2] 30-Day Growth Check: 10.09%
2025-11-06 20:34:17,651 [INFO   ]   [Filter 2] PASSED. Growth of 10.09% >= 10.0% threshold.
2025-11-06 20:34:17,653 [INFO   ]   [Filter 2.5] Historical Context Check: Current growth is in the 96.62th percentile of this stock's history.
2025-11-06 20:34:17,653 [INFO   ]   [Filter 2.5] PASSED. Percentile rank 96.62% >= 95.0% threshold.
2025-11-06 20:34:17,654 [INFO   ]     [Filter 3] DNA Test vs 'DOGE-USD_m30_ramp': Distance = 42.4264
2025-11-06 20:34:17,654 [INFO   ]     [Filter 3] DNA Test vs 'SSYS_m90_ramp': Distance = 42.4264
2025-11-06 20:34:17,654 [INFO   ]     [Filter 3] DNA Test vs 'SHIB-USD_m30_ramp': Distance = 42.4264
2025-11-06 20:34:17,654 [INFO   ]     [Filter 3] DNA Test vs 'CSCO_m90_ramp': Distance = 42.4264
2025-11-06 20:34:17,655 [INFO   ]     [Filter 3] DNA Test vs 'GME_m90_ramp': Distance = 42.4264
2025-11-06 20:34:17,655 [INFO   ]     [Filter 3] DNA Test vs 'IYR_m120_ramp': Distance = 42.4264
2025-11-06 20:34:17,655 [INFO   ]     [Filter 3] DNA Test vs 'VWAGY_m15_ramp': Distance = 42.4264
2025-11-06 20:34:17,655 [INFO   ]     [Filter 3] DNA Test vs 'AMC_m30_ramp': Distance = 42.4264
2025-11-06 20:34:17,655 [INFO   ]     [Filter 3] FAILED. No DNA match found below loose threshold.
2025-11-06 20:34:17,656 [INFO   ] 
--- Analyzing Valley at 2022-08-15 (index 1413) ---
2025-11-06 20:34:17,657 [INFO   ]   [Filter 2] Valley at 2022-08-15: Slope Check (30d) = -1.7303
2025-11-06 20:34:17,658 [INFO   ]   [Filter 2] Valley at 2022-08-15: Slope Check (60d) = -0.8002
2025-11-06 20:34:17,659 [INFO   ]   [Filter 2] Valley at 2022-08-15: Slope Check (90d) = -0.0960
2025-11-06 20:34:17,659 [INFO   ]   [Filter 2] FAILED. No positive slope found.
2025-11-06 20:34:17,659 [INFO   ] 
--- Analyzing Valley at 2022-09-23 (index 1441) ---
2025-11-06 20:34:17,660 [INFO   ]   [Filter 2] Valley at 2022-09-23: Slope Check (30d) = 0.6022
2025-11-06 20:34:17,661 [INFO   ]   [Filter 2] Valley at 2022-09-23: Slope Check (60d) = 0.7052
2025-11-06 20:34:17,661 [INFO   ]   [Filter 2] 30-Day Growth Check: 0.83%
2025-11-06 20:34:17,661 [INFO   ]   [Filter 2] FAILED. Growth of 0.83% < 10.0% threshold.
2025-11-06 20:34:17,661 [INFO   ] 
--- [Analysis Summary] ---
2025-11-06 20:34:17,661 [INFO   ] Total Valleys Found: 32
2025-11-06 20:34:17,662 [INFO   ] Valleys Passing Filter 2 (Intensity Test): 2
2025-11-06 20:34:17,662 [INFO   ] Valleys Passing Filter 2.5 (Context Test): 2
2025-11-06 20:34:17,662 [INFO   ] Valleys Passing Filter 3 (DNA Test): 0
2025-11-06 20:34:17,662 [INFO   ] --- [Historical Analyzer Finished] ---
