2025-11-06 20:42:01,147 [INFO   ] --- [Historical Analyzer Started for F] ---
2025-11-06 20:42:02,118 [INFO   ] Loaded 1510 data points for F.
2025-11-06 20:42:02,120 [INFO   ] Computing full CAC curve with m=30...
2025-11-06 20:42:27,478 [INFO   ] Found 15 significant valleys in the CAC curve.
2025-11-06 20:42:27,479 [INFO   ] 
--- Analyzing Valley at 2017-08-08 (index 150) ---
2025-11-06 20:42:27,480 [INFO   ]   [Filter 2] Valley at 2017-08-08: Slope Check (30d) = 0.0242
2025-11-06 20:42:27,481 [INFO   ]   [Filter 2] Valley at 2017-08-08: Slope Check (60d) = 0.0220
2025-11-06 20:42:27,482 [INFO   ]   [Filter 2] Valley at 2017-08-08: Slope Check (90d) = 0.0149
2025-11-06 20:42:27,482 [INFO   ]   [Filter 2] 30-Day Growth Check: 7.62%
2025-11-06 20:42:27,483 [INFO   ]   [Filter 2] FAILED. Growth of 7.62% < 10.0% threshold.
2025-11-06 20:42:27,483 [INFO   ] 
--- Analyzing Valley at 2017-11-13 (index 218) ---
2025-11-06 20:42:27,484 [INFO   ]   [Filter 2] Valley at 2017-11-13: Slope Check (30d) = 0.0165
2025-11-06 20:42:27,484 [INFO   ]   [Filter 2] Valley at 2017-11-13: Slope Check (60d) = -0.0099
2025-11-06 20:42:27,485 [INFO   ]   [Filter 2] Valley at 2017-11-13: Slope Check (90d) = -0.0149
2025-11-06 20:42:27,485 [INFO   ]   [Filter 2] 30-Day Growth Check: 3.62%
2025-11-06 20:42:27,485 [INFO   ]   [Filter 2] FAILED. Growth of 3.62% < 10.0% threshold.
2025-11-06 20:42:27,486 [INFO   ] 
--- Analyzing Valley at 2018-02-16 (index 283) ---
2025-11-06 20:42:27,487 [INFO   ]   [Filter 2] Valley at 2018-02-16: Slope Check (30d) = 0.0095
2025-11-06 20:42:27,488 [INFO   ]   [Filter 2] Valley at 2018-02-16: Slope Check (60d) = 0.0111
2025-11-06 20:42:27,488 [INFO   ]   [Filter 2] Valley at 2018-02-16: Slope Check (90d) = 0.0119
2025-11-06 20:42:27,489 [INFO   ]   [Filter 2] 30-Day Growth Check: 2.36%
2025-11-06 20:42:27,489 [INFO   ]   [Filter 2] FAILED. Growth of 2.36% < 10.0% threshold.
2025-11-06 20:42:27,489 [INFO   ] 
--- Analyzing Valley at 2018-05-10 (index 340) ---
2025-11-06 20:42:27,490 [INFO   ]   [Filter 2] Valley at 2018-05-10: Slope Check (30d) = 0.0199
2025-11-06 20:42:27,491 [INFO   ]   [Filter 2] Valley at 2018-05-10: Slope Check (60d) = -0.0161
2025-11-06 20:42:27,491 [INFO   ]   [Filter 2] Valley at 2018-05-10: Slope Check (90d) = -0.0202
2025-11-06 20:42:27,492 [INFO   ]   [Filter 2] 30-Day Growth Check: 4.46%
2025-11-06 20:42:27,492 [INFO   ]   [Filter 2] FAILED. Growth of 4.46% < 10.0% threshold.
2025-11-06 20:42:27,492 [INFO   ] 
--- Analyzing Valley at 2018-07-23 (index 390) ---
2025-11-06 20:42:27,493 [INFO   ]   [Filter 2] Valley at 2018-07-23: Slope Check (30d) = -0.0149
2025-11-06 20:42:27,493 [INFO   ]   [Filter 2] Valley at 2018-07-23: Slope Check (60d) = -0.0139
2025-11-06 20:42:27,494 [INFO   ]   [Filter 2] Valley at 2018-07-23: Slope Check (90d) = -0.0064
2025-11-06 20:42:27,494 [INFO   ]   [Filter 2] FAILED. No positive slope found.
2025-11-06 20:42:27,495 [INFO   ] 
--- Analyzing Valley at 2018-09-11 (index 425) ---
2025-11-06 20:42:27,496 [INFO   ]   [Filter 2] Valley at 2018-09-11: Slope Check (30d) = -0.0263
2025-11-06 20:42:27,497 [INFO   ]   [Filter 2] Valley at 2018-09-11: Slope Check (60d) = 0.0025
2025-11-06 20:42:27,498 [INFO   ]   [Filter 2] Valley at 2018-09-11: Slope Check (90d) = -0.0076
2025-11-06 20:42:27,498 [INFO   ]   [Filter 2] 30-Day Growth Check: -8.04%
2025-11-06 20:42:27,498 [INFO   ]   [Filter 2] FAILED. Growth of -8.04% < 10.0% threshold.
2025-11-06 20:42:27,499 [INFO   ] 
--- Analyzing Valley at 2018-12-03 (index 483) ---
2025-11-06 20:42:27,500 [INFO   ]   [Filter 2] Valley at 2018-12-03: Slope Check (30d) = -0.0118
2025-11-06 20:42:27,501 [INFO   ]   [Filter 2] Valley at 2018-12-03: Slope Check (60d) = 0.0055
2025-11-06 20:42:27,502 [INFO   ]   [Filter 2] Valley at 2018-12-03: Slope Check (90d) = 0.0065
2025-11-06 20:42:27,502 [INFO   ]   [Filter 2] 30-Day Growth Check: -13.65%
2025-11-06 20:42:27,502 [INFO   ]   [Filter 2] FAILED. Growth of -13.65% < 10.0% threshold.
2025-11-06 20:42:27,503 [INFO   ] 
--- Analyzing Valley at 2019-06-25 (index 622) ---
2025-11-06 20:42:27,504 [INFO   ]   [Filter 2] Valley at 2019-06-25: Slope Check (30d) = -0.0154
2025-11-06 20:42:27,505 [INFO   ]   [Filter 2] Valley at 2019-06-25: Slope Check (60d) = -0.0143
2025-11-06 20:42:27,506 [INFO   ]   [Filter 2] Valley at 2019-06-25: Slope Check (90d) = -0.0110
2025-11-06 20:42:27,506 [INFO   ]   [Filter 2] FAILED. No positive slope found.
2025-11-06 20:42:27,507 [INFO   ] 
--- Analyzing Valley at 2019-11-29 (index 732) ---
2025-11-06 20:42:27,507 [INFO   ]   [Filter 2] Valley at 2019-11-29: Slope Check (30d) = 0.0083
2025-11-06 20:42:27,508 [INFO   ]   [Filter 2] Valley at 2019-11-29: Slope Check (60d) = -0.0166
2025-11-06 20:42:27,509 [INFO   ]   [Filter 2] Valley at 2019-11-29: Slope Check (90d) = -0.0457
2025-11-06 20:42:27,509 [INFO   ]   [Filter 2] 30-Day Growth Check: 1.99%
2025-11-06 20:42:27,509 [INFO   ]   [Filter 2] FAILED. Growth of 1.99% < 10.0% threshold.
2025-11-06 20:42:27,509 [INFO   ] 
--- Analyzing Valley at 2020-02-11 (index 781) ---
2025-11-06 20:42:27,510 [INFO   ]   [Filter 2] Valley at 2020-02-11: Slope Check (30d) = -0.1139
2025-11-06 20:42:27,511 [INFO   ]   [Filter 2] Valley at 2020-02-11: Slope Check (60d) = -0.0444
2025-11-06 20:42:27,512 [INFO   ]   [Filter 2] Valley at 2020-02-11: Slope Check (90d) = -0.0093
2025-11-06 20:42:27,512 [INFO   ]   [Filter 2] FAILED. No positive slope found.
2025-11-06 20:42:27,512 [INFO   ] 
--- Analyzing Valley at 2020-06-26 (index 876) ---
2025-11-06 20:42:27,513 [INFO   ]   [Filter 2] Valley at 2020-06-26: Slope Check (30d) = 0.0299
2025-11-06 20:42:27,514 [INFO   ]   [Filter 2] Valley at 2020-06-26: Slope Check (60d) = 0.0124
2025-11-06 20:42:27,515 [INFO   ]   [Filter 2] Valley at 2020-06-26: Slope Check (90d) = 0.0122
2025-11-06 20:42:27,515 [INFO   ]   [Filter 2] 30-Day Growth Check: 16.07%
2025-11-06 20:42:27,515 [INFO   ]   [Filter 2] PASSED. Growth of 16.07% >= 10.0% threshold.
2025-11-06 20:42:27,517 [INFO   ]   [Filter 2.5] Historical Context Check: Current growth is in the 85.62th percentile of this stock's history.
2025-11-06 20:42:27,517 [INFO   ]   [Filter 2.5] FAILED. Percentile rank 85.62% < 95.0% threshold.
2025-11-06 20:42:27,517 [INFO   ] 
--- Analyzing Valley at 2020-09-18 (index 934) ---
2025-11-06 20:42:27,519 [INFO   ]   [Filter 2] Valley at 2020-09-18: Slope Check (30d) = 0.0411
2025-11-06 20:42:27,519 [INFO   ]   [Filter 2] Valley at 2020-09-18: Slope Check (60d) = 0.0374
2025-11-06 20:42:27,520 [INFO   ]   [Filter 2] Valley at 2020-09-18: Slope Check (90d) = 0.0309
2025-11-06 20:42:27,520 [INFO   ]   [Filter 2] 30-Day Growth Check: 9.27%
2025-11-06 20:42:27,520 [INFO   ]   [Filter 2] FAILED. Growth of 9.27% < 10.0% threshold.
2025-11-06 20:42:27,520 [INFO   ] 
--- Analyzing Valley at 2020-12-07 (index 989) ---
2025-11-06 20:42:27,521 [INFO   ]   [Filter 2] Valley at 2020-12-07: Slope Check (30d) = 0.0221
2025-11-06 20:42:27,522 [INFO   ]   [Filter 2] Valley at 2020-12-07: Slope Check (60d) = 0.0508
2025-11-06 20:42:27,523 [INFO   ]   [Filter 2] Valley at 2020-12-07: Slope Check (90d) = 0.0393
2025-11-06 20:42:27,523 [INFO   ]   [Filter 2] 30-Day Growth Check: 17.79%
2025-11-06 20:42:27,523 [INFO   ]   [Filter 2] PASSED. Growth of 17.79% >= 10.0% threshold.
2025-11-06 20:42:27,525 [INFO   ]   [Filter 2.5] Historical Context Check: Current growth is in the 86.83th percentile of this stock's history.
2025-11-06 20:42:27,525 [INFO   ]   [Filter 2.5] FAILED. Percentile rank 86.83% < 95.0% threshold.
2025-11-06 20:42:27,526 [INFO   ] 
--- Analyzing Valley at 2021-03-10 (index 1052) ---
2025-11-06 20:42:27,526 [INFO   ]   [Filter 2] Valley at 2021-03-10: Slope Check (30d) = -0.0239
2025-11-06 20:42:27,527 [INFO   ]   [Filter 2] Valley at 2021-03-10: Slope Check (60d) = 0.0099
2025-11-06 20:42:27,528 [INFO   ]   [Filter 2] Valley at 2021-03-10: Slope Check (90d) = 0.0282
2025-11-06 20:42:27,528 [INFO   ]   [Filter 2] 30-Day Growth Check: -9.14%
2025-11-06 20:42:27,528 [INFO   ]   [Filter 2] FAILED. Growth of -9.14% < 10.0% threshold.
2025-11-06 20:42:27,528 [INFO   ] 
--- Analyzing Valley at 2021-05-28 (index 1108) ---
2025-11-06 20:42:27,529 [INFO   ]   [Filter 2] Valley at 2021-05-28: Slope Check (30d) = -0.0233
2025-11-06 20:42:27,530 [INFO   ]   [Filter 2] Valley at 2021-05-28: Slope Check (60d) = -0.0317
2025-11-06 20:42:27,531 [INFO   ]   [Filter 2] Valley at 2021-05-28: Slope Check (90d) = -0.0191
2025-11-06 20:42:27,531 [INFO   ]   [Filter 2] FAILED. No positive slope found.
2025-11-06 20:42:27,531 [INFO   ] 
--- [Analysis Summary] ---
2025-11-06 20:42:27,531 [INFO   ] Total Valleys Found: 15
2025-11-06 20:42:27,531 [INFO   ] Valleys Passing Filter 2 (Intensity Test): 2
2025-11-06 20:42:27,531 [INFO   ] Valleys Passing Filter 2.5 (Context Test): 0
2025-11-06 20:42:27,531 [INFO   ] Valleys Passing Filter 3 (DNA Test): 0
2025-11-06 20:42:27,532 [INFO   ] --- [Historical Analyzer Finished] ---
