2025-11-06 20:43:34,311 [INFO   ] --- [Historical Analyzer Started for JPM] ---
2025-11-06 20:43:35,122 [INFO   ] Loaded 1510 data points for JPM.
2025-11-06 20:43:35,124 [INFO   ] Computing full CAC curve with m=15...
2025-11-06 20:44:02,244 [INFO   ] Found 17 significant valleys in the CAC curve.
2025-11-06 20:44:02,244 [INFO   ] 
--- Analyzing Valley at 2018-09-13 (index 427) ---
2025-11-06 20:44:02,246 [INFO   ]   [Filter 2] Valley at 2018-09-13: Slope Check (30d) = -0.2845
2025-11-06 20:44:02,248 [INFO   ]   [Filter 2] Valley at 2018-09-13: Slope Check (60d) = -0.0984
2025-11-06 20:44:02,249 [INFO   ]   [Filter 2] Valley at 2018-09-13: Slope Check (90d) = -0.1492
2025-11-06 20:44:02,249 [INFO   ]   [Filter 2] FAILED. No positive slope found.
2025-11-06 20:44:02,249 [INFO   ] 
--- Analyzing Valley at 2019-03-27 (index 560) ---
2025-11-06 20:44:02,250 [INFO   ]   [Filter 2] Valley at 2019-03-27: Slope Check (30d) = 0.4724
2025-11-06 20:44:02,252 [INFO   ]   [Filter 2] Valley at 2019-03-27: Slope Check (60d) = 0.0543
2025-11-06 20:44:02,253 [INFO   ]   [Filter 2] Valley at 2019-03-27: Slope Check (90d) = 0.0754
2025-11-06 20:44:02,253 [INFO   ]   [Filter 2] 30-Day Growth Check: 13.95%
2025-11-06 20:44:02,253 [INFO   ]   [Filter 2] PASSED. Growth of 13.95% >= 10.0% threshold.
2025-11-06 20:44:02,257 [INFO   ]   [Filter 2.5] Historical Context Check: Current growth is in the 94.46th percentile of this stock's history.
2025-11-06 20:44:02,258 [INFO   ]   [Filter 2.5] FAILED. Percentile rank 94.46% < 95.0% threshold.
2025-11-06 20:44:02,258 [INFO   ] 
--- Analyzing Valley at 2019-06-06 (index 609) ---
2025-11-06 20:44:02,259 [INFO   ]   [Filter 2] Valley at 2019-06-06: Slope Check (30d) = 0.2055
2025-11-06 20:44:02,260 [INFO   ]   [Filter 2] Valley at 2019-06-06: Slope Check (60d) = -0.0237
2025-11-06 20:44:02,261 [INFO   ]   [Filter 2] Valley at 2019-06-06: Slope Check (90d) = 0.0583
2025-11-06 20:44:02,261 [INFO   ]   [Filter 2] 30-Day Growth Check: 4.63%
2025-11-06 20:44:02,261 [INFO   ]   [Filter 2] FAILED. Growth of 4.63% < 10.0% threshold.
2025-11-06 20:44:02,261 [INFO   ] 
--- Analyzing Valley at 2019-09-11 (index 676) ---
2025-11-06 20:44:02,262 [INFO   ]   [Filter 2] Valley at 2019-09-11: Slope Check (30d) = 0.0630
2025-11-06 20:44:02,264 [INFO   ]   [Filter 2] Valley at 2019-09-11: Slope Check (60d) = 0.2860
2025-11-06 20:44:02,265 [INFO   ]   [Filter 2] Valley at 2019-09-11: Slope Check (90d) = 0.2706
2025-11-06 20:44:02,265 [INFO   ]   [Filter 2] 30-Day Growth Check: 7.34%
2025-11-06 20:44:02,265 [INFO   ]   [Filter 2] FAILED. Growth of 7.34% < 10.0% threshold.
2025-11-06 20:44:02,266 [INFO   ] 
--- Analyzing Valley at 2019-12-10 (index 739) ---
2025-11-06 20:44:02,267 [INFO   ]   [Filter 2] Valley at 2019-12-10: Slope Check (30d) = 0.0496
2025-11-06 20:44:02,268 [INFO   ]   [Filter 2] Valley at 2019-12-10: Slope Check (60d) = -0.2031
2025-11-06 20:44:02,268 [INFO   ]   [Filter 2] Valley at 2019-12-10: Slope Check (90d) = -0.5910
2025-11-06 20:44:02,269 [INFO   ]   [Filter 2] 30-Day Growth Check: 2.17%
2025-11-06 20:44:02,269 [INFO   ]   [Filter 2] FAILED. Growth of 2.17% < 10.0% threshold.
2025-11-06 20:44:02,269 [INFO   ] 
--- Analyzing Valley at 2020-02-05 (index 777) ---
2025-11-06 20:44:02,270 [INFO   ]   [Filter 2] Valley at 2020-02-05: Slope Check (30d) = -1.6843
2025-11-06 20:44:02,271 [INFO   ]   [Filter 2] Valley at 2020-02-05: Slope Check (60d) = -0.7785
2025-11-06 20:44:02,272 [INFO   ]   [Filter 2] Valley at 2020-02-05: Slope Check (90d) = -0.3222
2025-11-06 20:44:02,272 [INFO   ]   [Filter 2] FAILED. No positive slope found.
2025-11-06 20:44:02,272 [INFO   ] 
--- Analyzing Valley at 2020-03-19 (index 807) ---
2025-11-06 20:44:02,273 [INFO   ]   [Filter 2] Valley at 2020-03-19: Slope Check (30d) = 0.2669
2025-11-06 20:44:02,274 [INFO   ]   [Filter 2] Valley at 2020-03-19: Slope Check (60d) = 0.2163
2025-11-06 20:44:02,274 [INFO   ]   [Filter 2] Valley at 2020-03-19: Slope Check (90d) = 0.1164
2025-11-06 20:44:02,275 [INFO   ]   [Filter 2] 30-Day Growth Check: 13.43%
2025-11-06 20:44:02,275 [INFO   ]   [Filter 2] PASSED. Growth of 13.43% >= 10.0% threshold.
2025-11-06 20:44:02,278 [INFO   ]   [Filter 2.5] Historical Context Check: Current growth is in the 94.19th percentile of this stock's history.
2025-11-06 20:44:02,278 [INFO   ]   [Filter 2.5] FAILED. Percentile rank 94.19% < 95.0% threshold.
2025-11-06 20:44:02,279 [INFO   ] 
--- Analyzing Valley at 2020-06-02 (index 858) ---
2025-11-06 20:44:02,280 [INFO   ]   [Filter 2] Valley at 2020-06-02: Slope Check (30d) = -0.3994
2025-11-06 20:44:02,281 [INFO   ]   [Filter 2] Valley at 2020-06-02: Slope Check (60d) = -0.0257
2025-11-06 20:44:02,282 [INFO   ]   [Filter 2] Valley at 2020-06-02: Slope Check (90d) = -0.0111
2025-11-06 20:44:02,282 [INFO   ]   [Filter 2] FAILED. No positive slope found.
2025-11-06 20:44:02,282 [INFO   ] 
--- Analyzing Valley at 2020-08-28 (index 920) ---
2025-11-06 20:44:02,283 [INFO   ]   [Filter 2] Valley at 2020-08-28: Slope Check (30d) = -0.1055
2025-11-06 20:44:02,284 [INFO   ]   [Filter 2] Valley at 2020-08-28: Slope Check (60d) = 0.2288
2025-11-06 20:44:02,285 [INFO   ]   [Filter 2] Valley at 2020-08-28: Slope Check (90d) = 0.3443
2025-11-06 20:44:02,286 [INFO   ]   [Filter 2] 30-Day Growth Check: -0.61%
2025-11-06 20:44:02,286 [INFO   ]   [Filter 2] FAILED. Growth of -0.61% < 10.0% threshold.
2025-11-06 20:44:02,286 [INFO   ] 
--- Analyzing Valley at 2020-11-11 (index 972) ---
2025-11-06 20:44:02,287 [INFO   ]   [Filter 2] Valley at 2020-11-11: Slope Check (30d) = 0.2202
2025-11-06 20:44:02,288 [INFO   ]   [Filter 2] Valley at 2020-11-11: Slope Check (60d) = 0.3772
2025-11-06 20:44:02,290 [INFO   ]   [Filter 2] Valley at 2020-11-11: Slope Check (90d) = 0.4454
2025-11-06 20:44:02,290 [INFO   ]   [Filter 2] 30-Day Growth Check: 8.96%
2025-11-06 20:44:02,290 [INFO   ]   [Filter 2] FAILED. Growth of 8.96% < 10.0% threshold.
2025-11-06 20:44:02,291 [INFO   ] 
--- Analyzing Valley at 2020-12-30 (index 1005) ---
2025-11-06 20:44:02,292 [INFO   ]   [Filter 2] Valley at 2020-12-30: Slope Check (30d) = 0.2174
2025-11-06 20:44:02,293 [INFO   ]   [Filter 2] Valley at 2020-12-30: Slope Check (60d) = 0.4353
2025-11-06 20:44:02,295 [INFO   ]   [Filter 2] Valley at 2020-12-30: Slope Check (90d) = 0.2892
2025-11-06 20:44:02,295 [INFO   ]   [Filter 2] 30-Day Growth Check: 11.90%
2025-11-06 20:44:02,295 [INFO   ]   [Filter 2] PASSED. Growth of 11.90% >= 10.0% threshold.
2025-11-06 20:44:02,299 [INFO   ]   [Filter 2.5] Historical Context Check: Current growth is in the 91.83th percentile of this stock's history.
2025-11-06 20:44:02,299 [INFO   ]   [Filter 2.5] FAILED. Percentile rank 91.83% < 95.0% threshold.
2025-11-06 20:44:02,300 [INFO   ] 
--- Analyzing Valley at 2021-02-11 (index 1034) ---
2025-11-06 20:44:02,301 [INFO   ]   [Filter 2] Valley at 2021-02-11: Slope Check (30d) = 0.3159
2025-11-06 20:44:02,302 [INFO   ]   [Filter 2] Valley at 2021-02-11: Slope Check (60d) = 0.1315
2025-11-06 20:44:02,304 [INFO   ]   [Filter 2] Valley at 2021-02-11: Slope Check (90d) = 0.1535
2025-11-06 20:44:02,304 [INFO   ]   [Filter 2] 30-Day Growth Check: 9.54%
2025-11-06 20:44:02,304 [INFO   ]   [Filter 2] FAILED. Growth of 9.54% < 10.0% threshold.
2025-11-06 20:44:02,304 [INFO   ] 
--- Analyzing Valley at 2021-04-08 (index 1072) ---
2025-11-06 20:44:02,305 [INFO   ]   [Filter 2] Valley at 2021-04-08: Slope Check (30d) = 0.3441
2025-11-06 20:44:02,306 [INFO   ]   [Filter 2] Valley at 2021-04-08: Slope Check (60d) = 0.0592
2025-11-06 20:44:02,307 [INFO   ]   [Filter 2] Valley at 2021-04-08: Slope Check (90d) = -0.0082
2025-11-06 20:44:02,307 [INFO   ]   [Filter 2] 30-Day Growth Check: 3.86%
2025-11-06 20:44:02,307 [INFO   ]   [Filter 2] FAILED. Growth of 3.86% < 10.0% threshold.
2025-11-06 20:44:02,307 [INFO   ] 
--- Analyzing Valley at 2021-05-18 (index 1100) ---
2025-11-06 20:44:02,308 [INFO   ]   [Filter 2] Valley at 2021-05-18: Slope Check (30d) = -0.4400
2025-11-06 20:44:02,309 [INFO   ]   [Filter 2] Valley at 2021-05-18: Slope Check (60d) = -0.1546
2025-11-06 20:44:02,310 [INFO   ]   [Filter 2] Valley at 2021-05-18: Slope Check (90d) = -0.0167
2025-11-06 20:44:02,310 [INFO   ]   [Filter 2] FAILED. No positive slope found.
2025-11-06 20:44:02,310 [INFO   ] 
--- Analyzing Valley at 2021-06-30 (index 1130) ---
2025-11-06 20:44:02,311 [INFO   ]   [Filter 2] Valley at 2021-06-30: Slope Check (30d) = 0.0313
2025-11-06 20:44:02,313 [INFO   ]   [Filter 2] Valley at 2021-06-30: Slope Check (60d) = 0.1015
2025-11-06 20:44:02,314 [INFO   ]   [Filter 2] Valley at 2021-06-30: Slope Check (90d) = 0.2052
2025-11-06 20:44:02,314 [INFO   ]   [Filter 2] 30-Day Growth Check: 4.21%
2025-11-06 20:44:02,314 [INFO   ]   [Filter 2] FAILED. Growth of 4.21% < 10.0% threshold.
2025-11-06 20:44:02,314 [INFO   ] 
--- Analyzing Valley at 2021-10-04 (index 1196) ---
2025-11-06 20:44:02,316 [INFO   ]   [Filter 2] Valley at 2021-10-04: Slope Check (30d) = 0.0528
2025-11-06 20:44:02,317 [INFO   ]   [Filter 2] Valley at 2021-10-04: Slope Check (60d) = -0.2048
2025-11-06 20:44:02,318 [INFO   ]   [Filter 2] Valley at 2021-10-04: Slope Check (90d) = -0.1852
2025-11-06 20:44:02,318 [INFO   ]   [Filter 2] 30-Day Growth Check: 0.55%
2025-11-06 20:44:02,319 [INFO   ]   [Filter 2] FAILED. Growth of 0.55% < 10.0% threshold.
2025-11-06 20:44:02,319 [INFO   ] 
--- Analyzing Valley at 2022-06-09 (index 1368) ---
2025-11-06 20:44:02,320 [INFO   ]   [Filter 2] Valley at 2022-06-09: Slope Check (30d) = -0.1126
2025-11-06 20:44:02,321 [INFO   ]   [Filter 2] Valley at 2022-06-09: Slope Check (60d) = 0.0482
2025-11-06 20:44:02,323 [INFO   ]   [Filter 2] Valley at 2022-06-09: Slope Check (90d) = -0.0453
2025-11-06 20:44:02,323 [INFO   ]   [Filter 2] 30-Day Growth Check: -7.61%
2025-11-06 20:44:02,323 [INFO   ]   [Filter 2] FAILED. Growth of -7.61% < 10.0% threshold.
2025-11-06 20:44:02,323 [INFO   ] 
--- [Analysis Summary] ---
2025-11-06 20:44:02,323 [INFO   ] Total Valleys Found: 17
2025-11-06 20:44:02,323 [INFO   ] Valleys Passing Filter 2 (Intensity Test): 3
2025-11-06 20:44:02,324 [INFO   ] Valleys Passing Filter 2.5 (Context Test): 0
2025-11-06 20:44:02,324 [INFO   ] Valleys Passing Filter 3 (DNA Test): 0
2025-11-06 20:44:02,324 [INFO   ] --- [Historical Analyzer Finished] ---
