2025-11-06 20:41:53,836 [INFO   ] --- [Historical Analyzer Started for F] ---
2025-11-06 20:41:54,766 [INFO   ] Loaded 1510 data points for F.
2025-11-06 20:41:54,767 [INFO   ] Computing full CAC curve with m=15...
2025-11-06 20:42:20,245 [INFO   ] Found 11 significant valleys in the CAC curve.
2025-11-06 20:42:20,245 [INFO   ] 
--- Analyzing Valley at 2017-04-21 (index 75) ---
2025-11-06 20:42:20,247 [INFO   ]   [Filter 2] Valley at 2017-04-21: Slope Check (30d) = -0.0083
2025-11-06 20:42:20,247 [INFO   ]   [Filter 2] Valley at 2017-04-21: Slope Check (60d) = 0.0022
2025-11-06 20:42:20,248 [INFO   ]   [Filter 2] Valley at 2017-04-21: Slope Check (90d) = -0.0007
2025-11-06 20:42:20,248 [INFO   ]   [Filter 2] 30-Day Growth Check: 0.09%
2025-11-06 20:42:20,248 [INFO   ]   [Filter 2] FAILED. Growth of 0.09% < 10.0% threshold.
2025-11-06 20:42:20,249 [INFO   ] 
--- Analyzing Valley at 2017-05-16 (index 92) ---
2025-11-06 20:42:20,250 [INFO   ]   [Filter 2] Valley at 2017-05-16: Slope Check (30d) = 0.0061
2025-11-06 20:42:20,251 [INFO   ]   [Filter 2] Valley at 2017-05-16: Slope Check (60d) = 0.0042
2025-11-06 20:42:20,252 [INFO   ]   [Filter 2] Valley at 2017-05-16: Slope Check (90d) = 0.0027
2025-11-06 20:42:20,252 [INFO   ]   [Filter 2] 30-Day Growth Check: 1.28%
2025-11-06 20:42:20,252 [INFO   ]   [Filter 2] FAILED. Growth of 1.28% < 10.0% threshold.
2025-11-06 20:42:20,253 [INFO   ] 
--- Analyzing Valley at 2017-07-03 (index 125) ---
2025-11-06 20:42:20,254 [INFO   ]   [Filter 2] Valley at 2017-07-03: Slope Check (30d) = -0.0128
2025-11-06 20:42:20,254 [INFO   ]   [Filter 2] Valley at 2017-07-03: Slope Check (60d) = 0.0032
2025-11-06 20:42:20,256 [INFO   ]   [Filter 2] Valley at 2017-07-03: Slope Check (90d) = 0.0114
2025-11-06 20:42:20,256 [INFO   ]   [Filter 2] 30-Day Growth Check: -4.41%
2025-11-06 20:42:20,256 [INFO   ]   [Filter 2] FAILED. Growth of -4.41% < 10.0% threshold.
2025-11-06 20:42:20,256 [INFO   ] 
--- Analyzing Valley at 2019-04-09 (index 569) ---
2025-11-06 20:42:20,257 [INFO   ]   [Filter 2] Valley at 2019-04-09: Slope Check (30d) = 0.0359
2025-11-06 20:42:20,258 [INFO   ]   [Filter 2] Valley at 2019-04-09: Slope Check (60d) = 0.0059
2025-11-06 20:42:20,259 [INFO   ]   [Filter 2] Valley at 2019-04-09: Slope Check (90d) = 0.0002
2025-11-06 20:42:20,259 [INFO   ]   [Filter 2] 30-Day Growth Check: 12.97%
2025-11-06 20:42:20,259 [INFO   ]   [Filter 2] PASSED. Growth of 12.97% >= 10.0% threshold.
2025-11-06 20:42:20,263 [INFO   ]   [Filter 2.5] Historical Context Check: Current growth is in the 81.43th percentile of this stock's history.
2025-11-06 20:42:20,264 [INFO   ]   [Filter 2.5] FAILED. Percentile rank 81.43% < 95.0% threshold.
2025-11-06 20:42:20,264 [INFO   ] 
--- Analyzing Valley at 2019-06-07 (index 610) ---
2025-11-06 20:42:20,265 [INFO   ]   [Filter 2] Valley at 2019-06-07: Slope Check (30d) = 0.0128
2025-11-06 20:42:20,266 [INFO   ]   [Filter 2] Valley at 2019-06-07: Slope Check (60d) = -0.0140
2025-11-06 20:42:20,267 [INFO   ]   [Filter 2] Valley at 2019-06-07: Slope Check (90d) = -0.0111
2025-11-06 20:42:20,267 [INFO   ]   [Filter 2] 30-Day Growth Check: 4.51%
2025-11-06 20:42:20,267 [INFO   ]   [Filter 2] FAILED. Growth of 4.51% < 10.0% threshold.
2025-11-06 20:42:20,268 [INFO   ] 
--- Analyzing Valley at 2019-08-14 (index 657) ---
2025-11-06 20:42:20,269 [INFO   ]   [Filter 2] Valley at 2019-08-14: Slope Check (30d) = 0.0105
2025-11-06 20:42:20,270 [INFO   ]   [Filter 2] Valley at 2019-08-14: Slope Check (60d) = -0.0023
2025-11-06 20:42:20,271 [INFO   ]   [Filter 2] Valley at 2019-08-14: Slope Check (90d) = 0.0015
2025-11-06 20:42:20,271 [INFO   ]   [Filter 2] 30-Day Growth Check: 2.22%
2025-11-06 20:42:20,272 [INFO   ]   [Filter 2] FAILED. Growth of 2.22% < 10.0% threshold.
2025-11-06 20:42:20,272 [INFO   ] 
--- Analyzing Valley at 2019-09-25 (index 686) ---
2025-11-06 20:42:20,273 [INFO   ]   [Filter 2] Valley at 2019-09-25: Slope Check (30d) = 0.0021
2025-11-06 20:42:20,274 [INFO   ]   [Filter 2] Valley at 2019-09-25: Slope Check (60d) = 0.0063
2025-11-06 20:42:20,275 [INFO   ]   [Filter 2] Valley at 2019-09-25: Slope Check (90d) = 0.0049
2025-11-06 20:42:20,275 [INFO   ]   [Filter 2] 30-Day Growth Check: -0.35%
2025-11-06 20:42:20,275 [INFO   ]   [Filter 2] FAILED. Growth of -0.35% < 10.0% threshold.
2025-11-06 20:42:20,276 [INFO   ] 
--- Analyzing Valley at 2019-11-19 (index 725) ---
2025-11-06 20:42:20,277 [INFO   ]   [Filter 2] Valley at 2019-11-19: Slope Check (30d) = 0.0179
2025-11-06 20:42:20,278 [INFO   ]   [Filter 2] Valley at 2019-11-19: Slope Check (60d) = -0.0057
2025-11-06 20:42:20,279 [INFO   ]   [Filter 2] Valley at 2019-11-19: Slope Check (90d) = -0.0365
2025-11-06 20:42:20,279 [INFO   ]   [Filter 2] 30-Day Growth Check: 5.84%
2025-11-06 20:42:20,279 [INFO   ]   [Filter 2] FAILED. Growth of 5.84% < 10.0% threshold.
2025-11-06 20:42:20,279 [INFO   ] 
--- Analyzing Valley at 2020-01-13 (index 761) ---
2025-11-06 20:42:20,280 [INFO   ]   [Filter 2] Valley at 2020-01-13: Slope Check (30d) = -0.0419
2025-11-06 20:42:20,281 [INFO   ]   [Filter 2] Valley at 2020-01-13: Slope Check (60d) = -0.0731
2025-11-06 20:42:20,282 [INFO   ]   [Filter 2] Valley at 2020-01-13: Slope Check (90d) = -0.0439
2025-11-06 20:42:20,282 [INFO   ]   [Filter 2] FAILED. No positive slope found.
2025-11-06 20:42:20,282 [INFO   ] 
--- Analyzing Valley at 2020-02-05 (index 777) ---
2025-11-06 20:42:20,283 [INFO   ]   [Filter 2] Valley at 2020-02-05: Slope Check (30d) = -0.0944
2025-11-06 20:42:20,284 [INFO   ]   [Filter 2] Valley at 2020-02-05: Slope Check (60d) = -0.0514
2025-11-06 20:42:20,284 [INFO   ]   [Filter 2] Valley at 2020-02-05: Slope Check (90d) = -0.0159
2025-11-06 20:42:20,284 [INFO   ]   [Filter 2] FAILED. No positive slope found.
2025-11-06 20:42:20,285 [INFO   ] 
--- Analyzing Valley at 2020-03-05 (index 797) ---
2025-11-06 20:42:20,286 [INFO   ]   [Filter 2] Valley at 2020-03-05: Slope Check (30d) = -0.0299
2025-11-06 20:42:20,286 [INFO   ]   [Filter 2] Valley at 2020-03-05: Slope Check (60d) = 0.0004
2025-11-06 20:42:20,287 [INFO   ]   [Filter 2] Valley at 2020-03-05: Slope Check (90d) = 0.0125
2025-11-06 20:42:20,287 [INFO   ]   [Filter 2] 30-Day Growth Check: -26.71%
2025-11-06 20:42:20,287 [INFO   ]   [Filter 2] FAILED. Growth of -26.71% < 10.0% threshold.
2025-11-06 20:42:20,288 [INFO   ] 
--- [Analysis Summary] ---
2025-11-06 20:42:20,288 [INFO   ] Total Valleys Found: 11
2025-11-06 20:42:20,288 [INFO   ] Valleys Passing Filter 2 (Intensity Test): 1
2025-11-06 20:42:20,288 [INFO   ] Valleys Passing Filter 2.5 (Context Test): 0
2025-11-06 20:42:20,288 [INFO   ] Valleys Passing Filter 3 (DNA Test): 0
2025-11-06 20:42:20,288 [INFO   ] --- [Historical Analyzer Finished] ---
