2025-11-06 20:33:56,785 [INFO   ] --- [Historical Analyzer Started for SPY] ---
2025-11-06 20:33:57,320 [INFO   ] Loaded 1510 data points for SPY.
2025-11-06 20:33:57,322 [INFO   ] Computing full CAC curve with m=15...
2025-11-06 20:34:21,452 [INFO   ] Found 27 significant valleys in the CAC curve.
2025-11-06 20:34:21,453 [INFO   ] 
--- Analyzing Valley at 2017-04-25 (index 77) ---
2025-11-06 20:34:21,454 [INFO   ]   [Filter 2] Valley at 2017-04-25: Slope Check (30d) = 0.1435
2025-11-06 20:34:21,455 [INFO   ]   [Filter 2] Valley at 2017-04-25: Slope Check (60d) = 0.1211
2025-11-06 20:34:21,456 [INFO   ]   [Filter 2] Valley at 2017-04-25: Slope Check (90d) = 0.0970
2025-11-06 20:34:21,456 [INFO   ]   [Filter 2] 30-Day Growth Check: 1.95%
2025-11-06 20:34:21,456 [INFO   ]   [Filter 2] FAILED. Growth of 1.95% < 10.0% threshold.
2025-11-06 20:34:21,456 [INFO   ] 
--- Analyzing Valley at 2017-06-26 (index 120) ---
2025-11-06 20:34:21,457 [INFO   ]   [Filter 2] Valley at 2017-06-26: Slope Check (30d) = 0.2146
2025-11-06 20:34:21,458 [INFO   ]   [Filter 2] Valley at 2017-06-26: Slope Check (60d) = 0.0851
2025-11-06 20:34:21,459 [INFO   ]   [Filter 2] Valley at 2017-06-26: Slope Check (90d) = 0.1548
2025-11-06 20:34:21,459 [INFO   ]   [Filter 2] 30-Day Growth Check: 1.88%
2025-11-06 20:34:21,459 [INFO   ]   [Filter 2] FAILED. Growth of 1.88% < 10.0% threshold.
2025-11-06 20:34:21,459 [INFO   ] 
--- Analyzing Valley at 2017-09-08 (index 172) ---
2025-11-06 20:34:21,460 [INFO   ]   [Filter 2] Valley at 2017-09-08: Slope Check (30d) = 0.2790
2025-11-06 20:34:21,461 [INFO   ]   [Filter 2] Valley at 2017-09-08: Slope Check (60d) = 0.2147
2025-11-06 20:34:21,461 [INFO   ]   [Filter 2] Valley at 2017-09-08: Slope Check (90d) = 0.2767
2025-11-06 20:34:21,462 [INFO   ]   [Filter 2] 30-Day Growth Check: 4.25%
2025-11-06 20:34:21,462 [INFO   ]   [Filter 2] FAILED. Growth of 4.25% < 10.0% threshold.
2025-11-06 20:34:21,462 [INFO   ] 
--- Analyzing Valley at 2017-11-06 (index 213) ---
2025-11-06 20:34:21,463 [INFO   ]   [Filter 2] Valley at 2017-11-06: Slope Check (30d) = 0.3409
2025-11-06 20:34:21,463 [INFO   ]   [Filter 2] Valley at 2017-11-06: Slope Check (60d) = 0.4506
2025-11-06 20:34:21,464 [INFO   ]   [Filter 2] Valley at 2017-11-06: Slope Check (90d) = 0.1893
2025-11-06 20:34:21,464 [INFO   ]   [Filter 2] 30-Day Growth Check: 4.14%
2025-11-06 20:34:21,464 [INFO   ]   [Filter 2] FAILED. Growth of 4.14% < 10.0% threshold.
2025-11-06 20:34:21,464 [INFO   ] 
--- Analyzing Valley at 2017-12-19 (index 243) ---
2025-11-06 20:34:21,465 [INFO   ]   [Filter 2] Valley at 2017-12-19: Slope Check (30d) = 0.6331
2025-11-06 20:34:21,466 [INFO   ]   [Filter 2] Valley at 2017-12-19: Slope Check (60d) = 0.0293
2025-11-06 20:34:21,467 [INFO   ]   [Filter 2] Valley at 2017-12-19: Slope Check (90d) = -0.0883
2025-11-06 20:34:21,467 [INFO   ]   [Filter 2] 30-Day Growth Check: 5.39%
2025-11-06 20:34:21,467 [INFO   ]   [Filter 2] FAILED. Growth of 5.39% < 10.0% threshold.
2025-11-06 20:34:21,467 [INFO   ] 
--- Analyzing Valley at 2018-02-08 (index 277) ---
2025-11-06 20:34:21,468 [INFO   ]   [Filter 2] Valley at 2018-02-08: Slope Check (30d) = 0.2369
2025-11-06 20:34:21,469 [INFO   ]   [Filter 2] Valley at 2018-02-08: Slope Check (60d) = -0.0888
2025-11-06 20:34:21,470 [INFO   ]   [Filter 2] Valley at 2018-02-08: Slope Check (90d) = 0.0695
2025-11-06 20:34:21,470 [INFO   ]   [Filter 2] 30-Day Growth Check: 2.75%
2025-11-06 20:34:21,471 [INFO   ]   [Filter 2] FAILED. Growth of 2.75% < 10.0% threshold.
2025-11-06 20:34:21,471 [INFO   ] 
--- Analyzing Valley at 2018-05-29 (index 352) ---
2025-11-06 20:34:21,472 [INFO   ]   [Filter 2] Valley at 2018-05-29: Slope Check (30d) = 0.0281
2025-11-06 20:34:21,473 [INFO   ]   [Filter 2] Valley at 2018-05-29: Slope Check (60d) = 0.2102
2025-11-06 20:34:21,474 [INFO   ]   [Filter 2] Valley at 2018-05-29: Slope Check (90d) = 0.2294
2025-11-06 20:34:21,474 [INFO   ]   [Filter 2] 30-Day Growth Check: 4.14%
2025-11-06 20:34:21,475 [INFO   ]   [Filter 2] FAILED. Growth of 4.14% < 10.0% threshold.
2025-11-06 20:34:21,475 [INFO   ] 
--- Analyzing Valley at 2018-07-03 (index 377) ---
2025-11-06 20:34:21,476 [INFO   ]   [Filter 2] Valley at 2018-07-03: Slope Check (30d) = 0.2975
2025-11-06 20:34:21,478 [INFO   ]   [Filter 2] Valley at 2018-07-03: Slope Check (60d) = 0.2522
2025-11-06 20:34:21,479 [INFO   ]   [Filter 2] Valley at 2018-07-03: Slope Check (90d) = -0.0211
2025-11-06 20:34:21,479 [INFO   ]   [Filter 2] 30-Day Growth Check: 4.80%
2025-11-06 20:34:21,479 [INFO   ]   [Filter 2] FAILED. Growth of 4.80% < 10.0% threshold.
2025-11-06 20:34:21,480 [INFO   ] 
--- Analyzing Valley at 2018-07-26 (index 393) ---
2025-11-06 20:34:21,481 [INFO   ]   [Filter 2] Valley at 2018-07-26: Slope Check (30d) = 0.2856
2025-11-06 20:34:21,482 [INFO   ]   [Filter 2] Valley at 2018-07-26: Slope Check (60d) = 0.0440
2025-11-06 20:34:21,483 [INFO   ]   [Filter 2] Valley at 2018-07-26: Slope Check (90d) = -0.1730
2025-11-06 20:34:21,483 [INFO   ]   [Filter 2] 30-Day Growth Check: 1.70%
2025-11-06 20:34:21,483 [INFO   ]   [Filter 2] FAILED. Growth of 1.70% < 10.0% threshold.
2025-11-06 20:34:21,483 [INFO   ] 
--- Analyzing Valley at 2018-09-25 (index 435) ---
2025-11-06 20:34:21,484 [INFO   ]   [Filter 2] Valley at 2018-09-25: Slope Check (30d) = -0.8346
2025-11-06 20:34:21,484 [INFO   ]   [Filter 2] Valley at 2018-09-25: Slope Check (60d) = -0.4079
2025-11-06 20:34:21,485 [INFO   ]   [Filter 2] Valley at 2018-09-25: Slope Check (90d) = -0.2889
2025-11-06 20:34:21,485 [INFO   ]   [Filter 2] FAILED. No positive slope found.
2025-11-06 20:34:21,485 [INFO   ] 
--- Analyzing Valley at 2018-10-30 (index 460) ---
2025-11-06 20:34:21,486 [INFO   ]   [Filter 2] Valley at 2018-10-30: Slope Check (30d) = -0.2190
2025-11-06 20:34:21,487 [INFO   ]   [Filter 2] Valley at 2018-10-30: Slope Check (60d) = -0.2850
2025-11-06 20:34:21,487 [INFO   ]   [Filter 2] Valley at 2018-10-30: Slope Check (90d) = 0.1003
2025-11-06 20:34:21,488 [INFO   ]   [Filter 2] 30-Day Growth Check: -0.86%
2025-11-06 20:34:21,488 [INFO   ]   [Filter 2] FAILED. Growth of -0.86% < 10.0% threshold.
2025-11-06 20:34:21,488 [INFO   ] 
--- Analyzing Valley at 2019-01-24 (index 517) ---
2025-11-06 20:34:21,489 [INFO   ]   [Filter 2] Valley at 2019-01-24: Slope Check (30d) = 0.4847
2025-11-06 20:34:21,489 [INFO   ]   [Filter 2] Valley at 2019-01-24: Slope Check (60d) = 0.3726
2025-11-06 20:34:21,490 [INFO   ]   [Filter 2] Valley at 2019-01-24: Slope Check (90d) = 0.2030
2025-11-06 20:34:21,490 [INFO   ]   [Filter 2] 30-Day Growth Check: 4.35%
2025-11-06 20:34:21,490 [INFO   ]   [Filter 2] FAILED. Growth of 4.35% < 10.0% threshold.
2025-11-06 20:34:21,490 [INFO   ] 
--- Analyzing Valley at 2019-02-26 (index 539) ---
2025-11-06 20:34:21,491 [INFO   ]   [Filter 2] Valley at 2019-02-26: Slope Check (30d) = 0.3397
2025-11-06 20:34:21,492 [INFO   ]   [Filter 2] Valley at 2019-02-26: Slope Check (60d) = 0.2116
2025-11-06 20:34:21,493 [INFO   ]   [Filter 2] Valley at 2019-02-26: Slope Check (90d) = 0.1292
2025-11-06 20:34:21,493 [INFO   ]   [Filter 2] 30-Day Growth Check: 3.85%
2025-11-06 20:34:21,494 [INFO   ]   [Filter 2] FAILED. Growth of 3.85% < 10.0% threshold.
2025-11-06 20:34:21,494 [INFO   ] 
--- Analyzing Valley at 2019-04-29 (index 582) ---
2025-11-06 20:34:21,495 [INFO   ]   [Filter 2] Valley at 2019-04-29: Slope Check (30d) = -0.3713
2025-11-06 20:34:21,496 [INFO   ]   [Filter 2] Valley at 2019-04-29: Slope Check (60d) = 0.2483
2025-11-06 20:34:21,497 [INFO   ]   [Filter 2] Valley at 2019-04-29: Slope Check (90d) = 0.0970
2025-11-06 20:34:21,497 [INFO   ]   [Filter 2] 30-Day Growth Check: -1.67%
2025-11-06 20:34:21,498 [INFO   ]   [Filter 2] FAILED. Growth of -1.67% < 10.0% threshold.
2025-11-06 20:34:21,498 [INFO   ] 
--- Analyzing Valley at 2019-08-15 (index 658) ---
2025-11-06 20:34:21,498 [INFO   ]   [Filter 2] Valley at 2019-08-15: Slope Check (30d) = 0.4637
2025-11-06 20:34:21,500 [INFO   ]   [Filter 2] Valley at 2019-08-15: Slope Check (60d) = 0.2410
2025-11-06 20:34:21,500 [INFO   ]   [Filter 2] Valley at 2019-08-15: Slope Check (90d) = 0.3201
2025-11-06 20:34:21,501 [INFO   ]   [Filter 2] 30-Day Growth Check: 4.82%
2025-11-06 20:34:21,501 [INFO   ]   [Filter 2] FAILED. Growth of 4.82% < 10.0% threshold.
2025-11-06 20:34:21,501 [INFO   ] 
--- Analyzing Valley at 2020-01-02 (index 754) ---
2025-11-06 20:34:21,502 [INFO   ]   [Filter 2] Valley at 2020-01-02: Slope Check (30d) = 0.3139
2025-11-06 20:34:21,502 [INFO   ]   [Filter 2] Valley at 2020-01-02: Slope Check (60d) = -1.4178
2025-11-06 20:34:21,503 [INFO   ]   [Filter 2] Valley at 2020-01-02: Slope Check (90d) = -0.7579
2025-11-06 20:34:21,504 [INFO   ]   [Filter 2] 30-Day Growth Check: 3.75%
2025-11-06 20:34:21,504 [INFO   ]   [Filter 2] FAILED. Growth of 3.75% < 10.0% threshold.
2025-11-06 20:34:21,504 [INFO   ] 
--- Analyzing Valley at 2020-02-07 (index 779) ---
2025-11-06 20:34:21,505 [INFO   ]   [Filter 2] Valley at 2020-02-07: Slope Check (30d) = -3.5139
2025-11-06 20:34:21,506 [INFO   ]   [Filter 2] Valley at 2020-02-07: Slope Check (60d) = -0.8811
2025-11-06 20:34:21,507 [INFO   ]   [Filter 2] Valley at 2020-02-07: Slope Check (90d) = 0.0065
2025-11-06 20:34:21,507 [INFO   ]   [Filter 2] 30-Day Growth Check: -30.72%
2025-11-06 20:34:21,508 [INFO   ]   [Filter 2] FAILED. Growth of -30.72% < 10.0% threshold.
2025-11-06 20:34:21,508 [INFO   ] 
--- Analyzing Valley at 2020-05-15 (index 847) ---
2025-11-06 20:34:21,509 [INFO   ]   [Filter 2] Valley at 2020-05-15: Slope Check (30d) = 0.5468
2025-11-06 20:34:21,509 [INFO   ]   [Filter 2] Valley at 2020-05-15: Slope Check (60d) = 0.5519
2025-11-06 20:34:21,510 [INFO   ]   [Filter 2] Valley at 2020-05-15: Slope Check (90d) = 0.5273
2025-11-06 20:34:21,510 [INFO   ]   [Filter 2] 30-Day Growth Check: 5.27%
2025-11-06 20:34:21,510 [INFO   ]   [Filter 2] FAILED. Growth of 5.27% < 10.0% threshold.
2025-11-06 20:34:21,510 [INFO   ] 
--- Analyzing Valley at 2020-07-23 (index 894) ---
2025-11-06 20:34:21,511 [INFO   ]   [Filter 2] Valley at 2020-07-23: Slope Check (30d) = 1.0138
2025-11-06 20:34:21,512 [INFO   ]   [Filter 2] Valley at 2020-07-23: Slope Check (60d) = 0.2191
2025-11-06 20:34:21,513 [INFO   ]   [Filter 2] Valley at 2020-07-23: Slope Check (90d) = 0.2704
2025-11-06 20:34:21,513 [INFO   ]   [Filter 2] 30-Day Growth Check: 10.76%
2025-11-06 20:34:21,513 [INFO   ]   [Filter 2] PASSED. Growth of 10.76% >= 10.0% threshold.
2025-11-06 20:34:21,515 [INFO   ]   [Filter 2.5] Historical Context Check: Current growth is in the 97.37th percentile of this stock's history.
2025-11-06 20:34:21,515 [INFO   ]   [Filter 2.5] PASSED. Percentile rank 97.37% >= 95.0% threshold.
2025-11-06 20:34:21,516 [INFO   ]     [Filter 3] DNA Test vs 'DOGE-USD_m30_ramp': Distance = 42.4264
2025-11-06 20:34:21,516 [INFO   ]     [Filter 3] DNA Test vs 'SSYS_m90_ramp': Distance = 42.4264
2025-11-06 20:34:21,516 [INFO   ]     [Filter 3] DNA Test vs 'SHIB-USD_m30_ramp': Distance = 42.4264
2025-11-06 20:34:21,516 [INFO   ]     [Filter 3] DNA Test vs 'CSCO_m90_ramp': Distance = 42.4264
2025-11-06 20:34:21,516 [INFO   ]     [Filter 3] DNA Test vs 'GME_m90_ramp': Distance = 42.4264
2025-11-06 20:34:21,517 [INFO   ]     [Filter 3] DNA Test vs 'IYR_m120_ramp': Distance = 42.4264
2025-11-06 20:34:21,517 [INFO   ]     [Filter 3] DNA Test vs 'VWAGY_m15_ramp': Distance = 42.4264
2025-11-06 20:34:21,517 [INFO   ]     [Filter 3] DNA Test vs 'AMC_m30_ramp': Distance = 42.4264
2025-11-06 20:34:21,517 [INFO   ]     [Filter 3] FAILED. No DNA match found below loose threshold.
2025-11-06 20:34:21,518 [INFO   ] 
--- Analyzing Valley at 2020-08-24 (index 916) ---
2025-11-06 20:34:21,519 [INFO   ]   [Filter 2] Valley at 2020-08-24: Slope Check (30d) = -0.5717
2025-11-06 20:34:21,519 [INFO   ]   [Filter 2] Valley at 2020-08-24: Slope Check (60d) = 0.1330
2025-11-06 20:34:21,520 [INFO   ]   [Filter 2] Valley at 2020-08-24: Slope Check (90d) = 0.4072
2025-11-06 20:34:21,520 [INFO   ]   [Filter 2] 30-Day Growth Check: -0.52%
2025-11-06 20:34:21,520 [INFO   ]   [Filter 2] FAILED. Growth of -0.52% < 10.0% threshold.
2025-11-06 20:34:21,521 [INFO   ] 
--- Analyzing Valley at 2021-02-10 (index 1033) ---
2025-11-06 20:34:21,521 [INFO   ]   [Filter 2] Valley at 2021-02-10: Slope Check (30d) = 0.0980
2025-11-06 20:34:21,522 [INFO   ]   [Filter 2] Valley at 2021-02-10: Slope Check (60d) = 0.6405
2025-11-06 20:34:21,523 [INFO   ]   [Filter 2] Valley at 2021-02-10: Slope Check (90d) = 0.4717
2025-11-06 20:34:21,523 [INFO   ]   [Filter 2] 30-Day Growth Check: -0.33%
2025-11-06 20:34:21,523 [INFO   ]   [Filter 2] FAILED. Growth of -0.33% < 10.0% threshold.
2025-11-06 20:34:21,523 [INFO   ] 
--- Analyzing Valley at 2021-05-18 (index 1100) ---
2025-11-06 20:34:21,524 [INFO   ]   [Filter 2] Valley at 2021-05-18: Slope Check (30d) = 0.4060
2025-11-06 20:34:21,525 [INFO   ]   [Filter 2] Valley at 2021-05-18: Slope Check (60d) = 0.4930
2025-11-06 20:34:21,525 [INFO   ]   [Filter 2] Valley at 2021-05-18: Slope Check (90d) = 0.3941
2025-11-06 20:34:21,525 [INFO   ]   [Filter 2] 30-Day Growth Check: 4.17%
2025-11-06 20:34:21,526 [INFO   ]   [Filter 2] FAILED. Growth of 4.17% < 10.0% threshold.
2025-11-06 20:34:21,526 [INFO   ] 
--- Analyzing Valley at 2021-08-23 (index 1167) ---
2025-11-06 20:34:21,526 [INFO   ]   [Filter 2] Valley at 2021-08-23: Slope Check (30d) = -0.5880
2025-11-06 20:34:21,527 [INFO   ]   [Filter 2] Valley at 2021-08-23: Slope Check (60d) = 0.3197
2025-11-06 20:34:21,528 [INFO   ]   [Filter 2] Valley at 2021-08-23: Slope Check (90d) = 0.3543
2025-11-06 20:34:21,528 [INFO   ]   [Filter 2] 30-Day Growth Check: -3.86%
2025-11-06 20:34:21,528 [INFO   ]   [Filter 2] FAILED. Growth of -3.86% < 10.0% threshold.
2025-11-06 20:34:21,528 [INFO   ] 
--- Analyzing Valley at 2021-11-24 (index 1233) ---
2025-11-06 20:34:21,529 [INFO   ]   [Filter 2] Valley at 2021-11-24: Slope Check (30d) = 0.6269
2025-11-06 20:34:21,530 [INFO   ]   [Filter 2] Valley at 2021-11-24: Slope Check (60d) = -0.4023
2025-11-06 20:34:21,531 [INFO   ]   [Filter 2] Valley at 2021-11-24: Slope Check (90d) = -0.3430
2025-11-06 20:34:21,531 [INFO   ]   [Filter 2] 30-Day Growth Check: 0.03%
2025-11-06 20:34:21,531 [INFO   ]   [Filter 2] FAILED. Growth of 0.03% < 10.0% threshold.
2025-11-06 20:34:21,531 [INFO   ] 
--- Analyzing Valley at 2022-01-05 (index 1261) ---
2025-11-06 20:34:21,532 [INFO   ]   [Filter 2] Valley at 2022-01-05: Slope Check (30d) = -0.7470
2025-11-06 20:34:21,533 [INFO   ]   [Filter 2] Valley at 2022-01-05: Slope Check (60d) = -0.3127
2025-11-06 20:34:21,534 [INFO   ]   [Filter 2] Valley at 2022-01-05: Slope Check (90d) = -0.3833
2025-11-06 20:34:21,534 [INFO   ]   [Filter 2] FAILED. No positive slope found.
2025-11-06 20:34:21,534 [INFO   ] 
--- Analyzing Valley at 2022-03-14 (index 1307) ---
2025-11-06 20:34:21,535 [INFO   ]   [Filter 2] Valley at 2022-03-14: Slope Check (30d) = -0.0483
2025-11-06 20:34:21,536 [INFO   ]   [Filter 2] Valley at 2022-03-14: Slope Check (60d) = -0.9152
2025-11-06 20:34:21,537 [INFO   ]   [Filter 2] Valley at 2022-03-14: Slope Check (90d) = -0.8354
2025-11-06 20:34:21,537 [INFO   ]   [Filter 2] FAILED. No positive slope found.
2025-11-06 20:34:21,537 [INFO   ] 
--- Analyzing Valley at 2022-08-15 (index 1413) ---
2025-11-06 20:34:21,538 [INFO   ]   [Filter 2] Valley at 2022-08-15: Slope Check (30d) = -1.7303
2025-11-06 20:34:21,539 [INFO   ]   [Filter 2] Valley at 2022-08-15: Slope Check (60d) = -0.8002
2025-11-06 20:34:21,540 [INFO   ]   [Filter 2] Valley at 2022-08-15: Slope Check (90d) = -0.0960
2025-11-06 20:34:21,540 [INFO   ]   [Filter 2] FAILED. No positive slope found.
2025-11-06 20:34:21,540 [INFO   ] 
--- [Analysis Summary] ---
2025-11-06 20:34:21,540 [INFO   ] Total Valleys Found: 27
2025-11-06 20:34:21,540 [INFO   ] Valleys Passing Filter 2 (Intensity Test): 1
2025-11-06 20:34:21,540 [INFO   ] Valleys Passing Filter 2.5 (Context Test): 1
2025-11-06 20:34:21,540 [INFO   ] Valleys Passing Filter 3 (DNA Test): 0
2025-11-06 20:34:21,541 [INFO   ] --- [Historical Analyzer Finished] ---
