2025-11-06 20:43:41,190 [INFO   ] --- [Historical Analyzer Started for JPM] ---
2025-11-06 20:43:42,047 [INFO   ] Loaded 1510 data points for JPM.
2025-11-06 20:43:42,048 [INFO   ] Computing full CAC curve with m=30...
2025-11-06 20:44:09,786 [INFO   ] Found 16 significant valleys in the CAC curve.
2025-11-06 20:44:09,786 [INFO   ] 
--- Analyzing Valley at 2017-10-06 (index 192) ---
2025-11-06 20:44:09,788 [INFO   ]   [Filter 2] Valley at 2017-10-06: Slope Check (30d) = 0.0538
2025-11-06 20:44:09,789 [INFO   ]   [Filter 2] Valley at 2017-10-06: Slope Check (60d) = 0.1528
2025-11-06 20:44:09,791 [INFO   ]   [Filter 2] Valley at 2017-10-06: Slope Check (90d) = 0.1842
2025-11-06 20:44:09,791 [INFO   ]   [Filter 2] 30-Day Growth Check: 1.60%
2025-11-06 20:44:09,791 [INFO   ]   [Filter 2] FAILED. Growth of 1.60% < 10.0% threshold.
2025-11-06 20:44:09,791 [INFO   ] 
--- Analyzing Valley at 2018-03-28 (index 310) ---
2025-11-06 20:44:09,792 [INFO   ]   [Filter 2] Valley at 2018-03-28: Slope Check (30d) = 0.0038
2025-11-06 20:44:09,793 [INFO   ]   [Filter 2] Valley at 2018-03-28: Slope Check (60d) = -0.0153
2025-11-06 20:44:09,793 [INFO   ]   [Filter 2] Valley at 2018-03-28: Slope Check (90d) = 0.0097
2025-11-06 20:44:09,794 [INFO   ]   [Filter 2] 30-Day Growth Check: 5.54%
2025-11-06 20:44:09,794 [INFO   ]   [Filter 2] FAILED. Growth of 5.54% < 10.0% threshold.
2025-11-06 20:44:09,794 [INFO   ] 
--- Analyzing Valley at 2018-05-17 (index 345) ---
2025-11-06 20:44:09,795 [INFO   ]   [Filter 2] Valley at 2018-05-17: Slope Check (30d) = -0.1860
2025-11-06 20:44:09,795 [INFO   ]   [Filter 2] Valley at 2018-05-17: Slope Check (60d) = 0.1007
2025-11-06 20:44:09,796 [INFO   ]   [Filter 2] Valley at 2018-05-17: Slope Check (90d) = 0.0934
2025-11-06 20:44:09,796 [INFO   ]   [Filter 2] 30-Day Growth Check: -7.11%
2025-11-06 20:44:09,796 [INFO   ]   [Filter 2] FAILED. Growth of -7.11% < 10.0% threshold.
2025-11-06 20:44:09,797 [INFO   ] 
--- Analyzing Valley at 2018-08-07 (index 401) ---
2025-11-06 20:44:09,797 [INFO   ]   [Filter 2] Valley at 2018-08-07: Slope Check (30d) = -0.0676
2025-11-06 20:44:09,798 [INFO   ]   [Filter 2] Valley at 2018-08-07: Slope Check (60d) = -0.1241
2025-11-06 20:44:09,799 [INFO   ]   [Filter 2] Valley at 2018-08-07: Slope Check (90d) = -0.0975
2025-11-06 20:44:09,799 [INFO   ]   [Filter 2] FAILED. No positive slope found.
2025-11-06 20:44:09,800 [INFO   ] 
--- Analyzing Valley at 2018-10-23 (index 455) ---
2025-11-06 20:44:09,801 [INFO   ]   [Filter 2] Valley at 2018-10-23: Slope Check (30d) = 0.1327
2025-11-06 20:44:09,801 [INFO   ]   [Filter 2] Valley at 2018-10-23: Slope Check (60d) = -0.1527
2025-11-06 20:44:09,802 [INFO   ]   [Filter 2] Valley at 2018-10-23: Slope Check (90d) = -0.0379
2025-11-06 20:44:09,802 [INFO   ]   [Filter 2] 30-Day Growth Check: 1.88%
2025-11-06 20:44:09,803 [INFO   ]   [Filter 2] FAILED. Growth of 1.88% < 10.0% threshold.
2025-11-06 20:44:09,803 [INFO   ] 
--- Analyzing Valley at 2018-12-20 (index 495) ---
2025-11-06 20:44:09,804 [INFO   ]   [Filter 2] Valley at 2018-12-20: Slope Check (30d) = 0.3132
2025-11-06 20:44:09,805 [INFO   ]   [Filter 2] Valley at 2018-12-20: Slope Check (60d) = 0.1301
2025-11-06 20:44:09,806 [INFO   ]   [Filter 2] Valley at 2018-12-20: Slope Check (90d) = 0.1311
2025-11-06 20:44:09,806 [INFO   ]   [Filter 2] 30-Day Growth Check: 8.96%
2025-11-06 20:44:09,806 [INFO   ]   [Filter 2] FAILED. Growth of 8.96% < 10.0% threshold.
2025-11-06 20:44:09,806 [INFO   ] 
--- Analyzing Valley at 2019-03-05 (index 544) ---
2025-11-06 20:44:09,807 [INFO   ]   [Filter 2] Valley at 2019-03-05: Slope Check (30d) = 0.1143
2025-11-06 20:44:09,808 [INFO   ]   [Filter 2] Valley at 2019-03-05: Slope Check (60d) = 0.1758
2025-11-06 20:44:09,809 [INFO   ]   [Filter 2] Valley at 2019-03-05: Slope Check (90d) = 0.0888
2025-11-06 20:44:09,810 [INFO   ]   [Filter 2] 30-Day Growth Check: 6.41%
2025-11-06 20:44:09,810 [INFO   ]   [Filter 2] FAILED. Growth of 6.41% < 10.0% threshold.
2025-11-06 20:44:09,810 [INFO   ] 
--- Analyzing Valley at 2019-05-09 (index 590) ---
2025-11-06 20:44:09,812 [INFO   ]   [Filter 2] Valley at 2019-05-09: Slope Check (30d) = -0.0410
2025-11-06 20:44:09,813 [INFO   ]   [Filter 2] Valley at 2019-05-09: Slope Check (60d) = 0.1077
2025-11-06 20:44:09,814 [INFO   ]   [Filter 2] Valley at 2019-05-09: Slope Check (90d) = 0.0325
2025-11-06 20:44:09,814 [INFO   ]   [Filter 2] 30-Day Growth Check: -2.07%
2025-11-06 20:44:09,814 [INFO   ]   [Filter 2] FAILED. Growth of -2.07% < 10.0% threshold.
2025-11-06 20:44:09,814 [INFO   ] 
--- Analyzing Valley at 2019-06-27 (index 624) ---
2025-11-06 20:44:09,816 [INFO   ]   [Filter 2] Valley at 2019-06-27: Slope Check (30d) = -0.0000
2025-11-06 20:44:09,817 [INFO   ]   [Filter 2] Valley at 2019-06-27: Slope Check (60d) = 0.0164
2025-11-06 20:44:09,818 [INFO   ]   [Filter 2] Valley at 2019-06-27: Slope Check (90d) = 0.1156
2025-11-06 20:44:09,818 [INFO   ]   [Filter 2] 30-Day Growth Check: 1.65%
2025-11-06 20:44:09,818 [INFO   ]   [Filter 2] FAILED. Growth of 1.65% < 10.0% threshold.
2025-11-06 20:44:09,818 [INFO   ] 
--- Analyzing Valley at 2019-09-11 (index 676) ---
2025-11-06 20:44:09,820 [INFO   ]   [Filter 2] Valley at 2019-09-11: Slope Check (30d) = 0.0630
2025-11-06 20:44:09,820 [INFO   ]   [Filter 2] Valley at 2019-09-11: Slope Check (60d) = 0.2860
2025-11-06 20:44:09,821 [INFO   ]   [Filter 2] Valley at 2019-09-11: Slope Check (90d) = 0.2706
2025-11-06 20:44:09,822 [INFO   ]   [Filter 2] 30-Day Growth Check: 7.34%
2025-11-06 20:44:09,822 [INFO   ]   [Filter 2] FAILED. Growth of 7.34% < 10.0% threshold.
2025-11-06 20:44:09,822 [INFO   ] 
--- Analyzing Valley at 2019-12-20 (index 747) ---
2025-11-06 20:44:09,823 [INFO   ]   [Filter 2] Valley at 2019-12-20: Slope Check (30d) = -0.1243
2025-11-06 20:44:09,824 [INFO   ]   [Filter 2] Valley at 2019-12-20: Slope Check (60d) = -0.5780
2025-11-06 20:44:09,825 [INFO   ]   [Filter 2] Valley at 2019-12-20: Slope Check (90d) = -0.6221
2025-11-06 20:44:09,825 [INFO   ]   [Filter 2] FAILED. No positive slope found.
2025-11-06 20:44:09,826 [INFO   ] 
--- Analyzing Valley at 2020-11-06 (index 969) ---
2025-11-06 20:44:09,826 [INFO   ]   [Filter 2] Valley at 2020-11-06: Slope Check (30d) = 0.2618
2025-11-06 20:44:09,827 [INFO   ]   [Filter 2] Valley at 2020-11-06: Slope Check (60d) = 0.3770
2025-11-06 20:44:09,828 [INFO   ]   [Filter 2] Valley at 2020-11-06: Slope Check (90d) = 0.4515
2025-11-06 20:44:09,828 [INFO   ]   [Filter 2] 30-Day Growth Check: 15.66%
2025-11-06 20:44:09,829 [INFO   ]   [Filter 2] PASSED. Growth of 15.66% >= 10.0% threshold.
2025-11-06 20:44:09,831 [INFO   ]   [Filter 2.5] Historical Context Check: Current growth is in the 95.81th percentile of this stock's history.
2025-11-06 20:44:09,831 [INFO   ]   [Filter 2.5] PASSED. Percentile rank 95.81% >= 95.0% threshold.
2025-11-06 20:44:09,832 [INFO   ]     [Filter 3] DNA Test vs 'DOGE-USD_m30_ramp': Distance = 42.4264
2025-11-06 20:44:09,832 [INFO   ]     [Filter 3] DNA Test vs 'SSYS_m90_ramp': Distance = 42.4264
2025-11-06 20:44:09,832 [INFO   ]     [Filter 3] DNA Test vs 'SHIB-USD_m30_ramp': Distance = 42.4264
2025-11-06 20:44:09,832 [INFO   ]     [Filter 3] DNA Test vs 'CSCO_m90_ramp': Distance = 42.4264
2025-11-06 20:44:09,832 [INFO   ]     [Filter 3] DNA Test vs 'GME_m90_ramp': Distance = 42.4264
2025-11-06 20:44:09,833 [INFO   ]     [Filter 3] DNA Test vs 'IYR_m120_ramp': Distance = 42.4264
2025-11-06 20:44:09,833 [INFO   ]     [Filter 3] DNA Test vs 'VWAGY_m15_ramp': Distance = 42.4264
2025-11-06 20:44:09,833 [INFO   ]     [Filter 3] DNA Test vs 'AMC_m30_ramp': Distance = 42.4264
2025-11-06 20:44:09,833 [INFO   ]     [Filter 3] FAILED. No DNA match found below loose threshold.
2025-11-06 20:44:09,833 [INFO   ] 
--- Analyzing Valley at 2021-02-08 (index 1031) ---
2025-11-06 20:44:09,834 [INFO   ]   [Filter 2] Valley at 2021-02-08: Slope Check (30d) = 0.4850
2025-11-06 20:44:09,835 [INFO   ]   [Filter 2] Valley at 2021-02-08: Slope Check (60d) = 0.1467
2025-11-06 20:44:09,836 [INFO   ]   [Filter 2] Valley at 2021-02-08: Slope Check (90d) = 0.1933
2025-11-06 20:44:09,836 [INFO   ]   [Filter 2] 30-Day Growth Check: 7.73%
2025-11-06 20:44:09,836 [INFO   ]   [Filter 2] FAILED. Growth of 7.73% < 10.0% threshold.
2025-11-06 20:44:09,836 [INFO   ] 
--- Analyzing Valley at 2021-05-24 (index 1104) ---
2025-11-06 20:44:09,837 [INFO   ]   [Filter 2] Valley at 2021-05-24: Slope Check (30d) = -0.4413
2025-11-06 20:44:09,838 [INFO   ]   [Filter 2] Valley at 2021-05-24: Slope Check (60d) = -0.1055
2025-11-06 20:44:09,839 [INFO   ]   [Filter 2] Valley at 2021-05-24: Slope Check (90d) = 0.0165
2025-11-06 20:44:09,839 [INFO   ]   [Filter 2] 30-Day Growth Check: -5.65%
2025-11-06 20:44:09,840 [INFO   ]   [Filter 2] FAILED. Growth of -5.65% < 10.0% threshold.
2025-11-06 20:44:09,840 [INFO   ] 
--- Analyzing Valley at 2021-10-06 (index 1198) ---
2025-11-06 20:44:09,841 [INFO   ]   [Filter 2] Valley at 2021-10-06: Slope Check (30d) = 0.0116
2025-11-06 20:44:09,842 [INFO   ]   [Filter 2] Valley at 2021-10-06: Slope Check (60d) = -0.2132
2025-11-06 20:44:09,843 [INFO   ]   [Filter 2] Valley at 2021-10-06: Slope Check (90d) = -0.1854
2025-11-06 20:44:09,843 [INFO   ]   [Filter 2] 30-Day Growth Check: -2.17%
2025-11-06 20:44:09,843 [INFO   ]   [Filter 2] FAILED. Growth of -2.17% < 10.0% threshold.
2025-11-06 20:44:09,843 [INFO   ] 
--- Analyzing Valley at 2021-12-02 (index 1238) ---
2025-11-06 20:44:09,844 [INFO   ]   [Filter 2] Valley at 2021-12-02: Slope Check (30d) = 0.2889
2025-11-06 20:44:09,845 [INFO   ]   [Filter 2] Valley at 2021-12-02: Slope Check (60d) = -0.1851
2025-11-06 20:44:09,847 [INFO   ]   [Filter 2] Valley at 2021-12-02: Slope Check (90d) = -0.3095
2025-11-06 20:44:09,847 [INFO   ]   [Filter 2] 30-Day Growth Check: 4.98%
2025-11-06 20:44:09,847 [INFO   ]   [Filter 2] FAILED. Growth of 4.98% < 10.0% threshold.
2025-11-06 20:44:09,847 [INFO   ] 
--- [Analysis Summary] ---
2025-11-06 20:44:09,847 [INFO   ] Total Valleys Found: 16
2025-11-06 20:44:09,847 [INFO   ] Valleys Passing Filter 2 (Intensity Test): 1
2025-11-06 20:44:09,848 [INFO   ] Valleys Passing Filter 2.5 (Context Test): 1
2025-11-06 20:44:09,848 [INFO   ] Valleys Passing Filter 3 (DNA Test): 0
2025-11-06 20:44:09,848 [INFO   ] --- [Historical Analyzer Finished] ---
