2025-11-06 20:57:28,247 [INFO   ] --- [Historical Analyzer Started for INTC] ---
2025-11-06 20:57:28,772 [INFO   ] Loaded 1510 data points for INTC.
2025-11-06 20:57:28,773 [INFO   ] Computing full CAC curve with m=15...
2025-11-06 20:57:56,328 [INFO   ] Found 24 significant valleys in the CAC curve.
2025-11-06 20:57:56,328 [INFO   ] 
--- Analyzing Valley at 2017-07-12 (index 131) ---
2025-11-06 20:57:56,331 [INFO   ]   [Filter 2] Valley at 2017-07-12: Slope Check (30d) = 0.0531
2025-11-06 20:57:56,332 [INFO   ]   [Filter 2] Valley at 2017-07-12: Slope Check (60d) = 0.0486
2025-11-06 20:57:56,333 [INFO   ]   [Filter 2] Valley at 2017-07-12: Slope Check (90d) = 0.1118
2025-11-06 20:57:56,334 [INFO   ]   [Filter 2] 30-Day Growth Check: 1.93%
2025-11-06 20:57:56,334 [INFO   ]   [Filter 2] FAILED. Growth of 1.93% < 10.0% threshold.
2025-11-06 20:57:56,334 [INFO   ] 
--- Analyzing Valley at 2017-10-17 (index 199) ---
2025-11-06 20:57:56,336 [INFO   ]   [Filter 2] Valley at 2017-10-17: Slope Check (30d) = 0.1557
2025-11-06 20:57:56,336 [INFO   ]   [Filter 2] Valley at 2017-10-17: Slope Check (60d) = 0.0378
2025-11-06 20:57:56,337 [INFO   ]   [Filter 2] Valley at 2017-10-17: Slope Check (90d) = 0.0324
2025-11-06 20:57:56,337 [INFO   ]   [Filter 2] 30-Day Growth Check: 13.08%
2025-11-06 20:57:56,338 [INFO   ]   [Filter 2] PASSED. Growth of 13.08% >= 10.0% threshold.
2025-11-06 20:57:56,343 [INFO   ]   [Filter 2.5] Historical Context Check: Current growth is in the 90.95th percentile of this stock's history.
2025-11-06 20:57:56,343 [INFO   ]   [Filter 2.5] FAILED. Percentile rank 90.95% < 95.0% threshold.
2025-11-06 20:57:56,343 [INFO   ] 
--- Analyzing Valley at 2017-11-27 (index 227) ---
2025-11-06 20:57:56,345 [INFO   ]   [Filter 2] Valley at 2017-11-27: Slope Check (30d) = 0.0532
2025-11-06 20:57:56,346 [INFO   ]   [Filter 2] Valley at 2017-11-27: Slope Check (60d) = 0.0277
2025-11-06 20:57:56,348 [INFO   ]   [Filter 2] Valley at 2017-11-27: Slope Check (90d) = 0.0774
2025-11-06 20:57:56,348 [INFO   ]   [Filter 2] 30-Day Growth Check: -1.96%
2025-11-06 20:57:56,348 [INFO   ]   [Filter 2] FAILED. Growth of -1.96% < 10.0% threshold.
2025-11-06 20:57:56,348 [INFO   ] 
--- Analyzing Valley at 2018-01-09 (index 256) ---
2025-11-06 20:57:56,350 [INFO   ]   [Filter 2] Valley at 2018-01-09: Slope Check (30d) = 0.0569
2025-11-06 20:57:56,351 [INFO   ]   [Filter 2] Valley at 2018-01-09: Slope Check (60d) = 0.1221
2025-11-06 20:57:56,352 [INFO   ]   [Filter 2] Valley at 2018-01-09: Slope Check (90d) = 0.1036
2025-11-06 20:57:56,352 [INFO   ]   [Filter 2] 30-Day Growth Check: 6.03%
2025-11-06 20:57:56,353 [INFO   ]   [Filter 2] FAILED. Growth of 6.03% < 10.0% threshold.
2025-11-06 20:57:56,353 [INFO   ] 
--- Analyzing Valley at 2018-02-15 (index 282) ---
2025-11-06 20:57:56,354 [INFO   ]   [Filter 2] Valley at 2018-02-15: Slope Check (30d) = 0.1609
2025-11-06 20:57:56,355 [INFO   ]   [Filter 2] Valley at 2018-02-15: Slope Check (60d) = 0.0854
2025-11-06 20:57:56,356 [INFO   ]   [Filter 2] Valley at 2018-02-15: Slope Check (90d) = 0.0742
2025-11-06 20:57:56,356 [INFO   ]   [Filter 2] 30-Day Growth Check: 13.41%
2025-11-06 20:57:56,357 [INFO   ]   [Filter 2] PASSED. Growth of 13.41% >= 10.0% threshold.
2025-11-06 20:57:56,359 [INFO   ]   [Filter 2.5] Historical Context Check: Current growth is in the 91.76th percentile of this stock's history.
2025-11-06 20:57:56,359 [INFO   ]   [Filter 2.5] FAILED. Percentile rank 91.76% < 95.0% threshold.
2025-11-06 20:57:56,360 [INFO   ] 
--- Analyzing Valley at 2018-05-29 (index 352) ---
2025-11-06 20:57:56,361 [INFO   ]   [Filter 2] Valley at 2018-05-29: Slope Check (30d) = -0.2168
2025-11-06 20:57:56,362 [INFO   ]   [Filter 2] Valley at 2018-05-29: Slope Check (60d) = -0.1153
2025-11-06 20:57:56,363 [INFO   ]   [Filter 2] Valley at 2018-05-29: Slope Check (90d) = -0.0913
2025-11-06 20:57:56,364 [INFO   ]   [Filter 2] FAILED. No positive slope found.
2025-11-06 20:57:56,364 [INFO   ] 
--- Analyzing Valley at 2018-08-16 (index 408) ---
2025-11-06 20:57:56,365 [INFO   ]   [Filter 2] Valley at 2018-08-16: Slope Check (30d) = -0.0599
2025-11-06 20:57:56,366 [INFO   ]   [Filter 2] Valley at 2018-08-16: Slope Check (60d) = -0.0159
2025-11-06 20:57:56,367 [INFO   ]   [Filter 2] Valley at 2018-08-16: Slope Check (90d) = 0.0074
2025-11-06 20:57:56,367 [INFO   ]   [Filter 2] 30-Day Growth Check: -2.73%
2025-11-06 20:57:56,368 [INFO   ]   [Filter 2] FAILED. Growth of -2.73% < 10.0% threshold.
2025-11-06 20:57:56,368 [INFO   ] 
--- Analyzing Valley at 2018-09-14 (index 428) ---
2025-11-06 20:57:56,370 [INFO   ]   [Filter 2] Valley at 2018-09-14: Slope Check (30d) = -0.0720
2025-11-06 20:57:56,371 [INFO   ]   [Filter 2] Valley at 2018-09-14: Slope Check (60d) = 0.0396
2025-11-06 20:57:56,372 [INFO   ]   [Filter 2] Valley at 2018-09-14: Slope Check (90d) = 0.0238
2025-11-06 20:57:56,372 [INFO   ]   [Filter 2] 30-Day Growth Check: -2.70%
2025-11-06 20:57:56,373 [INFO   ]   [Filter 2] FAILED. Growth of -2.70% < 10.0% threshold.
2025-11-06 20:57:56,373 [INFO   ] 
--- Analyzing Valley at 2019-04-04 (index 566) ---
2025-11-06 20:57:56,374 [INFO   ]   [Filter 2] Valley at 2019-04-04: Slope Check (30d) = -0.3752
2025-11-06 20:57:56,376 [INFO   ]   [Filter 2] Valley at 2019-04-04: Slope Check (60d) = -0.1808
2025-11-06 20:57:56,377 [INFO   ]   [Filter 2] Valley at 2019-04-04: Slope Check (90d) = -0.0535
2025-11-06 20:57:56,377 [INFO   ]   [Filter 2] FAILED. No positive slope found.
2025-11-06 20:57:56,377 [INFO   ] 
--- Analyzing Valley at 2019-07-29 (index 645) ---
2025-11-06 20:57:56,378 [INFO   ]   [Filter 2] Valley at 2019-07-29: Slope Check (30d) = -0.0167
2025-11-06 20:57:56,379 [INFO   ]   [Filter 2] Valley at 2019-07-29: Slope Check (60d) = 0.0784
2025-11-06 20:57:56,381 [INFO   ]   [Filter 2] Valley at 2019-07-29: Slope Check (90d) = 0.1300
2025-11-06 20:57:56,381 [INFO   ]   [Filter 2] 30-Day Growth Check: -1.09%
2025-11-06 20:57:56,381 [INFO   ]   [Filter 2] FAILED. Growth of -1.09% < 10.0% threshold.
2025-11-06 20:57:56,381 [INFO   ] 
--- Analyzing Valley at 2019-09-11 (index 676) ---
2025-11-06 20:57:56,382 [INFO   ]   [Filter 2] Valley at 2019-09-11: Slope Check (30d) = -0.0084
2025-11-06 20:57:56,383 [INFO   ]   [Filter 2] Valley at 2019-09-11: Slope Check (60d) = 0.1449
2025-11-06 20:57:56,384 [INFO   ]   [Filter 2] Valley at 2019-09-11: Slope Check (90d) = 0.1062
2025-11-06 20:57:56,385 [INFO   ]   [Filter 2] 30-Day Growth Check: -1.48%
2025-11-06 20:57:56,385 [INFO   ]   [Filter 2] FAILED. Growth of -1.48% < 10.0% threshold.
2025-11-06 20:57:56,385 [INFO   ] 
--- Analyzing Valley at 2020-01-17 (index 765) ---
2025-11-06 20:57:56,386 [INFO   ]   [Filter 2] Valley at 2020-01-17: Slope Check (30d) = -0.1208
2025-11-06 20:57:56,387 [INFO   ]   [Filter 2] Valley at 2020-01-17: Slope Check (60d) = -0.2297
2025-11-06 20:57:56,388 [INFO   ]   [Filter 2] Valley at 2020-01-17: Slope Check (90d) = -0.0481
2025-11-06 20:57:56,388 [INFO   ]   [Filter 2] FAILED. No positive slope found.
2025-11-06 20:57:56,388 [INFO   ] 
--- Analyzing Valley at 2020-03-31 (index 815) ---
2025-11-06 20:57:56,389 [INFO   ]   [Filter 2] Valley at 2020-03-31: Slope Check (30d) = 0.1311
2025-11-06 20:57:56,390 [INFO   ]   [Filter 2] Valley at 2020-03-31: Slope Check (60d) = 0.0837
2025-11-06 20:57:56,391 [INFO   ]   [Filter 2] Valley at 2020-03-31: Slope Check (90d) = -0.0404
2025-11-06 20:57:56,392 [INFO   ]   [Filter 2] 30-Day Growth Check: 8.50%
2025-11-06 20:57:56,392 [INFO   ]   [Filter 2] FAILED. Growth of 8.50% < 10.0% threshold.
2025-11-06 20:57:56,392 [INFO   ] 
--- Analyzing Valley at 2020-06-10 (index 864) ---
2025-11-06 20:57:56,393 [INFO   ]   [Filter 2] Valley at 2020-06-10: Slope Check (30d) = -0.0234
2025-11-06 20:57:56,394 [INFO   ]   [Filter 2] Valley at 2020-06-10: Slope Check (60d) = -0.2214
2025-11-06 20:57:56,395 [INFO   ]   [Filter 2] Valley at 2020-06-10: Slope Check (90d) = -0.1046
2025-11-06 20:57:56,395 [INFO   ]   [Filter 2] FAILED. No positive slope found.
2025-11-06 20:57:56,396 [INFO   ] 
--- Analyzing Valley at 2020-10-23 (index 959) ---
2025-11-06 20:57:56,397 [INFO   ]   [Filter 2] Valley at 2020-10-23: Slope Check (30d) = 0.1492
2025-11-06 20:57:56,398 [INFO   ]   [Filter 2] Valley at 2020-10-23: Slope Check (60d) = 0.1566
2025-11-06 20:57:56,399 [INFO   ]   [Filter 2] Valley at 2020-10-23: Slope Check (90d) = 0.1995
2025-11-06 20:57:56,399 [INFO   ]   [Filter 2] 30-Day Growth Check: 8.65%
2025-11-06 20:57:56,399 [INFO   ]   [Filter 2] FAILED. Growth of 8.65% < 10.0% threshold.
2025-11-06 20:57:56,399 [INFO   ] 
--- Analyzing Valley at 2020-11-17 (index 976) ---
2025-11-06 20:57:56,401 [INFO   ]   [Filter 2] Valley at 2020-11-17: Slope Check (30d) = 0.0617
2025-11-06 20:57:56,402 [INFO   ]   [Filter 2] Valley at 2020-11-17: Slope Check (60d) = 0.2202
2025-11-06 20:57:56,403 [INFO   ]   [Filter 2] Valley at 2020-11-17: Slope Check (90d) = 0.2098
2025-11-06 20:57:56,403 [INFO   ]   [Filter 2] 30-Day Growth Check: 7.07%
2025-11-06 20:57:56,403 [INFO   ]   [Filter 2] FAILED. Growth of 7.07% < 10.0% threshold.
2025-11-06 20:57:56,403 [INFO   ] 
--- Analyzing Valley at 2021-01-12 (index 1013) ---
2025-11-06 20:57:56,404 [INFO   ]   [Filter 2] Valley at 2021-01-12: Slope Check (30d) = 0.2123
2025-11-06 20:57:56,405 [INFO   ]   [Filter 2] Valley at 2021-01-12: Slope Check (60d) = 0.1561
2025-11-06 20:57:56,406 [INFO   ]   [Filter 2] Valley at 2021-01-12: Slope Check (90d) = 0.0111
2025-11-06 20:57:56,406 [INFO   ]   [Filter 2] 30-Day Growth Check: 19.41%
2025-11-06 20:57:56,406 [INFO   ]   [Filter 2] PASSED. Growth of 19.41% >= 10.0% threshold.
2025-11-06 20:57:56,411 [INFO   ]   [Filter 2.5] Historical Context Check: Current growth is in the 97.97th percentile of this stock's history.
2025-11-06 20:57:56,411 [INFO   ]   [Filter 2.5] PASSED. Percentile rank 97.97% >= 95.0% threshold.
2025-11-06 20:57:56,412 [INFO   ]     [Filter 3] DNA Test vs 'DOGE-USD_m30_ramp': Distance = 42.4264
2025-11-06 20:57:56,412 [INFO   ]     [Filter 3] DNA Test vs 'SSYS_m90_ramp': Distance = 42.4264
2025-11-06 20:57:56,412 [INFO   ]     [Filter 3] DNA Test vs 'SHIB-USD_m30_ramp': Distance = 42.4264
2025-11-06 20:57:56,412 [INFO   ]     [Filter 3] DNA Test vs 'CSCO_m90_ramp': Distance = 42.4264
2025-11-06 20:57:56,412 [INFO   ]     [Filter 3] DNA Test vs 'GME_m90_ramp': Distance = 42.4264
2025-11-06 20:57:56,412 [INFO   ]     [Filter 3] DNA Test vs 'IYR_m120_ramp': Distance = 42.4264
2025-11-06 20:57:56,412 [INFO   ]     [Filter 3] DNA Test vs 'VWAGY_m15_ramp': Distance = 42.4264
2025-11-06 20:57:56,413 [INFO   ]     [Filter 3] DNA Test vs 'AMC_m30_ramp': Distance = 42.4264
2025-11-06 20:57:56,413 [INFO   ]     [Filter 3] FAILED. No DNA match found below loose threshold.
2025-11-06 20:57:56,413 [INFO   ] 
--- Analyzing Valley at 2021-02-26 (index 1044) ---
2025-11-06 20:57:56,416 [INFO   ]   [Filter 2] Valley at 2021-02-26: Slope Check (30d) = 0.1894
2025-11-06 20:57:56,418 [INFO   ]   [Filter 2] Valley at 2021-02-26: Slope Check (60d) = -0.1236
2025-11-06 20:57:56,420 [INFO   ]   [Filter 2] Valley at 2021-02-26: Slope Check (90d) = -0.0927
2025-11-06 20:57:56,420 [INFO   ]   [Filter 2] 30-Day Growth Check: 12.31%
2025-11-06 20:57:56,420 [INFO   ]   [Filter 2] PASSED. Growth of 12.31% >= 10.0% threshold.
2025-11-06 20:57:56,424 [INFO   ]   [Filter 2.5] Historical Context Check: Current growth is in the 89.47th percentile of this stock's history.
2025-11-06 20:57:56,425 [INFO   ]   [Filter 2.5] FAILED. Percentile rank 89.47% < 95.0% threshold.
2025-11-06 20:57:56,425 [INFO   ] 
--- Analyzing Valley at 2021-06-14 (index 1118) ---
2025-11-06 20:57:56,426 [INFO   ]   [Filter 2] Valley at 2021-06-14: Slope Check (30d) = -0.0693
2025-11-06 20:57:56,427 [INFO   ]   [Filter 2] Valley at 2021-06-14: Slope Check (60d) = -0.0600
2025-11-06 20:57:56,429 [INFO   ]   [Filter 2] Valley at 2021-06-14: Slope Check (90d) = -0.0274
2025-11-06 20:57:56,429 [INFO   ]   [Filter 2] FAILED. No positive slope found.
2025-11-06 20:57:56,429 [INFO   ] 
--- Analyzing Valley at 2021-11-18 (index 1229) ---
2025-11-06 20:57:56,431 [INFO   ]   [Filter 2] Valley at 2021-11-18: Slope Check (30d) = 0.0775
2025-11-06 20:57:56,432 [INFO   ]   [Filter 2] Valley at 2021-11-18: Slope Check (60d) = 0.0035
2025-11-06 20:57:56,433 [INFO   ]   [Filter 2] Valley at 2021-11-18: Slope Check (90d) = -0.0355
2025-11-06 20:57:56,434 [INFO   ]   [Filter 2] 30-Day Growth Check: 3.66%
2025-11-06 20:57:56,434 [INFO   ]   [Filter 2] FAILED. Growth of 3.66% < 10.0% threshold.
2025-11-06 20:57:56,434 [INFO   ] 
--- Analyzing Valley at 2022-02-02 (index 1280) ---
2025-11-06 20:57:56,436 [INFO   ]   [Filter 2] Valley at 2022-02-02: Slope Check (30d) = -0.0802
2025-11-06 20:57:56,437 [INFO   ]   [Filter 2] Valley at 2022-02-02: Slope Check (60d) = -0.0076
2025-11-06 20:57:56,438 [INFO   ]   [Filter 2] Valley at 2022-02-02: Slope Check (90d) = -0.0629
2025-11-06 20:57:56,439 [INFO   ]   [Filter 2] FAILED. No positive slope found.
2025-11-06 20:57:56,439 [INFO   ] 
--- Analyzing Valley at 2022-03-30 (index 1319) ---
2025-11-06 20:57:56,441 [INFO   ]   [Filter 2] Valley at 2022-03-30: Slope Check (30d) = -0.1697
2025-11-06 20:57:56,442 [INFO   ]   [Filter 2] Valley at 2022-03-30: Slope Check (60d) = -0.1646
2025-11-06 20:57:56,443 [INFO   ]   [Filter 2] Valley at 2022-03-30: Slope Check (90d) = -0.1311
2025-11-06 20:57:56,443 [INFO   ]   [Filter 2] FAILED. No positive slope found.
2025-11-06 20:57:56,443 [INFO   ] 
--- Analyzing Valley at 2022-06-17 (index 1374) ---
2025-11-06 20:57:56,444 [INFO   ]   [Filter 2] Valley at 2022-06-17: Slope Check (30d) = 0.0594
2025-11-06 20:57:56,446 [INFO   ]   [Filter 2] Valley at 2022-06-17: Slope Check (60d) = -0.1127
2025-11-06 20:57:56,447 [INFO   ]   [Filter 2] Valley at 2022-06-17: Slope Check (90d) = -0.1596
2025-11-06 20:57:56,447 [INFO   ]   [Filter 2] 30-Day Growth Check: -0.03%
2025-11-06 20:57:56,447 [INFO   ]   [Filter 2] FAILED. Growth of -0.03% < 10.0% threshold.
2025-11-06 20:57:56,447 [INFO   ] 
--- Analyzing Valley at 2022-08-10 (index 1410) ---
2025-11-06 20:57:56,449 [INFO   ]   [Filter 2] Valley at 2022-08-10: Slope Check (30d) = -0.2762
2025-11-06 20:57:56,450 [INFO   ]   [Filter 2] Valley at 2022-08-10: Slope Check (60d) = -0.1675
2025-11-06 20:57:56,451 [INFO   ]   [Filter 2] Valley at 2022-08-10: Slope Check (90d) = -0.0538
2025-11-06 20:57:56,451 [INFO   ]   [Filter 2] FAILED. No positive slope found.
2025-11-06 20:57:56,452 [INFO   ] 
--- [Analysis Summary] ---
2025-11-06 20:57:56,452 [INFO   ] Total Valleys Found: 24
2025-11-06 20:57:56,452 [INFO   ] Valleys Passing Filter 2 (Intensity Test): 4
2025-11-06 20:57:56,452 [INFO   ] Valleys Passing Filter 2.5 (Context Test): 1
2025-11-06 20:57:56,453 [INFO   ] Valleys Passing Filter 3 (DNA Test): 0
2025-11-06 20:57:56,453 [INFO   ] --- [Historical Analyzer Finished] ---
