2025-10-30 22:00:27,573 [INFO   ] --- [Historical Analyzer Started for KO] ---
2025-10-30 22:00:28,702 [INFO   ] Loaded 1510 data points for KO.
2025-10-30 22:00:28,704 [INFO   ] Computing full CAC curve with m=10...
2025-10-30 22:01:22,027 [INFO   ] Found 19 significant valleys in the CAC curve.
2025-10-30 22:01:22,028 [INFO   ] 
--- Analyzing Valley at 2017-08-18 (index 158) ---
2025-10-30 22:01:22,031 [INFO   ]   [Filter 2] Valley at 2017-08-18: Slope Check (30d) = 0.0084
2025-10-30 22:01:22,032 [INFO   ]   [Filter 2] Valley at 2017-08-18: Slope Check (60d) = 0.0118
2025-10-30 22:01:22,033 [INFO   ]   [Filter 2] Valley at 2017-08-18: Slope Check (90d) = 0.0084
2025-10-30 22:01:22,033 [INFO   ]   [Filter 2] 30-Day Growth Check: -0.66%
2025-10-30 22:01:22,033 [INFO   ]   [Filter 2] FAILED. Growth of -0.66% < 10.0% threshold.
2025-10-30 22:01:22,033 [INFO   ] 
--- Analyzing Valley at 2018-02-08 (index 277) ---
2025-10-30 22:01:22,034 [INFO   ]   [Filter 2] Valley at 2018-02-08: Slope Check (30d) = -0.0007
2025-10-30 22:01:22,035 [INFO   ]   [Filter 2] Valley at 2018-02-08: Slope Check (60d) = -0.0036
2025-10-30 22:01:22,036 [INFO   ]   [Filter 2] Valley at 2018-02-08: Slope Check (90d) = -0.0054
2025-10-30 22:01:22,036 [INFO   ]   [Filter 2] FAILED. No positive slope found.
2025-10-30 22:01:22,041 [INFO   ] 
--- Analyzing Valley at 2018-05-31 (index 354) ---
2025-10-30 22:01:22,045 [INFO   ]   [Filter 2] Valley at 2018-05-31: Slope Check (30d) = 0.0451
2025-10-30 22:01:22,048 [INFO   ]   [Filter 2] Valley at 2018-05-31: Slope Check (60d) = 0.0552
2025-10-30 22:01:22,050 [INFO   ]   [Filter 2] Valley at 2018-05-31: Slope Check (90d) = 0.0327
2025-10-30 22:01:22,050 [INFO   ]   [Filter 2] 30-Day Growth Check: 4.81%
2025-10-30 22:01:22,050 [INFO   ]   [Filter 2] FAILED. Growth of 4.81% < 10.0% threshold.
2025-10-30 22:01:22,051 [INFO   ] 
--- Analyzing Valley at 2018-09-25 (index 435) ---
2025-10-30 22:01:22,620 [INFO   ]   [Filter 2] Valley at 2018-09-25: Slope Check (30d) = 0.0513
2025-10-30 22:01:22,621 [INFO   ]   [Filter 2] Valley at 2018-09-25: Slope Check (60d) = 0.0713
2025-10-30 22:01:22,623 [INFO   ]   [Filter 2] Valley at 2018-09-25: Slope Check (90d) = 0.0210
2025-10-30 22:01:22,623 [INFO   ]   [Filter 2] 30-Day Growth Check: 6.59%
2025-10-30 22:01:22,623 [INFO   ]   [Filter 2] FAILED. Growth of 6.59% < 10.0% threshold.
2025-10-30 22:01:22,623 [INFO   ] 
--- Analyzing Valley at 2018-11-19 (index 474) ---
2025-10-30 22:01:22,625 [INFO   ]   [Filter 2] Valley at 2018-11-19: Slope Check (30d) = -0.0769
2025-10-30 22:01:22,626 [INFO   ]   [Filter 2] Valley at 2018-11-19: Slope Check (60d) = -0.0168
2025-10-30 22:01:22,627 [INFO   ]   [Filter 2] Valley at 2018-11-19: Slope Check (90d) = -0.0310
2025-10-30 22:01:22,627 [INFO   ]   [Filter 2] FAILED. No positive slope found.
2025-10-30 22:01:22,628 [INFO   ] 
--- Analyzing Valley at 2019-01-17 (index 513) ---
2025-10-30 22:01:22,630 [INFO   ]   [Filter 2] Valley at 2019-01-17: Slope Check (30d) = -0.0918
2025-10-30 22:01:22,632 [INFO   ]   [Filter 2] Valley at 2019-01-17: Slope Check (60d) = -0.0226
2025-10-30 22:01:22,957 [INFO   ]   [Filter 2] Valley at 2019-01-17: Slope Check (90d) = 0.0195
2025-10-30 22:01:22,957 [INFO   ]   [Filter 2] 30-Day Growth Check: -3.57%
2025-10-30 22:01:22,957 [INFO   ]   [Filter 2] FAILED. Growth of -3.57% < 10.0% threshold.
2025-10-30 22:01:22,957 [INFO   ] 
--- Analyzing Valley at 2019-04-04 (index 566) ---
2025-10-30 22:01:22,959 [INFO   ]   [Filter 2] Valley at 2019-04-04: Slope Check (30d) = 0.0703
2025-10-30 22:01:22,960 [INFO   ]   [Filter 2] Valley at 2019-04-04: Slope Check (60d) = 0.0799
2025-10-30 22:01:22,961 [INFO   ]   [Filter 2] Valley at 2019-04-04: Slope Check (90d) = 0.0705
2025-10-30 22:01:23,304 [INFO   ]   [Filter 2] 30-Day Growth Check: 6.67%
2025-10-30 22:01:23,304 [INFO   ]   [Filter 2] FAILED. Growth of 6.67% < 10.0% threshold.
2025-10-30 22:01:23,304 [INFO   ] 
--- Analyzing Valley at 2019-06-26 (index 623) ---
2025-10-30 22:01:23,306 [INFO   ]   [Filter 2] Valley at 2019-06-26: Slope Check (30d) = 0.0490
2025-10-30 22:01:23,307 [INFO   ]   [Filter 2] Valley at 2019-06-26: Slope Check (60d) = 0.0562
2025-10-30 22:01:23,307 [INFO   ]   [Filter 2] Valley at 2019-06-26: Slope Check (90d) = 0.0286
2025-10-30 22:01:23,307 [INFO   ]   [Filter 2] 30-Day Growth Check: 4.03%
2025-10-30 22:01:23,308 [INFO   ]   [Filter 2] FAILED. Growth of 4.03% < 10.0% threshold.
2025-10-30 22:01:23,308 [INFO   ] 
--- Analyzing Valley at 2019-09-17 (index 680) ---
2025-10-30 22:01:23,308 [INFO   ]   [Filter 2] Valley at 2019-09-17: Slope Check (30d) = -0.0100
2025-10-30 22:01:23,309 [INFO   ]   [Filter 2] Valley at 2019-09-17: Slope Check (60d) = -0.0091
2025-10-30 22:01:23,633 [INFO   ]   [Filter 2] Valley at 2019-09-17: Slope Check (90d) = 0.0270
2025-10-30 22:01:23,633 [INFO   ]   [Filter 2] 30-Day Growth Check: -1.24%
2025-10-30 22:01:23,634 [INFO   ]   [Filter 2] FAILED. Growth of -1.24% < 10.0% threshold.
2025-10-30 22:01:23,634 [INFO   ] 
--- Analyzing Valley at 2020-02-10 (index 780) ---
2025-10-30 22:01:23,635 [INFO   ]   [Filter 2] Valley at 2020-02-10: Slope Check (30d) = -0.5701
2025-10-30 22:01:23,635 [INFO   ]   [Filter 2] Valley at 2020-02-10: Slope Check (60d) = -0.2226
2025-10-30 22:01:23,636 [INFO   ]   [Filter 2] Valley at 2020-02-10: Slope Check (90d) = -0.1018
2025-10-30 22:01:23,636 [INFO   ]   [Filter 2] FAILED. No positive slope found.
2025-10-30 22:01:23,636 [INFO   ] 
--- Analyzing Valley at 2020-03-06 (index 798) ---
2025-10-30 22:01:23,932 [INFO   ]   [Filter 2] Valley at 2020-03-06: Slope Check (30d) = -0.0578
2025-10-30 22:01:23,934 [INFO   ]   [Filter 2] Valley at 2020-03-06: Slope Check (60d) = -0.0147
2025-10-30 22:01:23,935 [INFO   ]   [Filter 2] Valley at 2020-03-06: Slope Check (90d) = -0.0001
2025-10-30 22:01:23,935 [INFO   ]   [Filter 2] FAILED. No positive slope found.
2025-10-30 22:01:23,935 [INFO   ] 
--- Analyzing Valley at 2020-03-23 (index 809) ---
2025-10-30 22:01:23,936 [INFO   ]   [Filter 2] Valley at 2020-03-23: Slope Check (30d) = 0.1470
2025-10-30 22:01:24,294 [INFO   ]   [Filter 2] Valley at 2020-03-23: Slope Check (60d) = 0.0514
2025-10-30 22:01:24,296 [INFO   ]   [Filter 2] Valley at 2020-03-23: Slope Check (90d) = 0.0274
2025-10-30 22:01:24,296 [INFO   ]   [Filter 2] 30-Day Growth Check: 20.18%
2025-10-30 22:01:24,296 [INFO   ]   [Filter 2] PASSED. Growth of 20.18% >= 10.0% threshold.
2025-10-30 22:01:25,194 [INFO   ]     [Filter 3] DNA Test vs 'DOGE-USD_m30_ramp': Distance = 4.4346
2025-10-30 22:01:25,204 [INFO   ]     [Filter 3] DNA Test vs 'SSYS_m90_ramp': Distance = 7.2712
2025-10-30 22:01:25,206 [INFO   ]     [Filter 3] DNA Test vs 'SHIB-USD_m30_ramp': Distance = 6.2357
2025-10-30 22:01:25,207 [INFO   ]     [Filter 3] DNA Test vs 'CSCO_m90_ramp': Distance = 4.2974
2025-10-30 22:01:25,209 [INFO   ]     [Filter 3] DNA Test vs 'GME_m90_ramp': Distance = 4.0121
2025-10-30 22:01:25,211 [INFO   ]     [Filter 3] DNA Test vs 'IYR_m120_ramp': Distance = 5.2708
2025-10-30 22:01:25,212 [INFO   ]     [Filter 3] DNA Test vs 'VWAGY_m15_ramp': Distance = 7.6892
2025-10-30 22:01:25,214 [INFO   ]     [Filter 3] DNA Test vs 'AMC_m30_ramp': Distance = 5.4009
2025-10-30 22:01:25,214 [INFO   ]     [Filter 3] PASSED. Best Match: 'GME_m90_ramp' (Distance: 4.0121) <= Loose Threshold (4.75)
2025-10-30 22:01:25,214 [INFO   ]     [Filter 3] PASSED. Best Match: 'GME_m90_ramp' (Distance: 4.0121)
2025-10-30 22:01:25,214 [INFO   ] 
--- Analyzing Valley at 2020-07-09 (index 884) ---
2025-10-30 22:01:25,216 [INFO   ]   [Filter 2] Valley at 2020-07-09: Slope Check (30d) = 0.0778
2025-10-30 22:01:25,216 [INFO   ]   [Filter 2] Valley at 2020-07-09: Slope Check (60d) = 0.0663
2025-10-30 22:01:25,217 [INFO   ]   [Filter 2] Valley at 2020-07-09: Slope Check (90d) = 0.0476
2025-10-30 22:01:25,218 [INFO   ]   [Filter 2] 30-Day Growth Check: 7.88%
2025-10-30 22:01:25,218 [INFO   ]   [Filter 2] FAILED. Growth of 7.88% < 10.0% threshold.
2025-10-30 22:01:25,218 [INFO   ] 
--- Analyzing Valley at 2020-08-27 (index 919) ---
2025-10-30 22:01:25,219 [INFO   ]   [Filter 2] Valley at 2020-08-27: Slope Check (30d) = -0.0094
2025-10-30 22:01:25,220 [INFO   ]   [Filter 2] Valley at 2020-08-27: Slope Check (60d) = 0.0364
2025-10-30 22:01:25,220 [INFO   ]   [Filter 2] Valley at 2020-08-27: Slope Check (90d) = 0.0544
2025-10-30 22:01:25,221 [INFO   ]   [Filter 2] 30-Day Growth Check: 5.47%
2025-10-30 22:01:25,221 [INFO   ]   [Filter 2] FAILED. Growth of 5.47% < 10.0% threshold.
2025-10-30 22:01:25,221 [INFO   ] 
--- Analyzing Valley at 2020-10-22 (index 958) ---
2025-10-30 22:01:25,222 [INFO   ]   [Filter 2] Valley at 2020-10-22: Slope Check (30d) = 0.1400
2025-10-30 22:01:25,223 [INFO   ]   [Filter 2] Valley at 2020-10-22: Slope Check (60d) = 0.0275
2025-10-30 22:01:25,223 [INFO   ]   [Filter 2] Valley at 2020-10-22: Slope Check (90d) = -0.0172
2025-10-30 22:01:25,224 [INFO   ]   [Filter 2] 30-Day Growth Check: 4.96%
2025-10-30 22:01:25,224 [INFO   ]   [Filter 2] FAILED. Growth of 4.96% < 10.0% threshold.
2025-10-30 22:01:25,224 [INFO   ] 
--- Analyzing Valley at 2021-07-07 (index 1134) ---
2025-10-30 22:01:25,225 [INFO   ]   [Filter 2] Valley at 2021-07-07: Slope Check (30d) = 0.0728
2025-10-30 22:01:25,226 [INFO   ]   [Filter 2] Valley at 2021-07-07: Slope Check (60d) = -0.0183
2025-10-30 22:01:25,226 [INFO   ]   [Filter 2] Valley at 2021-07-07: Slope Check (90d) = -0.0104
2025-10-30 22:01:25,227 [INFO   ]   [Filter 2] 30-Day Growth Check: 5.45%
2025-10-30 22:01:25,227 [INFO   ]   [Filter 2] FAILED. Growth of 5.45% < 10.0% threshold.
2025-10-30 22:01:25,227 [INFO   ] 
--- Analyzing Valley at 2021-08-17 (index 1163) ---
2025-10-30 22:01:25,228 [INFO   ]   [Filter 2] Valley at 2021-08-17: Slope Check (30d) = -0.0827
2025-10-30 22:01:25,228 [INFO   ]   [Filter 2] Valley at 2021-08-17: Slope Check (60d) = -0.0087
2025-10-30 22:01:25,229 [INFO   ]   [Filter 2] Valley at 2021-08-17: Slope Check (90d) = 0.0148
2025-10-30 22:01:25,229 [INFO   ]   [Filter 2] 30-Day Growth Check: -7.41%
2025-10-30 22:01:25,230 [INFO   ]   [Filter 2] FAILED. Growth of -7.41% < 10.0% threshold.
2025-10-30 22:01:25,230 [INFO   ] 
--- Analyzing Valley at 2022-03-16 (index 1309) ---
2025-10-30 22:01:25,230 [INFO   ]   [Filter 2] Valley at 2022-03-16: Slope Check (30d) = 0.2018
2025-10-30 22:01:25,231 [INFO   ]   [Filter 2] Valley at 2022-03-16: Slope Check (60d) = 0.0324
2025-10-30 22:01:25,232 [INFO   ]   [Filter 2] Valley at 2022-03-16: Slope Check (90d) = -0.0020
2025-10-30 22:01:25,232 [INFO   ]   [Filter 2] 30-Day Growth Check: 10.26%
2025-10-30 22:01:25,232 [INFO   ]   [Filter 2] PASSED. Growth of 10.26% >= 10.0% threshold.
2025-10-30 22:01:25,240 [INFO   ]     [Filter 3] DNA Test vs 'DOGE-USD_m30_ramp': Distance = 3.5580
2025-10-30 22:01:25,243 [INFO   ]     [Filter 3] DNA Test vs 'SSYS_m90_ramp': Distance = 7.2671
2025-10-30 22:01:25,244 [INFO   ]     [Filter 3] DNA Test vs 'SHIB-USD_m30_ramp': Distance = 3.2504
2025-10-30 22:01:25,246 [INFO   ]     [Filter 3] DNA Test vs 'CSCO_m90_ramp': Distance = 1.9000
2025-10-30 22:01:25,247 [INFO   ]     [Filter 3] DNA Test vs 'GME_m90_ramp': Distance = 4.9080
2025-10-30 22:01:25,249 [INFO   ]     [Filter 3] DNA Test vs 'IYR_m120_ramp': Distance = 1.8105
2025-10-30 22:01:25,250 [INFO   ]     [Filter 3] DNA Test vs 'VWAGY_m15_ramp': Distance = 6.6848
2025-10-30 22:01:25,252 [INFO   ]     [Filter 3] DNA Test vs 'AMC_m30_ramp': Distance = 2.1382
2025-10-30 22:01:25,252 [INFO   ]     [Filter 3] PASSED. Best Match: 'IYR_m120_ramp' (Distance: 1.8105) <= Strict Threshold (2.75)
2025-10-30 22:01:25,252 [INFO   ]     [Filter 3] PASSED. Best Match: 'IYR_m120_ramp' (Distance: 1.8105)
2025-10-30 22:01:25,252 [INFO   ] 
--- Analyzing Valley at 2022-04-20 (index 1333) ---
2025-10-30 22:01:25,403 [INFO   ]   [Filter 2] Valley at 2022-04-20: Slope Check (30d) = -0.0835
2025-10-30 22:01:25,404 [INFO   ]   [Filter 2] Valley at 2022-04-20: Slope Check (60d) = -0.0446
2025-10-30 22:01:25,405 [INFO   ]   [Filter 2] Valley at 2022-04-20: Slope Check (90d) = -0.0020
2025-10-30 22:01:25,406 [INFO   ]   [Filter 2] FAILED. No positive slope found.
2025-10-30 22:01:25,406 [INFO   ] 
--- [Analysis Summary] ---
2025-10-30 22:01:25,406 [INFO   ] Total Valleys Found: 19
2025-10-30 22:01:25,406 [INFO   ] Valleys Passing Filter 2 (Qualification Test): 2
2025-10-30 22:01:25,406 [INFO   ] Valleys Passing Filter 3 (DNA Test): 2
2025-10-30 22:01:25,406 [INFO   ] --- [Historical Analyzer Finished] ---
