2025-11-06 22:55:59,314 [INFO   ] --- [Historical Analyzer Started for AMC] ---
2025-11-06 22:56:00,045 [INFO   ] Loaded 1259 data points for AMC.
2025-11-06 22:56:00,047 [INFO   ] Computing full CAC curve with m=30...
2025-11-06 22:56:21,856 [INFO   ] Found 19 significant valleys in the CAC curve (Prominence >= 0).
2025-11-06 22:56:21,856 [INFO   ] 
--- Analyzing Valley at 2018-08-16 (index 157) ---
2025-11-06 22:56:21,856 [INFO   ]   [Filter 1] CAC Valley Prominence: 0.0212 (Threshold: 0)
2025-11-06 22:56:21,859 [INFO   ]   [Filter 2] 30-Day Growth Check: 23.07%
2025-11-06 22:56:21,859 [INFO   ]   [Filter 2] PASSED. Growth of 23.07% >= 10.0% threshold.
2025-11-06 22:56:21,859 [ERROR  ]     [Filter 3] CRITICAL ERROR during normalization: module 'stumpy' has no attribute 'z_norm'
2025-11-06 22:56:21,859 [WARNING]     [Filter 3] DNA test could not be performed.
2025-11-06 22:56:21,859 [INFO   ] 
--- Analyzing Valley at 2018-10-02 (index 189) ---
2025-11-06 22:56:21,860 [INFO   ]   [Filter 1] CAC Valley Prominence: 0.1450 (Threshold: 0)
2025-11-06 22:56:21,862 [INFO   ]   [Filter 2] FAILED. No positive slope found.
2025-11-06 22:56:21,862 [INFO   ] 
--- Analyzing Valley at 2019-01-17 (index 262) ---
2025-11-06 22:56:21,863 [INFO   ]   [Filter 1] CAC Valley Prominence: 0.0698 (Threshold: 0)
2025-11-06 22:56:21,866 [INFO   ]   [Filter 2] 30-Day Growth Check: 13.39%
2025-11-06 22:56:21,866 [INFO   ]   [Filter 2] PASSED. Growth of 13.39% >= 10.0% threshold.
2025-11-06 22:56:21,866 [ERROR  ]     [Filter 3] CRITICAL ERROR during normalization: module 'stumpy' has no attribute 'z_norm'
2025-11-06 22:56:21,866 [WARNING]     [Filter 3] DNA test could not be performed.
2025-11-06 22:56:21,867 [INFO   ] 
--- Analyzing Valley at 2019-03-08 (index 296) ---
2025-11-06 22:56:21,867 [INFO   ]   [Filter 1] CAC Valley Prominence: 0.0022 (Threshold: 0)
2025-11-06 22:56:21,869 [INFO   ]   [Filter 2] 30-Day Growth Check: 9.04%
2025-11-06 22:56:21,869 [INFO   ]   [Filter 2] FAILED. Growth of 9.04% < 10.0% threshold.
2025-11-06 22:56:21,869 [INFO   ] 
--- Analyzing Valley at 2019-06-05 (index 357) ---
2025-11-06 22:56:21,869 [INFO   ]   [Filter 1] CAC Valley Prominence: 0.0002 (Threshold: 0)
2025-11-06 22:56:21,871 [INFO   ]   [Filter 2] 30-Day Growth Check: -10.64%
2025-11-06 22:56:21,871 [INFO   ]   [Filter 2] FAILED. Growth of -10.64% < 10.0% threshold.
2025-11-06 22:56:21,871 [INFO   ] 
--- Analyzing Valley at 2019-07-19 (index 388) ---
2025-11-06 22:56:21,872 [INFO   ]   [Filter 1] CAC Valley Prominence: 0.0395 (Threshold: 0)
2025-11-06 22:56:21,873 [INFO   ]   [Filter 2] 30-Day Growth Check: 7.21%
2025-11-06 22:56:21,873 [INFO   ]   [Filter 2] FAILED. Growth of 7.21% < 10.0% threshold.
2025-11-06 22:56:21,874 [INFO   ] 
--- Analyzing Valley at 2019-10-02 (index 440) ---
2025-11-06 22:56:21,874 [INFO   ]   [Filter 1] CAC Valley Prominence: 0.0217 (Threshold: 0)
2025-11-06 22:56:21,875 [INFO   ]   [Filter 2] FAILED. No positive slope found.
2025-11-06 22:56:21,875 [INFO   ] 
--- Analyzing Valley at 2019-11-18 (index 473) ---
2025-11-06 22:56:21,876 [INFO   ]   [Filter 1] CAC Valley Prominence: 0.1143 (Threshold: 0)
2025-11-06 22:56:21,878 [INFO   ]   [Filter 2] FAILED. No positive slope found.
2025-11-06 22:56:21,878 [INFO   ] 
--- Analyzing Valley at 2020-01-17 (index 514) ---
2025-11-06 22:56:21,878 [INFO   ]   [Filter 1] CAC Valley Prominence: 0.0114 (Threshold: 0)
2025-11-06 22:56:21,881 [INFO   ]   [Filter 2] FAILED. No positive slope found.
2025-11-06 22:56:21,882 [INFO   ] 
--- Analyzing Valley at 2020-03-27 (index 562) ---
2025-11-06 22:56:21,882 [INFO   ]   [Filter 1] CAC Valley Prominence: 0.0181 (Threshold: 0)
2025-11-06 22:56:21,884 [INFO   ]   [Filter 2] 30-Day Growth Check: 13.89%
2025-11-06 22:56:21,884 [INFO   ]   [Filter 2] PASSED. Growth of 13.89% >= 10.0% threshold.
2025-11-06 22:56:21,884 [ERROR  ]     [Filter 3] CRITICAL ERROR during normalization: module 'stumpy' has no attribute 'z_norm'
2025-11-06 22:56:21,884 [WARNING]     [Filter 3] DNA test could not be performed.
2025-11-06 22:56:21,884 [INFO   ] 
--- Analyzing Valley at 2020-05-15 (index 596) ---
2025-11-06 22:56:21,885 [INFO   ]   [Filter 1] CAC Valley Prominence: 0.0288 (Threshold: 0)
2025-11-06 22:56:21,887 [INFO   ]   [Filter 2] 30-Day Growth Check: -7.52%
2025-11-06 22:56:21,887 [INFO   ]   [Filter 2] FAILED. Growth of -7.52% < 10.0% threshold.
2025-11-06 22:56:21,887 [INFO   ] 
--- Analyzing Valley at 2020-07-01 (index 628) ---
2025-11-06 22:56:21,887 [INFO   ]   [Filter 1] CAC Valley Prominence: 0.0140 (Threshold: 0)
2025-11-06 22:56:21,890 [INFO   ]   [Filter 2] 30-Day Growth Check: 1.53%
2025-11-06 22:56:21,890 [INFO   ]   [Filter 2] FAILED. Growth of 1.53% < 10.0% threshold.
2025-11-06 22:56:21,890 [INFO   ] 
--- Analyzing Valley at 2020-09-25 (index 688) ---
2025-11-06 22:56:21,890 [INFO   ]   [Filter 1] CAC Valley Prominence: 0.0142 (Threshold: 0)
2025-11-06 22:56:21,892 [INFO   ]   [Filter 2] 30-Day Growth Check: -49.59%
2025-11-06 22:56:21,892 [INFO   ]   [Filter 2] FAILED. Growth of -49.59% < 10.0% threshold.
2025-11-06 22:56:21,892 [INFO   ] 
--- Analyzing Valley at 2020-11-27 (index 732) ---
2025-11-06 22:56:21,892 [INFO   ]   [Filter 1] CAC Valley Prominence: 0.0787 (Threshold: 0)
2025-11-06 22:56:21,894 [INFO   ]   [Filter 2] 30-Day Growth Check: -50.56%
2025-11-06 22:56:21,895 [INFO   ]   [Filter 2] FAILED. Growth of -50.56% < 10.0% threshold.
2025-11-06 22:56:21,895 [INFO   ] 
--- Analyzing Valley at 2021-02-09 (index 781) ---
2025-11-06 22:56:21,895 [INFO   ]   [Filter 1] CAC Valley Prominence: 0.0242 (Threshold: 0)
2025-11-06 22:56:21,896 [INFO   ]   [Filter 2] 30-Day Growth Check: 93.82%
2025-11-06 22:56:21,897 [INFO   ]   [Filter 2] PASSED. Growth of 93.82% >= 10.0% threshold.
2025-11-06 22:56:21,897 [ERROR  ]     [Filter 3] CRITICAL ERROR during normalization: module 'stumpy' has no attribute 'z_norm'
2025-11-06 22:56:21,897 [WARNING]     [Filter 3] DNA test could not be performed.
2025-11-06 22:56:21,897 [INFO   ] 
--- Analyzing Valley at 2021-09-23 (index 938) ---
2025-11-06 22:56:21,897 [INFO   ]   [Filter 1] CAC Valley Prominence: 0.0391 (Threshold: 0)
2025-11-06 22:56:21,899 [INFO   ]   [Filter 2] FAILED. No positive slope found.
2025-11-06 22:56:21,899 [INFO   ] 
--- Analyzing Valley at 2021-11-16 (index 976) ---
2025-11-06 22:56:21,899 [INFO   ]   [Filter 1] CAC Valley Prominence: 0.0270 (Threshold: 0)
2025-11-06 22:56:21,901 [INFO   ]   [Filter 2] FAILED. No positive slope found.
2025-11-06 22:56:21,901 [INFO   ] 
--- Analyzing Valley at 2022-01-06 (index 1011) ---
2025-11-06 22:56:21,901 [INFO   ]   [Filter 1] CAC Valley Prominence: 0.0035 (Threshold: 0)
2025-11-06 22:56:21,903 [INFO   ]   [Filter 2] 30-Day Growth Check: -15.67%
2025-11-06 22:56:21,903 [INFO   ]   [Filter 2] FAILED. Growth of -15.67% < 10.0% threshold.
2025-11-06 22:56:21,903 [INFO   ] 
--- Analyzing Valley at 2022-03-21 (index 1061) ---
2025-11-06 22:56:21,903 [INFO   ]   [Filter 1] CAC Valley Prominence: 0.0566 (Threshold: 0)
2025-11-06 22:56:21,905 [INFO   ]   [Filter 2] FAILED. No positive slope found.
2025-11-06 22:56:21,905 [INFO   ] 
--- [Analysis Summary] ---
2025-11-06 22:56:21,905 [INFO   ] Total Valleys Found (Prominence >= 0): 19
2025-11-06 22:56:21,905 [INFO   ] Valleys Passing Filter 2 (Intensity Test): 4
2025-11-06 22:56:21,905 [INFO   ] Valleys Passing Filter 3 (DNA Test): 0
2025-11-06 22:56:21,905 [INFO   ] --- [Historical Analyzer Finished] ---
