2025-11-07 00:23:43,315 [INFO   ] --- [Historical Analyzer Started for AMC] ---
2025-11-07 00:23:45,476 [INFO   ] Loaded 1259 data points for AMC.
2025-11-07 00:23:45,480 [INFO   ] Computing full CAC curve with m=30...
2025-11-07 00:24:09,325 [INFO   ] Found 19 candidate valleys in the CAC curve.
2025-11-07 00:24:09,325 [INFO   ] 
--- Analyzing Valley at 2018-08-16 ---
2025-11-07 00:24:09,325 [INFO   ]   [Filter 2] 30-Day Growth Check: 23.07%
2025-11-07 00:24:09,325 [INFO   ]   [Filter 2] PASSED. Growth of 23.07% >= 10.0% threshold.
2025-11-07 00:24:09,981 [INFO   ]     [Filter 3] DNA Test vs 'DOGE-USD_m30_ramp': Distance = 4.9767
2025-11-07 00:24:09,983 [INFO   ]     [Filter 3] DNA Test vs 'SSYS_m90_ramp': Distance = 7.9833
2025-11-07 00:24:09,984 [INFO   ]     [Filter 3] DNA Test vs 'SHIB-USD_m30_ramp': Distance = 4.1972
2025-11-07 00:24:09,985 [INFO   ]     [Filter 3] DNA Test vs 'CSCO_m90_ramp': Distance = 3.0040
2025-11-07 00:24:09,987 [INFO   ]     [Filter 3] DNA Test vs 'GME_m90_ramp': Distance = 5.4678
2025-11-07 00:24:09,988 [INFO   ]     [Filter 3] DNA Test vs 'IYR_m120_ramp': Distance = 1.9231
2025-11-07 00:24:09,990 [INFO   ]     [Filter 3] DNA Test vs 'VWAGY_m15_ramp': Distance = 6.2737
2025-11-07 00:24:09,992 [INFO   ]     [Filter 3] DNA Test vs 'AMC_m30_ramp': Distance = 2.7676
2025-11-07 00:24:09,993 [INFO   ]     [Filter 3] PASSED. Best Match: 'IYR_m120_ramp' (Strict Match) (Distance: 1.9231)
2025-11-07 00:24:09,993 [INFO   ] 
--- Analyzing Valley at 2018-10-02 ---
2025-11-07 00:24:09,993 [INFO   ]   [Filter 2] 30-Day Growth Check: -23.13%
2025-11-07 00:24:09,993 [INFO   ]   [Filter 2] FAILED. Growth of -23.13% < 10.0% threshold.
2025-11-07 00:24:09,994 [INFO   ] 
--- Analyzing Valley at 2019-01-17 ---
2025-11-07 00:24:09,994 [INFO   ]   [Filter 2] 30-Day Growth Check: 13.39%
2025-11-07 00:24:09,994 [INFO   ]   [Filter 2] PASSED. Growth of 13.39% >= 10.0% threshold.
2025-11-07 00:24:09,996 [INFO   ]     [Filter 3] DNA Test vs 'DOGE-USD_m30_ramp': Distance = 8.8743
2025-11-07 00:24:09,997 [INFO   ]     [Filter 3] DNA Test vs 'SSYS_m90_ramp': Distance = 6.4090
2025-11-07 00:24:09,999 [INFO   ]     [Filter 3] DNA Test vs 'SHIB-USD_m30_ramp': Distance = 8.6103
2025-11-07 00:24:10,000 [INFO   ]     [Filter 3] DNA Test vs 'CSCO_m90_ramp': Distance = 8.4237
2025-11-07 00:24:10,001 [INFO   ]     [Filter 3] DNA Test vs 'GME_m90_ramp': Distance = 8.6888
2025-11-07 00:24:10,003 [INFO   ]     [Filter 3] DNA Test vs 'IYR_m120_ramp': Distance = 7.9088
2025-11-07 00:24:10,007 [INFO   ]     [Filter 3] DNA Test vs 'VWAGY_m15_ramp': Distance = 5.0353
2025-11-07 00:24:10,014 [INFO   ]     [Filter 3] DNA Test vs 'AMC_m30_ramp': Distance = 8.2870
2025-11-07 00:24:10,014 [INFO   ]     [Filter 3] FAILED. Best Match 'VWAGY_m15_ramp' (Distance: 5.0353) > Loose Threshold.
2025-11-07 00:24:10,014 [INFO   ] 
--- Analyzing Valley at 2019-03-08 ---
2025-11-07 00:24:10,015 [INFO   ]   [Filter 2] 30-Day Growth Check: 9.04%
2025-11-07 00:24:10,015 [INFO   ]   [Filter 2] FAILED. Growth of 9.04% < 10.0% threshold.
2025-11-07 00:24:10,015 [INFO   ] 
--- Analyzing Valley at 2019-06-05 ---
2025-11-07 00:24:10,015 [INFO   ]   [Filter 2] 30-Day Growth Check: -10.64%
2025-11-07 00:24:10,015 [INFO   ]   [Filter 2] FAILED. Growth of -10.64% < 10.0% threshold.
2025-11-07 00:24:10,016 [INFO   ] 
--- Analyzing Valley at 2019-07-19 ---
2025-11-07 00:24:10,016 [INFO   ]   [Filter 2] 30-Day Growth Check: 7.21%
2025-11-07 00:24:10,016 [INFO   ]   [Filter 2] FAILED. Growth of 7.21% < 10.0% threshold.
2025-11-07 00:24:10,016 [INFO   ] 
--- Analyzing Valley at 2019-10-02 ---
2025-11-07 00:24:10,017 [INFO   ]   [Filter 2] 30-Day Growth Check: -9.20%
2025-11-07 00:24:10,017 [INFO   ]   [Filter 2] FAILED. Growth of -9.20% < 10.0% threshold.
2025-11-07 00:24:10,017 [INFO   ] 
--- Analyzing Valley at 2019-11-18 ---
2025-11-07 00:24:10,017 [INFO   ]   [Filter 2] 30-Day Growth Check: -12.44%
2025-11-07 00:24:10,017 [INFO   ]   [Filter 2] FAILED. Growth of -12.44% < 10.0% threshold.
2025-11-07 00:24:10,017 [INFO   ] 
--- Analyzing Valley at 2020-01-17 ---
2025-11-07 00:24:10,018 [INFO   ]   [Filter 2] 30-Day Growth Check: -16.07%
2025-11-07 00:24:10,018 [INFO   ]   [Filter 2] FAILED. Growth of -16.07% < 10.0% threshold.
2025-11-07 00:24:10,018 [INFO   ] 
--- Analyzing Valley at 2020-03-27 ---
2025-11-07 00:24:10,018 [INFO   ]   [Filter 2] 30-Day Growth Check: 13.89%
2025-11-07 00:24:10,018 [INFO   ]   [Filter 2] PASSED. Growth of 13.89% >= 10.0% threshold.
2025-11-07 00:24:10,021 [INFO   ]     [Filter 3] DNA Test vs 'DOGE-USD_m30_ramp': Distance = 5.9031
2025-11-07 00:24:10,023 [INFO   ]     [Filter 3] DNA Test vs 'SSYS_m90_ramp': Distance = 7.9507
2025-11-07 00:24:10,024 [INFO   ]     [Filter 3] DNA Test vs 'SHIB-USD_m30_ramp': Distance = 4.2563
2025-11-07 00:24:10,034 [INFO   ]     [Filter 3] DNA Test vs 'CSCO_m90_ramp': Distance = 4.7543
2025-11-07 00:24:10,036 [INFO   ]     [Filter 3] DNA Test vs 'GME_m90_ramp': Distance = 7.2497
2025-11-07 00:24:10,037 [INFO   ]     [Filter 3] DNA Test vs 'IYR_m120_ramp': Distance = 4.4920
2025-11-07 00:24:10,039 [INFO   ]     [Filter 3] DNA Test vs 'VWAGY_m15_ramp': Distance = 6.9851
2025-11-07 00:24:10,040 [INFO   ]     [Filter 3] DNA Test vs 'AMC_m30_ramp': Distance = 4.3424
2025-11-07 00:24:10,040 [INFO   ]     [Filter 3] PASSED. Best Match: 'SHIB-USD_m30_ramp' (Loose Match) (Distance: 4.2563)
2025-11-07 00:24:10,040 [INFO   ] 
--- Analyzing Valley at 2020-05-15 ---
2025-11-07 00:24:10,041 [INFO   ]   [Filter 2] 30-Day Growth Check: -7.52%
2025-11-07 00:24:10,041 [INFO   ]   [Filter 2] FAILED. Growth of -7.52% < 10.0% threshold.
2025-11-07 00:24:10,041 [INFO   ] 
--- Analyzing Valley at 2020-07-01 ---
2025-11-07 00:24:10,041 [INFO   ]   [Filter 2] 30-Day Growth Check: 1.53%
2025-11-07 00:24:10,041 [INFO   ]   [Filter 2] FAILED. Growth of 1.53% < 10.0% threshold.
2025-11-07 00:24:10,042 [INFO   ] 
--- Analyzing Valley at 2020-09-25 ---
2025-11-07 00:24:10,042 [INFO   ]   [Filter 2] 30-Day Growth Check: -49.59%
2025-11-07 00:24:10,042 [INFO   ]   [Filter 2] FAILED. Growth of -49.59% < 10.0% threshold.
2025-11-07 00:24:10,042 [INFO   ] 
--- Analyzing Valley at 2020-11-27 ---
2025-11-07 00:24:10,042 [INFO   ]   [Filter 2] 30-Day Growth Check: -50.56%
2025-11-07 00:24:10,042 [INFO   ]   [Filter 2] FAILED. Growth of -50.56% < 10.0% threshold.
2025-11-07 00:24:10,042 [INFO   ] 
--- Analyzing Valley at 2021-02-09 ---
2025-11-07 00:24:10,043 [INFO   ]   [Filter 2] 30-Day Growth Check: 93.82%
2025-11-07 00:24:10,043 [INFO   ]   [Filter 2] PASSED. Growth of 93.82% >= 10.0% threshold.
2025-11-07 00:24:10,044 [INFO   ]     [Filter 3] DNA Test vs 'DOGE-USD_m30_ramp': Distance = 4.3311
2025-11-07 00:24:10,046 [INFO   ]     [Filter 3] DNA Test vs 'SSYS_m90_ramp': Distance = 7.4255
2025-11-07 00:24:10,055 [INFO   ]     [Filter 3] DNA Test vs 'SHIB-USD_m30_ramp': Distance = 3.8632
2025-11-07 00:24:10,057 [INFO   ]     [Filter 3] DNA Test vs 'CSCO_m90_ramp': Distance = 2.5929
2025-11-07 00:24:10,058 [INFO   ]     [Filter 3] DNA Test vs 'GME_m90_ramp': Distance = 5.6335
2025-11-07 00:24:10,060 [INFO   ]     [Filter 3] DNA Test vs 'IYR_m120_ramp': Distance = 2.0524
2025-11-07 00:24:10,061 [INFO   ]     [Filter 3] DNA Test vs 'VWAGY_m15_ramp': Distance = 7.4575
2025-11-07 00:24:10,063 [INFO   ]     [Filter 3] DNA Test vs 'AMC_m30_ramp': Distance = 0.0000
2025-11-07 00:24:10,063 [INFO   ]     [Filter 3] PASSED. Best Match: 'AMC_m30_ramp' (Strict Match) (Distance: 0.0000)
2025-11-07 00:24:10,064 [INFO   ] 
--- Analyzing Valley at 2021-09-23 ---
2025-11-07 00:24:10,064 [INFO   ]   [Filter 2] 30-Day Growth Check: 2.03%
2025-11-07 00:24:10,064 [INFO   ]   [Filter 2] FAILED. Growth of 2.03% < 10.0% threshold.
2025-11-07 00:24:10,064 [INFO   ] 
--- Analyzing Valley at 2021-11-16 ---
2025-11-07 00:24:10,064 [INFO   ]   [Filter 2] 30-Day Growth Check: -34.39%
2025-11-07 00:24:10,064 [INFO   ]   [Filter 2] FAILED. Growth of -34.39% < 10.0% threshold.
2025-11-07 00:24:10,064 [INFO   ] 
--- Analyzing Valley at 2022-01-06 ---
2025-11-07 00:24:10,065 [INFO   ]   [Filter 2] 30-Day Growth Check: -15.67%
2025-11-07 00:24:10,065 [INFO   ]   [Filter 2] FAILED. Growth of -15.67% < 10.0% threshold.
2025-11-07 00:24:10,065 [INFO   ] 
--- Analyzing Valley at 2022-03-21 ---
2025-11-07 00:24:10,065 [INFO   ]   [Filter 2] 30-Day Growth Check: -3.78%
2025-11-07 00:24:10,065 [INFO   ]   [Filter 2] FAILED. Growth of -3.78% < 10.0% threshold.
2025-11-07 00:24:10,065 [INFO   ] 

============================================================
2025-11-07 00:24:10,065 [INFO   ] --- [FINAL ANALYSIS REPORT] ---
2025-11-07 00:24:10,066 [INFO   ] ============================================================
2025-11-07 00:24:10,066 [INFO   ] Total Valleys Found: 19
2025-11-07 00:24:10,066 [INFO   ] Valleys Passing Filter 2 (Growth > 10.0%): 4
2025-11-07 00:24:10,066 [INFO   ] Total Alerts Generated (Passing Filter 3): 3
2025-11-07 00:24:10,066 [INFO   ]   - Strict Matches: 2
2025-11-07 00:24:10,066 [INFO   ]   - Loose Matches: 1
2025-11-07 00:24:10,066 [INFO   ] 
--- [ALERT DETAILS FOR NEWS SYSTEM] ---
2025-11-07 00:24:10,076 [INFO   ] 
| date       |   m_value |   growth_pct | best_match        |   distance | match_type   |
|:-----------|----------:|-------------:|:------------------|-----------:|:-------------|
| 2018-08-16 |        30 |      23.0744 | IYR_m120_ramp     |    1.92308 | Strict       |
| 2020-03-27 |        30 |      13.8889 | SHIB-USD_m30_ramp |    4.25633 | Loose        |
| 2021-02-09 |        30 |      93.8182 | AMC_m30_ramp      |    0       | Strict       |
2025-11-07 00:24:10,076 [INFO   ] ============================================================
2025-11-07 00:24:10,076 [INFO   ] --- [Historical Analyzer Finished] ---
