2025-11-06 21:36:38,466 [INFO   ] --- [Historical Analyzer Started for AMC] ---
2025-11-06 21:36:39,377 [INFO   ] Loaded 1259 data points for AMC.
2025-11-06 21:36:39,381 [INFO   ] Computing full CAC curve with m=30...
2025-11-06 21:37:01,076 [INFO   ] Found 16 significant valleys in the CAC curve.
2025-11-06 21:37:01,076 [INFO   ] 
--- Analyzing Valley at 2018-08-16 (index 157) ---
2025-11-06 21:37:01,088 [INFO   ]   [Filter 2] Valley at 2018-08-16: Slope Check (30d) = 1.0543
2025-11-06 21:37:01,089 [INFO   ]   [Filter 2] Valley at 2018-08-16: Slope Check (60d) = 0.2981
2025-11-06 21:37:01,090 [INFO   ]   [Filter 2] Valley at 2018-08-16: Slope Check (90d) = -0.5346
2025-11-06 21:37:01,090 [INFO   ]   [Filter 2] 30-Day Growth Check: 23.07%
2025-11-06 21:37:01,090 [INFO   ]   [Filter 2] PASSED. Growth of 23.07% >= 10.0% threshold.
2025-11-06 21:37:01,093 [INFO   ]   [Filter 2.5] Historical Context Check (m=30, Tier 1):
2025-11-06 21:37:01,093 [INFO   ]     - Current growth is in the 82.44th percentile of this stock's history.
2025-11-06 21:37:01,093 [INFO   ]     - Required Threshold: 97.0%
2025-11-06 21:37:01,093 [INFO   ]   [Filter 2.5] FAILED. Percentile rank 82.44% < 97.0% threshold.
2025-11-06 21:37:01,093 [INFO   ] 
--- Analyzing Valley at 2018-10-02 (index 189) ---
2025-11-06 21:37:01,095 [INFO   ]   [Filter 2] Valley at 2018-10-02: Slope Check (30d) = -0.7652
2025-11-06 21:37:01,096 [INFO   ]   [Filter 2] Valley at 2018-10-02: Slope Check (60d) = -1.2562
2025-11-06 21:37:01,097 [INFO   ]   [Filter 2] Valley at 2018-10-02: Slope Check (90d) = -0.6974
2025-11-06 21:37:01,097 [INFO   ]   [Filter 2] FAILED. No positive slope found.
2025-11-06 21:37:01,097 [INFO   ] 
--- Analyzing Valley at 2019-01-17 (index 262) ---
2025-11-06 21:37:01,098 [INFO   ]   [Filter 2] Valley at 2019-01-17: Slope Check (30d) = -0.0397
2025-11-06 21:37:01,099 [INFO   ]   [Filter 2] Valley at 2019-01-17: Slope Check (60d) = 0.3616
2025-11-06 21:37:01,100 [INFO   ]   [Filter 2] Valley at 2019-01-17: Slope Check (90d) = 0.0645
2025-11-06 21:37:01,100 [INFO   ]   [Filter 2] 30-Day Growth Check: 13.39%
2025-11-06 21:37:01,100 [INFO   ]   [Filter 2] PASSED. Growth of 13.39% >= 10.0% threshold.
2025-11-06 21:37:01,103 [INFO   ]   [Filter 2.5] Historical Context Check (m=30, Tier 1):
2025-11-06 21:37:01,103 [INFO   ]     - Current growth is in the 72.03th percentile of this stock's history.
2025-11-06 21:37:01,103 [INFO   ]     - Required Threshold: 97.0%
2025-11-06 21:37:01,104 [INFO   ]   [Filter 2.5] FAILED. Percentile rank 72.03% < 97.0% threshold.
2025-11-06 21:37:01,104 [INFO   ] 
--- Analyzing Valley at 2019-07-19 (index 388) ---
2025-11-06 21:37:01,105 [INFO   ]   [Filter 2] Valley at 2019-07-19: Slope Check (30d) = 0.1218
2025-11-06 21:37:01,106 [INFO   ]   [Filter 2] Valley at 2019-07-19: Slope Check (60d) = -0.1466
2025-11-06 21:37:01,107 [INFO   ]   [Filter 2] Valley at 2019-07-19: Slope Check (90d) = -0.3045
2025-11-06 21:37:01,107 [INFO   ]   [Filter 2] 30-Day Growth Check: 7.21%
2025-11-06 21:37:01,107 [INFO   ]   [Filter 2] FAILED. Growth of 7.21% < 10.0% threshold.
2025-11-06 21:37:01,107 [INFO   ] 
--- Analyzing Valley at 2019-10-02 (index 440) ---
2025-11-06 21:37:01,108 [INFO   ]   [Filter 2] Valley at 2019-10-02: Slope Check (30d) = -0.0334
2025-11-06 21:37:01,109 [INFO   ]   [Filter 2] Valley at 2019-10-02: Slope Check (60d) = -0.3460
2025-11-06 21:37:01,110 [INFO   ]   [Filter 2] Valley at 2019-10-02: Slope Check (90d) = -0.3763
2025-11-06 21:37:01,111 [INFO   ]   [Filter 2] FAILED. No positive slope found.
2025-11-06 21:37:01,111 [INFO   ] 
--- Analyzing Valley at 2019-11-18 (index 473) ---
2025-11-06 21:37:01,112 [INFO   ]   [Filter 2] Valley at 2019-11-18: Slope Check (30d) = -0.2539
2025-11-06 21:37:01,113 [INFO   ]   [Filter 2] Valley at 2019-11-18: Slope Check (60d) = -0.3127
2025-11-06 21:37:01,114 [INFO   ]   [Filter 2] Valley at 2019-11-18: Slope Check (90d) = -0.5327
2025-11-06 21:37:01,114 [INFO   ]   [Filter 2] FAILED. No positive slope found.
2025-11-06 21:37:01,114 [INFO   ] 
--- Analyzing Valley at 2020-01-17 (index 514) ---
2025-11-06 21:37:01,115 [INFO   ]   [Filter 2] Valley at 2020-01-17: Slope Check (30d) = -0.0999
2025-11-06 21:37:01,116 [INFO   ]   [Filter 2] Valley at 2020-01-17: Slope Check (60d) = -0.9661
2025-11-06 21:37:01,117 [INFO   ]   [Filter 2] Valley at 2020-01-17: Slope Check (90d) = -0.3907
2025-11-06 21:37:01,118 [INFO   ]   [Filter 2] FAILED. No positive slope found.
2025-11-06 21:37:01,118 [INFO   ] 
--- Analyzing Valley at 2020-03-27 (index 562) ---
2025-11-06 21:37:01,119 [INFO   ]   [Filter 2] Valley at 2020-03-27: Slope Check (30d) = 0.6263
2025-11-06 21:37:01,120 [INFO   ]   [Filter 2] Valley at 2020-03-27: Slope Check (60d) = 0.6256
2025-11-06 21:37:01,121 [INFO   ]   [Filter 2] Valley at 2020-03-27: Slope Check (90d) = 0.1759
2025-11-06 21:37:01,121 [INFO   ]   [Filter 2] 30-Day Growth Check: 13.89%
2025-11-06 21:37:01,122 [INFO   ]   [Filter 2] PASSED. Growth of 13.89% >= 10.0% threshold.
2025-11-06 21:37:01,124 [INFO   ]   [Filter 2.5] Historical Context Check (m=30, Tier 1):
2025-11-06 21:37:01,124 [INFO   ]     - Current growth is in the 72.44th percentile of this stock's history.
2025-11-06 21:37:01,124 [INFO   ]     - Required Threshold: 97.0%
2025-11-06 21:37:01,124 [INFO   ]   [Filter 2.5] FAILED. Percentile rank 72.44% < 97.0% threshold.
2025-11-06 21:37:01,124 [INFO   ] 
--- Analyzing Valley at 2020-05-15 (index 596) ---
2025-11-06 21:37:01,125 [INFO   ]   [Filter 2] Valley at 2020-05-15: Slope Check (30d) = 0.1227
2025-11-06 21:37:01,126 [INFO   ]   [Filter 2] Valley at 2020-05-15: Slope Check (60d) = -0.2432
2025-11-06 21:37:01,127 [INFO   ]   [Filter 2] Valley at 2020-05-15: Slope Check (90d) = 0.0827
2025-11-06 21:37:01,127 [INFO   ]   [Filter 2] 30-Day Growth Check: -7.52%
2025-11-06 21:37:01,127 [INFO   ]   [Filter 2] FAILED. Growth of -7.52% < 10.0% threshold.
2025-11-06 21:37:01,128 [INFO   ] 
--- Analyzing Valley at 2020-07-01 (index 628) ---
2025-11-06 21:37:01,129 [INFO   ]   [Filter 2] Valley at 2020-07-01: Slope Check (30d) = -0.0314
2025-11-06 21:37:01,129 [INFO   ]   [Filter 2] Valley at 2020-07-01: Slope Check (60d) = 0.3557
2025-11-06 21:37:01,130 [INFO   ]   [Filter 2] Valley at 2020-07-01: Slope Check (90d) = -0.1631
2025-11-06 21:37:01,130 [INFO   ]   [Filter 2] 30-Day Growth Check: 1.53%
2025-11-06 21:37:01,130 [INFO   ]   [Filter 2] FAILED. Growth of 1.53% < 10.0% threshold.
2025-11-06 21:37:01,131 [INFO   ] 
--- Analyzing Valley at 2020-09-25 (index 688) ---
2025-11-06 21:37:01,131 [INFO   ]   [Filter 2] Valley at 2020-09-25: Slope Check (30d) = -0.9823
2025-11-06 21:37:01,132 [INFO   ]   [Filter 2] Valley at 2020-09-25: Slope Check (60d) = -0.0968
2025-11-06 21:37:01,133 [INFO   ]   [Filter 2] Valley at 2020-09-25: Slope Check (90d) = 0.2366
2025-11-06 21:37:01,133 [INFO   ]   [Filter 2] 30-Day Growth Check: -49.59%
2025-11-06 21:37:01,133 [INFO   ]   [Filter 2] FAILED. Growth of -49.59% < 10.0% threshold.
2025-11-06 21:37:01,133 [INFO   ] 
--- Analyzing Valley at 2020-11-27 (index 732) ---
2025-11-06 21:37:01,134 [INFO   ]   [Filter 2] Valley at 2020-11-27: Slope Check (30d) = -0.8926
2025-11-06 21:37:01,135 [INFO   ]   [Filter 2] Valley at 2020-11-27: Slope Check (60d) = 0.8817
2025-11-06 21:37:01,136 [INFO   ]   [Filter 2] Valley at 2020-11-27: Slope Check (90d) = 1.1333
2025-11-06 21:37:01,137 [INFO   ]   [Filter 2] 30-Day Growth Check: -50.56%
2025-11-06 21:37:01,137 [INFO   ]   [Filter 2] FAILED. Growth of -50.56% < 10.0% threshold.
2025-11-06 21:37:01,137 [INFO   ] 
--- Analyzing Valley at 2021-02-09 (index 781) ---
2025-11-06 21:37:01,139 [INFO   ]   [Filter 2] Valley at 2021-02-09: Slope Check (30d) = 3.0142
2025-11-06 21:37:01,140 [INFO   ]   [Filter 2] Valley at 2021-02-09: Slope Check (60d) = 0.6073
2025-11-06 21:37:01,141 [INFO   ]   [Filter 2] Valley at 2021-02-09: Slope Check (90d) = 4.0940
2025-11-06 21:37:01,141 [INFO   ]   [Filter 2] 30-Day Growth Check: 93.82%
2025-11-06 21:37:01,141 [INFO   ]   [Filter 2] PASSED. Growth of 93.82% >= 10.0% threshold.
2025-11-06 21:37:01,145 [INFO   ]   [Filter 2.5] Historical Context Check (m=30, Tier 1):
2025-11-06 21:37:01,145 [INFO   ]     - Current growth is in the 94.23th percentile of this stock's history.
2025-11-06 21:37:01,145 [INFO   ]     - Required Threshold: 97.0%
2025-11-06 21:37:01,145 [INFO   ]   [Filter 2.5] FAILED. Percentile rank 94.23% < 97.0% threshold.
2025-11-06 21:37:01,145 [INFO   ] 
--- Analyzing Valley at 2021-09-23 (index 938) ---
2025-11-06 21:37:01,147 [INFO   ]   [Filter 2] Valley at 2021-09-23: Slope Check (30d) = -0.2190
2025-11-06 21:37:01,147 [INFO   ]   [Filter 2] Valley at 2021-09-23: Slope Check (60d) = -1.6154
2025-11-06 21:37:01,148 [INFO   ]   [Filter 2] Valley at 2021-09-23: Slope Check (90d) = -2.7390
2025-11-06 21:37:01,148 [INFO   ]   [Filter 2] FAILED. No positive slope found.
2025-11-06 21:37:01,148 [INFO   ] 
--- Analyzing Valley at 2021-11-16 (index 976) ---
2025-11-06 21:37:01,149 [INFO   ]   [Filter 2] Valley at 2021-11-16: Slope Check (30d) = -5.4734
2025-11-06 21:37:01,150 [INFO   ]   [Filter 2] Valley at 2021-11-16: Slope Check (60d) = -4.3012
2025-11-06 21:37:01,151 [INFO   ]   [Filter 2] Valley at 2021-11-16: Slope Check (90d) = -2.5524
2025-11-06 21:37:01,151 [INFO   ]   [Filter 2] FAILED. No positive slope found.
2025-11-06 21:37:01,151 [INFO   ] 
--- Analyzing Valley at 2022-03-21 (index 1061) ---
2025-11-06 21:37:01,152 [INFO   ]   [Filter 2] Valley at 2022-03-21: Slope Check (30d) = -2.7775
2025-11-06 21:37:01,152 [INFO   ]   [Filter 2] Valley at 2022-03-21: Slope Check (60d) = -2.0929
2025-11-06 21:37:01,153 [INFO   ]   [Filter 2] Valley at 2022-03-21: Slope Check (90d) = -0.8477
2025-11-06 21:37:01,153 [INFO   ]   [Filter 2] FAILED. No positive slope found.
2025-11-06 21:37:01,153 [INFO   ] 
--- [Analysis Summary] ---
2025-11-06 21:37:01,153 [INFO   ] Total Valleys Found: 16
2025-11-06 21:37:01,153 [INFO   ] Valleys Passing Filter 2 (Intensity Test): 4
2025-11-06 21:37:01,153 [INFO   ] Valleys Passing Filter 2.5 (Context Test): 0
2025-11-06 21:37:01,154 [INFO   ] Valleys Passing Filter 3 (DNA Test): 0
2025-11-06 21:37:01,154 [INFO   ] --- [Historical Analyzer Finished] ---
