2025-10-30 22:35:23,909 [INFO   ] --- [Historical Analyzer Started for F] ---
2025-10-30 22:35:24,839 [INFO   ] Loaded 1510 data points for F.
2025-10-30 22:35:24,840 [INFO   ] Computing full CAC curve with m=30...
2025-10-30 22:35:45,879 [INFO   ] Found 15 significant valleys in the CAC curve.
2025-10-30 22:35:45,880 [INFO   ] 
--- Analyzing Valley at 2017-08-08 (index 150) ---
2025-10-30 22:35:45,881 [INFO   ]   [Filter 2] Valley at 2017-08-08: Slope Check (30d) = 0.0242
2025-10-30 22:35:45,882 [INFO   ]   [Filter 2] Valley at 2017-08-08: Slope Check (60d) = 0.0220
2025-10-30 22:35:45,883 [INFO   ]   [Filter 2] Valley at 2017-08-08: Slope Check (90d) = 0.0149
2025-10-30 22:35:45,883 [INFO   ]   [Filter 2] 30-Day Growth Check: 7.62%
2025-10-30 22:35:45,883 [INFO   ]   [Filter 2] FAILED. Growth of 7.62% < 10.0% threshold.
2025-10-30 22:35:45,883 [INFO   ] 
--- Analyzing Valley at 2017-11-13 (index 218) ---
2025-10-30 22:35:45,884 [INFO   ]   [Filter 2] Valley at 2017-11-13: Slope Check (30d) = 0.0165
2025-10-30 22:35:45,885 [INFO   ]   [Filter 2] Valley at 2017-11-13: Slope Check (60d) = -0.0099
2025-10-30 22:35:45,885 [INFO   ]   [Filter 2] Valley at 2017-11-13: Slope Check (90d) = -0.0149
2025-10-30 22:35:45,886 [INFO   ]   [Filter 2] 30-Day Growth Check: 3.62%
2025-10-30 22:35:45,886 [INFO   ]   [Filter 2] FAILED. Growth of 3.62% < 10.0% threshold.
2025-10-30 22:35:45,886 [INFO   ] 
--- Analyzing Valley at 2018-02-16 (index 283) ---
2025-10-30 22:35:45,887 [INFO   ]   [Filter 2] Valley at 2018-02-16: Slope Check (30d) = 0.0095
2025-10-30 22:35:45,887 [INFO   ]   [Filter 2] Valley at 2018-02-16: Slope Check (60d) = 0.0111
2025-10-30 22:35:45,888 [INFO   ]   [Filter 2] Valley at 2018-02-16: Slope Check (90d) = 0.0119
2025-10-30 22:35:45,888 [INFO   ]   [Filter 2] 30-Day Growth Check: 2.36%
2025-10-30 22:35:45,888 [INFO   ]   [Filter 2] FAILED. Growth of 2.36% < 10.0% threshold.
2025-10-30 22:35:45,888 [INFO   ] 
--- Analyzing Valley at 2018-05-10 (index 340) ---
2025-10-30 22:35:45,889 [INFO   ]   [Filter 2] Valley at 2018-05-10: Slope Check (30d) = 0.0199
2025-10-30 22:35:45,890 [INFO   ]   [Filter 2] Valley at 2018-05-10: Slope Check (60d) = -0.0161
2025-10-30 22:35:45,890 [INFO   ]   [Filter 2] Valley at 2018-05-10: Slope Check (90d) = -0.0202
2025-10-30 22:35:45,891 [INFO   ]   [Filter 2] 30-Day Growth Check: 4.46%
2025-10-30 22:35:45,891 [INFO   ]   [Filter 2] FAILED. Growth of 4.46% < 10.0% threshold.
2025-10-30 22:35:45,891 [INFO   ] 
--- Analyzing Valley at 2018-07-23 (index 390) ---
2025-10-30 22:35:45,891 [INFO   ]   [Filter 2] Valley at 2018-07-23: Slope Check (30d) = -0.0149
2025-10-30 22:35:45,892 [INFO   ]   [Filter 2] Valley at 2018-07-23: Slope Check (60d) = -0.0139
2025-10-30 22:35:45,893 [INFO   ]   [Filter 2] Valley at 2018-07-23: Slope Check (90d) = -0.0064
2025-10-30 22:35:45,893 [INFO   ]   [Filter 2] FAILED. No positive slope found.
2025-10-30 22:35:45,893 [INFO   ] 
--- Analyzing Valley at 2018-09-11 (index 425) ---
2025-10-30 22:35:45,894 [INFO   ]   [Filter 2] Valley at 2018-09-11: Slope Check (30d) = -0.0263
2025-10-30 22:35:45,894 [INFO   ]   [Filter 2] Valley at 2018-09-11: Slope Check (60d) = 0.0025
2025-10-30 22:35:45,895 [INFO   ]   [Filter 2] Valley at 2018-09-11: Slope Check (90d) = -0.0076
2025-10-30 22:35:45,895 [INFO   ]   [Filter 2] 30-Day Growth Check: -8.04%
2025-10-30 22:35:45,895 [INFO   ]   [Filter 2] FAILED. Growth of -8.04% < 10.0% threshold.
2025-10-30 22:35:45,895 [INFO   ] 
--- Analyzing Valley at 2018-12-03 (index 483) ---
2025-10-30 22:35:45,896 [INFO   ]   [Filter 2] Valley at 2018-12-03: Slope Check (30d) = -0.0118
2025-10-30 22:35:45,897 [INFO   ]   [Filter 2] Valley at 2018-12-03: Slope Check (60d) = 0.0055
2025-10-30 22:35:45,898 [INFO   ]   [Filter 2] Valley at 2018-12-03: Slope Check (90d) = 0.0065
2025-10-30 22:35:45,898 [INFO   ]   [Filter 2] 30-Day Growth Check: -13.65%
2025-10-30 22:35:45,898 [INFO   ]   [Filter 2] FAILED. Growth of -13.65% < 10.0% threshold.
2025-10-30 22:35:45,898 [INFO   ] 
--- Analyzing Valley at 2019-06-25 (index 622) ---
2025-10-30 22:35:45,899 [INFO   ]   [Filter 2] Valley at 2019-06-25: Slope Check (30d) = -0.0154
2025-10-30 22:35:45,900 [INFO   ]   [Filter 2] Valley at 2019-06-25: Slope Check (60d) = -0.0143
2025-10-30 22:35:45,900 [INFO   ]   [Filter 2] Valley at 2019-06-25: Slope Check (90d) = -0.0110
2025-10-30 22:35:45,900 [INFO   ]   [Filter 2] FAILED. No positive slope found.
2025-10-30 22:35:45,901 [INFO   ] 
--- Analyzing Valley at 2019-11-29 (index 732) ---
2025-10-30 22:35:45,901 [INFO   ]   [Filter 2] Valley at 2019-11-29: Slope Check (30d) = 0.0083
2025-10-30 22:35:45,902 [INFO   ]   [Filter 2] Valley at 2019-11-29: Slope Check (60d) = -0.0166
2025-10-30 22:35:45,903 [INFO   ]   [Filter 2] Valley at 2019-11-29: Slope Check (90d) = -0.0457
2025-10-30 22:35:45,903 [INFO   ]   [Filter 2] 30-Day Growth Check: 1.99%
2025-10-30 22:35:45,903 [INFO   ]   [Filter 2] FAILED. Growth of 1.99% < 10.0% threshold.
2025-10-30 22:35:45,903 [INFO   ] 
--- Analyzing Valley at 2020-02-11 (index 781) ---
2025-10-30 22:35:45,904 [INFO   ]   [Filter 2] Valley at 2020-02-11: Slope Check (30d) = -0.1139
2025-10-30 22:35:45,905 [INFO   ]   [Filter 2] Valley at 2020-02-11: Slope Check (60d) = -0.0444
2025-10-30 22:35:45,905 [INFO   ]   [Filter 2] Valley at 2020-02-11: Slope Check (90d) = -0.0093
2025-10-30 22:35:45,905 [INFO   ]   [Filter 2] FAILED. No positive slope found.
2025-10-30 22:35:45,906 [INFO   ] 
--- Analyzing Valley at 2020-06-26 (index 876) ---
2025-10-30 22:35:45,906 [INFO   ]   [Filter 2] Valley at 2020-06-26: Slope Check (30d) = 0.0299
2025-10-30 22:35:45,907 [INFO   ]   [Filter 2] Valley at 2020-06-26: Slope Check (60d) = 0.0124
2025-10-30 22:35:45,908 [INFO   ]   [Filter 2] Valley at 2020-06-26: Slope Check (90d) = 0.0122
2025-10-30 22:35:45,908 [INFO   ]   [Filter 2] 30-Day Growth Check: 16.07%
2025-10-30 22:35:45,908 [INFO   ]   [Filter 2] PASSED. Growth of 16.07% >= 10.0% threshold.
2025-10-30 22:35:46,546 [INFO   ]     [Filter 3] DNA Test vs 'DOGE-USD_m30_ramp': Distance = 3.3367
2025-10-30 22:35:46,548 [INFO   ]     [Filter 3] DNA Test vs 'SSYS_m90_ramp': Distance = 8.1315
2025-10-30 22:35:46,550 [INFO   ]     [Filter 3] DNA Test vs 'SHIB-USD_m30_ramp': Distance = 3.7785
2025-10-30 22:35:46,551 [INFO   ]     [Filter 3] DNA Test vs 'CSCO_m90_ramp': Distance = 3.1505
2025-10-30 22:35:46,553 [INFO   ]     [Filter 3] DNA Test vs 'GME_m90_ramp': Distance = 3.3115
2025-10-30 22:35:46,554 [INFO   ]     [Filter 3] DNA Test vs 'IYR_m120_ramp': Distance = 2.9692
2025-10-30 22:35:46,556 [INFO   ]     [Filter 3] DNA Test vs 'VWAGY_m15_ramp': Distance = 6.5030
2025-10-30 22:35:46,558 [INFO   ]     [Filter 3] DNA Test vs 'AMC_m30_ramp': Distance = 3.9074
2025-10-30 22:35:46,558 [INFO   ]     [Filter 3] PASSED. Best Match: 'IYR_m120_ramp' (Distance: 2.9692) <= Loose Threshold (4.75)
2025-10-30 22:35:46,558 [INFO   ]     [Filter 3] PASSED. Best Match: 'IYR_m120_ramp' (Distance: 2.9692)
2025-10-30 22:35:46,559 [INFO   ] 
--- Analyzing Valley at 2020-09-18 (index 934) ---
2025-10-30 22:35:46,560 [INFO   ]   [Filter 2] Valley at 2020-09-18: Slope Check (30d) = 0.0411
2025-10-30 22:35:46,561 [INFO   ]   [Filter 2] Valley at 2020-09-18: Slope Check (60d) = 0.0374
2025-10-30 22:35:46,562 [INFO   ]   [Filter 2] Valley at 2020-09-18: Slope Check (90d) = 0.0309
2025-10-30 22:35:46,562 [INFO   ]   [Filter 2] 30-Day Growth Check: 9.27%
2025-10-30 22:35:46,562 [INFO   ]   [Filter 2] FAILED. Growth of 9.27% < 10.0% threshold.
2025-10-30 22:35:46,562 [INFO   ] 
--- Analyzing Valley at 2020-12-07 (index 989) ---
2025-10-30 22:35:46,563 [INFO   ]   [Filter 2] Valley at 2020-12-07: Slope Check (30d) = 0.0221
2025-10-30 22:35:46,564 [INFO   ]   [Filter 2] Valley at 2020-12-07: Slope Check (60d) = 0.0508
2025-10-30 22:35:46,565 [INFO   ]   [Filter 2] Valley at 2020-12-07: Slope Check (90d) = 0.0393
2025-10-30 22:35:46,565 [INFO   ]   [Filter 2] 30-Day Growth Check: 17.79%
2025-10-30 22:35:46,565 [INFO   ]   [Filter 2] PASSED. Growth of 17.79% >= 10.0% threshold.
2025-10-30 22:35:46,567 [INFO   ]     [Filter 3] DNA Test vs 'DOGE-USD_m30_ramp': Distance = 7.6170
2025-10-30 22:35:46,568 [INFO   ]     [Filter 3] DNA Test vs 'SSYS_m90_ramp': Distance = 7.9373
2025-10-30 22:35:46,569 [INFO   ]     [Filter 3] DNA Test vs 'SHIB-USD_m30_ramp': Distance = 6.9164
2025-10-30 22:35:46,571 [INFO   ]     [Filter 3] DNA Test vs 'CSCO_m90_ramp': Distance = 6.4499
2025-10-30 22:35:46,572 [INFO   ]     [Filter 3] DNA Test vs 'GME_m90_ramp': Distance = 8.1690
2025-10-30 22:35:46,573 [INFO   ]     [Filter 3] DNA Test vs 'IYR_m120_ramp': Distance = 5.2716
2025-10-30 22:35:46,574 [INFO   ]     [Filter 3] DNA Test vs 'VWAGY_m15_ramp': Distance = 5.9850
2025-10-30 22:35:46,575 [INFO   ]     [Filter 3] DNA Test vs 'AMC_m30_ramp': Distance = 5.5777
2025-10-30 22:35:46,576 [INFO   ]     [Filter 3] FAILED. Best Match Distance (5.2716) > Loose Threshold (4.75)
2025-10-30 22:35:46,576 [INFO   ]     [Filter 3] FAILED. No DNA match found below threshold 2.75.
2025-10-30 22:35:46,576 [INFO   ] 
--- Analyzing Valley at 2021-03-10 (index 1052) ---
2025-10-30 22:35:46,577 [INFO   ]   [Filter 2] Valley at 2021-03-10: Slope Check (30d) = -0.0239
2025-10-30 22:35:46,577 [INFO   ]   [Filter 2] Valley at 2021-03-10: Slope Check (60d) = 0.0099
2025-10-30 22:35:46,578 [INFO   ]   [Filter 2] Valley at 2021-03-10: Slope Check (90d) = 0.0282
2025-10-30 22:35:46,578 [INFO   ]   [Filter 2] 30-Day Growth Check: -9.14%
2025-10-30 22:35:46,578 [INFO   ]   [Filter 2] FAILED. Growth of -9.14% < 10.0% threshold.
2025-10-30 22:35:46,578 [INFO   ] 
--- Analyzing Valley at 2021-05-28 (index 1108) ---
2025-10-30 22:35:46,579 [INFO   ]   [Filter 2] Valley at 2021-05-28: Slope Check (30d) = -0.0233
2025-10-30 22:35:46,580 [INFO   ]   [Filter 2] Valley at 2021-05-28: Slope Check (60d) = -0.0317
2025-10-30 22:35:46,580 [INFO   ]   [Filter 2] Valley at 2021-05-28: Slope Check (90d) = -0.0191
2025-10-30 22:35:46,580 [INFO   ]   [Filter 2] FAILED. No positive slope found.
2025-10-30 22:35:46,580 [INFO   ] 
--- [Analysis Summary] ---
2025-10-30 22:35:46,580 [INFO   ] Total Valleys Found: 15
2025-10-30 22:35:46,581 [INFO   ] Valleys Passing Filter 2 (Qualification Test): 2
2025-10-30 22:35:46,581 [INFO   ] Valleys Passing Filter 3 (DNA Test): 1
2025-10-30 22:35:46,581 [INFO   ] --- [Historical Analyzer Finished] ---
