2025-10-30 22:42:54,917 [INFO   ] --- [Historical Analyzer Started for DUK] ---
2025-10-30 22:42:56,181 [INFO   ] Loaded 1510 data points for DUK.
2025-10-30 22:42:56,182 [INFO   ] Computing full CAC curve with m=10...
2025-10-30 22:43:17,325 [INFO   ] Found 21 significant valleys in the CAC curve.
2025-10-30 22:43:17,325 [INFO   ] 
--- Analyzing Valley at 2017-11-15 (index 220) ---
2025-10-30 22:43:17,327 [INFO   ]   [Filter 2] Valley at 2017-11-15: Slope Check (30d) = -0.1396
2025-10-30 22:43:17,328 [INFO   ]   [Filter 2] Valley at 2017-11-15: Slope Check (60d) = -0.2040
2025-10-30 22:43:17,329 [INFO   ]   [Filter 2] Valley at 2017-11-15: Slope Check (90d) = -0.1226
2025-10-30 22:43:17,329 [INFO   ]   [Filter 2] FAILED. No positive slope found.
2025-10-30 22:43:17,329 [INFO   ] 
--- Analyzing Valley at 2017-12-06 (index 234) ---
2025-10-30 22:43:17,330 [INFO   ]   [Filter 2] Valley at 2017-12-06: Slope Check (30d) = -0.2857
2025-10-30 22:43:17,330 [INFO   ]   [Filter 2] Valley at 2017-12-06: Slope Check (60d) = -0.1579
2025-10-30 22:43:17,331 [INFO   ]   [Filter 2] Valley at 2017-12-06: Slope Check (90d) = -0.0705
2025-10-30 22:43:17,331 [INFO   ]   [Filter 2] FAILED. No positive slope found.
2025-10-30 22:43:17,331 [INFO   ] 
--- Analyzing Valley at 2018-04-02 (index 312) ---
2025-10-30 22:43:17,332 [INFO   ]   [Filter 2] Valley at 2018-04-02: Slope Check (30d) = 0.0470
2025-10-30 22:43:17,333 [INFO   ]   [Filter 2] Valley at 2018-04-02: Slope Check (60d) = -0.0384
2025-10-30 22:43:17,334 [INFO   ]   [Filter 2] Valley at 2018-04-02: Slope Check (90d) = 0.0359
2025-10-30 22:43:17,334 [INFO   ]   [Filter 2] 30-Day Growth Check: 1.05%
2025-10-30 22:43:17,334 [INFO   ]   [Filter 2] FAILED. Growth of 1.05% < 10.0% threshold.
2025-10-30 22:43:17,334 [INFO   ] 
--- Analyzing Valley at 2019-05-15 (index 594) ---
2025-10-30 22:43:17,335 [INFO   ]   [Filter 2] Valley at 2019-05-15: Slope Check (30d) = 0.0547
2025-10-30 22:43:17,336 [INFO   ]   [Filter 2] Valley at 2019-05-15: Slope Check (60d) = 0.0246
2025-10-30 22:43:17,337 [INFO   ]   [Filter 2] Valley at 2019-05-15: Slope Check (90d) = 0.0751
2025-10-30 22:43:17,337 [INFO   ]   [Filter 2] 30-Day Growth Check: 2.47%
2025-10-30 22:43:17,337 [INFO   ]   [Filter 2] FAILED. Growth of 2.47% < 10.0% threshold.
2025-10-30 22:43:17,337 [INFO   ] 
--- Analyzing Valley at 2019-08-01 (index 648) ---
2025-10-30 22:43:17,339 [INFO   ]   [Filter 2] Valley at 2019-08-01: Slope Check (30d) = 0.2281
2025-10-30 22:43:17,340 [INFO   ]   [Filter 2] Valley at 2019-08-01: Slope Check (60d) = 0.1235
2025-10-30 22:43:17,341 [INFO   ]   [Filter 2] Valley at 2019-08-01: Slope Check (90d) = 0.0001
2025-10-30 22:43:17,341 [INFO   ]   [Filter 2] 30-Day Growth Check: 9.69%
2025-10-30 22:43:17,341 [INFO   ]   [Filter 2] FAILED. Growth of 9.69% < 10.0% threshold.
2025-10-30 22:43:17,342 [INFO   ] 
--- Analyzing Valley at 2019-09-25 (index 686) ---
2025-10-30 22:43:17,343 [INFO   ]   [Filter 2] Valley at 2019-09-25: Slope Check (30d) = -0.0652
2025-10-30 22:43:17,344 [INFO   ]   [Filter 2] Valley at 2019-09-25: Slope Check (60d) = -0.1145
2025-10-30 22:43:17,345 [INFO   ]   [Filter 2] Valley at 2019-09-25: Slope Check (90d) = -0.0104
2025-10-30 22:43:17,345 [INFO   ]   [Filter 2] FAILED. No positive slope found.
2025-10-30 22:43:17,345 [INFO   ] 
--- Analyzing Valley at 2019-12-04 (index 735) ---
2025-10-30 22:43:17,346 [INFO   ]   [Filter 2] Valley at 2019-12-04: Slope Check (30d) = 0.0676
2025-10-30 22:43:17,347 [INFO   ]   [Filter 2] Valley at 2019-12-04: Slope Check (60d) = 0.1766
2025-10-30 22:43:17,349 [INFO   ]   [Filter 2] Valley at 2019-12-04: Slope Check (90d) = -0.0741
2025-10-30 22:43:17,349 [INFO   ]   [Filter 2] 30-Day Growth Check: 4.76%
2025-10-30 22:43:17,349 [INFO   ]   [Filter 2] FAILED. Growth of 4.76% < 10.0% threshold.
2025-10-30 22:43:17,349 [INFO   ] 
--- Analyzing Valley at 2020-01-31 (index 774) ---
2025-10-30 22:43:17,351 [INFO   ]   [Filter 2] Valley at 2020-01-31: Slope Check (30d) = -0.1612
2025-10-30 22:43:17,352 [INFO   ]   [Filter 2] Valley at 2020-01-31: Slope Check (60d) = -0.2683
2025-10-30 22:43:17,354 [INFO   ]   [Filter 2] Valley at 2020-01-31: Slope Check (90d) = -0.1190
2025-10-30 22:43:17,354 [INFO   ]   [Filter 2] FAILED. No positive slope found.
2025-10-30 22:43:17,354 [INFO   ] 
--- Analyzing Valley at 2020-07-15 (index 888) ---
2025-10-30 22:43:17,355 [INFO   ]   [Filter 2] Valley at 2020-07-15: Slope Check (30d) = 0.0154
2025-10-30 22:43:17,356 [INFO   ]   [Filter 2] Valley at 2020-07-15: Slope Check (60d) = 0.0675
2025-10-30 22:43:17,358 [INFO   ]   [Filter 2] Valley at 2020-07-15: Slope Check (90d) = 0.1521
2025-10-30 22:43:17,358 [INFO   ]   [Filter 2] 30-Day Growth Check: 1.69%
2025-10-30 22:43:17,358 [INFO   ]   [Filter 2] FAILED. Growth of 1.69% < 10.0% threshold.
2025-10-30 22:43:17,358 [INFO   ] 
--- Analyzing Valley at 2020-09-28 (index 940) ---
2025-10-30 22:43:17,359 [INFO   ]   [Filter 2] Valley at 2020-09-28: Slope Check (30d) = 0.1736
2025-10-30 22:43:17,360 [INFO   ]   [Filter 2] Valley at 2020-09-28: Slope Check (60d) = 0.0454
2025-10-30 22:43:17,362 [INFO   ]   [Filter 2] Valley at 2020-09-28: Slope Check (90d) = 0.0080
2025-10-30 22:43:17,362 [INFO   ]   [Filter 2] 30-Day Growth Check: 12.75%
2025-10-30 22:43:17,363 [INFO   ]   [Filter 2] PASSED. Growth of 12.75% >= 10.0% threshold.
2025-10-30 22:43:17,978 [INFO   ]     [Filter 3] DNA Test vs 'DOGE-USD_m30_ramp': Distance = 4.7242
2025-10-30 22:43:17,980 [INFO   ]     [Filter 3] DNA Test vs 'SSYS_m90_ramp': Distance = 6.4854
2025-10-30 22:43:17,981 [INFO   ]     [Filter 3] DNA Test vs 'SHIB-USD_m30_ramp': Distance = 5.9688
2025-10-30 22:43:17,983 [INFO   ]     [Filter 3] DNA Test vs 'CSCO_m90_ramp': Distance = 4.0427
2025-10-30 22:43:17,984 [INFO   ]     [Filter 3] DNA Test vs 'GME_m90_ramp': Distance = 5.3193
2025-10-30 22:43:17,986 [INFO   ]     [Filter 3] DNA Test vs 'IYR_m120_ramp': Distance = 5.0623
2025-10-30 22:43:17,987 [INFO   ]     [Filter 3] DNA Test vs 'VWAGY_m15_ramp': Distance = 7.2345
2025-10-30 22:43:17,989 [INFO   ]     [Filter 3] DNA Test vs 'AMC_m30_ramp': Distance = 5.1582
2025-10-30 22:43:17,989 [INFO   ]     [Filter 3] PASSED. Best Match: 'CSCO_m90_ramp' (Distance: 4.0427) <= Loose Threshold (4.75)
2025-10-30 22:43:17,989 [INFO   ]     [Filter 3] PASSED. Best Match: 'CSCO_m90_ramp' (Distance: 4.0427)
2025-10-30 22:43:17,989 [INFO   ] 
--- Analyzing Valley at 2020-10-21 (index 957) ---
2025-10-30 22:43:17,990 [INFO   ]   [Filter 2] Valley at 2020-10-21: Slope Check (30d) = 0.0705
2025-10-30 22:43:17,991 [INFO   ]   [Filter 2] Valley at 2020-10-21: Slope Check (60d) = -0.0502
2025-10-30 22:43:17,992 [INFO   ]   [Filter 2] Valley at 2020-10-21: Slope Check (90d) = -0.0303
2025-10-30 22:43:17,992 [INFO   ]   [Filter 2] 30-Day Growth Check: 2.49%
2025-10-30 22:43:17,992 [INFO   ]   [Filter 2] FAILED. Growth of 2.49% < 10.0% threshold.
2025-10-30 22:43:17,993 [INFO   ] 
--- Analyzing Valley at 2020-12-02 (index 986) ---
2025-10-30 22:43:17,994 [INFO   ]   [Filter 2] Valley at 2020-12-02: Slope Check (30d) = -0.0621
2025-10-30 22:43:17,994 [INFO   ]   [Filter 2] Valley at 2020-12-02: Slope Check (60d) = -0.0112
2025-10-30 22:43:17,995 [INFO   ]   [Filter 2] Valley at 2020-12-02: Slope Check (90d) = 0.0532
2025-10-30 22:43:17,996 [INFO   ]   [Filter 2] 30-Day Growth Check: -2.35%
2025-10-30 22:43:17,996 [INFO   ]   [Filter 2] FAILED. Growth of -2.35% < 10.0% threshold.
2025-10-30 22:43:17,996 [INFO   ] 
--- Analyzing Valley at 2021-01-05 (index 1008) ---
2025-10-30 22:43:17,997 [INFO   ]   [Filter 2] Valley at 2021-01-05: Slope Check (30d) = 0.0725
2025-10-30 22:43:17,998 [INFO   ]   [Filter 2] Valley at 2021-01-05: Slope Check (60d) = 0.0525
2025-10-30 22:43:17,998 [INFO   ]   [Filter 2] Valley at 2021-01-05: Slope Check (90d) = 0.1315
2025-10-30 22:43:17,998 [INFO   ]   [Filter 2] 30-Day Growth Check: 0.42%
2025-10-30 22:43:17,999 [INFO   ]   [Filter 2] FAILED. Growth of 0.42% < 10.0% threshold.
2025-10-30 22:43:17,999 [INFO   ] 
--- Analyzing Valley at 2021-03-02 (index 1046) ---
2025-10-30 22:43:17,999 [INFO   ]   [Filter 2] Valley at 2021-03-02: Slope Check (30d) = 0.3293
2025-10-30 22:43:18,000 [INFO   ]   [Filter 2] Valley at 2021-03-02: Slope Check (60d) = 0.2180
2025-10-30 22:43:18,001 [INFO   ]   [Filter 2] Valley at 2021-03-02: Slope Check (90d) = 0.1138
2025-10-30 22:43:18,001 [INFO   ]   [Filter 2] 30-Day Growth Check: 12.91%
2025-10-30 22:43:18,001 [INFO   ]   [Filter 2] PASSED. Growth of 12.91% >= 10.0% threshold.
2025-10-30 22:43:18,003 [INFO   ]     [Filter 3] DNA Test vs 'DOGE-USD_m30_ramp': Distance = 3.5969
2025-10-30 22:43:18,004 [INFO   ]     [Filter 3] DNA Test vs 'SSYS_m90_ramp': Distance = 7.3498
2025-10-30 22:43:18,006 [INFO   ]     [Filter 3] DNA Test vs 'SHIB-USD_m30_ramp': Distance = 3.3478
2025-10-30 22:43:18,007 [INFO   ]     [Filter 3] DNA Test vs 'CSCO_m90_ramp': Distance = 1.7024
2025-10-30 22:43:18,009 [INFO   ]     [Filter 3] DNA Test vs 'GME_m90_ramp': Distance = 4.5311
2025-10-30 22:43:18,011 [INFO   ]     [Filter 3] DNA Test vs 'IYR_m120_ramp': Distance = 2.1224
2025-10-30 22:43:18,013 [INFO   ]     [Filter 3] DNA Test vs 'VWAGY_m15_ramp': Distance = 6.4366
2025-10-30 22:43:18,014 [INFO   ]     [Filter 3] DNA Test vs 'AMC_m30_ramp': Distance = 2.6375
2025-10-30 22:43:18,014 [INFO   ]     [Filter 3] PASSED. Best Match: 'CSCO_m90_ramp' (Distance: 1.7024) <= Strict Threshold (2.75)
2025-10-30 22:43:18,014 [INFO   ]     [Filter 3] PASSED. Best Match: 'CSCO_m90_ramp' (Distance: 1.7024)
2025-10-30 22:43:18,014 [INFO   ] 
--- Analyzing Valley at 2021-12-03 (index 1239) ---
2025-10-30 22:43:18,015 [INFO   ]   [Filter 2] Valley at 2021-12-03: Slope Check (30d) = 0.0967
2025-10-30 22:43:18,016 [INFO   ]   [Filter 2] Valley at 2021-12-03: Slope Check (60d) = -0.0278
2025-10-30 22:43:18,017 [INFO   ]   [Filter 2] Valley at 2021-12-03: Slope Check (90d) = 0.0975
2025-10-30 22:43:18,017 [INFO   ]   [Filter 2] 30-Day Growth Check: 4.17%
2025-10-30 22:43:18,017 [INFO   ]   [Filter 2] FAILED. Growth of 4.17% < 10.0% threshold.
2025-10-30 22:43:18,017 [INFO   ] 
--- Analyzing Valley at 2022-04-04 (index 1322) ---
2025-10-30 22:43:18,018 [INFO   ]   [Filter 2] Valley at 2022-04-04: Slope Check (30d) = -0.1736
2025-10-30 22:43:18,018 [INFO   ]   [Filter 2] Valley at 2022-04-04: Slope Check (60d) = -0.1550
2025-10-30 22:43:18,019 [INFO   ]   [Filter 2] Valley at 2022-04-04: Slope Check (90d) = -0.0665
2025-10-30 22:43:18,019 [INFO   ]   [Filter 2] FAILED. No positive slope found.
2025-10-30 22:43:18,019 [INFO   ] 
--- Analyzing Valley at 2022-05-03 (index 1342) ---
2025-10-30 22:43:18,020 [INFO   ]   [Filter 2] Valley at 2022-05-03: Slope Check (30d) = -0.0244
2025-10-30 22:43:18,021 [INFO   ]   [Filter 2] Valley at 2022-05-03: Slope Check (60d) = -0.0830
2025-10-30 22:43:18,022 [INFO   ]   [Filter 2] Valley at 2022-05-03: Slope Check (90d) = 0.0159
2025-10-30 22:43:18,022 [INFO   ]   [Filter 2] 30-Day Growth Check: -6.01%
2025-10-30 22:43:18,022 [INFO   ]   [Filter 2] FAILED. Growth of -6.01% < 10.0% threshold.
2025-10-30 22:43:18,022 [INFO   ] 
--- Analyzing Valley at 2022-06-23 (index 1377) ---
2025-10-30 22:43:18,023 [INFO   ]   [Filter 2] Valley at 2022-06-23: Slope Check (30d) = 0.1015
2025-10-30 22:43:18,024 [INFO   ]   [Filter 2] Valley at 2022-06-23: Slope Check (60d) = 0.0818
2025-10-30 22:43:18,024 [INFO   ]   [Filter 2] Valley at 2022-06-23: Slope Check (90d) = -0.1755
2025-10-30 22:43:18,025 [INFO   ]   [Filter 2] 30-Day Growth Check: 6.11%
2025-10-30 22:43:18,025 [INFO   ]   [Filter 2] FAILED. Growth of 6.11% < 10.0% threshold.
2025-10-30 22:43:18,025 [INFO   ] 
--- Analyzing Valley at 2022-07-21 (index 1396) ---
2025-10-30 22:43:18,025 [INFO   ]   [Filter 2] Valley at 2022-07-21: Slope Check (30d) = 0.1589
2025-10-30 22:43:18,026 [INFO   ]   [Filter 2] Valley at 2022-07-21: Slope Check (60d) = -0.2550
2025-10-30 22:43:18,027 [INFO   ]   [Filter 2] Valley at 2022-07-21: Slope Check (90d) = -0.2105
2025-10-30 22:43:18,027 [INFO   ]   [Filter 2] 30-Day Growth Check: 4.21%
2025-10-30 22:43:18,027 [INFO   ]   [Filter 2] FAILED. Growth of 4.21% < 10.0% threshold.
2025-10-30 22:43:18,027 [INFO   ] 
--- Analyzing Valley at 2022-08-15 (index 1413) ---
2025-10-30 22:43:18,028 [INFO   ]   [Filter 2] Valley at 2022-08-15: Slope Check (30d) = -0.2534
2025-10-30 22:43:18,028 [INFO   ]   [Filter 2] Valley at 2022-08-15: Slope Check (60d) = -0.4164
2025-10-30 22:43:18,029 [INFO   ]   [Filter 2] Valley at 2022-08-15: Slope Check (90d) = -0.1208
2025-10-30 22:43:18,029 [INFO   ]   [Filter 2] FAILED. No positive slope found.
2025-10-30 22:43:18,029 [INFO   ] 
--- Analyzing Valley at 2022-10-05 (index 1449) ---
2025-10-30 22:43:18,030 [INFO   ]   [Filter 2] Valley at 2022-10-05: Slope Check (30d) = 0.2246
2025-10-30 22:43:18,031 [INFO   ]   [Filter 2] Valley at 2022-10-05: Slope Check (60d) = 0.2720
2025-10-30 22:43:18,031 [INFO   ]   [Filter 2] 30-Day Growth Check: 3.31%
2025-10-30 22:43:18,031 [INFO   ]   [Filter 2] FAILED. Growth of 3.31% < 10.0% threshold.
2025-10-30 22:43:18,031 [INFO   ] 
--- [Analysis Summary] ---
2025-10-30 22:43:18,031 [INFO   ] Total Valleys Found: 21
2025-10-30 22:43:18,031 [INFO   ] Valleys Passing Filter 2 (Qualification Test): 2
2025-10-30 22:43:18,031 [INFO   ] Valleys Passing Filter 3 (DNA Test): 2
2025-10-30 22:43:18,031 [INFO   ] --- [Historical Analyzer Finished] ---
