2025-10-30 22:40:18,686 [INFO   ] --- [Historical Analyzer Started for JPM] ---
2025-10-30 22:40:19,710 [INFO   ] Loaded 1510 data points for JPM.
2025-10-30 22:40:19,711 [INFO   ] Computing full CAC curve with m=30...
2025-10-30 22:40:40,548 [INFO   ] Found 16 significant valleys in the CAC curve.
2025-10-30 22:40:40,549 [INFO   ] 
--- Analyzing Valley at 2017-10-06 (index 192) ---
2025-10-30 22:40:40,551 [INFO   ]   [Filter 2] Valley at 2017-10-06: Slope Check (30d) = 0.0538
2025-10-30 22:40:40,551 [INFO   ]   [Filter 2] Valley at 2017-10-06: Slope Check (60d) = 0.1528
2025-10-30 22:40:40,552 [INFO   ]   [Filter 2] Valley at 2017-10-06: Slope Check (90d) = 0.1842
2025-10-30 22:40:40,552 [INFO   ]   [Filter 2] 30-Day Growth Check: 1.60%
2025-10-30 22:40:40,553 [INFO   ]   [Filter 2] FAILED. Growth of 1.60% < 10.0% threshold.
2025-10-30 22:40:40,553 [INFO   ] 
--- Analyzing Valley at 2018-03-28 (index 310) ---
2025-10-30 22:40:40,553 [INFO   ]   [Filter 2] Valley at 2018-03-28: Slope Check (30d) = 0.0038
2025-10-30 22:40:40,554 [INFO   ]   [Filter 2] Valley at 2018-03-28: Slope Check (60d) = -0.0153
2025-10-30 22:40:40,555 [INFO   ]   [Filter 2] Valley at 2018-03-28: Slope Check (90d) = 0.0097
2025-10-30 22:40:40,555 [INFO   ]   [Filter 2] 30-Day Growth Check: 5.54%
2025-10-30 22:40:40,555 [INFO   ]   [Filter 2] FAILED. Growth of 5.54% < 10.0% threshold.
2025-10-30 22:40:40,555 [INFO   ] 
--- Analyzing Valley at 2018-05-17 (index 345) ---
2025-10-30 22:40:40,556 [INFO   ]   [Filter 2] Valley at 2018-05-17: Slope Check (30d) = -0.1860
2025-10-30 22:40:40,556 [INFO   ]   [Filter 2] Valley at 2018-05-17: Slope Check (60d) = 0.1007
2025-10-30 22:40:40,557 [INFO   ]   [Filter 2] Valley at 2018-05-17: Slope Check (90d) = 0.0934
2025-10-30 22:40:40,557 [INFO   ]   [Filter 2] 30-Day Growth Check: -7.11%
2025-10-30 22:40:40,558 [INFO   ]   [Filter 2] FAILED. Growth of -7.11% < 10.0% threshold.
2025-10-30 22:40:40,558 [INFO   ] 
--- Analyzing Valley at 2018-08-07 (index 401) ---
2025-10-30 22:40:40,559 [INFO   ]   [Filter 2] Valley at 2018-08-07: Slope Check (30d) = -0.0676
2025-10-30 22:40:40,559 [INFO   ]   [Filter 2] Valley at 2018-08-07: Slope Check (60d) = -0.1241
2025-10-30 22:40:40,560 [INFO   ]   [Filter 2] Valley at 2018-08-07: Slope Check (90d) = -0.0975
2025-10-30 22:40:40,560 [INFO   ]   [Filter 2] FAILED. No positive slope found.
2025-10-30 22:40:40,560 [INFO   ] 
--- Analyzing Valley at 2018-10-23 (index 455) ---
2025-10-30 22:40:40,561 [INFO   ]   [Filter 2] Valley at 2018-10-23: Slope Check (30d) = 0.1327
2025-10-30 22:40:40,562 [INFO   ]   [Filter 2] Valley at 2018-10-23: Slope Check (60d) = -0.1527
2025-10-30 22:40:40,563 [INFO   ]   [Filter 2] Valley at 2018-10-23: Slope Check (90d) = -0.0379
2025-10-30 22:40:40,563 [INFO   ]   [Filter 2] 30-Day Growth Check: 1.88%
2025-10-30 22:40:40,563 [INFO   ]   [Filter 2] FAILED. Growth of 1.88% < 10.0% threshold.
2025-10-30 22:40:40,563 [INFO   ] 
--- Analyzing Valley at 2018-12-20 (index 495) ---
2025-10-30 22:40:40,564 [INFO   ]   [Filter 2] Valley at 2018-12-20: Slope Check (30d) = 0.3132
2025-10-30 22:40:40,564 [INFO   ]   [Filter 2] Valley at 2018-12-20: Slope Check (60d) = 0.1301
2025-10-30 22:40:40,565 [INFO   ]   [Filter 2] Valley at 2018-12-20: Slope Check (90d) = 0.1311
2025-10-30 22:40:40,565 [INFO   ]   [Filter 2] 30-Day Growth Check: 8.96%
2025-10-30 22:40:40,565 [INFO   ]   [Filter 2] FAILED. Growth of 8.96% < 10.0% threshold.
2025-10-30 22:40:40,565 [INFO   ] 
--- Analyzing Valley at 2019-03-05 (index 544) ---
2025-10-30 22:40:40,566 [INFO   ]   [Filter 2] Valley at 2019-03-05: Slope Check (30d) = 0.1143
2025-10-30 22:40:40,567 [INFO   ]   [Filter 2] Valley at 2019-03-05: Slope Check (60d) = 0.1758
2025-10-30 22:40:40,567 [INFO   ]   [Filter 2] Valley at 2019-03-05: Slope Check (90d) = 0.0888
2025-10-30 22:40:40,568 [INFO   ]   [Filter 2] 30-Day Growth Check: 6.41%
2025-10-30 22:40:40,568 [INFO   ]   [Filter 2] FAILED. Growth of 6.41% < 10.0% threshold.
2025-10-30 22:40:40,568 [INFO   ] 
--- Analyzing Valley at 2019-05-09 (index 590) ---
2025-10-30 22:40:40,568 [INFO   ]   [Filter 2] Valley at 2019-05-09: Slope Check (30d) = -0.0410
2025-10-30 22:40:40,569 [INFO   ]   [Filter 2] Valley at 2019-05-09: Slope Check (60d) = 0.1077
2025-10-30 22:40:40,570 [INFO   ]   [Filter 2] Valley at 2019-05-09: Slope Check (90d) = 0.0325
2025-10-30 22:40:40,570 [INFO   ]   [Filter 2] 30-Day Growth Check: -2.07%
2025-10-30 22:40:40,570 [INFO   ]   [Filter 2] FAILED. Growth of -2.07% < 10.0% threshold.
2025-10-30 22:40:40,570 [INFO   ] 
--- Analyzing Valley at 2019-06-27 (index 624) ---
2025-10-30 22:40:40,571 [INFO   ]   [Filter 2] Valley at 2019-06-27: Slope Check (30d) = -0.0000
2025-10-30 22:40:40,571 [INFO   ]   [Filter 2] Valley at 2019-06-27: Slope Check (60d) = 0.0164
2025-10-30 22:40:40,572 [INFO   ]   [Filter 2] Valley at 2019-06-27: Slope Check (90d) = 0.1156
2025-10-30 22:40:40,572 [INFO   ]   [Filter 2] 30-Day Growth Check: 1.65%
2025-10-30 22:40:40,572 [INFO   ]   [Filter 2] FAILED. Growth of 1.65% < 10.0% threshold.
2025-10-30 22:40:40,572 [INFO   ] 
--- Analyzing Valley at 2019-09-11 (index 676) ---
2025-10-30 22:40:40,573 [INFO   ]   [Filter 2] Valley at 2019-09-11: Slope Check (30d) = 0.0630
2025-10-30 22:40:40,574 [INFO   ]   [Filter 2] Valley at 2019-09-11: Slope Check (60d) = 0.2860
2025-10-30 22:40:40,574 [INFO   ]   [Filter 2] Valley at 2019-09-11: Slope Check (90d) = 0.2706
2025-10-30 22:40:40,574 [INFO   ]   [Filter 2] 30-Day Growth Check: 7.34%
2025-10-30 22:40:40,575 [INFO   ]   [Filter 2] FAILED. Growth of 7.34% < 10.0% threshold.
2025-10-30 22:40:40,575 [INFO   ] 
--- Analyzing Valley at 2019-12-20 (index 747) ---
2025-10-30 22:40:40,575 [INFO   ]   [Filter 2] Valley at 2019-12-20: Slope Check (30d) = -0.1243
2025-10-30 22:40:40,576 [INFO   ]   [Filter 2] Valley at 2019-12-20: Slope Check (60d) = -0.5780
2025-10-30 22:40:40,577 [INFO   ]   [Filter 2] Valley at 2019-12-20: Slope Check (90d) = -0.6221
2025-10-30 22:40:40,577 [INFO   ]   [Filter 2] FAILED. No positive slope found.
2025-10-30 22:40:40,577 [INFO   ] 
--- Analyzing Valley at 2020-11-06 (index 969) ---
2025-10-30 22:40:40,578 [INFO   ]   [Filter 2] Valley at 2020-11-06: Slope Check (30d) = 0.2618
2025-10-30 22:40:40,578 [INFO   ]   [Filter 2] Valley at 2020-11-06: Slope Check (60d) = 0.3770
2025-10-30 22:40:40,579 [INFO   ]   [Filter 2] Valley at 2020-11-06: Slope Check (90d) = 0.4515
2025-10-30 22:40:40,579 [INFO   ]   [Filter 2] 30-Day Growth Check: 15.66%
2025-10-30 22:40:40,579 [INFO   ]   [Filter 2] PASSED. Growth of 15.66% >= 10.0% threshold.
2025-10-30 22:40:41,220 [INFO   ]     [Filter 3] DNA Test vs 'DOGE-USD_m30_ramp': Distance = 4.0083
2025-10-30 22:40:41,221 [INFO   ]     [Filter 3] DNA Test vs 'SSYS_m90_ramp': Distance = 7.0675
2025-10-30 22:40:41,223 [INFO   ]     [Filter 3] DNA Test vs 'SHIB-USD_m30_ramp': Distance = 5.2095
2025-10-30 22:40:41,224 [INFO   ]     [Filter 3] DNA Test vs 'CSCO_m90_ramp': Distance = 4.2339
2025-10-30 22:40:41,226 [INFO   ]     [Filter 3] DNA Test vs 'GME_m90_ramp': Distance = 4.4185
2025-10-30 22:40:41,227 [INFO   ]     [Filter 3] DNA Test vs 'IYR_m120_ramp': Distance = 4.8482
2025-10-30 22:40:41,228 [INFO   ]     [Filter 3] DNA Test vs 'VWAGY_m15_ramp': Distance = 6.9976
2025-10-30 22:40:41,230 [INFO   ]     [Filter 3] DNA Test vs 'AMC_m30_ramp': Distance = 5.2227
2025-10-30 22:40:41,230 [INFO   ]     [Filter 3] PASSED. Best Match: 'DOGE-USD_m30_ramp' (Distance: 4.0083) <= Loose Threshold (4.75)
2025-10-30 22:40:41,230 [INFO   ]     [Filter 3] PASSED. Best Match: 'DOGE-USD_m30_ramp' (Distance: 4.0083)
2025-10-30 22:40:41,230 [INFO   ] 
--- Analyzing Valley at 2021-02-08 (index 1031) ---
2025-10-30 22:40:41,231 [INFO   ]   [Filter 2] Valley at 2021-02-08: Slope Check (30d) = 0.4850
2025-10-30 22:40:41,232 [INFO   ]   [Filter 2] Valley at 2021-02-08: Slope Check (60d) = 0.1467
2025-10-30 22:40:41,232 [INFO   ]   [Filter 2] Valley at 2021-02-08: Slope Check (90d) = 0.1933
2025-10-30 22:40:41,233 [INFO   ]   [Filter 2] 30-Day Growth Check: 7.73%
2025-10-30 22:40:41,233 [INFO   ]   [Filter 2] FAILED. Growth of 7.73% < 10.0% threshold.
2025-10-30 22:40:41,233 [INFO   ] 
--- Analyzing Valley at 2021-05-24 (index 1104) ---
2025-10-30 22:40:41,234 [INFO   ]   [Filter 2] Valley at 2021-05-24: Slope Check (30d) = -0.4413
2025-10-30 22:40:41,234 [INFO   ]   [Filter 2] Valley at 2021-05-24: Slope Check (60d) = -0.1055
2025-10-30 22:40:41,235 [INFO   ]   [Filter 2] Valley at 2021-05-24: Slope Check (90d) = 0.0165
2025-10-30 22:40:41,235 [INFO   ]   [Filter 2] 30-Day Growth Check: -5.65%
2025-10-30 22:40:41,236 [INFO   ]   [Filter 2] FAILED. Growth of -5.65% < 10.0% threshold.
2025-10-30 22:40:41,236 [INFO   ] 
--- Analyzing Valley at 2021-10-06 (index 1198) ---
2025-10-30 22:40:41,236 [INFO   ]   [Filter 2] Valley at 2021-10-06: Slope Check (30d) = 0.0116
2025-10-30 22:40:41,237 [INFO   ]   [Filter 2] Valley at 2021-10-06: Slope Check (60d) = -0.2132
2025-10-30 22:40:41,238 [INFO   ]   [Filter 2] Valley at 2021-10-06: Slope Check (90d) = -0.1854
2025-10-30 22:40:41,238 [INFO   ]   [Filter 2] 30-Day Growth Check: -2.17%
2025-10-30 22:40:41,238 [INFO   ]   [Filter 2] FAILED. Growth of -2.17% < 10.0% threshold.
2025-10-30 22:40:41,238 [INFO   ] 
--- Analyzing Valley at 2021-12-02 (index 1238) ---
2025-10-30 22:40:41,239 [INFO   ]   [Filter 2] Valley at 2021-12-02: Slope Check (30d) = 0.2889
2025-10-30 22:40:41,239 [INFO   ]   [Filter 2] Valley at 2021-12-02: Slope Check (60d) = -0.1851
2025-10-30 22:40:41,240 [INFO   ]   [Filter 2] Valley at 2021-12-02: Slope Check (90d) = -0.3095
2025-10-30 22:40:41,240 [INFO   ]   [Filter 2] 30-Day Growth Check: 4.98%
2025-10-30 22:40:41,240 [INFO   ]   [Filter 2] FAILED. Growth of 4.98% < 10.0% threshold.
2025-10-30 22:40:41,240 [INFO   ] 
--- [Analysis Summary] ---
2025-10-30 22:40:41,240 [INFO   ] Total Valleys Found: 16
2025-10-30 22:40:41,240 [INFO   ] Valleys Passing Filter 2 (Qualification Test): 1
2025-10-30 22:40:41,241 [INFO   ] Valleys Passing Filter 3 (DNA Test): 1
2025-10-30 22:40:41,241 [INFO   ] --- [Historical Analyzer Finished] ---
