2025-10-30 22:39:14,967 [INFO   ] --- [Historical Analyzer Started for JPM] ---
2025-10-30 22:39:16,327 [INFO   ] Loaded 1510 data points for JPM.
2025-10-30 22:39:16,329 [INFO   ] Computing full CAC curve with m=10...
2025-10-30 22:39:37,147 [INFO   ] Found 18 significant valleys in the CAC curve.
2025-10-30 22:39:37,147 [INFO   ] 
--- Analyzing Valley at 2017-05-09 (index 87) ---
2025-10-30 22:39:37,149 [INFO   ]   [Filter 2] Valley at 2017-05-09: Slope Check (30d) = 0.0021
2025-10-30 22:39:37,150 [INFO   ]   [Filter 2] Valley at 2017-05-09: Slope Check (60d) = 0.1370
2025-10-30 22:39:37,150 [INFO   ]   [Filter 2] Valley at 2017-05-09: Slope Check (90d) = 0.0763
2025-10-30 22:39:37,151 [INFO   ]   [Filter 2] 30-Day Growth Check: 0.89%
2025-10-30 22:39:37,151 [INFO   ]   [Filter 2] FAILED. Growth of 0.89% < 10.0% threshold.
2025-10-30 22:39:37,151 [INFO   ] 
--- Analyzing Valley at 2017-05-30 (index 101) ---
2025-10-30 22:39:37,152 [INFO   ]   [Filter 2] Valley at 2017-05-30: Slope Check (30d) = 0.3242
2025-10-30 22:39:37,152 [INFO   ]   [Filter 2] Valley at 2017-05-30: Slope Check (60d) = 0.1352
2025-10-30 22:39:37,153 [INFO   ]   [Filter 2] Valley at 2017-05-30: Slope Check (90d) = 0.0810
2025-10-30 22:39:37,153 [INFO   ]   [Filter 2] 30-Day Growth Check: 11.25%
2025-10-30 22:39:37,153 [INFO   ]   [Filter 2] PASSED. Growth of 11.25% >= 10.0% threshold.
2025-10-30 22:39:37,782 [INFO   ]     [Filter 3] DNA Test vs 'DOGE-USD_m30_ramp': Distance = 4.5957
2025-10-30 22:39:37,784 [INFO   ]     [Filter 3] DNA Test vs 'SSYS_m90_ramp': Distance = 7.1862
2025-10-30 22:39:37,786 [INFO   ]     [Filter 3] DNA Test vs 'SHIB-USD_m30_ramp': Distance = 4.4424
2025-10-30 22:39:37,787 [INFO   ]     [Filter 3] DNA Test vs 'CSCO_m90_ramp': Distance = 2.6426
2025-10-30 22:39:37,789 [INFO   ]     [Filter 3] DNA Test vs 'GME_m90_ramp': Distance = 5.7955
2025-10-30 22:39:37,791 [INFO   ]     [Filter 3] DNA Test vs 'IYR_m120_ramp': Distance = 2.1492
2025-10-30 22:39:37,793 [INFO   ]     [Filter 3] DNA Test vs 'VWAGY_m15_ramp': Distance = 6.9027
2025-10-30 22:39:37,794 [INFO   ]     [Filter 3] DNA Test vs 'AMC_m30_ramp': Distance = 1.8819
2025-10-30 22:39:37,794 [INFO   ]     [Filter 3] PASSED. Best Match: 'AMC_m30_ramp' (Distance: 1.8819) <= Strict Threshold (2.75)
2025-10-30 22:39:37,794 [INFO   ]     [Filter 3] PASSED. Best Match: 'AMC_m30_ramp' (Distance: 1.8819)
2025-10-30 22:39:37,795 [INFO   ] 
--- Analyzing Valley at 2017-06-16 (index 114) ---
2025-10-30 22:39:37,796 [INFO   ]   [Filter 2] Valley at 2017-06-16: Slope Check (30d) = 0.1572
2025-10-30 22:39:37,796 [INFO   ]   [Filter 2] Valley at 2017-06-16: Slope Check (60d) = 0.0269
2025-10-30 22:39:37,797 [INFO   ]   [Filter 2] Valley at 2017-06-16: Slope Check (90d) = 0.0721
2025-10-30 22:39:37,797 [INFO   ]   [Filter 2] 30-Day Growth Check: 6.50%
2025-10-30 22:39:37,797 [INFO   ]   [Filter 2] FAILED. Growth of 6.50% < 10.0% threshold.
2025-10-30 22:39:37,797 [INFO   ] 
--- Analyzing Valley at 2018-05-15 (index 343) ---
2025-10-30 22:39:37,798 [INFO   ]   [Filter 2] Valley at 2018-05-15: Slope Check (30d) = -0.1767
2025-10-30 22:39:37,799 [INFO   ]   [Filter 2] Valley at 2018-05-15: Slope Check (60d) = 0.0754
2025-10-30 22:39:37,800 [INFO   ]   [Filter 2] Valley at 2018-05-15: Slope Check (90d) = 0.0852
2025-10-30 22:39:37,800 [INFO   ]   [Filter 2] 30-Day Growth Check: -7.23%
2025-10-30 22:39:37,800 [INFO   ]   [Filter 2] FAILED. Growth of -7.23% < 10.0% threshold.
2025-10-30 22:39:37,800 [INFO   ] 
--- Analyzing Valley at 2018-08-27 (index 415) ---
2025-10-30 22:39:37,801 [INFO   ]   [Filter 2] Valley at 2018-08-27: Slope Check (30d) = 0.0057
2025-10-30 22:39:37,801 [INFO   ]   [Filter 2] Valley at 2018-08-27: Slope Check (60d) = -0.1132
2025-10-30 22:39:37,802 [INFO   ]   [Filter 2] Valley at 2018-08-27: Slope Check (90d) = -0.1602
2025-10-30 22:39:37,802 [INFO   ]   [Filter 2] 30-Day Growth Check: -0.50%
2025-10-30 22:39:37,802 [INFO   ]   [Filter 2] FAILED. Growth of -0.50% < 10.0% threshold.
2025-10-30 22:39:37,803 [INFO   ] 
--- Analyzing Valley at 2018-10-09 (index 445) ---
2025-10-30 22:39:37,803 [INFO   ]   [Filter 2] Valley at 2018-10-09: Slope Check (30d) = 0.0485
2025-10-30 22:39:37,804 [INFO   ]   [Filter 2] Valley at 2018-10-09: Slope Check (60d) = -0.1757
2025-10-30 22:39:37,805 [INFO   ]   [Filter 2] Valley at 2018-10-09: Slope Check (90d) = -0.0714
2025-10-30 22:39:37,805 [INFO   ]   [Filter 2] 30-Day Growth Check: -3.22%
2025-10-30 22:39:37,805 [INFO   ]   [Filter 2] FAILED. Growth of -3.22% < 10.0% threshold.
2025-10-30 22:39:37,805 [INFO   ] 
--- Analyzing Valley at 2018-11-26 (index 478) ---
2025-10-30 22:39:37,806 [INFO   ]   [Filter 2] Valley at 2018-11-26: Slope Check (30d) = -0.3653
2025-10-30 22:39:37,807 [INFO   ]   [Filter 2] Valley at 2018-11-26: Slope Check (60d) = 0.0127
2025-10-30 22:39:37,807 [INFO   ]   [Filter 2] Valley at 2018-11-26: Slope Check (90d) = 0.0249
2025-10-30 22:39:37,808 [INFO   ]   [Filter 2] 30-Day Growth Check: -7.36%
2025-10-30 22:39:37,808 [INFO   ]   [Filter 2] FAILED. Growth of -7.36% < 10.0% threshold.
2025-10-30 22:39:37,808 [INFO   ] 
--- Analyzing Valley at 2019-01-16 (index 512) ---
2025-10-30 22:39:37,809 [INFO   ]   [Filter 2] Valley at 2019-01-16: Slope Check (30d) = 0.0593
2025-10-30 22:39:37,809 [INFO   ]   [Filter 2] Valley at 2019-01-16: Slope Check (60d) = 0.0171
2025-10-30 22:39:37,810 [INFO   ]   [Filter 2] Valley at 2019-01-16: Slope Check (90d) = 0.1185
2025-10-30 22:39:37,810 [INFO   ]   [Filter 2] 30-Day Growth Check: 1.81%
2025-10-30 22:39:37,810 [INFO   ]   [Filter 2] FAILED. Growth of 1.81% < 10.0% threshold.
2025-10-30 22:39:37,811 [INFO   ] 
--- Analyzing Valley at 2019-03-22 (index 557) ---
2025-10-30 22:39:37,811 [INFO   ]   [Filter 2] Valley at 2019-03-22: Slope Check (30d) = 0.5682
2025-10-30 22:39:37,812 [INFO   ]   [Filter 2] Valley at 2019-03-22: Slope Check (60d) = 0.0960
2025-10-30 22:39:37,813 [INFO   ]   [Filter 2] Valley at 2019-03-22: Slope Check (90d) = 0.0908
2025-10-30 22:39:37,813 [INFO   ]   [Filter 2] 30-Day Growth Check: 17.29%
2025-10-30 22:39:37,813 [INFO   ]   [Filter 2] PASSED. Growth of 17.29% >= 10.0% threshold.
2025-10-30 22:39:37,815 [INFO   ]     [Filter 3] DNA Test vs 'DOGE-USD_m30_ramp': Distance = 3.7032
2025-10-30 22:39:37,816 [INFO   ]     [Filter 3] DNA Test vs 'SSYS_m90_ramp': Distance = 7.4546
2025-10-30 22:39:37,818 [INFO   ]     [Filter 3] DNA Test vs 'SHIB-USD_m30_ramp': Distance = 3.0204
2025-10-30 22:39:37,819 [INFO   ]     [Filter 3] DNA Test vs 'CSCO_m90_ramp': Distance = 1.9243
2025-10-30 22:39:37,820 [INFO   ]     [Filter 3] DNA Test vs 'GME_m90_ramp': Distance = 4.5331
2025-10-30 22:39:37,822 [INFO   ]     [Filter 3] DNA Test vs 'IYR_m120_ramp': Distance = 2.1089
2025-10-30 22:39:37,824 [INFO   ]     [Filter 3] DNA Test vs 'VWAGY_m15_ramp': Distance = 6.4785
2025-10-30 22:39:37,825 [INFO   ]     [Filter 3] DNA Test vs 'AMC_m30_ramp': Distance = 2.6500
2025-10-30 22:39:37,825 [INFO   ]     [Filter 3] PASSED. Best Match: 'CSCO_m90_ramp' (Distance: 1.9243) <= Strict Threshold (2.75)
2025-10-30 22:39:37,825 [INFO   ]     [Filter 3] PASSED. Best Match: 'CSCO_m90_ramp' (Distance: 1.9243)
2025-10-30 22:39:37,825 [INFO   ] 
--- Analyzing Valley at 2019-05-31 (index 605) ---
2025-10-30 22:39:37,826 [INFO   ]   [Filter 2] Valley at 2019-05-31: Slope Check (30d) = 0.1923
2025-10-30 22:39:37,827 [INFO   ]   [Filter 2] Valley at 2019-05-31: Slope Check (60d) = 0.0160
2025-10-30 22:39:37,828 [INFO   ]   [Filter 2] Valley at 2019-05-31: Slope Check (90d) = 0.0648
2025-10-30 22:39:37,828 [INFO   ]   [Filter 2] 30-Day Growth Check: 9.59%
2025-10-30 22:39:37,828 [INFO   ]   [Filter 2] FAILED. Growth of 9.59% < 10.0% threshold.
2025-10-30 22:39:37,828 [INFO   ] 
--- Analyzing Valley at 2019-08-29 (index 668) ---
2025-10-30 22:39:37,829 [INFO   ]   [Filter 2] Valley at 2019-08-29: Slope Check (30d) = 0.0891
2025-10-30 22:39:37,830 [INFO   ]   [Filter 2] Valley at 2019-08-29: Slope Check (60d) = 0.3006
2025-10-30 22:39:37,831 [INFO   ]   [Filter 2] Valley at 2019-08-29: Slope Check (90d) = 0.2926
2025-10-30 22:39:37,832 [INFO   ]   [Filter 2] 30-Day Growth Check: 5.41%
2025-10-30 22:39:37,832 [INFO   ]   [Filter 2] FAILED. Growth of 5.41% < 10.0% threshold.
2025-10-30 22:39:37,832 [INFO   ] 
--- Analyzing Valley at 2019-10-16 (index 701) ---
2025-10-30 22:39:37,833 [INFO   ]   [Filter 2] Valley at 2019-10-16: Slope Check (30d) = 0.2896
2025-10-30 22:39:37,834 [INFO   ]   [Filter 2] Valley at 2019-10-16: Slope Check (60d) = 0.2531
2025-10-30 22:39:37,835 [INFO   ]   [Filter 2] Valley at 2019-10-16: Slope Check (90d) = 0.1328
2025-10-30 22:39:37,835 [INFO   ]   [Filter 2] 30-Day Growth Check: 10.02%
2025-10-30 22:39:37,835 [INFO   ]   [Filter 2] PASSED. Growth of 10.02% >= 10.0% threshold.
2025-10-30 22:39:37,837 [INFO   ]     [Filter 3] DNA Test vs 'DOGE-USD_m30_ramp': Distance = 3.8629
2025-10-30 22:39:37,839 [INFO   ]     [Filter 3] DNA Test vs 'SSYS_m90_ramp': Distance = 7.2615
2025-10-30 22:39:37,840 [INFO   ]     [Filter 3] DNA Test vs 'SHIB-USD_m30_ramp': Distance = 4.3817
2025-10-30 22:39:37,841 [INFO   ]     [Filter 3] DNA Test vs 'CSCO_m90_ramp': Distance = 2.3357
2025-10-30 22:39:37,843 [INFO   ]     [Filter 3] DNA Test vs 'GME_m90_ramp': Distance = 4.0206
2025-10-30 22:39:37,844 [INFO   ]     [Filter 3] DNA Test vs 'IYR_m120_ramp': Distance = 3.0902
2025-10-30 22:39:37,846 [INFO   ]     [Filter 3] DNA Test vs 'VWAGY_m15_ramp': Distance = 6.5419
2025-10-30 22:39:37,848 [INFO   ]     [Filter 3] DNA Test vs 'AMC_m30_ramp': Distance = 3.6771
2025-10-30 22:39:37,848 [INFO   ]     [Filter 3] PASSED. Best Match: 'CSCO_m90_ramp' (Distance: 2.3357) <= Strict Threshold (2.75)
2025-10-30 22:39:37,848 [INFO   ]     [Filter 3] PASSED. Best Match: 'CSCO_m90_ramp' (Distance: 2.3357)
2025-10-30 22:39:37,848 [INFO   ] 
--- Analyzing Valley at 2019-12-24 (index 749) ---
2025-10-30 22:39:37,849 [INFO   ]   [Filter 2] Valley at 2019-12-24: Slope Check (30d) = -0.1138
2025-10-30 22:39:37,850 [INFO   ]   [Filter 2] Valley at 2019-12-24: Slope Check (60d) = -0.6746
2025-10-30 22:39:37,851 [INFO   ]   [Filter 2] Valley at 2019-12-24: Slope Check (90d) = -0.6235
2025-10-30 22:39:37,851 [INFO   ]   [Filter 2] FAILED. No positive slope found.
2025-10-30 22:39:37,851 [INFO   ] 
--- Analyzing Valley at 2020-06-25 (index 875) ---
2025-10-30 22:39:37,852 [INFO   ]   [Filter 2] Valley at 2020-06-25: Slope Check (30d) = 0.1527
2025-10-30 22:39:37,853 [INFO   ]   [Filter 2] Valley at 2020-06-25: Slope Check (60d) = 0.1084
2025-10-30 22:39:37,854 [INFO   ]   [Filter 2] Valley at 2020-06-25: Slope Check (90d) = 0.0509
2025-10-30 22:39:37,854 [INFO   ]   [Filter 2] 30-Day Growth Check: 0.23%
2025-10-30 22:39:37,855 [INFO   ]   [Filter 2] FAILED. Growth of 0.23% < 10.0% threshold.
2025-10-30 22:39:37,855 [INFO   ] 
--- Analyzing Valley at 2020-11-06 (index 969) ---
2025-10-30 22:39:37,856 [INFO   ]   [Filter 2] Valley at 2020-11-06: Slope Check (30d) = 0.2618
2025-10-30 22:39:37,856 [INFO   ]   [Filter 2] Valley at 2020-11-06: Slope Check (60d) = 0.3770
2025-10-30 22:39:37,857 [INFO   ]   [Filter 2] Valley at 2020-11-06: Slope Check (90d) = 0.4515
2025-10-30 22:39:37,857 [INFO   ]   [Filter 2] 30-Day Growth Check: 15.66%
2025-10-30 22:39:37,857 [INFO   ]   [Filter 2] PASSED. Growth of 15.66% >= 10.0% threshold.
2025-10-30 22:39:37,859 [INFO   ]     [Filter 3] DNA Test vs 'DOGE-USD_m30_ramp': Distance = 4.0083
2025-10-30 22:39:37,860 [INFO   ]     [Filter 3] DNA Test vs 'SSYS_m90_ramp': Distance = 7.0675
2025-10-30 22:39:37,861 [INFO   ]     [Filter 3] DNA Test vs 'SHIB-USD_m30_ramp': Distance = 5.2095
2025-10-30 22:39:37,862 [INFO   ]     [Filter 3] DNA Test vs 'CSCO_m90_ramp': Distance = 4.2338
2025-10-30 22:39:37,864 [INFO   ]     [Filter 3] DNA Test vs 'GME_m90_ramp': Distance = 4.4185
2025-10-30 22:39:37,865 [INFO   ]     [Filter 3] DNA Test vs 'IYR_m120_ramp': Distance = 4.8482
2025-10-30 22:39:37,866 [INFO   ]     [Filter 3] DNA Test vs 'VWAGY_m15_ramp': Distance = 6.9975
2025-10-30 22:39:37,867 [INFO   ]     [Filter 3] DNA Test vs 'AMC_m30_ramp': Distance = 5.2227
2025-10-30 22:39:37,868 [INFO   ]     [Filter 3] PASSED. Best Match: 'DOGE-USD_m30_ramp' (Distance: 4.0083) <= Loose Threshold (4.75)
2025-10-30 22:39:37,868 [INFO   ]     [Filter 3] PASSED. Best Match: 'DOGE-USD_m30_ramp' (Distance: 4.0083)
2025-10-30 22:39:37,868 [INFO   ] 
--- Analyzing Valley at 2021-04-14 (index 1076) ---
2025-10-30 22:39:37,869 [INFO   ]   [Filter 2] Valley at 2021-04-14: Slope Check (30d) = 0.4717
2025-10-30 22:39:37,870 [INFO   ]   [Filter 2] Valley at 2021-04-14: Slope Check (60d) = 0.0307
2025-10-30 22:39:37,870 [INFO   ]   [Filter 2] Valley at 2021-04-14: Slope Check (90d) = -0.0093
2025-10-30 22:39:37,871 [INFO   ]   [Filter 2] 30-Day Growth Check: 7.04%
2025-10-30 22:39:37,871 [INFO   ]   [Filter 2] FAILED. Growth of 7.04% < 10.0% threshold.
2025-10-30 22:39:37,871 [INFO   ] 
--- Analyzing Valley at 2022-01-06 (index 1262) ---
2025-10-30 22:39:37,872 [INFO   ]   [Filter 2] Valley at 2022-01-06: Slope Check (30d) = -0.3396
2025-10-30 22:39:37,872 [INFO   ]   [Filter 2] Valley at 2022-01-06: Slope Check (60d) = -0.4125
2025-10-30 22:39:37,873 [INFO   ]   [Filter 2] Valley at 2022-01-06: Slope Check (90d) = -0.4055
2025-10-30 22:39:37,873 [INFO   ]   [Filter 2] FAILED. No positive slope found.
2025-10-30 22:39:37,873 [INFO   ] 
--- Analyzing Valley at 2022-03-25 (index 1316) ---
2025-10-30 22:39:37,874 [INFO   ]   [Filter 2] Valley at 2022-03-25: Slope Check (30d) = -0.5734
2025-10-30 22:39:37,875 [INFO   ]   [Filter 2] Valley at 2022-03-25: Slope Check (60d) = -0.2434
2025-10-30 22:39:37,875 [INFO   ]   [Filter 2] Valley at 2022-03-25: Slope Check (90d) = -0.2268
2025-10-30 22:39:37,876 [INFO   ]   [Filter 2] FAILED. No positive slope found.
2025-10-30 22:39:37,876 [INFO   ] 
--- [Analysis Summary] ---
2025-10-30 22:39:37,876 [INFO   ] Total Valleys Found: 18
2025-10-30 22:39:37,876 [INFO   ] Valleys Passing Filter 2 (Qualification Test): 4
2025-10-30 22:39:37,876 [INFO   ] Valleys Passing Filter 3 (DNA Test): 4
2025-10-30 22:39:37,876 [INFO   ] --- [Historical Analyzer Finished] ---
