2025-10-30 22:23:08,373 [INFO   ] --- [Historical Analyzer Started for AAPL] ---
2025-10-30 22:23:09,347 [INFO   ] Loaded 1510 data points for AAPL.
2025-10-30 22:23:09,348 [INFO   ] Computing full CAC curve with m=15...
2025-10-30 22:23:30,273 [INFO   ] Found 13 significant valleys in the CAC curve.
2025-10-30 22:23:30,273 [INFO   ] 
--- Analyzing Valley at 2020-07-01 (index 879) ---
2025-10-30 22:23:30,274 [INFO   ]   [Filter 2] Valley at 2020-07-01: Slope Check (30d) = 0.6864
2025-10-30 22:23:30,275 [INFO   ]   [Filter 2] Valley at 2020-07-01: Slope Check (60d) = 0.4797
2025-10-30 22:23:30,276 [INFO   ]   [Filter 2] Valley at 2020-07-01: Slope Check (90d) = 0.2407
2025-10-30 22:23:30,276 [INFO   ]   [Filter 2] 30-Day Growth Check: 24.37%
2025-10-30 22:23:30,276 [INFO   ]   [Filter 2] PASSED. Growth of 24.37% >= 10.0% threshold.
2025-10-30 22:23:30,891 [INFO   ]     [Filter 3] DNA Test vs 'DOGE-USD_m30_ramp': Distance = 5.4781
2025-10-30 22:23:30,893 [INFO   ]     [Filter 3] DNA Test vs 'SSYS_m90_ramp': Distance = 7.0633
2025-10-30 22:23:30,894 [INFO   ]     [Filter 3] DNA Test vs 'SHIB-USD_m30_ramp': Distance = 5.1343
2025-10-30 22:23:30,896 [INFO   ]     [Filter 3] DNA Test vs 'CSCO_m90_ramp': Distance = 3.7852
2025-10-30 22:23:30,897 [INFO   ]     [Filter 3] DNA Test vs 'GME_m90_ramp': Distance = 7.2234
2025-10-30 22:23:30,898 [INFO   ]     [Filter 3] DNA Test vs 'IYR_m120_ramp': Distance = 3.3127
2025-10-30 22:23:30,899 [INFO   ]     [Filter 3] DNA Test vs 'VWAGY_m15_ramp': Distance = 6.8403
2025-10-30 22:23:30,901 [INFO   ]     [Filter 3] DNA Test vs 'AMC_m30_ramp': Distance = 3.0027
2025-10-30 22:23:30,901 [INFO   ]     [Filter 3] PASSED. Best Match: 'AMC_m30_ramp' (Distance: 3.0027) <= Loose Threshold (4.75)
2025-10-30 22:23:30,901 [INFO   ]     [Filter 3] PASSED. Best Match: 'AMC_m30_ramp' (Distance: 3.0027)
2025-10-30 22:23:30,901 [INFO   ] 
--- Analyzing Valley at 2020-08-17 (index 911) ---
2025-10-30 22:23:30,902 [INFO   ]   [Filter 2] Valley at 2020-08-17: Slope Check (30d) = -0.4956
2025-10-30 22:23:30,903 [INFO   ]   [Filter 2] Valley at 2020-08-17: Slope Check (60d) = -0.1140
2025-10-30 22:23:30,904 [INFO   ]   [Filter 2] Valley at 2020-08-17: Slope Check (90d) = 0.0525
2025-10-30 22:23:30,904 [INFO   ]   [Filter 2] 30-Day Growth Check: 0.31%
2025-10-30 22:23:30,904 [INFO   ]   [Filter 2] FAILED. Growth of 0.31% < 10.0% threshold.
2025-10-30 22:23:30,904 [INFO   ] 
--- Analyzing Valley at 2021-02-10 (index 1033) ---
2025-10-30 22:23:30,905 [INFO   ]   [Filter 2] Valley at 2021-02-10: Slope Check (30d) = -0.4301
2025-10-30 22:23:30,906 [INFO   ]   [Filter 2] Valley at 2021-02-10: Slope Check (60d) = 0.1099
2025-10-30 22:23:30,906 [INFO   ]   [Filter 2] Valley at 2021-02-10: Slope Check (90d) = 0.0316
2025-10-30 22:23:30,907 [INFO   ]   [Filter 2] 30-Day Growth Check: -11.30%
2025-10-30 22:23:30,907 [INFO   ]   [Filter 2] FAILED. Growth of -11.30% < 10.0% threshold.
2025-10-30 22:23:30,907 [INFO   ] 
--- Analyzing Valley at 2021-04-23 (index 1083) ---
2025-10-30 22:23:30,908 [INFO   ]   [Filter 2] Valley at 2021-04-23: Slope Check (30d) = -0.3169
2025-10-30 22:23:30,908 [INFO   ]   [Filter 2] Valley at 2021-04-23: Slope Check (60d) = 0.2658
2025-10-30 22:23:30,909 [INFO   ]   [Filter 2] Valley at 2021-04-23: Slope Check (90d) = 0.3102
2025-10-30 22:23:30,909 [INFO   ]   [Filter 2] 30-Day Growth Check: -6.12%
2025-10-30 22:23:30,909 [INFO   ]   [Filter 2] FAILED. Growth of -6.12% < 10.0% threshold.
2025-10-30 22:23:30,910 [INFO   ] 
--- Analyzing Valley at 2021-07-06 (index 1133) ---
2025-10-30 22:23:30,910 [INFO   ]   [Filter 2] Valley at 2021-07-06: Slope Check (30d) = 0.1261
2025-10-30 22:23:30,911 [INFO   ]   [Filter 2] Valley at 2021-07-06: Slope Check (60d) = 0.0653
2025-10-30 22:23:30,911 [INFO   ]   [Filter 2] Valley at 2021-07-06: Slope Check (90d) = 0.0191
2025-10-30 22:23:30,912 [INFO   ]   [Filter 2] 30-Day Growth Check: 6.57%
2025-10-30 22:23:30,912 [INFO   ]   [Filter 2] FAILED. Growth of 6.57% < 10.0% threshold.
2025-10-30 22:23:30,912 [INFO   ] 
--- Analyzing Valley at 2021-08-17 (index 1163) ---
2025-10-30 22:23:30,913 [INFO   ]   [Filter 2] Valley at 2021-08-17: Slope Check (30d) = -0.1585
2025-10-30 22:23:30,913 [INFO   ]   [Filter 2] Valley at 2021-08-17: Slope Check (60d) = -0.0291
2025-10-30 22:23:30,914 [INFO   ]   [Filter 2] Valley at 2021-08-17: Slope Check (90d) = 0.2729
2025-10-30 22:23:30,914 [INFO   ]   [Filter 2] 30-Day Growth Check: -5.51%
2025-10-30 22:23:30,914 [INFO   ]   [Filter 2] FAILED. Growth of -5.51% < 10.0% threshold.
2025-10-30 22:23:30,915 [INFO   ] 
--- Analyzing Valley at 2021-10-11 (index 1201) ---
2025-10-30 22:23:30,915 [INFO   ]   [Filter 2] Valley at 2021-10-11: Slope Check (30d) = 0.3700
2025-10-30 22:23:30,916 [INFO   ]   [Filter 2] Valley at 2021-10-11: Slope Check (60d) = 0.6858
2025-10-30 22:23:30,917 [INFO   ]   [Filter 2] Valley at 2021-10-11: Slope Check (90d) = 0.3503
2025-10-30 22:23:30,917 [INFO   ]   [Filter 2] 30-Day Growth Check: 12.59%
2025-10-30 22:23:30,917 [INFO   ]   [Filter 2] PASSED. Growth of 12.59% >= 10.0% threshold.
2025-10-30 22:23:30,918 [INFO   ]     [Filter 3] DNA Test vs 'DOGE-USD_m30_ramp': Distance = 5.0959
2025-10-30 22:23:30,919 [INFO   ]     [Filter 3] DNA Test vs 'SSYS_m90_ramp': Distance = 7.0888
2025-10-30 22:23:30,921 [INFO   ]     [Filter 3] DNA Test vs 'SHIB-USD_m30_ramp': Distance = 5.5682
2025-10-30 22:23:30,922 [INFO   ]     [Filter 3] DNA Test vs 'CSCO_m90_ramp': Distance = 4.1373
2025-10-30 22:23:30,923 [INFO   ]     [Filter 3] DNA Test vs 'GME_m90_ramp': Distance = 4.5243
2025-10-30 22:23:30,924 [INFO   ]     [Filter 3] DNA Test vs 'IYR_m120_ramp': Distance = 3.8614
2025-10-30 22:23:30,927 [INFO   ]     [Filter 3] DNA Test vs 'VWAGY_m15_ramp': Distance = 5.0936
2025-10-30 22:23:30,928 [INFO   ]     [Filter 3] DNA Test vs 'AMC_m30_ramp': Distance = 4.8905
2025-10-30 22:23:30,928 [INFO   ]     [Filter 3] PASSED. Best Match: 'IYR_m120_ramp' (Distance: 3.8614) <= Loose Threshold (4.75)
2025-10-30 22:23:30,928 [INFO   ]     [Filter 3] PASSED. Best Match: 'IYR_m120_ramp' (Distance: 3.8614)
2025-10-30 22:23:30,928 [INFO   ] 
--- Analyzing Valley at 2021-11-29 (index 1235) ---
2025-10-30 22:23:30,929 [INFO   ]   [Filter 2] Valley at 2021-11-29: Slope Check (30d) = 0.4178
2025-10-30 22:23:30,930 [INFO   ]   [Filter 2] Valley at 2021-11-29: Slope Check (60d) = -0.0426
2025-10-30 22:23:30,930 [INFO   ]   [Filter 2] Valley at 2021-11-29: Slope Check (90d) = -0.0578
2025-10-30 22:23:30,931 [INFO   ]   [Filter 2] 30-Day Growth Check: 7.46%
2025-10-30 22:23:30,931 [INFO   ]   [Filter 2] FAILED. Growth of 7.46% < 10.0% threshold.
2025-10-30 22:23:30,931 [INFO   ] 
--- Analyzing Valley at 2022-01-21 (index 1272) ---
2025-10-30 22:23:30,931 [INFO   ]   [Filter 2] Valley at 2022-01-21: Slope Check (30d) = -0.0517
2025-10-30 22:23:30,932 [INFO   ]   [Filter 2] Valley at 2022-01-21: Slope Check (60d) = 0.0479
2025-10-30 22:23:30,933 [INFO   ]   [Filter 2] Valley at 2022-01-21: Slope Check (90d) = -0.2347
2025-10-30 22:23:30,933 [INFO   ]   [Filter 2] 30-Day Growth Check: 0.60%
2025-10-30 22:23:30,933 [INFO   ]   [Filter 2] FAILED. Growth of 0.60% < 10.0% threshold.
2025-10-30 22:23:30,933 [INFO   ] 
--- Analyzing Valley at 2022-04-07 (index 1325) ---
2025-10-30 22:23:30,934 [INFO   ]   [Filter 2] Valley at 2022-04-07: Slope Check (30d) = -0.9647
2025-10-30 22:23:30,935 [INFO   ]   [Filter 2] Valley at 2022-04-07: Slope Check (60d) = -0.5877
2025-10-30 22:23:30,936 [INFO   ]   [Filter 2] Valley at 2022-04-07: Slope Check (90d) = -0.0207
2025-10-30 22:23:30,936 [INFO   ]   [Filter 2] FAILED. No positive slope found.
2025-10-30 22:23:30,936 [INFO   ] 
--- Analyzing Valley at 2022-05-13 (index 1350) ---
2025-10-30 22:23:30,936 [INFO   ]   [Filter 2] Valley at 2022-05-13: Slope Check (30d) = -0.3286
2025-10-30 22:23:30,937 [INFO   ]   [Filter 2] Valley at 2022-05-13: Slope Check (60d) = 0.3381
2025-10-30 22:23:30,938 [INFO   ]   [Filter 2] Valley at 2022-05-13: Slope Check (90d) = 0.3009
2025-10-30 22:23:30,938 [INFO   ]   [Filter 2] 30-Day Growth Check: -3.70%
2025-10-30 22:23:30,938 [INFO   ]   [Filter 2] FAILED. Growth of -3.70% < 10.0% threshold.
2025-10-30 22:23:30,938 [INFO   ] 
--- Analyzing Valley at 2022-07-07 (index 1386) ---
2025-10-30 22:23:30,939 [INFO   ]   [Filter 2] Valley at 2022-07-07: Slope Check (30d) = 1.0526
2025-10-30 22:23:30,940 [INFO   ]   [Filter 2] Valley at 2022-07-07: Slope Check (60d) = 0.0307
2025-10-30 22:23:30,940 [INFO   ]   [Filter 2] Valley at 2022-07-07: Slope Check (90d) = -0.1933
2025-10-30 22:23:30,941 [INFO   ]   [Filter 2] 30-Day Growth Check: 19.43%
2025-10-30 22:23:30,941 [INFO   ]   [Filter 2] PASSED. Growth of 19.43% >= 10.0% threshold.
2025-10-30 22:23:30,942 [INFO   ]     [Filter 3] DNA Test vs 'DOGE-USD_m30_ramp': Distance = 4.2482
2025-10-30 22:23:30,944 [INFO   ]     [Filter 3] DNA Test vs 'SSYS_m90_ramp': Distance = 7.6806
2025-10-30 22:23:30,945 [INFO   ]     [Filter 3] DNA Test vs 'SHIB-USD_m30_ramp': Distance = 3.4175
2025-10-30 22:23:30,946 [INFO   ]     [Filter 3] DNA Test vs 'CSCO_m90_ramp': Distance = 2.4296
2025-10-30 22:23:30,947 [INFO   ]     [Filter 3] DNA Test vs 'GME_m90_ramp': Distance = 4.9060
2025-10-30 22:23:30,949 [INFO   ]     [Filter 3] DNA Test vs 'IYR_m120_ramp': Distance = 1.4741
2025-10-30 22:23:30,950 [INFO   ]     [Filter 3] DNA Test vs 'VWAGY_m15_ramp': Distance = 6.2540
2025-10-30 22:23:30,951 [INFO   ]     [Filter 3] DNA Test vs 'AMC_m30_ramp': Distance = 2.3708
2025-10-30 22:23:30,951 [INFO   ]     [Filter 3] PASSED. Best Match: 'IYR_m120_ramp' (Distance: 1.4741) <= Strict Threshold (2.75)
2025-10-30 22:23:30,951 [INFO   ]     [Filter 3] PASSED. Best Match: 'IYR_m120_ramp' (Distance: 1.4741)
2025-10-30 22:23:30,952 [INFO   ] 
--- Analyzing Valley at 2022-08-22 (index 1418) ---
2025-10-30 22:23:30,953 [INFO   ]   [Filter 2] Valley at 2022-08-22: Slope Check (30d) = -0.7384
2025-10-30 22:23:30,953 [INFO   ]   [Filter 2] Valley at 2022-08-22: Slope Check (60d) = -0.3552
2025-10-30 22:23:30,954 [INFO   ]   [Filter 2] Valley at 2022-08-22: Slope Check (90d) = -0.2436
2025-10-30 22:23:30,954 [INFO   ]   [Filter 2] FAILED. No positive slope found.
2025-10-30 22:23:30,954 [INFO   ] 
--- [Analysis Summary] ---
2025-10-30 22:23:30,954 [INFO   ] Total Valleys Found: 13
2025-10-30 22:23:30,954 [INFO   ] Valleys Passing Filter 2 (Qualification Test): 3
2025-10-30 22:23:30,954 [INFO   ] Valleys Passing Filter 3 (DNA Test): 3
2025-10-30 22:23:30,954 [INFO   ] --- [Historical Analyzer Finished] ---
