2025-10-30 22:31:54,811 [INFO   ] --- [Historical Analyzer Started for CAT] ---
2025-10-30 22:31:56,036 [INFO   ] Loaded 1510 data points for CAT.
2025-10-30 22:31:56,038 [INFO   ] Computing full CAC curve with m=30...
2025-10-30 22:32:17,535 [INFO   ] Found 11 significant valleys in the CAC curve.
2025-10-30 22:32:17,535 [INFO   ] 
--- Analyzing Valley at 2017-08-08 (index 150) ---
2025-10-30 22:32:17,537 [INFO   ]   [Filter 2] Valley at 2017-08-08: Slope Check (30d) = 0.2796
2025-10-30 22:32:17,537 [INFO   ]   [Filter 2] Valley at 2017-08-08: Slope Check (60d) = 0.3585
2025-10-30 22:32:17,538 [INFO   ]   [Filter 2] Valley at 2017-08-08: Slope Check (90d) = 0.3200
2025-10-30 22:32:17,539 [INFO   ]   [Filter 2] 30-Day Growth Check: 9.03%
2025-10-30 22:32:17,539 [INFO   ]   [Filter 2] FAILED. Growth of 9.03% < 10.0% threshold.
2025-10-30 22:32:17,539 [INFO   ] 
--- Analyzing Valley at 2017-09-27 (index 185) ---
2025-10-30 22:32:17,540 [INFO   ]   [Filter 2] Valley at 2017-09-27: Slope Check (30d) = 0.4757
2025-10-30 22:32:17,541 [INFO   ]   [Filter 2] Valley at 2017-09-27: Slope Check (60d) = 0.3206
2025-10-30 22:32:17,541 [INFO   ]   [Filter 2] Valley at 2017-09-27: Slope Check (90d) = 0.4456
2025-10-30 22:32:17,541 [INFO   ]   [Filter 2] 30-Day Growth Check: 12.14%
2025-10-30 22:32:17,542 [INFO   ]   [Filter 2] PASSED. Growth of 12.14% >= 10.0% threshold.
2025-10-30 22:32:18,161 [INFO   ]     [Filter 3] DNA Test vs 'DOGE-USD_m30_ramp': Distance = 3.5451
2025-10-30 22:32:18,163 [INFO   ]     [Filter 3] DNA Test vs 'SSYS_m90_ramp': Distance = 7.5122
2025-10-30 22:32:18,164 [INFO   ]     [Filter 3] DNA Test vs 'SHIB-USD_m30_ramp': Distance = 2.9732
2025-10-30 22:32:18,165 [INFO   ]     [Filter 3] DNA Test vs 'CSCO_m90_ramp': Distance = 2.1495
2025-10-30 22:32:18,167 [INFO   ]     [Filter 3] DNA Test vs 'GME_m90_ramp': Distance = 4.7569
2025-10-30 22:32:18,168 [INFO   ]     [Filter 3] DNA Test vs 'IYR_m120_ramp': Distance = 1.7066
2025-10-30 22:32:18,169 [INFO   ]     [Filter 3] DNA Test vs 'VWAGY_m15_ramp': Distance = 6.1575
2025-10-30 22:32:18,170 [INFO   ]     [Filter 3] DNA Test vs 'AMC_m30_ramp': Distance = 2.5091
2025-10-30 22:32:18,170 [INFO   ]     [Filter 3] PASSED. Best Match: 'IYR_m120_ramp' (Distance: 1.7066) <= Strict Threshold (2.75)
2025-10-30 22:32:18,170 [INFO   ]     [Filter 3] PASSED. Best Match: 'IYR_m120_ramp' (Distance: 1.7066)
2025-10-30 22:32:18,171 [INFO   ] 
--- Analyzing Valley at 2017-11-21 (index 224) ---
2025-10-30 22:32:18,171 [INFO   ]   [Filter 2] Valley at 2017-11-21: Slope Check (30d) = 0.7177
2025-10-30 22:32:18,172 [INFO   ]   [Filter 2] Valley at 2017-11-21: Slope Check (60d) = 0.3566
2025-10-30 22:32:18,173 [INFO   ]   [Filter 2] Valley at 2017-11-21: Slope Check (90d) = 0.0719
2025-10-30 22:32:18,173 [INFO   ]   [Filter 2] 30-Day Growth Check: 15.87%
2025-10-30 22:32:18,173 [INFO   ]   [Filter 2] PASSED. Growth of 15.87% >= 10.0% threshold.
2025-10-30 22:32:18,175 [INFO   ]     [Filter 3] DNA Test vs 'DOGE-USD_m30_ramp': Distance = 4.1448
2025-10-30 22:32:18,176 [INFO   ]     [Filter 3] DNA Test vs 'SSYS_m90_ramp': Distance = 7.5921
2025-10-30 22:32:18,177 [INFO   ]     [Filter 3] DNA Test vs 'SHIB-USD_m30_ramp': Distance = 3.0977
2025-10-30 22:32:18,179 [INFO   ]     [Filter 3] DNA Test vs 'CSCO_m90_ramp': Distance = 2.2678
2025-10-30 22:32:18,180 [INFO   ]     [Filter 3] DNA Test vs 'GME_m90_ramp': Distance = 5.4582
2025-10-30 22:32:18,181 [INFO   ]     [Filter 3] DNA Test vs 'IYR_m120_ramp': Distance = 1.5864
2025-10-30 22:32:18,185 [INFO   ]     [Filter 3] DNA Test vs 'VWAGY_m15_ramp': Distance = 6.3911
2025-10-30 22:32:18,187 [INFO   ]     [Filter 3] DNA Test vs 'AMC_m30_ramp': Distance = 2.1761
2025-10-30 22:32:18,187 [INFO   ]     [Filter 3] PASSED. Best Match: 'IYR_m120_ramp' (Distance: 1.5864) <= Strict Threshold (2.75)
2025-10-30 22:32:18,187 [INFO   ]     [Filter 3] PASSED. Best Match: 'IYR_m120_ramp' (Distance: 1.5864)
2025-10-30 22:32:18,188 [INFO   ] 
--- Analyzing Valley at 2018-04-05 (index 315) ---
2025-10-30 22:32:18,189 [INFO   ]   [Filter 2] Valley at 2018-04-05: Slope Check (30d) = 0.1431
2025-10-30 22:32:18,190 [INFO   ]   [Filter 2] Valley at 2018-04-05: Slope Check (60d) = -0.0304
2025-10-30 22:32:18,191 [INFO   ]   [Filter 2] Valley at 2018-04-05: Slope Check (90d) = -0.1353
2025-10-30 22:32:18,191 [INFO   ]   [Filter 2] 30-Day Growth Check: 4.35%
2025-10-30 22:32:18,192 [INFO   ]   [Filter 2] FAILED. Growth of 4.35% < 10.0% threshold.
2025-10-30 22:32:18,192 [INFO   ] 
--- Analyzing Valley at 2018-09-11 (index 425) ---
2025-10-30 22:32:18,193 [INFO   ]   [Filter 2] Valley at 2018-09-11: Slope Check (30d) = -0.3401
2025-10-30 22:32:18,194 [INFO   ]   [Filter 2] Valley at 2018-09-11: Slope Check (60d) = -0.4515
2025-10-30 22:32:18,194 [INFO   ]   [Filter 2] Valley at 2018-09-11: Slope Check (90d) = -0.2391
2025-10-30 22:32:18,195 [INFO   ]   [Filter 2] FAILED. No positive slope found.
2025-10-30 22:32:18,195 [INFO   ] 
--- Analyzing Valley at 2020-03-27 (index 813) ---
2025-10-30 22:32:18,196 [INFO   ]   [Filter 2] Valley at 2020-03-27: Slope Check (30d) = -0.1238
2025-10-30 22:32:18,196 [INFO   ]   [Filter 2] Valley at 2020-03-27: Slope Check (60d) = 0.2448
2025-10-30 22:32:18,197 [INFO   ]   [Filter 2] Valley at 2020-03-27: Slope Check (90d) = 0.2889
2025-10-30 22:32:18,197 [INFO   ]   [Filter 2] 30-Day Growth Check: 7.30%
2025-10-30 22:32:18,197 [INFO   ]   [Filter 2] FAILED. Growth of 7.30% < 10.0% threshold.
2025-10-30 22:32:18,198 [INFO   ] 
--- Analyzing Valley at 2020-07-21 (index 892) ---
2025-10-30 22:32:18,198 [INFO   ]   [Filter 2] Valley at 2020-07-21: Slope Check (30d) = 0.2008
2025-10-30 22:32:18,199 [INFO   ]   [Filter 2] Valley at 2020-07-21: Slope Check (60d) = 0.3337
2025-10-30 22:32:18,200 [INFO   ]   [Filter 2] Valley at 2020-07-21: Slope Check (90d) = 0.4186
2025-10-30 22:32:18,200 [INFO   ]   [Filter 2] 30-Day Growth Check: 4.74%
2025-10-30 22:32:18,200 [INFO   ]   [Filter 2] FAILED. Growth of 4.74% < 10.0% threshold.
2025-10-30 22:32:18,200 [INFO   ] 
--- Analyzing Valley at 2020-09-29 (index 941) ---
2025-10-30 22:32:18,201 [INFO   ]   [Filter 2] Valley at 2020-09-29: Slope Check (30d) = 0.4410
2025-10-30 22:32:18,201 [INFO   ]   [Filter 2] Valley at 2020-09-29: Slope Check (60d) = 0.4715
2025-10-30 22:32:18,202 [INFO   ]   [Filter 2] Valley at 2020-09-29: Slope Check (90d) = 0.4360
2025-10-30 22:32:18,203 [INFO   ]   [Filter 2] 30-Day Growth Check: 16.59%
2025-10-30 22:32:18,203 [INFO   ]   [Filter 2] PASSED. Growth of 16.59% >= 10.0% threshold.
2025-10-30 22:32:18,205 [INFO   ]     [Filter 3] DNA Test vs 'DOGE-USD_m30_ramp': Distance = 5.5011
2025-10-30 22:32:18,207 [INFO   ]     [Filter 3] DNA Test vs 'SSYS_m90_ramp': Distance = 7.2707
2025-10-30 22:32:18,208 [INFO   ]     [Filter 3] DNA Test vs 'SHIB-USD_m30_ramp': Distance = 6.4639
2025-10-30 22:32:18,209 [INFO   ]     [Filter 3] DNA Test vs 'CSCO_m90_ramp': Distance = 5.0496
2025-10-30 22:32:18,211 [INFO   ]     [Filter 3] DNA Test vs 'GME_m90_ramp': Distance = 3.6287
2025-10-30 22:32:18,212 [INFO   ]     [Filter 3] DNA Test vs 'IYR_m120_ramp': Distance = 5.3237
2025-10-30 22:32:18,215 [INFO   ]     [Filter 3] DNA Test vs 'VWAGY_m15_ramp': Distance = 6.6931
2025-10-30 22:32:18,217 [INFO   ]     [Filter 3] DNA Test vs 'AMC_m30_ramp': Distance = 5.7593
2025-10-30 22:32:18,217 [INFO   ]     [Filter 3] PASSED. Best Match: 'GME_m90_ramp' (Distance: 3.6287) <= Loose Threshold (4.75)
2025-10-30 22:32:18,217 [INFO   ]     [Filter 3] PASSED. Best Match: 'GME_m90_ramp' (Distance: 3.6287)
2025-10-30 22:32:18,217 [INFO   ] 
--- Analyzing Valley at 2021-02-08 (index 1031) ---
2025-10-30 22:32:18,218 [INFO   ]   [Filter 2] Valley at 2021-02-08: Slope Check (30d) = 1.0542
2025-10-30 22:32:18,219 [INFO   ]   [Filter 2] Valley at 2021-02-08: Slope Check (60d) = 0.4861
2025-10-30 22:32:18,220 [INFO   ]   [Filter 2] Valley at 2021-02-08: Slope Check (90d) = 0.3268
2025-10-30 22:32:18,220 [INFO   ]   [Filter 2] 30-Day Growth Check: 14.47%
2025-10-30 22:32:18,221 [INFO   ]   [Filter 2] PASSED. Growth of 14.47% >= 10.0% threshold.
2025-10-30 22:32:18,222 [INFO   ]     [Filter 3] DNA Test vs 'DOGE-USD_m30_ramp': Distance = 3.7095
2025-10-30 22:32:18,224 [INFO   ]     [Filter 3] DNA Test vs 'SSYS_m90_ramp': Distance = 6.7044
2025-10-30 22:32:18,225 [INFO   ]     [Filter 3] DNA Test vs 'SHIB-USD_m30_ramp': Distance = 4.6196
2025-10-30 22:32:18,226 [INFO   ]     [Filter 3] DNA Test vs 'CSCO_m90_ramp': Distance = 2.4874
2025-10-30 22:32:18,228 [INFO   ]     [Filter 3] DNA Test vs 'GME_m90_ramp': Distance = 4.9132
2025-10-30 22:32:18,229 [INFO   ]     [Filter 3] DNA Test vs 'IYR_m120_ramp': Distance = 2.7636
2025-10-30 22:32:18,230 [INFO   ]     [Filter 3] DNA Test vs 'VWAGY_m15_ramp': Distance = 7.2402
2025-10-30 22:32:18,232 [INFO   ]     [Filter 3] DNA Test vs 'AMC_m30_ramp': Distance = 2.2254
2025-10-30 22:32:18,232 [INFO   ]     [Filter 3] PASSED. Best Match: 'AMC_m30_ramp' (Distance: 2.2254) <= Strict Threshold (2.75)
2025-10-30 22:32:18,232 [INFO   ]     [Filter 3] PASSED. Best Match: 'AMC_m30_ramp' (Distance: 2.2254)
2025-10-30 22:32:18,232 [INFO   ] 
--- Analyzing Valley at 2021-06-09 (index 1115) ---
2025-10-30 22:32:18,233 [INFO   ]   [Filter 2] Valley at 2021-06-09: Slope Check (30d) = -0.3650
2025-10-30 22:32:18,234 [INFO   ]   [Filter 2] Valley at 2021-06-09: Slope Check (60d) = -0.1127
2025-10-30 22:32:18,235 [INFO   ]   [Filter 2] Valley at 2021-06-09: Slope Check (90d) = -0.2503
2025-10-30 22:32:18,235 [INFO   ]   [Filter 2] FAILED. No positive slope found.
2025-10-30 22:32:18,235 [INFO   ] 
--- Analyzing Valley at 2021-12-27 (index 1254) ---
2025-10-30 22:32:18,236 [INFO   ]   [Filter 2] Valley at 2021-12-27: Slope Check (30d) = -0.2637
2025-10-30 22:32:18,236 [INFO   ]   [Filter 2] Valley at 2021-12-27: Slope Check (60d) = -0.1550
2025-10-30 22:32:18,237 [INFO   ]   [Filter 2] Valley at 2021-12-27: Slope Check (90d) = 0.1227
2025-10-30 22:32:18,237 [INFO   ]   [Filter 2] 30-Day Growth Check: -2.71%
2025-10-30 22:32:18,237 [INFO   ]   [Filter 2] FAILED. Growth of -2.71% < 10.0% threshold.
2025-10-30 22:32:18,238 [INFO   ] 
--- [Analysis Summary] ---
2025-10-30 22:32:18,238 [INFO   ] Total Valleys Found: 11
2025-10-30 22:32:18,238 [INFO   ] Valleys Passing Filter 2 (Qualification Test): 4
2025-10-30 22:32:18,238 [INFO   ] Valleys Passing Filter 3 (DNA Test): 4
2025-10-30 22:32:18,238 [INFO   ] --- [Historical Analyzer Finished] ---
