2025-10-30 22:46:44,753 [INFO   ] --- [Historical Analyzer Started for INTC] ---
2025-10-30 22:46:45,951 [INFO   ] Loaded 1510 data points for INTC.
2025-10-30 22:46:45,953 [INFO   ] Computing full CAC curve with m=15...
2025-10-30 22:47:06,788 [INFO   ] Found 24 significant valleys in the CAC curve.
2025-10-30 22:47:06,788 [INFO   ] 
--- Analyzing Valley at 2017-07-12 (index 131) ---
2025-10-30 22:47:06,790 [INFO   ]   [Filter 2] Valley at 2017-07-12: Slope Check (30d) = 0.0531
2025-10-30 22:47:06,790 [INFO   ]   [Filter 2] Valley at 2017-07-12: Slope Check (60d) = 0.0486
2025-10-30 22:47:06,791 [INFO   ]   [Filter 2] Valley at 2017-07-12: Slope Check (90d) = 0.1118
2025-10-30 22:47:06,791 [INFO   ]   [Filter 2] 30-Day Growth Check: 1.93%
2025-10-30 22:47:06,791 [INFO   ]   [Filter 2] FAILED. Growth of 1.93% < 10.0% threshold.
2025-10-30 22:47:06,791 [INFO   ] 
--- Analyzing Valley at 2017-10-17 (index 199) ---
2025-10-30 22:47:06,792 [INFO   ]   [Filter 2] Valley at 2017-10-17: Slope Check (30d) = 0.1557
2025-10-30 22:47:06,793 [INFO   ]   [Filter 2] Valley at 2017-10-17: Slope Check (60d) = 0.0378
2025-10-30 22:47:06,794 [INFO   ]   [Filter 2] Valley at 2017-10-17: Slope Check (90d) = 0.0324
2025-10-30 22:47:06,794 [INFO   ]   [Filter 2] 30-Day Growth Check: 13.08%
2025-10-30 22:47:06,794 [INFO   ]   [Filter 2] PASSED. Growth of 13.08% >= 10.0% threshold.
2025-10-30 22:47:07,377 [INFO   ]     [Filter 3] DNA Test vs 'DOGE-USD_m30_ramp': Distance = 3.3596
2025-10-30 22:47:07,379 [INFO   ]     [Filter 3] DNA Test vs 'SSYS_m90_ramp': Distance = 6.9100
2025-10-30 22:47:07,381 [INFO   ]     [Filter 3] DNA Test vs 'SHIB-USD_m30_ramp': Distance = 5.7251
2025-10-30 22:47:07,383 [INFO   ]     [Filter 3] DNA Test vs 'CSCO_m90_ramp': Distance = 3.8702
2025-10-30 22:47:07,384 [INFO   ]     [Filter 3] DNA Test vs 'GME_m90_ramp': Distance = 3.0245
2025-10-30 22:47:07,386 [INFO   ]     [Filter 3] DNA Test vs 'IYR_m120_ramp': Distance = 4.8036
2025-10-30 22:47:07,387 [INFO   ]     [Filter 3] DNA Test vs 'VWAGY_m15_ramp': Distance = 7.2381
2025-10-30 22:47:07,389 [INFO   ]     [Filter 3] DNA Test vs 'AMC_m30_ramp': Distance = 5.0036
2025-10-30 22:47:07,389 [INFO   ]     [Filter 3] PASSED. Best Match: 'GME_m90_ramp' (Distance: 3.0245) <= Loose Threshold (4.75)
2025-10-30 22:47:07,389 [INFO   ]     [Filter 3] PASSED. Best Match: 'GME_m90_ramp' (Distance: 3.0245)
2025-10-30 22:47:07,389 [INFO   ] 
--- Analyzing Valley at 2017-11-27 (index 227) ---
2025-10-30 22:47:07,390 [INFO   ]   [Filter 2] Valley at 2017-11-27: Slope Check (30d) = 0.0532
2025-10-30 22:47:07,391 [INFO   ]   [Filter 2] Valley at 2017-11-27: Slope Check (60d) = 0.0277
2025-10-30 22:47:07,392 [INFO   ]   [Filter 2] Valley at 2017-11-27: Slope Check (90d) = 0.0774
2025-10-30 22:47:07,392 [INFO   ]   [Filter 2] 30-Day Growth Check: -1.96%
2025-10-30 22:47:07,392 [INFO   ]   [Filter 2] FAILED. Growth of -1.96% < 10.0% threshold.
2025-10-30 22:47:07,392 [INFO   ] 
--- Analyzing Valley at 2018-01-09 (index 256) ---
2025-10-30 22:47:07,394 [INFO   ]   [Filter 2] Valley at 2018-01-09: Slope Check (30d) = 0.0569
2025-10-30 22:47:07,394 [INFO   ]   [Filter 2] Valley at 2018-01-09: Slope Check (60d) = 0.1221
2025-10-30 22:47:07,395 [INFO   ]   [Filter 2] Valley at 2018-01-09: Slope Check (90d) = 0.1036
2025-10-30 22:47:07,395 [INFO   ]   [Filter 2] 30-Day Growth Check: 6.03%
2025-10-30 22:47:07,395 [INFO   ]   [Filter 2] FAILED. Growth of 6.03% < 10.0% threshold.
2025-10-30 22:47:07,396 [INFO   ] 
--- Analyzing Valley at 2018-02-15 (index 282) ---
2025-10-30 22:47:07,396 [INFO   ]   [Filter 2] Valley at 2018-02-15: Slope Check (30d) = 0.1609
2025-10-30 22:47:07,397 [INFO   ]   [Filter 2] Valley at 2018-02-15: Slope Check (60d) = 0.0854
2025-10-30 22:47:07,398 [INFO   ]   [Filter 2] Valley at 2018-02-15: Slope Check (90d) = 0.0742
2025-10-30 22:47:07,398 [INFO   ]   [Filter 2] 30-Day Growth Check: 13.41%
2025-10-30 22:47:07,398 [INFO   ]   [Filter 2] PASSED. Growth of 13.41% >= 10.0% threshold.
2025-10-30 22:47:07,400 [INFO   ]     [Filter 3] DNA Test vs 'DOGE-USD_m30_ramp': Distance = 3.8150
2025-10-30 22:47:07,401 [INFO   ]     [Filter 3] DNA Test vs 'SSYS_m90_ramp': Distance = 6.9974
2025-10-30 22:47:07,402 [INFO   ]     [Filter 3] DNA Test vs 'SHIB-USD_m30_ramp': Distance = 4.9527
2025-10-30 22:47:07,404 [INFO   ]     [Filter 3] DNA Test vs 'CSCO_m90_ramp': Distance = 3.0256
2025-10-30 22:47:07,405 [INFO   ]     [Filter 3] DNA Test vs 'GME_m90_ramp': Distance = 3.6674
2025-10-30 22:47:07,406 [INFO   ]     [Filter 3] DNA Test vs 'IYR_m120_ramp': Distance = 4.3045
2025-10-30 22:47:07,408 [INFO   ]     [Filter 3] DNA Test vs 'VWAGY_m15_ramp': Distance = 6.8336
2025-10-30 22:47:07,409 [INFO   ]     [Filter 3] DNA Test vs 'AMC_m30_ramp': Distance = 4.5663
2025-10-30 22:47:07,409 [INFO   ]     [Filter 3] PASSED. Best Match: 'CSCO_m90_ramp' (Distance: 3.0256) <= Loose Threshold (4.75)
2025-10-30 22:47:07,409 [INFO   ]     [Filter 3] PASSED. Best Match: 'CSCO_m90_ramp' (Distance: 3.0256)
2025-10-30 22:47:07,409 [INFO   ] 
--- Analyzing Valley at 2018-05-29 (index 352) ---
2025-10-30 22:47:07,410 [INFO   ]   [Filter 2] Valley at 2018-05-29: Slope Check (30d) = -0.2168
2025-10-30 22:47:07,411 [INFO   ]   [Filter 2] Valley at 2018-05-29: Slope Check (60d) = -0.1153
2025-10-30 22:47:07,411 [INFO   ]   [Filter 2] Valley at 2018-05-29: Slope Check (90d) = -0.0913
2025-10-30 22:47:07,412 [INFO   ]   [Filter 2] FAILED. No positive slope found.
2025-10-30 22:47:07,412 [INFO   ] 
--- Analyzing Valley at 2018-08-16 (index 408) ---
2025-10-30 22:47:07,412 [INFO   ]   [Filter 2] Valley at 2018-08-16: Slope Check (30d) = -0.0599
2025-10-30 22:47:07,413 [INFO   ]   [Filter 2] Valley at 2018-08-16: Slope Check (60d) = -0.0159
2025-10-30 22:47:07,414 [INFO   ]   [Filter 2] Valley at 2018-08-16: Slope Check (90d) = 0.0074
2025-10-30 22:47:07,414 [INFO   ]   [Filter 2] 30-Day Growth Check: -2.73%
2025-10-30 22:47:07,414 [INFO   ]   [Filter 2] FAILED. Growth of -2.73% < 10.0% threshold.
2025-10-30 22:47:07,414 [INFO   ] 
--- Analyzing Valley at 2018-09-14 (index 428) ---
2025-10-30 22:47:07,415 [INFO   ]   [Filter 2] Valley at 2018-09-14: Slope Check (30d) = -0.0720
2025-10-30 22:47:07,415 [INFO   ]   [Filter 2] Valley at 2018-09-14: Slope Check (60d) = 0.0396
2025-10-30 22:47:07,416 [INFO   ]   [Filter 2] Valley at 2018-09-14: Slope Check (90d) = 0.0238
2025-10-30 22:47:07,416 [INFO   ]   [Filter 2] 30-Day Growth Check: -2.70%
2025-10-30 22:47:07,416 [INFO   ]   [Filter 2] FAILED. Growth of -2.70% < 10.0% threshold.
2025-10-30 22:47:07,416 [INFO   ] 
--- Analyzing Valley at 2019-04-04 (index 566) ---
2025-10-30 22:47:07,418 [INFO   ]   [Filter 2] Valley at 2019-04-04: Slope Check (30d) = -0.3752
2025-10-30 22:47:07,418 [INFO   ]   [Filter 2] Valley at 2019-04-04: Slope Check (60d) = -0.1808
2025-10-30 22:47:07,419 [INFO   ]   [Filter 2] Valley at 2019-04-04: Slope Check (90d) = -0.0535
2025-10-30 22:47:07,419 [INFO   ]   [Filter 2] FAILED. No positive slope found.
2025-10-30 22:47:07,419 [INFO   ] 
--- Analyzing Valley at 2019-07-29 (index 645) ---
2025-10-30 22:47:07,420 [INFO   ]   [Filter 2] Valley at 2019-07-29: Slope Check (30d) = -0.0167
2025-10-30 22:47:07,421 [INFO   ]   [Filter 2] Valley at 2019-07-29: Slope Check (60d) = 0.0784
2025-10-30 22:47:07,421 [INFO   ]   [Filter 2] Valley at 2019-07-29: Slope Check (90d) = 0.1300
2025-10-30 22:47:07,422 [INFO   ]   [Filter 2] 30-Day Growth Check: -1.09%
2025-10-30 22:47:07,422 [INFO   ]   [Filter 2] FAILED. Growth of -1.09% < 10.0% threshold.
2025-10-30 22:47:07,422 [INFO   ] 
--- Analyzing Valley at 2019-09-11 (index 676) ---
2025-10-30 22:47:07,423 [INFO   ]   [Filter 2] Valley at 2019-09-11: Slope Check (30d) = -0.0084
2025-10-30 22:47:07,423 [INFO   ]   [Filter 2] Valley at 2019-09-11: Slope Check (60d) = 0.1449
2025-10-30 22:47:07,424 [INFO   ]   [Filter 2] Valley at 2019-09-11: Slope Check (90d) = 0.1062
2025-10-30 22:47:07,424 [INFO   ]   [Filter 2] 30-Day Growth Check: -1.48%
2025-10-30 22:47:07,424 [INFO   ]   [Filter 2] FAILED. Growth of -1.48% < 10.0% threshold.
2025-10-30 22:47:07,424 [INFO   ] 
--- Analyzing Valley at 2020-01-17 (index 765) ---
2025-10-30 22:47:07,425 [INFO   ]   [Filter 2] Valley at 2020-01-17: Slope Check (30d) = -0.1208
2025-10-30 22:47:07,426 [INFO   ]   [Filter 2] Valley at 2020-01-17: Slope Check (60d) = -0.2297
2025-10-30 22:47:07,426 [INFO   ]   [Filter 2] Valley at 2020-01-17: Slope Check (90d) = -0.0481
2025-10-30 22:47:07,426 [INFO   ]   [Filter 2] FAILED. No positive slope found.
2025-10-30 22:47:07,427 [INFO   ] 
--- Analyzing Valley at 2020-03-31 (index 815) ---
2025-10-30 22:47:07,427 [INFO   ]   [Filter 2] Valley at 2020-03-31: Slope Check (30d) = 0.1311
2025-10-30 22:47:07,428 [INFO   ]   [Filter 2] Valley at 2020-03-31: Slope Check (60d) = 0.0837
2025-10-30 22:47:07,429 [INFO   ]   [Filter 2] Valley at 2020-03-31: Slope Check (90d) = -0.0404
2025-10-30 22:47:07,429 [INFO   ]   [Filter 2] 30-Day Growth Check: 8.50%
2025-10-30 22:47:07,429 [INFO   ]   [Filter 2] FAILED. Growth of 8.50% < 10.0% threshold.
2025-10-30 22:47:07,429 [INFO   ] 
--- Analyzing Valley at 2020-06-10 (index 864) ---
2025-10-30 22:47:07,430 [INFO   ]   [Filter 2] Valley at 2020-06-10: Slope Check (30d) = -0.0234
2025-10-30 22:47:07,431 [INFO   ]   [Filter 2] Valley at 2020-06-10: Slope Check (60d) = -0.2214
2025-10-30 22:47:07,431 [INFO   ]   [Filter 2] Valley at 2020-06-10: Slope Check (90d) = -0.1046
2025-10-30 22:47:07,431 [INFO   ]   [Filter 2] FAILED. No positive slope found.
2025-10-30 22:47:07,431 [INFO   ] 
--- Analyzing Valley at 2020-10-23 (index 959) ---
2025-10-30 22:47:07,432 [INFO   ]   [Filter 2] Valley at 2020-10-23: Slope Check (30d) = 0.1492
2025-10-30 22:47:07,433 [INFO   ]   [Filter 2] Valley at 2020-10-23: Slope Check (60d) = 0.1566
2025-10-30 22:47:07,434 [INFO   ]   [Filter 2] Valley at 2020-10-23: Slope Check (90d) = 0.1995
2025-10-30 22:47:07,434 [INFO   ]   [Filter 2] 30-Day Growth Check: 8.65%
2025-10-30 22:47:07,434 [INFO   ]   [Filter 2] FAILED. Growth of 8.65% < 10.0% threshold.
2025-10-30 22:47:07,434 [INFO   ] 
--- Analyzing Valley at 2020-11-17 (index 976) ---
2025-10-30 22:47:07,435 [INFO   ]   [Filter 2] Valley at 2020-11-17: Slope Check (30d) = 0.0617
2025-10-30 22:47:07,435 [INFO   ]   [Filter 2] Valley at 2020-11-17: Slope Check (60d) = 0.2202
2025-10-30 22:47:07,436 [INFO   ]   [Filter 2] Valley at 2020-11-17: Slope Check (90d) = 0.2098
2025-10-30 22:47:07,436 [INFO   ]   [Filter 2] 30-Day Growth Check: 7.07%
2025-10-30 22:47:07,436 [INFO   ]   [Filter 2] FAILED. Growth of 7.07% < 10.0% threshold.
2025-10-30 22:47:07,437 [INFO   ] 
--- Analyzing Valley at 2021-01-12 (index 1013) ---
2025-10-30 22:47:07,437 [INFO   ]   [Filter 2] Valley at 2021-01-12: Slope Check (30d) = 0.2123
2025-10-30 22:47:07,438 [INFO   ]   [Filter 2] Valley at 2021-01-12: Slope Check (60d) = 0.1561
2025-10-30 22:47:07,439 [INFO   ]   [Filter 2] Valley at 2021-01-12: Slope Check (90d) = 0.0111
2025-10-30 22:47:07,439 [INFO   ]   [Filter 2] 30-Day Growth Check: 19.41%
2025-10-30 22:47:07,439 [INFO   ]   [Filter 2] PASSED. Growth of 19.41% >= 10.0% threshold.
2025-10-30 22:47:07,441 [INFO   ]     [Filter 3] DNA Test vs 'DOGE-USD_m30_ramp': Distance = 6.0067
2025-10-30 22:47:07,443 [INFO   ]     [Filter 3] DNA Test vs 'SSYS_m90_ramp': Distance = 8.3941
2025-10-30 22:47:07,444 [INFO   ]     [Filter 3] DNA Test vs 'SHIB-USD_m30_ramp': Distance = 4.4922
2025-10-30 22:47:07,445 [INFO   ]     [Filter 3] DNA Test vs 'CSCO_m90_ramp': Distance = 4.4008
2025-10-30 22:47:07,446 [INFO   ]     [Filter 3] DNA Test vs 'GME_m90_ramp': Distance = 6.9873
2025-10-30 22:47:07,448 [INFO   ]     [Filter 3] DNA Test vs 'IYR_m120_ramp': Distance = 4.2837
2025-10-30 22:47:07,449 [INFO   ]     [Filter 3] DNA Test vs 'VWAGY_m15_ramp': Distance = 6.4873
2025-10-30 22:47:07,450 [INFO   ]     [Filter 3] DNA Test vs 'AMC_m30_ramp': Distance = 4.6333
2025-10-30 22:47:07,450 [INFO   ]     [Filter 3] PASSED. Best Match: 'IYR_m120_ramp' (Distance: 4.2837) <= Loose Threshold (4.75)
2025-10-30 22:47:07,450 [INFO   ]     [Filter 3] PASSED. Best Match: 'IYR_m120_ramp' (Distance: 4.2837)
2025-10-30 22:47:07,450 [INFO   ] 
--- Analyzing Valley at 2021-02-26 (index 1044) ---
2025-10-30 22:47:07,451 [INFO   ]   [Filter 2] Valley at 2021-02-26: Slope Check (30d) = 0.1894
2025-10-30 22:47:07,452 [INFO   ]   [Filter 2] Valley at 2021-02-26: Slope Check (60d) = -0.1236
2025-10-30 22:47:07,453 [INFO   ]   [Filter 2] Valley at 2021-02-26: Slope Check (90d) = -0.0927
2025-10-30 22:47:07,453 [INFO   ]   [Filter 2] 30-Day Growth Check: 12.31%
2025-10-30 22:47:07,453 [INFO   ]   [Filter 2] PASSED. Growth of 12.31% >= 10.0% threshold.
2025-10-30 22:47:07,454 [INFO   ]     [Filter 3] DNA Test vs 'DOGE-USD_m30_ramp': Distance = 4.8175
2025-10-30 22:47:07,456 [INFO   ]     [Filter 3] DNA Test vs 'SSYS_m90_ramp': Distance = 7.1116
2025-10-30 22:47:07,457 [INFO   ]     [Filter 3] DNA Test vs 'SHIB-USD_m30_ramp': Distance = 5.8051
2025-10-30 22:47:07,458 [INFO   ]     [Filter 3] DNA Test vs 'CSCO_m90_ramp': Distance = 4.0963
2025-10-30 22:47:07,459 [INFO   ]     [Filter 3] DNA Test vs 'GME_m90_ramp': Distance = 4.8942
2025-10-30 22:47:07,460 [INFO   ]     [Filter 3] DNA Test vs 'IYR_m120_ramp': Distance = 3.4600
2025-10-30 22:47:07,462 [INFO   ]     [Filter 3] DNA Test vs 'VWAGY_m15_ramp': Distance = 6.2013
2025-10-30 22:47:07,463 [INFO   ]     [Filter 3] DNA Test vs 'AMC_m30_ramp': Distance = 4.0456
2025-10-30 22:47:07,463 [INFO   ]     [Filter 3] PASSED. Best Match: 'IYR_m120_ramp' (Distance: 3.4600) <= Loose Threshold (4.75)
2025-10-30 22:47:07,463 [INFO   ]     [Filter 3] PASSED. Best Match: 'IYR_m120_ramp' (Distance: 3.4600)
2025-10-30 22:47:07,463 [INFO   ] 
--- Analyzing Valley at 2021-06-14 (index 1118) ---
2025-10-30 22:47:07,464 [INFO   ]   [Filter 2] Valley at 2021-06-14: Slope Check (30d) = -0.0693
2025-10-30 22:47:07,465 [INFO   ]   [Filter 2] Valley at 2021-06-14: Slope Check (60d) = -0.0600
2025-10-30 22:47:07,465 [INFO   ]   [Filter 2] Valley at 2021-06-14: Slope Check (90d) = -0.0274
2025-10-30 22:47:07,465 [INFO   ]   [Filter 2] FAILED. No positive slope found.
2025-10-30 22:47:07,465 [INFO   ] 
--- Analyzing Valley at 2021-11-18 (index 1229) ---
2025-10-30 22:47:07,466 [INFO   ]   [Filter 2] Valley at 2021-11-18: Slope Check (30d) = 0.0775
2025-10-30 22:47:07,467 [INFO   ]   [Filter 2] Valley at 2021-11-18: Slope Check (60d) = 0.0035
2025-10-30 22:47:07,467 [INFO   ]   [Filter 2] Valley at 2021-11-18: Slope Check (90d) = -0.0355
2025-10-30 22:47:07,468 [INFO   ]   [Filter 2] 30-Day Growth Check: 3.66%
2025-10-30 22:47:07,468 [INFO   ]   [Filter 2] FAILED. Growth of 3.66% < 10.0% threshold.
2025-10-30 22:47:07,468 [INFO   ] 
--- Analyzing Valley at 2022-02-02 (index 1280) ---
2025-10-30 22:47:07,468 [INFO   ]   [Filter 2] Valley at 2022-02-02: Slope Check (30d) = -0.0802
2025-10-30 22:47:07,469 [INFO   ]   [Filter 2] Valley at 2022-02-02: Slope Check (60d) = -0.0076
2025-10-30 22:47:07,470 [INFO   ]   [Filter 2] Valley at 2022-02-02: Slope Check (90d) = -0.0629
2025-10-30 22:47:07,470 [INFO   ]   [Filter 2] FAILED. No positive slope found.
2025-10-30 22:47:07,470 [INFO   ] 
--- Analyzing Valley at 2022-03-30 (index 1319) ---
2025-10-30 22:47:07,471 [INFO   ]   [Filter 2] Valley at 2022-03-30: Slope Check (30d) = -0.1697
2025-10-30 22:47:07,471 [INFO   ]   [Filter 2] Valley at 2022-03-30: Slope Check (60d) = -0.1646
2025-10-30 22:47:07,472 [INFO   ]   [Filter 2] Valley at 2022-03-30: Slope Check (90d) = -0.1311
2025-10-30 22:47:07,472 [INFO   ]   [Filter 2] FAILED. No positive slope found.
2025-10-30 22:47:07,472 [INFO   ] 
--- Analyzing Valley at 2022-06-17 (index 1374) ---
2025-10-30 22:47:07,473 [INFO   ]   [Filter 2] Valley at 2022-06-17: Slope Check (30d) = 0.0594
2025-10-30 22:47:07,473 [INFO   ]   [Filter 2] Valley at 2022-06-17: Slope Check (60d) = -0.1127
2025-10-30 22:47:07,474 [INFO   ]   [Filter 2] Valley at 2022-06-17: Slope Check (90d) = -0.1596
2025-10-30 22:47:07,474 [INFO   ]   [Filter 2] 30-Day Growth Check: -0.03%
2025-10-30 22:47:07,474 [INFO   ]   [Filter 2] FAILED. Growth of -0.03% < 10.0% threshold.
2025-10-30 22:47:07,475 [INFO   ] 
--- Analyzing Valley at 2022-08-10 (index 1410) ---
2025-10-30 22:47:07,475 [INFO   ]   [Filter 2] Valley at 2022-08-10: Slope Check (30d) = -0.2762
2025-10-30 22:47:07,476 [INFO   ]   [Filter 2] Valley at 2022-08-10: Slope Check (60d) = -0.1675
2025-10-30 22:47:07,477 [INFO   ]   [Filter 2] Valley at 2022-08-10: Slope Check (90d) = -0.0538
2025-10-30 22:47:07,477 [INFO   ]   [Filter 2] FAILED. No positive slope found.
2025-10-30 22:47:07,477 [INFO   ] 
--- [Analysis Summary] ---
2025-10-30 22:47:07,477 [INFO   ] Total Valleys Found: 24
2025-10-30 22:47:07,477 [INFO   ] Valleys Passing Filter 2 (Qualification Test): 4
2025-10-30 22:47:07,477 [INFO   ] Valleys Passing Filter 3 (DNA Test): 4
2025-10-30 22:47:07,477 [INFO   ] --- [Historical Analyzer Finished] ---
