2025-10-30 22:46:14,218 [INFO   ] --- [Historical Analyzer Started for INTC] ---
2025-10-30 22:46:15,609 [INFO   ] Loaded 1510 data points for INTC.
2025-10-30 22:46:15,610 [INFO   ] Computing full CAC curve with m=10...
2025-10-30 22:46:36,792 [INFO   ] Found 16 significant valleys in the CAC curve.
2025-10-30 22:46:36,792 [INFO   ] 
--- Analyzing Valley at 2018-02-09 (index 278) ---
2025-10-30 22:46:36,794 [INFO   ]   [Filter 2] Valley at 2018-02-09: Slope Check (30d) = 0.2232
2025-10-30 22:46:36,795 [INFO   ]   [Filter 2] Valley at 2018-02-09: Slope Check (60d) = 0.0957
2025-10-30 22:46:36,796 [INFO   ]   [Filter 2] Valley at 2018-02-09: Slope Check (90d) = 0.0920
2025-10-30 22:46:36,796 [INFO   ]   [Filter 2] 30-Day Growth Check: 12.31%
2025-10-30 22:46:36,796 [INFO   ]   [Filter 2] PASSED. Growth of 12.31% >= 10.0% threshold.
2025-10-30 22:46:37,401 [INFO   ]     [Filter 3] DNA Test vs 'DOGE-USD_m30_ramp': Distance = 3.0306
2025-10-30 22:46:37,403 [INFO   ]     [Filter 3] DNA Test vs 'SSYS_m90_ramp': Distance = 7.2404
2025-10-30 22:46:37,404 [INFO   ]     [Filter 3] DNA Test vs 'SHIB-USD_m30_ramp': Distance = 3.5746
2025-10-30 22:46:37,406 [INFO   ]     [Filter 3] DNA Test vs 'CSCO_m90_ramp': Distance = 2.3060
2025-10-30 22:46:37,407 [INFO   ]     [Filter 3] DNA Test vs 'GME_m90_ramp': Distance = 4.0232
2025-10-30 22:46:37,409 [INFO   ]     [Filter 3] DNA Test vs 'IYR_m120_ramp': Distance = 3.0495
2025-10-30 22:46:37,410 [INFO   ]     [Filter 3] DNA Test vs 'VWAGY_m15_ramp': Distance = 7.1605
2025-10-30 22:46:37,412 [INFO   ]     [Filter 3] DNA Test vs 'AMC_m30_ramp': Distance = 3.2433
2025-10-30 22:46:37,412 [INFO   ]     [Filter 3] PASSED. Best Match: 'CSCO_m90_ramp' (Distance: 2.3060) <= Strict Threshold (2.75)
2025-10-30 22:46:37,412 [INFO   ]     [Filter 3] PASSED. Best Match: 'CSCO_m90_ramp' (Distance: 2.3060)
2025-10-30 22:46:37,412 [INFO   ] 
--- Analyzing Valley at 2018-06-20 (index 368) ---
2025-10-30 22:46:37,413 [INFO   ]   [Filter 2] Valley at 2018-06-20: Slope Check (30d) = -0.0305
2025-10-30 22:46:37,414 [INFO   ]   [Filter 2] Valley at 2018-06-20: Slope Check (60d) = -0.0770
2025-10-30 22:46:37,415 [INFO   ]   [Filter 2] Valley at 2018-06-20: Slope Check (90d) = -0.0679
2025-10-30 22:46:37,415 [INFO   ]   [Filter 2] FAILED. No positive slope found.
2025-10-30 22:46:37,415 [INFO   ] 
--- Analyzing Valley at 2018-08-23 (index 413) ---
2025-10-30 22:46:37,416 [INFO   ]   [Filter 2] Valley at 2018-08-23: Slope Check (30d) = -0.0283
2025-10-30 22:46:37,416 [INFO   ]   [Filter 2] Valley at 2018-08-23: Slope Check (60d) = -0.0041
2025-10-30 22:46:37,417 [INFO   ]   [Filter 2] Valley at 2018-08-23: Slope Check (90d) = 0.0079
2025-10-30 22:46:37,417 [INFO   ]   [Filter 2] 30-Day Growth Check: 2.45%
2025-10-30 22:46:37,417 [INFO   ]   [Filter 2] FAILED. Growth of 2.45% < 10.0% threshold.
2025-10-30 22:46:37,417 [INFO   ] 
--- Analyzing Valley at 2018-11-12 (index 469) ---
2025-10-30 22:46:37,418 [INFO   ]   [Filter 2] Valley at 2018-11-12: Slope Check (30d) = -0.0576
2025-10-30 22:46:37,419 [INFO   ]   [Filter 2] Valley at 2018-11-12: Slope Check (60d) = 0.0162
2025-10-30 22:46:37,419 [INFO   ]   [Filter 2] Valley at 2018-11-12: Slope Check (90d) = 0.0777
2025-10-30 22:46:37,420 [INFO   ]   [Filter 2] 30-Day Growth Check: -0.99%
2025-10-30 22:46:37,420 [INFO   ]   [Filter 2] FAILED. Growth of -0.99% < 10.0% threshold.
2025-10-30 22:46:37,420 [INFO   ] 
--- Analyzing Valley at 2019-04-10 (index 570) ---
2025-10-30 22:46:37,420 [INFO   ]   [Filter 2] Valley at 2019-04-10: Slope Check (30d) = -0.4759
2025-10-30 22:46:37,421 [INFO   ]   [Filter 2] Valley at 2019-04-10: Slope Check (60d) = -0.1486
2025-10-30 22:46:37,422 [INFO   ]   [Filter 2] Valley at 2019-04-10: Slope Check (90d) = -0.0438
2025-10-30 22:46:37,422 [INFO   ]   [Filter 2] FAILED. No positive slope found.
2025-10-30 22:46:37,422 [INFO   ] 
--- Analyzing Valley at 2019-06-20 (index 619) ---
2025-10-30 22:46:37,423 [INFO   ]   [Filter 2] Valley at 2019-06-20: Slope Check (30d) = 0.1527
2025-10-30 22:46:37,424 [INFO   ]   [Filter 2] Valley at 2019-06-20: Slope Check (60d) = 0.0142
2025-10-30 22:46:37,424 [INFO   ]   [Filter 2] Valley at 2019-06-20: Slope Check (90d) = 0.0451
2025-10-30 22:46:37,425 [INFO   ]   [Filter 2] 30-Day Growth Check: 4.90%
2025-10-30 22:46:37,425 [INFO   ]   [Filter 2] FAILED. Growth of 4.90% < 10.0% threshold.
2025-10-30 22:46:37,425 [INFO   ] 
--- Analyzing Valley at 2019-09-24 (index 685) ---
2025-10-30 22:46:37,426 [INFO   ]   [Filter 2] Valley at 2019-09-24: Slope Check (30d) = 0.2099
2025-10-30 22:46:37,427 [INFO   ]   [Filter 2] Valley at 2019-09-24: Slope Check (60d) = 0.1421
2025-10-30 22:46:37,428 [INFO   ]   [Filter 2] Valley at 2019-09-24: Slope Check (90d) = 0.1308
2025-10-30 22:46:37,428 [INFO   ]   [Filter 2] 30-Day Growth Check: 15.64%
2025-10-30 22:46:37,428 [INFO   ]   [Filter 2] PASSED. Growth of 15.64% >= 10.0% threshold.
2025-10-30 22:46:37,429 [INFO   ]     [Filter 3] DNA Test vs 'DOGE-USD_m30_ramp': Distance = 5.8289
2025-10-30 22:46:37,431 [INFO   ]     [Filter 3] DNA Test vs 'SSYS_m90_ramp': Distance = 8.0308
2025-10-30 22:46:37,432 [INFO   ]     [Filter 3] DNA Test vs 'SHIB-USD_m30_ramp': Distance = 4.8375
2025-10-30 22:46:37,433 [INFO   ]     [Filter 3] DNA Test vs 'CSCO_m90_ramp': Distance = 4.1475
2025-10-30 22:46:37,434 [INFO   ]     [Filter 3] DNA Test vs 'GME_m90_ramp': Distance = 6.4937
2025-10-30 22:46:37,436 [INFO   ]     [Filter 3] DNA Test vs 'IYR_m120_ramp': Distance = 2.7569
2025-10-30 22:46:37,437 [INFO   ]     [Filter 3] DNA Test vs 'VWAGY_m15_ramp': Distance = 6.6491
2025-10-30 22:46:37,438 [INFO   ]     [Filter 3] DNA Test vs 'AMC_m30_ramp': Distance = 2.9788
2025-10-30 22:46:37,438 [INFO   ]     [Filter 3] PASSED. Best Match: 'IYR_m120_ramp' (Distance: 2.7569) <= Loose Threshold (4.75)
2025-10-30 22:46:37,438 [INFO   ]     [Filter 3] PASSED. Best Match: 'IYR_m120_ramp' (Distance: 2.7569)
2025-10-30 22:46:37,439 [INFO   ] 
--- Analyzing Valley at 2019-11-07 (index 717) ---
2025-10-30 22:46:37,439 [INFO   ]   [Filter 2] Valley at 2019-11-07: Slope Check (30d) = -0.0395
2025-10-30 22:46:37,440 [INFO   ]   [Filter 2] Valley at 2019-11-07: Slope Check (60d) = 0.1096
2025-10-30 22:46:37,441 [INFO   ]   [Filter 2] Valley at 2019-11-07: Slope Check (90d) = 0.0059
2025-10-30 22:46:37,441 [INFO   ]   [Filter 2] 30-Day Growth Check: -0.16%
2025-10-30 22:46:37,441 [INFO   ]   [Filter 2] FAILED. Growth of -0.16% < 10.0% threshold.
2025-10-30 22:46:37,441 [INFO   ] 
--- Analyzing Valley at 2020-02-24 (index 789) ---
2025-10-30 22:46:37,442 [INFO   ]   [Filter 2] Valley at 2020-02-24: Slope Check (30d) = -0.2120
2025-10-30 22:46:37,443 [INFO   ]   [Filter 2] Valley at 2020-02-24: Slope Check (60d) = 0.1050
2025-10-30 22:46:37,443 [INFO   ]   [Filter 2] Valley at 2020-02-24: Slope Check (90d) = 0.0953
2025-10-30 22:46:37,443 [INFO   ]   [Filter 2] 30-Day Growth Check: -12.35%
2025-10-30 22:46:37,443 [INFO   ]   [Filter 2] FAILED. Growth of -12.35% < 10.0% threshold.
2025-10-30 22:46:37,444 [INFO   ] 
--- Analyzing Valley at 2020-03-23 (index 809) ---
2025-10-30 22:46:37,444 [INFO   ]   [Filter 2] Valley at 2020-03-23: Slope Check (30d) = 0.2530
2025-10-30 22:46:37,445 [INFO   ]   [Filter 2] Valley at 2020-03-23: Slope Check (60d) = 0.1400
2025-10-30 22:46:37,445 [INFO   ]   [Filter 2] Valley at 2020-03-23: Slope Check (90d) = 0.0233
2025-10-30 22:46:37,446 [INFO   ]   [Filter 2] 30-Day Growth Check: 16.96%
2025-10-30 22:46:37,446 [INFO   ]   [Filter 2] PASSED. Growth of 16.96% >= 10.0% threshold.
2025-10-30 22:46:37,447 [INFO   ]     [Filter 3] DNA Test vs 'DOGE-USD_m30_ramp': Distance = 3.5895
2025-10-30 22:46:37,448 [INFO   ]     [Filter 3] DNA Test vs 'SSYS_m90_ramp': Distance = 7.3441
2025-10-30 22:46:37,449 [INFO   ]     [Filter 3] DNA Test vs 'SHIB-USD_m30_ramp': Distance = 4.9692
2025-10-30 22:46:37,451 [INFO   ]     [Filter 3] DNA Test vs 'CSCO_m90_ramp': Distance = 3.1822
2025-10-30 22:46:37,452 [INFO   ]     [Filter 3] DNA Test vs 'GME_m90_ramp': Distance = 4.2545
2025-10-30 22:46:37,453 [INFO   ]     [Filter 3] DNA Test vs 'IYR_m120_ramp': Distance = 3.9623
2025-10-30 22:46:37,454 [INFO   ]     [Filter 3] DNA Test vs 'VWAGY_m15_ramp': Distance = 7.4250
2025-10-30 22:46:37,455 [INFO   ]     [Filter 3] DNA Test vs 'AMC_m30_ramp': Distance = 4.0347
2025-10-30 22:46:37,456 [INFO   ]     [Filter 3] PASSED. Best Match: 'CSCO_m90_ramp' (Distance: 3.1822) <= Loose Threshold (4.75)
2025-10-30 22:46:37,456 [INFO   ]     [Filter 3] PASSED. Best Match: 'CSCO_m90_ramp' (Distance: 3.1822)
2025-10-30 22:46:37,456 [INFO   ] 
--- Analyzing Valley at 2020-04-21 (index 829) ---
2025-10-30 22:46:37,457 [INFO   ]   [Filter 2] Valley at 2020-04-21: Slope Check (30d) = 0.1435
2025-10-30 22:46:37,457 [INFO   ]   [Filter 2] Valley at 2020-04-21: Slope Check (60d) = 0.0022
2025-10-30 22:46:37,458 [INFO   ]   [Filter 2] Valley at 2020-04-21: Slope Check (90d) = -0.1254
2025-10-30 22:46:37,458 [INFO   ]   [Filter 2] 30-Day Growth Check: 10.84%
2025-10-30 22:46:37,458 [INFO   ]   [Filter 2] PASSED. Growth of 10.84% >= 10.0% threshold.
2025-10-30 22:46:37,460 [INFO   ]     [Filter 3] DNA Test vs 'DOGE-USD_m30_ramp': Distance = 5.3806
2025-10-30 22:46:37,461 [INFO   ]     [Filter 3] DNA Test vs 'SSYS_m90_ramp': Distance = 7.6180
2025-10-30 22:46:37,462 [INFO   ]     [Filter 3] DNA Test vs 'SHIB-USD_m30_ramp': Distance = 5.0137
2025-10-30 22:46:37,463 [INFO   ]     [Filter 3] DNA Test vs 'CSCO_m90_ramp': Distance = 4.2249
2025-10-30 22:46:37,465 [INFO   ]     [Filter 3] DNA Test vs 'GME_m90_ramp': Distance = 7.2403
2025-10-30 22:46:37,466 [INFO   ]     [Filter 3] DNA Test vs 'IYR_m120_ramp': Distance = 4.0801
2025-10-30 22:46:37,467 [INFO   ]     [Filter 3] DNA Test vs 'VWAGY_m15_ramp': Distance = 6.9514
2025-10-30 22:46:37,469 [INFO   ]     [Filter 3] DNA Test vs 'AMC_m30_ramp': Distance = 3.9365
2025-10-30 22:46:37,469 [INFO   ]     [Filter 3] PASSED. Best Match: 'AMC_m30_ramp' (Distance: 3.9365) <= Loose Threshold (4.75)
2025-10-30 22:46:37,469 [INFO   ]     [Filter 3] PASSED. Best Match: 'AMC_m30_ramp' (Distance: 3.9365)
2025-10-30 22:46:37,469 [INFO   ] 
--- Analyzing Valley at 2020-08-12 (index 908) ---
2025-10-30 22:46:37,470 [INFO   ]   [Filter 2] Valley at 2020-08-12: Slope Check (30d) = 0.0302
2025-10-30 22:46:37,471 [INFO   ]   [Filter 2] Valley at 2020-08-12: Slope Check (60d) = -0.0057
2025-10-30 22:46:37,471 [INFO   ]   [Filter 2] Valley at 2020-08-12: Slope Check (90d) = -0.0160
2025-10-30 22:46:37,472 [INFO   ]   [Filter 2] 30-Day Growth Check: -0.75%
2025-10-30 22:46:37,472 [INFO   ]   [Filter 2] FAILED. Growth of -0.75% < 10.0% threshold.
2025-10-30 22:46:37,472 [INFO   ] 
--- Analyzing Valley at 2020-10-23 (index 959) ---
2025-10-30 22:46:37,473 [INFO   ]   [Filter 2] Valley at 2020-10-23: Slope Check (30d) = 0.1492
2025-10-30 22:46:37,474 [INFO   ]   [Filter 2] Valley at 2020-10-23: Slope Check (60d) = 0.1566
2025-10-30 22:46:37,474 [INFO   ]   [Filter 2] Valley at 2020-10-23: Slope Check (90d) = 0.1995
2025-10-30 22:46:37,474 [INFO   ]   [Filter 2] 30-Day Growth Check: 8.65%
2025-10-30 22:46:37,475 [INFO   ]   [Filter 2] FAILED. Growth of 8.65% < 10.0% threshold.
2025-10-30 22:46:37,475 [INFO   ] 
--- Analyzing Valley at 2020-11-30 (index 984) ---
2025-10-30 22:46:37,475 [INFO   ]   [Filter 2] Valley at 2020-11-30: Slope Check (30d) = 0.0238
2025-10-30 22:46:37,476 [INFO   ]   [Filter 2] Valley at 2020-11-30: Slope Check (60d) = 0.2379
2025-10-30 22:46:37,477 [INFO   ]   [Filter 2] Valley at 2020-11-30: Slope Check (90d) = 0.2039
2025-10-30 22:46:37,477 [INFO   ]   [Filter 2] 30-Day Growth Check: 10.11%
2025-10-30 22:46:37,477 [INFO   ]   [Filter 2] PASSED. Growth of 10.11% >= 10.0% threshold.
2025-10-30 22:46:37,479 [INFO   ]     [Filter 3] DNA Test vs 'DOGE-USD_m30_ramp': Distance = 8.3489
2025-10-30 22:46:37,481 [INFO   ]     [Filter 3] DNA Test vs 'SSYS_m90_ramp': Distance = 6.5465
2025-10-30 22:46:37,482 [INFO   ]     [Filter 3] DNA Test vs 'SHIB-USD_m30_ramp': Distance = 8.2183
2025-10-30 22:46:37,484 [INFO   ]     [Filter 3] DNA Test vs 'CSCO_m90_ramp': Distance = 7.5931
2025-10-30 22:46:37,486 [INFO   ]     [Filter 3] DNA Test vs 'GME_m90_ramp': Distance = 9.2070
2025-10-30 22:46:37,488 [INFO   ]     [Filter 3] DNA Test vs 'IYR_m120_ramp': Distance = 7.0779
2025-10-30 22:46:37,489 [INFO   ]     [Filter 3] DNA Test vs 'VWAGY_m15_ramp': Distance = 7.0814
2025-10-30 22:46:37,491 [INFO   ]     [Filter 3] DNA Test vs 'AMC_m30_ramp': Distance = 6.9673
2025-10-30 22:46:37,491 [INFO   ]     [Filter 3] FAILED. Best Match Distance (6.5465) > Loose Threshold (4.75)
2025-10-30 22:46:37,491 [INFO   ]     [Filter 3] FAILED. No DNA match found below threshold 2.75.
2025-10-30 22:46:37,491 [INFO   ] 
--- Analyzing Valley at 2021-04-05 (index 1069) ---
2025-10-30 22:46:37,492 [INFO   ]   [Filter 2] Valley at 2021-04-05: Slope Check (30d) = -0.4337
2025-10-30 22:46:37,493 [INFO   ]   [Filter 2] Valley at 2021-04-05: Slope Check (60d) = -0.1371
2025-10-30 22:46:37,494 [INFO   ]   [Filter 2] Valley at 2021-04-05: Slope Check (90d) = -0.0913
2025-10-30 22:46:37,494 [INFO   ]   [Filter 2] FAILED. No positive slope found.
2025-10-30 22:46:37,494 [INFO   ] 
--- Analyzing Valley at 2021-06-02 (index 1110) ---
2025-10-30 22:46:37,495 [INFO   ]   [Filter 2] Valley at 2021-06-02: Slope Check (30d) = -0.0394
2025-10-30 22:46:37,496 [INFO   ]   [Filter 2] Valley at 2021-06-02: Slope Check (60d) = -0.0714
2025-10-30 22:46:37,496 [INFO   ]   [Filter 2] Valley at 2021-06-02: Slope Check (90d) = -0.0360
2025-10-30 22:46:37,497 [INFO   ]   [Filter 2] FAILED. No positive slope found.
2025-10-30 22:46:37,497 [INFO   ] 
--- [Analysis Summary] ---
2025-10-30 22:46:37,497 [INFO   ] Total Valleys Found: 16
2025-10-30 22:46:37,497 [INFO   ] Valleys Passing Filter 2 (Qualification Test): 5
2025-10-30 22:46:37,497 [INFO   ] Valleys Passing Filter 3 (DNA Test): 4
2025-10-30 22:46:37,497 [INFO   ] --- [Historical Analyzer Finished] ---
