2025-10-30 22:22:39,824 [INFO   ] --- [Historical Analyzer Started for AAPL] ---
2025-10-30 22:22:40,818 [INFO   ] Loaded 1510 data points for AAPL.
2025-10-30 22:22:40,820 [INFO   ] Computing full CAC curve with m=10...
2025-10-30 22:23:01,732 [INFO   ] Found 14 significant valleys in the CAC curve.
2025-10-30 22:23:01,732 [INFO   ] 
--- Analyzing Valley at 2017-03-23 (index 55) ---
2025-10-30 22:23:01,734 [INFO   ]   [Filter 2] Valley at 2017-03-23: Slope Check (30d) = 0.0254
2025-10-30 22:23:01,735 [INFO   ]   [Filter 2] Valley at 2017-03-23: Slope Check (60d) = 0.0503
2025-10-30 22:23:01,735 [INFO   ]   [Filter 2] Valley at 2017-03-23: Slope Check (90d) = 0.0169
2025-10-30 22:23:01,736 [INFO   ]   [Filter 2] 30-Day Growth Check: 3.98%
2025-10-30 22:23:01,736 [INFO   ]   [Filter 2] FAILED. Growth of 3.98% < 10.0% threshold.
2025-10-30 22:23:01,736 [INFO   ] 
--- Analyzing Valley at 2017-04-25 (index 77) ---
2025-10-30 22:23:01,737 [INFO   ]   [Filter 2] Valley at 2017-04-25: Slope Check (30d) = 0.0887
2025-10-30 22:23:01,737 [INFO   ]   [Filter 2] Valley at 2017-04-25: Slope Check (60d) = -0.0173
2025-10-30 22:23:01,738 [INFO   ]   [Filter 2] Valley at 2017-04-25: Slope Check (90d) = 0.0271
2025-10-30 22:23:01,738 [INFO   ]   [Filter 2] 30-Day Growth Check: 7.30%
2025-10-30 22:23:01,739 [INFO   ]   [Filter 2] FAILED. Growth of 7.30% < 10.0% threshold.
2025-10-30 22:23:01,739 [INFO   ] 
--- Analyzing Valley at 2017-06-20 (index 116) ---
2025-10-30 22:23:01,740 [INFO   ]   [Filter 2] Valley at 2017-06-20: Slope Check (30d) = 0.0649
2025-10-30 22:23:01,741 [INFO   ]   [Filter 2] Valley at 2017-06-20: Slope Check (60d) = 0.0892
2025-10-30 22:23:01,742 [INFO   ]   [Filter 2] Valley at 2017-06-20: Slope Check (90d) = 0.0361
2025-10-30 22:23:01,742 [INFO   ]   [Filter 2] 30-Day Growth Check: 3.48%
2025-10-30 22:23:01,742 [INFO   ]   [Filter 2] FAILED. Growth of 3.48% < 10.0% threshold.
2025-10-30 22:23:01,742 [INFO   ] 
--- Analyzing Valley at 2017-07-14 (index 133) ---
2025-10-30 22:23:01,743 [INFO   ]   [Filter 2] Valley at 2017-07-14: Slope Check (30d) = 0.1048
2025-10-30 22:23:01,744 [INFO   ]   [Filter 2] Valley at 2017-07-14: Slope Check (60d) = 0.0201
2025-10-30 22:23:01,744 [INFO   ]   [Filter 2] Valley at 2017-07-14: Slope Check (90d) = 0.0418
2025-10-30 22:23:01,744 [INFO   ]   [Filter 2] 30-Day Growth Check: 7.28%
2025-10-30 22:23:01,745 [INFO   ]   [Filter 2] FAILED. Growth of 7.28% < 10.0% threshold.
2025-10-30 22:23:01,745 [INFO   ] 
--- Analyzing Valley at 2017-08-07 (index 149) ---
2025-10-30 22:23:01,745 [INFO   ]   [Filter 2] Valley at 2017-08-07: Slope Check (30d) = 0.0183
2025-10-30 22:23:01,746 [INFO   ]   [Filter 2] Valley at 2017-08-07: Slope Check (60d) = -0.0128
2025-10-30 22:23:01,747 [INFO   ]   [Filter 2] Valley at 2017-08-07: Slope Check (90d) = 0.0445
2025-10-30 22:23:01,747 [INFO   ]   [Filter 2] 30-Day Growth Check: 0.30%
2025-10-30 22:23:01,747 [INFO   ]   [Filter 2] FAILED. Growth of 0.30% < 10.0% threshold.
2025-10-30 22:23:01,747 [INFO   ] 
--- Analyzing Valley at 2017-10-12 (index 196) ---
2025-10-30 22:23:01,748 [INFO   ]   [Filter 2] Valley at 2017-10-12: Slope Check (30d) = 0.1731
2025-10-30 22:23:01,749 [INFO   ]   [Filter 2] Valley at 2017-10-12: Slope Check (60d) = 0.0608
2025-10-30 22:23:01,749 [INFO   ]   [Filter 2] Valley at 2017-10-12: Slope Check (90d) = 0.0167
2025-10-30 22:23:01,749 [INFO   ]   [Filter 2] 30-Day Growth Check: 12.56%
2025-10-30 22:23:01,750 [INFO   ]   [Filter 2] PASSED. Growth of 12.56% >= 10.0% threshold.
2025-10-30 22:23:02,464 [INFO   ]     [Filter 3] DNA Test vs 'DOGE-USD_m30_ramp': Distance = 3.5485
2025-10-30 22:23:02,465 [INFO   ]     [Filter 3] DNA Test vs 'SSYS_m90_ramp': Distance = 8.3035
2025-10-30 22:23:02,467 [INFO   ]     [Filter 3] DNA Test vs 'SHIB-USD_m30_ramp': Distance = 3.0466
2025-10-30 22:23:02,468 [INFO   ]     [Filter 3] DNA Test vs 'CSCO_m90_ramp': Distance = 3.4109
2025-10-30 22:23:02,469 [INFO   ]     [Filter 3] DNA Test vs 'GME_m90_ramp': Distance = 3.6175
2025-10-30 22:23:02,471 [INFO   ]     [Filter 3] DNA Test vs 'IYR_m120_ramp': Distance = 2.8764
2025-10-30 22:23:02,473 [INFO   ]     [Filter 3] DNA Test vs 'VWAGY_m15_ramp': Distance = 6.0600
2025-10-30 22:23:02,474 [INFO   ]     [Filter 3] DNA Test vs 'AMC_m30_ramp': Distance = 4.0074
2025-10-30 22:23:02,474 [INFO   ]     [Filter 3] PASSED. Best Match: 'IYR_m120_ramp' (Distance: 2.8764) <= Loose Threshold (4.75)
2025-10-30 22:23:02,474 [INFO   ]     [Filter 3] PASSED. Best Match: 'IYR_m120_ramp' (Distance: 2.8764)
2025-10-30 22:23:02,475 [INFO   ] 
--- Analyzing Valley at 2017-12-05 (index 233) ---
2025-10-30 22:23:02,476 [INFO   ]   [Filter 2] Valley at 2017-12-05: Slope Check (30d) = 0.0507
2025-10-30 22:23:02,476 [INFO   ]   [Filter 2] Valley at 2017-12-05: Slope Check (60d) = -0.0078
2025-10-30 22:23:02,477 [INFO   ]   [Filter 2] Valley at 2017-12-05: Slope Check (90d) = 0.0039
2025-10-30 22:23:02,477 [INFO   ]   [Filter 2] 30-Day Growth Check: 5.67%
2025-10-30 22:23:02,477 [INFO   ]   [Filter 2] FAILED. Growth of 5.67% < 10.0% threshold.
2025-10-30 22:23:02,477 [INFO   ] 
--- Analyzing Valley at 2018-01-02 (index 251) ---
2025-10-30 22:23:02,478 [INFO   ]   [Filter 2] Valley at 2018-01-02: Slope Check (30d) = -0.1469
2025-10-30 22:23:02,479 [INFO   ]   [Filter 2] Valley at 2018-01-02: Slope Check (60d) = 0.0098
2025-10-30 22:23:02,480 [INFO   ]   [Filter 2] Valley at 2018-01-02: Slope Check (90d) = 0.0101
2025-10-30 22:23:02,480 [INFO   ]   [Filter 2] 30-Day Growth Check: -4.21%
2025-10-30 22:23:02,480 [INFO   ]   [Filter 2] FAILED. Growth of -4.21% < 10.0% threshold.
2025-10-30 22:23:02,480 [INFO   ] 
--- Analyzing Valley at 2018-03-26 (index 308) ---
2025-10-30 22:23:02,481 [INFO   ]   [Filter 2] Valley at 2018-03-26: Slope Check (30d) = 0.0362
2025-10-30 22:23:02,481 [INFO   ]   [Filter 2] Valley at 2018-03-26: Slope Check (60d) = 0.1185
2025-10-30 22:23:02,482 [INFO   ]   [Filter 2] Valley at 2018-03-26: Slope Check (90d) = 0.0716
2025-10-30 22:23:02,482 [INFO   ]   [Filter 2] 30-Day Growth Check: 7.17%
2025-10-30 22:23:02,483 [INFO   ]   [Filter 2] FAILED. Growth of 7.17% < 10.0% threshold.
2025-10-30 22:23:02,483 [INFO   ] 
--- Analyzing Valley at 2018-07-20 (index 389) ---
2025-10-30 22:23:02,484 [INFO   ]   [Filter 2] Valley at 2018-07-20: Slope Check (30d) = 0.2778
2025-10-30 22:23:02,484 [INFO   ]   [Filter 2] Valley at 2018-07-20: Slope Check (60d) = 0.1302
2025-10-30 22:23:02,485 [INFO   ]   [Filter 2] Valley at 2018-07-20: Slope Check (90d) = -0.0114
2025-10-30 22:23:02,485 [INFO   ]   [Filter 2] 30-Day Growth Check: 17.96%
2025-10-30 22:23:02,485 [INFO   ]   [Filter 2] PASSED. Growth of 17.96% >= 10.0% threshold.
2025-10-30 22:23:02,487 [INFO   ]     [Filter 3] DNA Test vs 'DOGE-USD_m30_ramp': Distance = 3.5077
2025-10-30 22:23:02,489 [INFO   ]     [Filter 3] DNA Test vs 'SSYS_m90_ramp': Distance = 7.3610
2025-10-30 22:23:02,490 [INFO   ]     [Filter 3] DNA Test vs 'SHIB-USD_m30_ramp': Distance = 3.7997
2025-10-30 22:23:02,492 [INFO   ]     [Filter 3] DNA Test vs 'CSCO_m90_ramp': Distance = 2.5348
2025-10-30 22:23:02,493 [INFO   ]     [Filter 3] DNA Test vs 'GME_m90_ramp': Distance = 4.2353
2025-10-30 22:23:02,494 [INFO   ]     [Filter 3] DNA Test vs 'IYR_m120_ramp': Distance = 1.7214
2025-10-30 22:23:02,496 [INFO   ]     [Filter 3] DNA Test vs 'VWAGY_m15_ramp': Distance = 6.1077
2025-10-30 22:23:02,497 [INFO   ]     [Filter 3] DNA Test vs 'AMC_m30_ramp': Distance = 2.5999
2025-10-30 22:23:02,497 [INFO   ]     [Filter 3] PASSED. Best Match: 'IYR_m120_ramp' (Distance: 1.7214) <= Strict Threshold (2.75)
2025-10-30 22:23:02,497 [INFO   ]     [Filter 3] PASSED. Best Match: 'IYR_m120_ramp' (Distance: 1.7214)
2025-10-30 22:23:02,498 [INFO   ] 
--- Analyzing Valley at 2021-09-08 (index 1178) ---
2025-10-30 22:23:02,498 [INFO   ]   [Filter 2] Valley at 2021-09-08: Slope Check (30d) = -0.2628
2025-10-30 22:23:02,499 [INFO   ]   [Filter 2] Valley at 2021-09-08: Slope Check (60d) = 0.2326
2025-10-30 22:23:02,500 [INFO   ]   [Filter 2] Valley at 2021-09-08: Slope Check (90d) = 0.4425
2025-10-30 22:23:02,500 [INFO   ]   [Filter 2] 30-Day Growth Check: -4.09%
2025-10-30 22:23:02,500 [INFO   ]   [Filter 2] FAILED. Growth of -4.09% < 10.0% threshold.
2025-10-30 22:23:02,500 [INFO   ] 
--- Analyzing Valley at 2021-12-07 (index 1241) ---
2025-10-30 22:23:02,501 [INFO   ]   [Filter 2] Valley at 2021-12-07: Slope Check (30d) = -0.0937
2025-10-30 22:23:02,502 [INFO   ]   [Filter 2] Valley at 2021-12-07: Slope Check (60d) = -0.1817
2025-10-30 22:23:02,502 [INFO   ]   [Filter 2] Valley at 2021-12-07: Slope Check (90d) = -0.0911
2025-10-30 22:23:02,502 [INFO   ]   [Filter 2] FAILED. No positive slope found.
2025-10-30 22:23:02,502 [INFO   ] 
--- Analyzing Valley at 2022-01-12 (index 1266) ---
2025-10-30 22:23:02,503 [INFO   ]   [Filter 2] Valley at 2022-01-12: Slope Check (30d) = -0.0046
2025-10-30 22:23:02,504 [INFO   ]   [Filter 2] Valley at 2022-01-12: Slope Check (60d) = 0.0259
2025-10-30 22:23:02,504 [INFO   ]   [Filter 2] Valley at 2022-01-12: Slope Check (90d) = -0.1823
2025-10-30 22:23:02,505 [INFO   ]   [Filter 2] 30-Day Growth Check: -7.17%
2025-10-30 22:23:02,505 [INFO   ]   [Filter 2] FAILED. Growth of -7.17% < 10.0% threshold.
2025-10-30 22:23:02,505 [INFO   ] 
--- Analyzing Valley at 2022-02-14 (index 1288) ---
2025-10-30 22:23:02,505 [INFO   ]   [Filter 2] Valley at 2022-02-14: Slope Check (30d) = -0.0029
2025-10-30 22:23:02,506 [INFO   ]   [Filter 2] Valley at 2022-02-14: Slope Check (60d) = -0.0700
2025-10-30 22:23:02,507 [INFO   ]   [Filter 2] Valley at 2022-02-14: Slope Check (90d) = -0.3723
2025-10-30 22:23:02,507 [INFO   ]   [Filter 2] FAILED. No positive slope found.
2025-10-30 22:23:02,507 [INFO   ] 
--- [Analysis Summary] ---
2025-10-30 22:23:02,507 [INFO   ] Total Valleys Found: 14
2025-10-30 22:23:02,507 [INFO   ] Valleys Passing Filter 2 (Qualification Test): 2
2025-10-30 22:23:02,507 [INFO   ] Valleys Passing Filter 3 (DNA Test): 2
2025-10-30 22:23:02,507 [INFO   ] --- [Historical Analyzer Finished] ---
