2025-10-30 22:47:16,502 [INFO   ] --- [Historical Analyzer Started for INTC] ---
2025-10-30 22:47:17,542 [INFO   ] Loaded 1510 data points for INTC.
2025-10-30 22:47:17,543 [INFO   ] Computing full CAC curve with m=30...
2025-10-30 22:47:38,616 [INFO   ] Found 11 significant valleys in the CAC curve.
2025-10-30 22:47:38,617 [INFO   ] 
--- Analyzing Valley at 2019-03-14 (index 551) ---
2025-10-30 22:47:38,618 [INFO   ]   [Filter 2] Valley at 2019-03-14: Slope Check (30d) = 0.1657
2025-10-30 22:47:38,619 [INFO   ]   [Filter 2] Valley at 2019-03-14: Slope Check (60d) = -0.1947
2025-10-30 22:47:38,620 [INFO   ]   [Filter 2] Valley at 2019-03-14: Slope Check (90d) = -0.0892
2025-10-30 22:47:38,620 [INFO   ]   [Filter 2] 30-Day Growth Check: 7.80%
2025-10-30 22:47:38,620 [INFO   ]   [Filter 2] FAILED. Growth of 7.80% < 10.0% threshold.
2025-10-30 22:47:38,621 [INFO   ] 
--- Analyzing Valley at 2019-10-23 (index 706) ---
2025-10-30 22:47:38,621 [INFO   ]   [Filter 2] Valley at 2019-10-23: Slope Check (30d) = 0.1000
2025-10-30 22:47:38,622 [INFO   ]   [Filter 2] Valley at 2019-10-23: Slope Check (60d) = 0.0590
2025-10-30 22:47:38,623 [INFO   ]   [Filter 2] Valley at 2019-10-23: Slope Check (90d) = 0.0929
2025-10-30 22:47:38,623 [INFO   ]   [Filter 2] 30-Day Growth Check: 8.91%
2025-10-30 22:47:38,623 [INFO   ]   [Filter 2] FAILED. Growth of 8.91% < 10.0% threshold.
2025-10-30 22:47:38,624 [INFO   ] 
--- Analyzing Valley at 2019-12-17 (index 744) ---
2025-10-30 22:47:38,624 [INFO   ]   [Filter 2] Valley at 2019-12-17: Slope Check (30d) = 0.2358
2025-10-30 22:47:38,625 [INFO   ]   [Filter 2] Valley at 2019-12-17: Slope Check (60d) = -0.0294
2025-10-30 22:47:38,626 [INFO   ]   [Filter 2] Valley at 2019-12-17: Slope Check (90d) = -0.0671
2025-10-30 22:47:38,626 [INFO   ]   [Filter 2] 30-Day Growth Check: 16.00%
2025-10-30 22:47:38,626 [INFO   ]   [Filter 2] PASSED. Growth of 16.00% >= 10.0% threshold.
2025-10-30 22:47:39,241 [INFO   ]     [Filter 3] DNA Test vs 'DOGE-USD_m30_ramp': Distance = 6.3957
2025-10-30 22:47:39,243 [INFO   ]     [Filter 3] DNA Test vs 'SSYS_m90_ramp': Distance = 7.1939
2025-10-30 22:47:39,244 [INFO   ]     [Filter 3] DNA Test vs 'SHIB-USD_m30_ramp': Distance = 5.7732
2025-10-30 22:47:39,245 [INFO   ]     [Filter 3] DNA Test vs 'CSCO_m90_ramp': Distance = 4.5069
2025-10-30 22:47:39,247 [INFO   ]     [Filter 3] DNA Test vs 'GME_m90_ramp': Distance = 6.9986
2025-10-30 22:47:39,248 [INFO   ]     [Filter 3] DNA Test vs 'IYR_m120_ramp': Distance = 3.6670
2025-10-30 22:47:39,250 [INFO   ]     [Filter 3] DNA Test vs 'VWAGY_m15_ramp': Distance = 6.9660
2025-10-30 22:47:39,251 [INFO   ]     [Filter 3] DNA Test vs 'AMC_m30_ramp': Distance = 3.5821
2025-10-30 22:47:39,251 [INFO   ]     [Filter 3] PASSED. Best Match: 'AMC_m30_ramp' (Distance: 3.5821) <= Loose Threshold (4.75)
2025-10-30 22:47:39,251 [INFO   ]     [Filter 3] PASSED. Best Match: 'AMC_m30_ramp' (Distance: 3.5821)
2025-10-30 22:47:39,252 [INFO   ] 
--- Analyzing Valley at 2020-04-01 (index 816) ---
2025-10-30 22:47:39,253 [INFO   ]   [Filter 2] Valley at 2020-04-01: Slope Check (30d) = 0.1025
2025-10-30 22:47:39,253 [INFO   ]   [Filter 2] Valley at 2020-04-01: Slope Check (60d) = 0.0732
2025-10-30 22:47:39,254 [INFO   ]   [Filter 2] Valley at 2020-04-01: Slope Check (90d) = -0.0500
2025-10-30 22:47:39,254 [INFO   ]   [Filter 2] 30-Day Growth Check: 11.92%
2025-10-30 22:47:39,254 [INFO   ]   [Filter 2] PASSED. Growth of 11.92% >= 10.0% threshold.
2025-10-30 22:47:39,256 [INFO   ]     [Filter 3] DNA Test vs 'DOGE-USD_m30_ramp': Distance = 5.6652
2025-10-30 22:47:39,258 [INFO   ]     [Filter 3] DNA Test vs 'SSYS_m90_ramp': Distance = 6.1153
2025-10-30 22:47:39,260 [INFO   ]     [Filter 3] DNA Test vs 'SHIB-USD_m30_ramp': Distance = 6.4557
2025-10-30 22:47:39,261 [INFO   ]     [Filter 3] DNA Test vs 'CSCO_m90_ramp': Distance = 4.9739
2025-10-30 22:47:39,262 [INFO   ]     [Filter 3] DNA Test vs 'GME_m90_ramp': Distance = 5.7450
2025-10-30 22:47:39,264 [INFO   ]     [Filter 3] DNA Test vs 'IYR_m120_ramp': Distance = 6.0521
2025-10-30 22:47:39,265 [INFO   ]     [Filter 3] DNA Test vs 'VWAGY_m15_ramp': Distance = 7.9257
2025-10-30 22:47:39,266 [INFO   ]     [Filter 3] DNA Test vs 'AMC_m30_ramp': Distance = 5.8428
2025-10-30 22:47:39,266 [INFO   ]     [Filter 3] FAILED. Best Match Distance (4.9739) > Loose Threshold (4.75)
2025-10-30 22:47:39,266 [INFO   ]     [Filter 3] FAILED. No DNA match found below threshold 2.75.
2025-10-30 22:47:39,267 [INFO   ] 
--- Analyzing Valley at 2020-06-04 (index 860) ---
2025-10-30 22:47:39,268 [INFO   ]   [Filter 2] Valley at 2020-06-04: Slope Check (30d) = -0.1352
2025-10-30 22:47:39,268 [INFO   ]   [Filter 2] Valley at 2020-06-04: Slope Check (60d) = -0.2499
2025-10-30 22:47:39,269 [INFO   ]   [Filter 2] Valley at 2020-06-04: Slope Check (90d) = -0.1313
2025-10-30 22:47:39,269 [INFO   ]   [Filter 2] FAILED. No positive slope found.
2025-10-30 22:47:39,269 [INFO   ] 
--- Analyzing Valley at 2021-04-01 (index 1068) ---
2025-10-30 22:47:39,270 [INFO   ]   [Filter 2] Valley at 2021-04-01: Slope Check (30d) = -0.4243
2025-10-30 22:47:39,271 [INFO   ]   [Filter 2] Valley at 2021-04-01: Slope Check (60d) = -0.1439
2025-10-30 22:47:39,272 [INFO   ]   [Filter 2] Valley at 2021-04-01: Slope Check (90d) = -0.0937
2025-10-30 22:47:39,272 [INFO   ]   [Filter 2] FAILED. No positive slope found.
2025-10-30 22:47:39,272 [INFO   ] 
--- Analyzing Valley at 2021-06-04 (index 1112) ---
2025-10-30 22:47:39,273 [INFO   ]   [Filter 2] Valley at 2021-06-04: Slope Check (30d) = -0.0508
2025-10-30 22:47:39,273 [INFO   ]   [Filter 2] Valley at 2021-06-04: Slope Check (60d) = -0.0710
2025-10-30 22:47:39,274 [INFO   ]   [Filter 2] Valley at 2021-06-04: Slope Check (90d) = -0.0347
2025-10-30 22:47:39,274 [INFO   ]   [Filter 2] FAILED. No positive slope found.
2025-10-30 22:47:39,274 [INFO   ] 
--- Analyzing Valley at 2021-08-20 (index 1166) ---
2025-10-30 22:47:39,275 [INFO   ]   [Filter 2] Valley at 2021-08-20: Slope Check (30d) = 0.0188
2025-10-30 22:47:39,276 [INFO   ]   [Filter 2] Valley at 2021-08-20: Slope Check (60d) = -0.0594
2025-10-30 22:47:39,277 [INFO   ]   [Filter 2] Valley at 2021-08-20: Slope Check (90d) = -0.0456
2025-10-30 22:47:39,277 [INFO   ]   [Filter 2] 30-Day Growth Check: 3.56%
2025-10-30 22:47:39,277 [INFO   ]   [Filter 2] FAILED. Growth of 3.56% < 10.0% threshold.
2025-10-30 22:47:39,278 [INFO   ] 
--- Analyzing Valley at 2021-10-25 (index 1211) ---
2025-10-30 22:47:39,279 [INFO   ]   [Filter 2] Valley at 2021-10-25: Slope Check (30d) = 0.0226
2025-10-30 22:47:39,280 [INFO   ]   [Filter 2] Valley at 2021-10-25: Slope Check (60d) = 0.0871
2025-10-30 22:47:39,280 [INFO   ]   [Filter 2] Valley at 2021-10-25: Slope Check (90d) = -0.0116
2025-10-30 22:47:39,281 [INFO   ]   [Filter 2] 30-Day Growth Check: 3.92%
2025-10-30 22:47:39,281 [INFO   ]   [Filter 2] FAILED. Growth of 3.92% < 10.0% threshold.
2025-10-30 22:47:39,281 [INFO   ] 
--- Analyzing Valley at 2021-12-28 (index 1255) ---
2025-10-30 22:47:39,282 [INFO   ]   [Filter 2] Valley at 2021-12-28: Slope Check (30d) = -0.1785
2025-10-30 22:47:39,282 [INFO   ]   [Filter 2] Valley at 2021-12-28: Slope Check (60d) = -0.1260
2025-10-30 22:47:39,283 [INFO   ]   [Filter 2] Valley at 2021-12-28: Slope Check (90d) = -0.0692
2025-10-30 22:47:39,283 [INFO   ]   [Filter 2] FAILED. No positive slope found.
2025-10-30 22:47:39,283 [INFO   ] 
--- Analyzing Valley at 2022-03-25 (index 1316) ---
2025-10-30 22:47:39,284 [INFO   ]   [Filter 2] Valley at 2022-03-25: Slope Check (30d) = -0.1993
2025-10-30 22:47:39,284 [INFO   ]   [Filter 2] Valley at 2022-03-25: Slope Check (60d) = -0.1700
2025-10-30 22:47:39,285 [INFO   ]   [Filter 2] Valley at 2022-03-25: Slope Check (90d) = -0.1379
2025-10-30 22:47:39,285 [INFO   ]   [Filter 2] FAILED. No positive slope found.
2025-10-30 22:47:39,285 [INFO   ] 
--- [Analysis Summary] ---
2025-10-30 22:47:39,285 [INFO   ] Total Valleys Found: 11
2025-10-30 22:47:39,285 [INFO   ] Valleys Passing Filter 2 (Qualification Test): 2
2025-10-30 22:47:39,285 [INFO   ] Valleys Passing Filter 3 (DNA Test): 1
2025-10-30 22:47:39,286 [INFO   ] --- [Historical Analyzer Finished] ---
