2025-10-29 21:21:40,705 [INFO   ] --- [Historical Analyzer Started for ZM] ---
2025-10-29 21:21:41,410 [INFO   ] Loaded 683 data points for ZM.
2025-10-29 21:21:41,411 [INFO   ] Computing full CAC curve with m=15...
2025-10-29 21:22:06,108 [INFO   ] Found 12 significant valleys in the CAC curve.
2025-10-29 21:22:06,108 [INFO   ] 
--- Analyzing Valley at 2019-09-04 (index 95) ---
2025-10-29 21:22:06,110 [INFO   ]   [Filter 2] Valley at 2019-09-04: Slope Check (30d) = -0.5609
2025-10-29 21:22:06,110 [INFO   ]   [Filter 2] Valley at 2019-09-04: Slope Check (60d) = -0.3085
2025-10-29 21:22:06,111 [INFO   ]   [Filter 2] Valley at 2019-09-04: Slope Check (90d) = -0.1717
2025-10-29 21:22:06,111 [INFO   ]   [Filter 2] FAILED. No positive slope found.
2025-10-29 21:22:06,112 [INFO   ] 
--- Analyzing Valley at 2019-09-30 (index 113) ---
2025-10-29 21:22:06,112 [INFO   ]   [Filter 2] Valley at 2019-09-30: Slope Check (30d) = -0.3287
2025-10-29 21:22:06,113 [INFO   ]   [Filter 2] Valley at 2019-09-30: Slope Check (60d) = -0.0909
2025-10-29 21:22:06,114 [INFO   ]   [Filter 2] Valley at 2019-09-30: Slope Check (90d) = 0.0675
2025-10-29 21:22:06,114 [INFO   ]   [Filter 2] PASSED. Best positive slope: 0.0675
2025-10-29 21:22:06,947 [INFO   ]     [Filter 3] DNA Test vs 'DOGE-USD_m30_ramp': Distance = 10.2599
2025-10-29 21:22:06,949 [INFO   ]     [Filter 3] DNA Test vs 'SHIB-USD_m30_ramp': Distance = 9.6346
2025-10-29 21:22:06,951 [INFO   ]     [Filter 3] DNA Test vs 'CSCO_m90_ramp': Distance = 10.0175
2025-10-29 21:22:06,952 [INFO   ]     [Filter 3] DNA Test vs 'GME_m90_ramp': Distance = 10.6702
2025-10-29 21:22:06,954 [INFO   ]     [Filter 3] DNA Test vs 'IYR_m120_ramp': Distance = 9.8155
2025-10-29 21:22:06,955 [INFO   ]     [Filter 3] DNA Test vs 'VWAGY_m15_ramp': Distance = 8.2900
2025-10-29 21:22:06,957 [INFO   ]     [Filter 3] DNA Test vs 'AMC_m30_ramp': Distance = 9.5665
2025-10-29 21:22:06,957 [INFO   ]     [Filter 3] FAILED. No DNA match found below threshold 2.75.
2025-10-29 21:22:06,957 [INFO   ] 
--- Analyzing Valley at 2019-11-25 (index 153) ---
2025-10-29 21:22:06,958 [INFO   ]   [Filter 2] Valley at 2019-11-25: Slope Check (30d) = -0.0894
2025-10-29 21:22:06,959 [INFO   ]   [Filter 2] Valley at 2019-11-25: Slope Check (60d) = 0.4777
2025-10-29 21:22:06,960 [INFO   ]   [Filter 2] Valley at 2019-11-25: Slope Check (90d) = 0.8880
2025-10-29 21:22:06,960 [INFO   ]   [Filter 2] PASSED. Best positive slope: 0.8880
2025-10-29 21:22:06,962 [INFO   ]     [Filter 3] DNA Test vs 'DOGE-USD_m30_ramp': Distance = 9.6650
2025-10-29 21:22:06,963 [INFO   ]     [Filter 3] DNA Test vs 'SHIB-USD_m30_ramp': Distance = 8.0321
2025-10-29 21:22:06,964 [INFO   ]     [Filter 3] DNA Test vs 'CSCO_m90_ramp': Distance = 9.2819
2025-10-29 21:22:06,966 [INFO   ]     [Filter 3] DNA Test vs 'GME_m90_ramp': Distance = 9.3151
2025-10-29 21:22:06,967 [INFO   ]     [Filter 3] DNA Test vs 'IYR_m120_ramp': Distance = 8.2435
2025-10-29 21:22:06,968 [INFO   ]     [Filter 3] DNA Test vs 'VWAGY_m15_ramp': Distance = 6.8720
2025-10-29 21:22:06,969 [INFO   ]     [Filter 3] DNA Test vs 'AMC_m30_ramp': Distance = 8.6080
2025-10-29 21:22:06,969 [INFO   ]     [Filter 3] FAILED. No DNA match found below threshold 2.75.
2025-10-29 21:22:06,970 [INFO   ] 
--- Analyzing Valley at 2019-12-18 (index 169) ---
2025-10-29 21:22:06,970 [INFO   ]   [Filter 2] Valley at 2019-12-18: Slope Check (30d) = 0.3320
2025-10-29 21:22:06,971 [INFO   ]   [Filter 2] Valley at 2019-12-18: Slope Check (60d) = 0.9552
2025-10-29 21:22:06,972 [INFO   ]   [Filter 2] Valley at 2019-12-18: Slope Check (90d) = 1.1038
2025-10-29 21:22:06,972 [INFO   ]   [Filter 2] PASSED. Best positive slope: 1.1038
2025-10-29 21:22:06,973 [INFO   ]     [Filter 3] DNA Test vs 'DOGE-USD_m30_ramp': Distance = 3.4693
2025-10-29 21:22:06,974 [INFO   ]     [Filter 3] DNA Test vs 'SHIB-USD_m30_ramp': Distance = 3.1621
2025-10-29 21:22:06,976 [INFO   ]     [Filter 3] DNA Test vs 'CSCO_m90_ramp': Distance = 3.6144
2025-10-29 21:22:06,977 [INFO   ]     [Filter 3] DNA Test vs 'GME_m90_ramp': Distance = 3.3969
2025-10-29 21:22:06,978 [INFO   ]     [Filter 3] DNA Test vs 'IYR_m120_ramp': Distance = 3.3886
2025-10-29 21:22:06,979 [INFO   ]     [Filter 3] DNA Test vs 'VWAGY_m15_ramp': Distance = 5.7624
2025-10-29 21:22:06,981 [INFO   ]     [Filter 3] DNA Test vs 'AMC_m30_ramp': Distance = 4.4388
2025-10-29 21:22:06,981 [INFO   ]     [Filter 3] FAILED. No DNA match found below threshold 2.75.
2025-10-29 21:22:06,981 [INFO   ] 
--- Analyzing Valley at 2020-09-08 (index 350) ---
2025-10-29 21:22:06,982 [INFO   ]   [Filter 2] Valley at 2020-09-08: Slope Check (30d) = 5.4269
2025-10-29 21:22:06,982 [INFO   ]   [Filter 2] Valley at 2020-09-08: Slope Check (60d) = 0.0131
2025-10-29 21:22:06,983 [INFO   ]   [Filter 2] Valley at 2020-09-08: Slope Check (90d) = -1.3003
2025-10-29 21:22:06,983 [INFO   ]   [Filter 2] PASSED. Best positive slope: 5.4269
2025-10-29 21:22:06,984 [INFO   ]     [Filter 3] DNA Test vs 'DOGE-USD_m30_ramp': Distance = 4.2381
2025-10-29 21:22:06,986 [INFO   ]     [Filter 3] DNA Test vs 'SHIB-USD_m30_ramp': Distance = 5.0056
2025-10-29 21:22:06,987 [INFO   ]     [Filter 3] DNA Test vs 'CSCO_m90_ramp': Distance = 2.9000
2025-10-29 21:22:06,988 [INFO   ]     [Filter 3] DNA Test vs 'GME_m90_ramp': Distance = 4.2688
2025-10-29 21:22:06,989 [INFO   ]     [Filter 3] DNA Test vs 'IYR_m120_ramp': Distance = 2.6255
2025-10-29 21:22:06,990 [INFO   ]     [Filter 3] DNA Test vs 'VWAGY_m15_ramp': Distance = 6.0963
2025-10-29 21:22:06,992 [INFO   ]     [Filter 3] DNA Test vs 'AMC_m30_ramp': Distance = 3.2475
2025-10-29 21:22:06,992 [INFO   ]     [Filter 3] PASSED. Best Match: 'IYR_m120_ramp' (Distance: 2.6255)
2025-10-29 21:22:06,992 [INFO   ] 
--- Analyzing Valley at 2020-10-12 (index 374) ---
2025-10-29 21:22:06,993 [INFO   ]   [Filter 2] Valley at 2020-10-12: Slope Check (30d) = -5.1856
2025-10-29 21:22:06,993 [INFO   ]   [Filter 2] Valley at 2020-10-12: Slope Check (60d) = -3.0109
2025-10-29 21:22:06,994 [INFO   ]   [Filter 2] Valley at 2020-10-12: Slope Check (90d) = -1.4520
2025-10-29 21:22:06,994 [INFO   ]   [Filter 2] FAILED. No positive slope found.
2025-10-29 21:22:06,994 [INFO   ] 
--- Analyzing Valley at 2020-11-17 (index 400) ---
2025-10-29 21:22:06,995 [INFO   ]   [Filter 2] Valley at 2020-11-17: Slope Check (30d) = -2.3131
2025-10-29 21:22:06,996 [INFO   ]   [Filter 2] Valley at 2020-11-17: Slope Check (60d) = -0.5696
2025-10-29 21:22:06,996 [INFO   ]   [Filter 2] Valley at 2020-11-17: Slope Check (90d) = -0.8684
2025-10-29 21:22:06,996 [INFO   ]   [Filter 2] FAILED. No positive slope found.
2025-10-29 21:22:06,996 [INFO   ] 
--- Analyzing Valley at 2021-02-22 (index 464) ---
2025-10-29 21:22:06,997 [INFO   ]   [Filter 2] Valley at 2021-02-22: Slope Check (30d) = -2.4901
2025-10-29 21:22:06,998 [INFO   ]   [Filter 2] Valley at 2021-02-22: Slope Check (60d) = -1.1077
2025-10-29 21:22:06,998 [INFO   ]   [Filter 2] Valley at 2021-02-22: Slope Check (90d) = 0.0266
2025-10-29 21:22:06,999 [INFO   ]   [Filter 2] PASSED. Best positive slope: 0.0266
2025-10-29 21:22:07,000 [INFO   ]     [Filter 3] DNA Test vs 'DOGE-USD_m30_ramp': Distance = 10.0555
2025-10-29 21:22:07,001 [INFO   ]     [Filter 3] DNA Test vs 'SHIB-USD_m30_ramp': Distance = 9.9766
2025-10-29 21:22:07,002 [INFO   ]     [Filter 3] DNA Test vs 'CSCO_m90_ramp': Distance = 10.4402
2025-10-29 21:22:07,004 [INFO   ]     [Filter 3] DNA Test vs 'GME_m90_ramp': Distance = 9.6774
2025-10-29 21:22:07,005 [INFO   ]     [Filter 3] DNA Test vs 'IYR_m120_ramp': Distance = 10.2406
2025-10-29 21:22:07,006 [INFO   ]     [Filter 3] DNA Test vs 'VWAGY_m15_ramp': Distance = 8.3139
2025-10-29 21:22:07,007 [INFO   ]     [Filter 3] DNA Test vs 'AMC_m30_ramp': Distance = 10.3911
2025-10-29 21:22:07,007 [INFO   ]     [Filter 3] FAILED. No DNA match found below threshold 2.75.
2025-10-29 21:22:07,007 [INFO   ] 
--- Analyzing Valley at 2021-04-07 (index 495) ---
2025-10-29 21:22:07,008 [INFO   ]   [Filter 2] Valley at 2021-04-07: Slope Check (30d) = -1.3326
2025-10-29 21:22:07,009 [INFO   ]   [Filter 2] Valley at 2021-04-07: Slope Check (60d) = 0.9936
2025-10-29 21:22:07,010 [INFO   ]   [Filter 2] Valley at 2021-04-07: Slope Check (90d) = 0.9029
2025-10-29 21:22:07,010 [INFO   ]   [Filter 2] PASSED. Best positive slope: 0.9936
2025-10-29 21:22:07,011 [INFO   ]     [Filter 3] DNA Test vs 'DOGE-USD_m30_ramp': Distance = 9.7462
2025-10-29 21:22:07,012 [INFO   ]     [Filter 3] DNA Test vs 'SHIB-USD_m30_ramp': Distance = 10.4459
2025-10-29 21:22:07,013 [INFO   ]     [Filter 3] DNA Test vs 'CSCO_m90_ramp': Distance = 10.1221
2025-10-29 21:22:07,014 [INFO   ]     [Filter 3] DNA Test vs 'GME_m90_ramp': Distance = 8.5572
2025-10-29 21:22:07,016 [INFO   ]     [Filter 3] DNA Test vs 'IYR_m120_ramp': Distance = 10.1790
2025-10-29 21:22:07,017 [INFO   ]     [Filter 3] DNA Test vs 'VWAGY_m15_ramp': Distance = 8.1429
2025-10-29 21:22:07,018 [INFO   ]     [Filter 3] DNA Test vs 'AMC_m30_ramp': Distance = 10.3754
2025-10-29 21:22:07,019 [INFO   ]     [Filter 3] FAILED. No DNA match found below threshold 2.75.
2025-10-29 21:22:07,019 [INFO   ] 
--- Analyzing Valley at 2021-05-24 (index 528) ---
2025-10-29 21:22:07,020 [INFO   ]   [Filter 2] Valley at 2021-05-24: Slope Check (30d) = 2.8131
2025-10-29 21:22:07,021 [INFO   ]   [Filter 2] Valley at 2021-05-24: Slope Check (60d) = 0.6517
2025-10-29 21:22:07,021 [INFO   ]   [Filter 2] Valley at 2021-05-24: Slope Check (90d) = -0.8538
2025-10-29 21:22:07,022 [INFO   ]   [Filter 2] PASSED. Best positive slope: 2.8131
2025-10-29 21:22:07,023 [INFO   ]     [Filter 3] DNA Test vs 'DOGE-USD_m30_ramp': Distance = 3.8078
2025-10-29 21:22:07,024 [INFO   ]     [Filter 3] DNA Test vs 'SHIB-USD_m30_ramp': Distance = 3.4887
2025-10-29 21:22:07,026 [INFO   ]     [Filter 3] DNA Test vs 'CSCO_m90_ramp': Distance = 2.5200
2025-10-29 21:22:07,027 [INFO   ]     [Filter 3] DNA Test vs 'GME_m90_ramp': Distance = 4.3748
2025-10-29 21:22:07,028 [INFO   ]     [Filter 3] DNA Test vs 'IYR_m120_ramp': Distance = 1.5655
2025-10-29 21:22:07,029 [INFO   ]     [Filter 3] DNA Test vs 'VWAGY_m15_ramp': Distance = 6.2234
2025-10-29 21:22:07,030 [INFO   ]     [Filter 3] DNA Test vs 'AMC_m30_ramp': Distance = 2.5948
2025-10-29 21:22:07,030 [INFO   ]     [Filter 3] PASSED. Best Match: 'IYR_m120_ramp' (Distance: 1.5655)
2025-10-29 21:22:07,031 [INFO   ] 
--- Analyzing Valley at 2021-06-25 (index 551) ---
2025-10-29 21:22:07,031 [INFO   ]   [Filter 2] Valley at 2021-06-25: Slope Check (30d) = -0.2788
2025-10-29 21:22:07,032 [INFO   ]   [Filter 2] Valley at 2021-06-25: Slope Check (60d) = -1.8505
2025-10-29 21:22:07,033 [INFO   ]   [Filter 2] Valley at 2021-06-25: Slope Check (90d) = -1.7327
2025-10-29 21:22:07,033 [INFO   ]   [Filter 2] FAILED. No positive slope found.
2025-10-29 21:22:07,033 [INFO   ] 
--- Analyzing Valley at 2021-08-10 (index 582) ---
2025-10-29 21:22:07,034 [INFO   ]   [Filter 2] Valley at 2021-08-10: Slope Check (30d) = -3.2523
2025-10-29 21:22:07,034 [INFO   ]   [Filter 2] Valley at 2021-08-10: Slope Check (60d) = -1.5807
2025-10-29 21:22:07,035 [INFO   ]   [Filter 2] Valley at 2021-08-10: Slope Check (90d) = -1.6062
2025-10-29 21:22:07,035 [INFO   ]   [Filter 2] FAILED. No positive slope found.
2025-10-29 21:22:07,035 [INFO   ] 
--- [Analysis Summary] ---
2025-10-29 21:22:07,035 [INFO   ] Total Valleys Found: 12
2025-10-29 21:22:07,035 [INFO   ] Valleys Passing Filter 2 (Slope Test): 7
2025-10-29 21:22:07,036 [INFO   ] Valleys Passing Filter 3 (DNA Test): 2
2025-10-29 21:22:07,036 [INFO   ] --- [Historical Analyzer Finished] ---
