2025-10-29 21:21:08,478 [INFO   ] --- [Historical Analyzer Started for PTON] ---
2025-10-29 21:21:09,304 [INFO   ] Loaded 572 data points for PTON.
2025-10-29 21:21:09,306 [INFO   ] Computing full CAC curve with m=10...
2025-10-29 21:21:30,824 [INFO   ] Found 11 significant valleys in the CAC curve.
2025-10-29 21:21:30,824 [INFO   ] 
--- Analyzing Valley at 2020-01-29 (index 85) ---
2025-10-29 21:21:30,826 [INFO   ]   [Filter 2] Valley at 2020-01-29: Slope Check (30d) = -0.2810
2025-10-29 21:21:30,827 [INFO   ]   [Filter 2] Valley at 2020-01-29: Slope Check (60d) = 0.0048
2025-10-29 21:21:30,827 [INFO   ]   [Filter 2] Valley at 2020-01-29: Slope Check (90d) = 0.2225
2025-10-29 21:21:30,827 [INFO   ]   [Filter 2] PASSED. Best positive slope: 0.2225
2025-10-29 21:21:31,637 [INFO   ]     [Filter 3] DNA Test vs 'DOGE-USD_m30_ramp': Distance = 9.8195
2025-10-29 21:21:31,639 [INFO   ]     [Filter 3] DNA Test vs 'SHIB-USD_m30_ramp': Distance = 9.4912
2025-10-29 21:21:31,641 [INFO   ]     [Filter 3] DNA Test vs 'CSCO_m90_ramp': Distance = 10.3285
2025-10-29 21:21:31,642 [INFO   ]     [Filter 3] DNA Test vs 'GME_m90_ramp': Distance = 9.9486
2025-10-29 21:21:31,643 [INFO   ]     [Filter 3] DNA Test vs 'IYR_m120_ramp': Distance = 10.3884
2025-10-29 21:21:31,645 [INFO   ]     [Filter 3] DNA Test vs 'VWAGY_m15_ramp': Distance = 9.0888
2025-10-29 21:21:31,646 [INFO   ]     [Filter 3] DNA Test vs 'AMC_m30_ramp': Distance = 10.1629
2025-10-29 21:21:31,646 [INFO   ]     [Filter 3] FAILED. No DNA match found below threshold 2.75.
2025-10-29 21:21:31,646 [INFO   ] 
--- Analyzing Valley at 2020-04-09 (index 135) ---
2025-10-29 21:21:31,647 [INFO   ]   [Filter 2] Valley at 2020-04-09: Slope Check (30d) = 0.6171
2025-10-29 21:21:31,648 [INFO   ]   [Filter 2] Valley at 2020-04-09: Slope Check (60d) = 0.4858
2025-10-29 21:21:31,649 [INFO   ]   [Filter 2] Valley at 2020-04-09: Slope Check (90d) = 0.4675
2025-10-29 21:21:31,649 [INFO   ]   [Filter 2] PASSED. Best positive slope: 0.6171
2025-10-29 21:21:31,651 [INFO   ]     [Filter 3] DNA Test vs 'DOGE-USD_m30_ramp': Distance = 5.2086
2025-10-29 21:21:31,652 [INFO   ]     [Filter 3] DNA Test vs 'SHIB-USD_m30_ramp': Distance = 2.9362
2025-10-29 21:21:31,654 [INFO   ]     [Filter 3] DNA Test vs 'CSCO_m90_ramp': Distance = 3.7326
2025-10-29 21:21:31,655 [INFO   ]     [Filter 3] DNA Test vs 'GME_m90_ramp': Distance = 6.4791
2025-10-29 21:21:31,657 [INFO   ]     [Filter 3] DNA Test vs 'IYR_m120_ramp': Distance = 2.8863
2025-10-29 21:21:31,658 [INFO   ]     [Filter 3] DNA Test vs 'VWAGY_m15_ramp': Distance = 6.4769
2025-10-29 21:21:31,659 [INFO   ]     [Filter 3] DNA Test vs 'AMC_m30_ramp': Distance = 3.1917
2025-10-29 21:21:31,659 [INFO   ]     [Filter 3] FAILED. No DNA match found below threshold 2.75.
2025-10-29 21:21:31,660 [INFO   ] 
--- Analyzing Valley at 2020-05-01 (index 150) ---
2025-10-29 21:21:31,660 [INFO   ]   [Filter 2] Valley at 2020-05-01: Slope Check (30d) = 0.3121
2025-10-29 21:21:31,661 [INFO   ]   [Filter 2] Valley at 2020-05-01: Slope Check (60d) = 0.4785
2025-10-29 21:21:31,662 [INFO   ]   [Filter 2] Valley at 2020-05-01: Slope Check (90d) = 0.4522
2025-10-29 21:21:31,662 [INFO   ]   [Filter 2] PASSED. Best positive slope: 0.4785
2025-10-29 21:21:31,663 [INFO   ]     [Filter 3] DNA Test vs 'DOGE-USD_m30_ramp': Distance = 4.4205
2025-10-29 21:21:31,665 [INFO   ]     [Filter 3] DNA Test vs 'SHIB-USD_m30_ramp': Distance = 6.0296
2025-10-29 21:21:31,666 [INFO   ]     [Filter 3] DNA Test vs 'CSCO_m90_ramp': Distance = 3.5141
2025-10-29 21:21:31,667 [INFO   ]     [Filter 3] DNA Test vs 'GME_m90_ramp': Distance = 6.1487
2025-10-29 21:21:31,668 [INFO   ]     [Filter 3] DNA Test vs 'IYR_m120_ramp': Distance = 5.0500
2025-10-29 21:21:31,670 [INFO   ]     [Filter 3] DNA Test vs 'VWAGY_m15_ramp': Distance = 7.1193
2025-10-29 21:21:31,671 [INFO   ]     [Filter 3] DNA Test vs 'AMC_m30_ramp': Distance = 4.8264
2025-10-29 21:21:31,671 [INFO   ]     [Filter 3] FAILED. No DNA match found below threshold 2.75.
2025-10-29 21:21:31,671 [INFO   ] 
--- Analyzing Valley at 2020-08-24 (index 229) ---
2025-10-29 21:21:31,672 [INFO   ]   [Filter 2] Valley at 2020-08-24: Slope Check (30d) = 1.2176
2025-10-29 21:21:31,673 [INFO   ]   [Filter 2] Valley at 2020-08-24: Slope Check (60d) = 0.8431
2025-10-29 21:21:31,674 [INFO   ]   [Filter 2] Valley at 2020-08-24: Slope Check (90d) = 0.6521
2025-10-29 21:21:31,674 [INFO   ]   [Filter 2] PASSED. Best positive slope: 1.2176
2025-10-29 21:21:31,675 [INFO   ]     [Filter 3] DNA Test vs 'DOGE-USD_m30_ramp': Distance = 4.6041
2025-10-29 21:21:31,677 [INFO   ]     [Filter 3] DNA Test vs 'SHIB-USD_m30_ramp': Distance = 4.4481
2025-10-29 21:21:31,679 [INFO   ]     [Filter 3] DNA Test vs 'CSCO_m90_ramp': Distance = 2.8755
2025-10-29 21:21:31,680 [INFO   ]     [Filter 3] DNA Test vs 'GME_m90_ramp': Distance = 5.4314
2025-10-29 21:21:31,682 [INFO   ]     [Filter 3] DNA Test vs 'IYR_m120_ramp': Distance = 2.7351
2025-10-29 21:21:31,684 [INFO   ]     [Filter 3] DNA Test vs 'VWAGY_m15_ramp': Distance = 6.1306
2025-10-29 21:21:31,686 [INFO   ]     [Filter 3] DNA Test vs 'AMC_m30_ramp': Distance = 3.2131
2025-10-29 21:21:31,686 [INFO   ]     [Filter 3] PASSED. Best Match: 'IYR_m120_ramp' (Distance: 2.7351)
2025-10-29 21:21:31,686 [INFO   ] 
--- Analyzing Valley at 2020-09-18 (index 247) ---
2025-10-29 21:21:31,687 [INFO   ]   [Filter 2] Valley at 2020-09-18: Slope Check (30d) = 1.3461
2025-10-29 21:21:31,688 [INFO   ]   [Filter 2] Valley at 2020-09-18: Slope Check (60d) = 0.1211
2025-10-29 21:21:31,690 [INFO   ]   [Filter 2] Valley at 2020-09-18: Slope Check (90d) = 0.6270
2025-10-29 21:21:31,690 [INFO   ]   [Filter 2] PASSED. Best positive slope: 1.3461
2025-10-29 21:21:31,692 [INFO   ]     [Filter 3] DNA Test vs 'DOGE-USD_m30_ramp': Distance = 3.0963
2025-10-29 21:21:31,693 [INFO   ]     [Filter 3] DNA Test vs 'SHIB-USD_m30_ramp': Distance = 3.3498
2025-10-29 21:21:31,695 [INFO   ]     [Filter 3] DNA Test vs 'CSCO_m90_ramp': Distance = 3.0963
2025-10-29 21:21:31,697 [INFO   ]     [Filter 3] DNA Test vs 'GME_m90_ramp': Distance = 3.3264
2025-10-29 21:21:31,698 [INFO   ]     [Filter 3] DNA Test vs 'IYR_m120_ramp': Distance = 3.6772
2025-10-29 21:21:31,699 [INFO   ]     [Filter 3] DNA Test vs 'VWAGY_m15_ramp': Distance = 6.8535
2025-10-29 21:21:31,700 [INFO   ]     [Filter 3] DNA Test vs 'AMC_m30_ramp': Distance = 4.1495
2025-10-29 21:21:31,700 [INFO   ]     [Filter 3] FAILED. No DNA match found below threshold 2.75.
2025-10-29 21:21:31,701 [INFO   ] 
--- Analyzing Valley at 2020-10-06 (index 259) ---
2025-10-29 21:21:31,701 [INFO   ]   [Filter 2] Valley at 2020-10-06: Slope Check (30d) = -0.7211
2025-10-29 21:21:31,702 [INFO   ]   [Filter 2] Valley at 2020-10-06: Slope Check (60d) = 0.3240
2025-10-29 21:21:31,703 [INFO   ]   [Filter 2] Valley at 2020-10-06: Slope Check (90d) = 0.5289
2025-10-29 21:21:31,703 [INFO   ]   [Filter 2] PASSED. Best positive slope: 0.5289
2025-10-29 21:21:31,704 [INFO   ]     [Filter 3] DNA Test vs 'DOGE-USD_m30_ramp': Distance = 8.8572
2025-10-29 21:21:31,705 [INFO   ]     [Filter 3] DNA Test vs 'SHIB-USD_m30_ramp': Distance = 9.7495
2025-10-29 21:21:31,707 [INFO   ]     [Filter 3] DNA Test vs 'CSCO_m90_ramp': Distance = 9.1631
2025-10-29 21:21:31,708 [INFO   ]     [Filter 3] DNA Test vs 'GME_m90_ramp': Distance = 9.1143
2025-10-29 21:21:31,709 [INFO   ]     [Filter 3] DNA Test vs 'IYR_m120_ramp': Distance = 10.1111
2025-10-29 21:21:31,710 [INFO   ]     [Filter 3] DNA Test vs 'VWAGY_m15_ramp': Distance = 8.8130
2025-10-29 21:21:31,711 [INFO   ]     [Filter 3] DNA Test vs 'AMC_m30_ramp': Distance = 9.7677
2025-10-29 21:21:31,712 [INFO   ]     [Filter 3] FAILED. No DNA match found below threshold 2.75.
2025-10-29 21:21:31,712 [INFO   ] 
--- Analyzing Valley at 2020-12-16 (index 309) ---
2025-10-29 21:21:31,713 [INFO   ]   [Filter 2] Valley at 2020-12-16: Slope Check (30d) = 0.2241
2025-10-29 21:21:31,714 [INFO   ]   [Filter 2] Valley at 2020-12-16: Slope Check (60d) = -0.7571
2025-10-29 21:21:31,714 [INFO   ]   [Filter 2] Valley at 2020-12-16: Slope Check (90d) = -0.6839
2025-10-29 21:21:31,714 [INFO   ]   [Filter 2] PASSED. Best positive slope: 0.2241
2025-10-29 21:21:31,716 [INFO   ]     [Filter 3] DNA Test vs 'DOGE-USD_m30_ramp': Distance = 6.5388
2025-10-29 21:21:31,717 [INFO   ]     [Filter 3] DNA Test vs 'SHIB-USD_m30_ramp': Distance = 6.0503
2025-10-29 21:21:31,718 [INFO   ]     [Filter 3] DNA Test vs 'CSCO_m90_ramp': Distance = 6.0003
2025-10-29 21:21:31,720 [INFO   ]     [Filter 3] DNA Test vs 'GME_m90_ramp': Distance = 6.6217
2025-10-29 21:21:31,721 [INFO   ]     [Filter 3] DNA Test vs 'IYR_m120_ramp': Distance = 7.1815
2025-10-29 21:21:31,722 [INFO   ]     [Filter 3] DNA Test vs 'VWAGY_m15_ramp': Distance = 7.9300
2025-10-29 21:21:31,724 [INFO   ]     [Filter 3] DNA Test vs 'AMC_m30_ramp': Distance = 7.1265
2025-10-29 21:21:31,724 [INFO   ]     [Filter 3] FAILED. No DNA match found below threshold 2.75.
2025-10-29 21:21:31,724 [INFO   ] 
--- Analyzing Valley at 2021-01-04 (index 320) ---
2025-10-29 21:21:31,725 [INFO   ]   [Filter 2] Valley at 2021-01-04: Slope Check (30d) = -0.2640
2025-10-29 21:21:31,725 [INFO   ]   [Filter 2] Valley at 2021-01-04: Slope Check (60d) = -1.0860
2025-10-29 21:21:31,726 [INFO   ]   [Filter 2] Valley at 2021-01-04: Slope Check (90d) = -0.7890
2025-10-29 21:21:31,726 [INFO   ]   [Filter 2] FAILED. No positive slope found.
2025-10-29 21:21:31,726 [INFO   ] 
--- Analyzing Valley at 2021-07-14 (index 452) ---
2025-10-29 21:21:31,727 [INFO   ]   [Filter 2] Valley at 2021-07-14: Slope Check (30d) = -0.3688
2025-10-29 21:21:31,727 [INFO   ]   [Filter 2] Valley at 2021-07-14: Slope Check (60d) = -0.5919
2025-10-29 21:21:31,728 [INFO   ]   [Filter 2] Valley at 2021-07-14: Slope Check (90d) = -0.6678
2025-10-29 21:21:31,728 [INFO   ]   [Filter 2] FAILED. No positive slope found.
2025-10-29 21:21:31,728 [INFO   ] 
--- Analyzing Valley at 2021-09-09 (index 492) ---
2025-10-29 21:21:31,729 [INFO   ]   [Filter 2] Valley at 2021-09-09: Slope Check (30d) = -0.9088
2025-10-29 21:21:31,730 [INFO   ]   [Filter 2] Valley at 2021-09-09: Slope Check (60d) = -1.1251
2025-10-29 21:21:31,730 [INFO   ]   [Filter 2] FAILED. No positive slope found.
2025-10-29 21:21:31,730 [INFO   ] 
--- Analyzing Valley at 2021-10-04 (index 509) ---
2025-10-29 21:21:31,730 [INFO   ]   [Filter 2] Valley at 2021-10-04: Slope Check (30d) = -1.0330
2025-10-29 21:21:31,731 [INFO   ]   [Filter 2] Valley at 2021-10-04: Slope Check (60d) = -1.1415
2025-10-29 21:21:31,731 [INFO   ]   [Filter 2] FAILED. No positive slope found.
2025-10-29 21:21:31,731 [INFO   ] 
--- [Analysis Summary] ---
2025-10-29 21:21:31,731 [INFO   ] Total Valleys Found: 11
2025-10-29 21:21:31,731 [INFO   ] Valleys Passing Filter 2 (Slope Test): 7
2025-10-29 21:21:31,731 [INFO   ] Valleys Passing Filter 3 (DNA Test): 1
2025-10-29 21:21:31,732 [INFO   ] --- [Historical Analyzer Finished] ---
