2025-10-29 22:07:38,792 [INFO   ] --- [Historical Analyzer Started for KOSS] ---
2025-10-29 22:07:39,542 [INFO   ] Loaded 1259 data points for KOSS.
2025-10-29 22:07:39,543 [INFO   ] Computing full CAC curve with m=15...
2025-10-29 22:08:04,094 [INFO   ] Found 17 significant valleys in the CAC curve.
2025-10-29 22:08:04,094 [INFO   ] 
--- Analyzing Valley at 2018-04-20 (index 75) ---
2025-10-29 22:08:04,095 [INFO   ]   [Filter 2] Valley at 2018-04-20: Slope Check (30d) = 0.0173
2025-10-29 22:08:04,096 [INFO   ]   [Filter 2] Valley at 2018-04-20: Slope Check (60d) = 0.0109
2025-10-29 22:08:04,097 [INFO   ]   [Filter 2] Valley at 2018-04-20: Slope Check (90d) = 0.0146
2025-10-29 22:08:04,097 [INFO   ]   [Filter 2] PASSED. Best positive slope: 0.0173
2025-10-29 22:08:02,461 [INFO   ]     [Filter 3] DNA Test vs 'DOGE-USD_m30_ramp': Distance = 4.8085
2025-10-29 22:08:02,463 [INFO   ]     [Filter 3] DNA Test vs 'SHIB-USD_m30_ramp': Distance = 3.8266
2025-10-29 22:08:02,464 [INFO   ]     [Filter 3] DNA Test vs 'CSCO_m90_ramp': Distance = 4.4773
2025-10-29 22:08:02,465 [INFO   ]     [Filter 3] DNA Test vs 'GME_m90_ramp': Distance = 4.1467
2025-10-29 22:08:02,467 [INFO   ]     [Filter 3] DNA Test vs 'IYR_m120_ramp': Distance = 4.8316
2025-10-29 22:08:02,468 [INFO   ]     [Filter 3] DNA Test vs 'VWAGY_m15_ramp': Distance = 6.8065
2025-10-29 22:08:02,470 [INFO   ]     [Filter 3] DNA Test vs 'AMC_m30_ramp': Distance = 5.3907
2025-10-29 22:08:02,470 [INFO   ]     [Filter 3] FAILED. No DNA match found below threshold 2.75.
2025-10-29 22:08:02,470 [INFO   ] 
--- Analyzing Valley at 2018-07-17 (index 135) ---
2025-10-29 22:08:02,471 [INFO   ]   [Filter 2] Valley at 2018-07-17: Slope Check (30d) = 0.0466
2025-10-29 22:08:02,472 [INFO   ]   [Filter 2] Valley at 2018-07-17: Slope Check (60d) = 0.0036
2025-10-29 22:08:02,473 [INFO   ]   [Filter 2] Valley at 2018-07-17: Slope Check (90d) = -0.0068
2025-10-29 22:08:02,473 [INFO   ]   [Filter 2] PASSED. Best positive slope: 0.0466
2025-10-29 22:08:02,475 [INFO   ]     [Filter 3] DNA Test vs 'DOGE-USD_m30_ramp': Distance = 6.8849
2025-10-29 22:08:02,476 [INFO   ]     [Filter 3] DNA Test vs 'SHIB-USD_m30_ramp': Distance = 6.1327
2025-10-29 22:08:02,477 [INFO   ]     [Filter 3] DNA Test vs 'CSCO_m90_ramp': Distance = 5.3941
2025-10-29 22:08:02,479 [INFO   ]     [Filter 3] DNA Test vs 'GME_m90_ramp': Distance = 7.1552
2025-10-29 22:08:02,480 [INFO   ]     [Filter 3] DNA Test vs 'IYR_m120_ramp': Distance = 4.2056
2025-10-29 22:08:02,481 [INFO   ]     [Filter 3] DNA Test vs 'VWAGY_m15_ramp': Distance = 6.6027
2025-10-29 22:08:02,482 [INFO   ]     [Filter 3] DNA Test vs 'AMC_m30_ramp': Distance = 4.5168
2025-10-29 22:08:02,483 [INFO   ]     [Filter 3] FAILED. No DNA match found below threshold 2.75.
2025-10-29 22:08:02,483 [INFO   ] 
--- Analyzing Valley at 2018-08-20 (index 159) ---
2025-10-29 22:08:02,483 [INFO   ]   [Filter 2] Valley at 2018-08-20: Slope Check (30d) = -0.0554
2025-10-29 22:08:02,484 [INFO   ]   [Filter 2] Valley at 2018-08-20: Slope Check (60d) = -0.0243
2025-10-29 22:08:02,485 [INFO   ]   [Filter 2] Valley at 2018-08-20: Slope Check (90d) = -0.0214
2025-10-29 22:08:02,485 [INFO   ]   [Filter 2] FAILED. No positive slope found.
2025-10-29 22:08:02,485 [INFO   ] 
--- Analyzing Valley at 2018-10-05 (index 192) ---
2025-10-29 22:08:02,486 [INFO   ]   [Filter 2] Valley at 2018-10-05: Slope Check (30d) = -0.0260
2025-10-29 22:08:02,486 [INFO   ]   [Filter 2] Valley at 2018-10-05: Slope Check (60d) = -0.0181
2025-10-29 22:08:02,487 [INFO   ]   [Filter 2] Valley at 2018-10-05: Slope Check (90d) = -0.0099
2025-10-29 22:08:02,487 [INFO   ]   [Filter 2] FAILED. No positive slope found.
2025-10-29 22:08:02,487 [INFO   ] 
--- Analyzing Valley at 2018-12-26 (index 247) ---
2025-10-29 22:08:02,488 [INFO   ]   [Filter 2] Valley at 2018-12-26: Slope Check (30d) = -0.0031
2025-10-29 22:08:02,488 [INFO   ]   [Filter 2] Valley at 2018-12-26: Slope Check (60d) = -0.0006
2025-10-29 22:08:02,489 [INFO   ]   [Filter 2] Valley at 2018-12-26: Slope Check (90d) = 0.0013
2025-10-29 22:08:02,489 [INFO   ]   [Filter 2] PASSED. Best positive slope: 0.0013
2025-10-29 22:08:02,491 [INFO   ]     [Filter 3] DNA Test vs 'DOGE-USD_m30_ramp': Distance = 7.8134
2025-10-29 22:08:02,492 [INFO   ]     [Filter 3] DNA Test vs 'SHIB-USD_m30_ramp': Distance = 8.6956
2025-10-29 22:08:02,493 [INFO   ]     [Filter 3] DNA Test vs 'CSCO_m90_ramp': Distance = 8.1814
2025-10-29 22:08:02,495 [INFO   ]     [Filter 3] DNA Test vs 'GME_m90_ramp': Distance = 6.1363
2025-10-29 22:08:02,496 [INFO   ]     [Filter 3] DNA Test vs 'IYR_m120_ramp': Distance = 8.9317
2025-10-29 22:08:02,497 [INFO   ]     [Filter 3] DNA Test vs 'VWAGY_m15_ramp': Distance = 8.4448
2025-10-29 22:08:02,498 [INFO   ]     [Filter 3] DNA Test vs 'AMC_m30_ramp': Distance = 9.0526
2025-10-29 22:08:02,498 [INFO   ]     [Filter 3] FAILED. No DNA match found below threshold 2.75.
2025-10-29 22:08:02,498 [INFO   ] 
--- Analyzing Valley at 2019-05-24 (index 350) ---
2025-10-29 22:08:02,499 [INFO   ]   [Filter 2] Valley at 2019-05-24: Slope Check (30d) = -0.0029
2025-10-29 22:08:02,500 [INFO   ]   [Filter 2] Valley at 2019-05-24: Slope Check (60d) = -0.0036
2025-10-29 22:08:02,501 [INFO   ]   [Filter 2] Valley at 2019-05-24: Slope Check (90d) = -0.0010
2025-10-29 22:08:02,501 [INFO   ]   [Filter 2] FAILED. No positive slope found.
2025-10-29 22:08:02,501 [INFO   ] 
--- Analyzing Valley at 2019-08-06 (index 400) ---
2025-10-29 22:08:02,502 [INFO   ]   [Filter 2] Valley at 2019-08-06: Slope Check (30d) = 0.0024
2025-10-29 22:08:02,502 [INFO   ]   [Filter 2] Valley at 2019-08-06: Slope Check (60d) = -0.0003
2025-10-29 22:08:02,503 [INFO   ]   [Filter 2] Valley at 2019-08-06: Slope Check (90d) = -0.0058
2025-10-29 22:08:02,503 [INFO   ]   [Filter 2] PASSED. Best positive slope: 0.0024
2025-10-29 22:08:02,504 [INFO   ]     [Filter 3] DNA Test vs 'DOGE-USD_m30_ramp': Distance = 7.0450
2025-10-29 22:08:02,506 [INFO   ]     [Filter 3] DNA Test vs 'SHIB-USD_m30_ramp': Distance = 8.0585
2025-10-29 22:08:02,507 [INFO   ]     [Filter 3] DNA Test vs 'CSCO_m90_ramp': Distance = 6.9185
2025-10-29 22:08:02,508 [INFO   ]     [Filter 3] DNA Test vs 'GME_m90_ramp': Distance = 6.6659
2025-10-29 22:08:02,510 [INFO   ]     [Filter 3] DNA Test vs 'IYR_m120_ramp': Distance = 7.1417
2025-10-29 22:08:02,511 [INFO   ]     [Filter 3] DNA Test vs 'VWAGY_m15_ramp': Distance = 7.6131
2025-10-29 22:08:02,512 [INFO   ]     [Filter 3] DNA Test vs 'AMC_m30_ramp': Distance = 7.3923
2025-10-29 22:08:02,512 [INFO   ]     [Filter 3] FAILED. No DNA match found below threshold 2.75.
2025-10-29 22:08:02,512 [INFO   ] 
--- Analyzing Valley at 2019-09-25 (index 435) ---
2025-10-29 22:08:02,513 [INFO   ]   [Filter 2] Valley at 2019-09-25: Slope Check (30d) = -0.0091
2025-10-29 22:08:02,514 [INFO   ]   [Filter 2] Valley at 2019-09-25: Slope Check (60d) = -0.0110
2025-10-29 22:08:02,514 [INFO   ]   [Filter 2] Valley at 2019-09-25: Slope Check (90d) = -0.0065
2025-10-29 22:08:02,515 [INFO   ]   [Filter 2] FAILED. No positive slope found.
2025-10-29 22:08:02,515 [INFO   ] 
--- Analyzing Valley at 2019-10-23 (index 455) ---
2025-10-29 22:08:02,515 [INFO   ]   [Filter 2] Valley at 2019-10-23: Slope Check (30d) = -0.0160
2025-10-29 22:08:02,516 [INFO   ]   [Filter 2] Valley at 2019-10-23: Slope Check (60d) = -0.0057
2025-10-29 22:08:02,517 [INFO   ]   [Filter 2] Valley at 2019-10-23: Slope Check (90d) = -0.0048
2025-10-29 22:08:02,517 [INFO   ]   [Filter 2] FAILED. No positive slope found.
2025-10-29 22:08:02,517 [INFO   ] 
--- Analyzing Valley at 2019-12-16 (index 492) ---
2025-10-29 22:08:02,517 [INFO   ]   [Filter 2] Valley at 2019-12-16: Slope Check (30d) = -0.0002
2025-10-29 22:08:02,518 [INFO   ]   [Filter 2] Valley at 2019-12-16: Slope Check (60d) = -0.0075
2025-10-29 22:08:02,519 [INFO   ]   [Filter 2] Valley at 2019-12-16: Slope Check (90d) = -0.0088
2025-10-29 22:08:02,519 [INFO   ]   [Filter 2] FAILED. No positive slope found.
2025-10-29 22:08:02,519 [INFO   ] 
--- Analyzing Valley at 2020-03-26 (index 561) ---
2025-10-29 22:08:02,519 [INFO   ]   [Filter 2] Valley at 2020-03-26: Slope Check (30d) = 0.0194
2025-10-29 22:08:02,520 [INFO   ]   [Filter 2] Valley at 2020-03-26: Slope Check (60d) = 0.0094
2025-10-29 22:08:02,521 [INFO   ]   [Filter 2] Valley at 2020-03-26: Slope Check (90d) = 0.0105
2025-10-29 22:08:02,521 [INFO   ]   [Filter 2] PASSED. Best positive slope: 0.0194
2025-10-29 22:08:02,522 [INFO   ]     [Filter 3] DNA Test vs 'DOGE-USD_m30_ramp': Distance = 3.5947
2025-10-29 22:08:02,524 [INFO   ]     [Filter 3] DNA Test vs 'SHIB-USD_m30_ramp': Distance = 3.1840
2025-10-29 22:08:02,525 [INFO   ]     [Filter 3] DNA Test vs 'CSCO_m90_ramp': Distance = 3.0175
2025-10-29 22:08:02,526 [INFO   ]     [Filter 3] DNA Test vs 'GME_m90_ramp': Distance = 4.9179
2025-10-29 22:08:02,527 [INFO   ]     [Filter 3] DNA Test vs 'IYR_m120_ramp': Distance = 2.9347
2025-10-29 22:08:02,529 [INFO   ]     [Filter 3] DNA Test vs 'VWAGY_m15_ramp': Distance = 6.6998
2025-10-29 22:08:02,530 [INFO   ]     [Filter 3] DNA Test vs 'AMC_m30_ramp': Distance = 3.2246
2025-10-29 22:08:02,530 [INFO   ]     [Filter 3] FAILED. No DNA match found below threshold 2.75.
2025-10-29 22:08:02,530 [INFO   ] 
--- Analyzing Valley at 2021-04-14 (index 825) ---
2025-10-29 22:08:02,531 [INFO   ]   [Filter 2] Valley at 2021-04-14: Slope Check (30d) = -0.0603
2025-10-29 22:08:02,532 [INFO   ]   [Filter 2] Valley at 2021-04-14: Slope Check (60d) = 0.1228
2025-10-29 22:08:02,533 [INFO   ]   [Filter 2] Valley at 2021-04-14: Slope Check (90d) = -0.0087
2025-10-29 22:08:02,533 [INFO   ]   [Filter 2] PASSED. Best positive slope: 0.1228
2025-10-29 22:08:02,534 [INFO   ]     [Filter 3] DNA Test vs 'DOGE-USD_m30_ramp': Distance = 9.1990
2025-10-29 22:08:02,535 [INFO   ]     [Filter 3] DNA Test vs 'SHIB-USD_m30_ramp': Distance = 9.6740
2025-10-29 22:08:02,537 [INFO   ]     [Filter 3] DNA Test vs 'CSCO_m90_ramp': Distance = 9.2361
2025-10-29 22:08:02,538 [INFO   ]     [Filter 3] DNA Test vs 'GME_m90_ramp': Distance = 9.8143
2025-10-29 22:08:02,541 [INFO   ]     [Filter 3] DNA Test vs 'IYR_m120_ramp': Distance = 9.3137
2025-10-29 22:08:02,543 [INFO   ]     [Filter 3] DNA Test vs 'VWAGY_m15_ramp': Distance = 6.9512
2025-10-29 22:08:02,544 [INFO   ]     [Filter 3] DNA Test vs 'AMC_m30_ramp': Distance = 9.1722
2025-10-29 22:08:02,544 [INFO   ]     [Filter 3] FAILED. No DNA match found below threshold 2.75.
2025-10-29 22:08:02,544 [INFO   ] 
--- Analyzing Valley at 2021-06-02 (index 859) ---
2025-10-29 22:08:02,545 [INFO   ]   [Filter 2] Valley at 2021-06-02: Slope Check (30d) = -0.3744
2025-10-29 22:08:02,546 [INFO   ]   [Filter 2] Valley at 2021-06-02: Slope Check (60d) = -0.1957
2025-10-29 22:08:02,546 [INFO   ]   [Filter 2] Valley at 2021-06-02: Slope Check (90d) = -0.1183
2025-10-29 22:08:02,547 [INFO   ]   [Filter 2] FAILED. No positive slope found.
2025-10-29 22:08:02,547 [INFO   ] 
--- Analyzing Valley at 2021-07-20 (index 892) ---
2025-10-29 22:08:02,547 [INFO   ]   [Filter 2] Valley at 2021-07-20: Slope Check (30d) = -0.0233
2025-10-29 22:08:02,548 [INFO   ]   [Filter 2] Valley at 2021-07-20: Slope Check (60d) = -0.0403
2025-10-29 22:08:02,549 [INFO   ]   [Filter 2] Valley at 2021-07-20: Slope Check (90d) = -0.0374
2025-10-29 22:08:02,549 [INFO   ]   [Filter 2] FAILED. No positive slope found.
2025-10-29 22:08:02,549 [INFO   ] 
--- Analyzing Valley at 2021-08-20 (index 915) ---
2025-10-29 22:08:02,550 [INFO   ]   [Filter 2] Valley at 2021-08-20: Slope Check (30d) = -0.0784
2025-10-29 22:08:02,550 [INFO   ]   [Filter 2] Valley at 2021-08-20: Slope Check (60d) = -0.0443
2025-10-29 22:08:02,551 [INFO   ]   [Filter 2] Valley at 2021-08-20: Slope Check (90d) = -0.0732
2025-10-29 22:08:02,551 [INFO   ]   [Filter 2] FAILED. No positive slope found.
2025-10-29 22:08:02,551 [INFO   ] 
--- Analyzing Valley at 2021-10-11 (index 950) ---
2025-10-29 22:08:02,552 [INFO   ]   [Filter 2] Valley at 2021-10-11: Slope Check (30d) = -0.0899
2025-10-29 22:08:02,552 [INFO   ]   [Filter 2] Valley at 2021-10-11: Slope Check (60d) = -0.1193
2025-10-29 22:08:02,553 [INFO   ]   [Filter 2] Valley at 2021-10-11: Slope Check (90d) = -0.1213
2025-10-29 22:08:02,553 [INFO   ]   [Filter 2] FAILED. No positive slope found.
2025-10-29 22:08:02,553 [INFO   ] 
--- Analyzing Valley at 2022-04-25 (index 1085) ---
2025-10-29 22:08:02,554 [INFO   ]   [Filter 2] Valley at 2022-04-25: Slope Check (30d) = 0.0168
2025-10-29 22:08:02,555 [INFO   ]   [Filter 2] Valley at 2022-04-25: Slope Check (60d) = 0.0201
2025-10-29 22:08:02,555 [INFO   ]   [Filter 2] Valley at 2022-04-25: Slope Check (90d) = 0.0332
2025-10-29 22:08:02,555 [INFO   ]   [Filter 2] PASSED. Best positive slope: 0.0332
2025-10-29 22:08:02,557 [INFO   ]     [Filter 3] DNA Test vs 'DOGE-USD_m30_ramp': Distance = 8.7782
2025-10-29 22:08:02,558 [INFO   ]     [Filter 3] DNA Test vs 'SHIB-USD_m30_ramp': Distance = 6.8284
2025-10-29 22:08:02,559 [INFO   ]     [Filter 3] DNA Test vs 'CSCO_m90_ramp': Distance = 7.5824
2025-10-29 22:08:02,561 [INFO   ]     [Filter 3] DNA Test vs 'GME_m90_ramp': Distance = 8.8718
2025-10-29 22:08:02,562 [INFO   ]     [Filter 3] DNA Test vs 'IYR_m120_ramp': Distance = 6.5415
2025-10-29 22:08:02,563 [INFO   ]     [Filter 3] DNA Test vs 'VWAGY_m15_ramp': Distance = 6.9125
2025-10-29 22:08:02,565 [INFO   ]     [Filter 3] DNA Test vs 'AMC_m30_ramp': Distance = 6.7169
2025-10-29 22:08:02,565 [INFO   ]     [Filter 3] FAILED. No DNA match found below threshold 2.75.
2025-10-29 22:08:02,565 [INFO   ] 
--- [Analysis Summary] ---
2025-10-29 22:08:02,565 [INFO   ] Total Valleys Found: 17
2025-10-29 22:08:02,565 [INFO   ] Valleys Passing Filter 2 (Slope Test): 7
2025-10-29 22:08:02,566 [INFO   ] Valleys Passing Filter 3 (DNA Test): 0
2025-10-29 22:08:02,566 [INFO   ] --- [Historical Analyzer Finished] ---
